,Play 1,Play2,Op symbol1,Op symbol2,Cost,Operation Type
347,"('LUIS', ""La lumière la plus belle et la plus pure,de qui le soleil l'a apprise,fuit-elle parce que j'arrive ?Suis-je la nuit par hasard ?Eh bien, pardonne ta beauté,si audacieuse et impolieen t'arrêtant tu vois moi, que dans cette éventualitéje ne veux pas demander de permission,parce que tu ne me la donnes pas,que, estimant ta rigueur,mon sort ne veut pasque même cela, qui est de la courtoisie, a le nom de faveur.Maintenant, je sais que mon amour foudans ton mépris n'atteint pasun atome d'espoir,mais moi, voyant une tellerigeurje dois t'aimerjuste pour me venger.Tu me donnera une plus grande gloirequand tu m'offriras plus de douleur,eh bien, plus tu me détestes,je dois t'aimer davantage.Si tu te plains de ça,car avec un seul amournous venons tous les deux être,entre plaisir et chagrin,rassemblons-nous, apprenons à aimerou apprends-moi à haïr.Apprends-moi tes rigueurs,je t'apprendrai la finesse;apprends-moi ta dureté,je t'apprendrai les faveurs; tu méprises et j'aime;tu oublies et je ferme la foi;bien que ce soit mieux, car cela donnegloire à l'amour, étant dieu,puisses-tu oublier pour nous deux,que j'aimerai pour tous deux vous."")","('Angelique', 'Helas c’est sur ce poinct que je n’ay rien à dire, Je confesse mon foible, et vous dy franchement, Que je perds de tout poinct icy le  Je n’esperois tirer de toutes ces folies Qu’un divertissement à mes melancolies ; Mais me voyant les sens interdits et confus, Je cognoy bien que j’ay quelque chose de plus : Car je ne puis nier que j’ay l’ame saisie, Et l’esprit agité d’un peu de jalousie, D’un beau portraict qu’il garde, et de certains escrits Qui m’ont en quelque sorte  Ne m’estant arrivé rien de tel en ma vie, Et si j’avoue aussi que je brusle d’envie De le voir cette nuict, et mesme luy parler, Jugez chere Cousine où cela peut aller.')",292,265,0.41,Substitution
348,"('BEATRIZ', 'Vous vous plaignez si polimentque même si je voudrais remerciervos chagrins, je ne le ferais passimplement parce que vous les dites.')","('Lucinde', 'Envers moy voulez-vous estre si rigoureuse ? Ne me le celez poinct, vous estes amoureuse. Pourquoy dissimuler ce que je cognoy mieux Mille fois que vous mesme, et qu’on lit dans vos yeux ? Au lieu de vous blasmer, non, non, je vous en louë.')",293,266,0.73,Substitution
349,"('LUIS', ""Parce que tu m'as si mal traité,j'ai appris le langage du dédain."")",,294,-,1.0,Insertion
350,"('BEATRIZ', ""Eh bien, c'est bien que vous continuiez, car dans ce casle mal sera seulpour ceux qui le disent si bien. (Arrête-la.)"")","('Angelique', 'Oüy, vous m’avez surprise, et quasi Si lors qu’on ayme, on a de pareils sentiments ; Si je ne dis tout haut que je l’ayme, je ments. Mais quoy que j’aye Cét amour, je vous jure, est bien dans l’innocence : Car je mourrois plustost ma Cousine, et me croy Que je fisse jamais rien indigne de moy ; Il est temps maintenant, et partant Isabelle Va promptement là bas querir de la chandelle, Ils sont tous occupés, et je veux à present Respondre à son escrit, et luy faire un present De cette escharpe icy, d’une façon nouvelle, Pour supporter son bras blessé pour ma querelle, Avec quelques douceurs ; il ne faut point tarder, Ils sortiront bien-tost.Taschez d’accomoder Ces  Et qu’ils soient retirez, Isabelle les porte.')",295,267,1.09,Substitution
351,"('LUIS', ""Hé, si c'est pour ça que tu viens,et souffrons tous les deux."")","('Lucinde', 'Disiez-vous pas tantost, qu’on vous a faict sçavoir Qu’ils doivent tous ensemble aller au bal ce soir ?')",296,268,1.55,Substitution
352,"('BEATRIZ', ""Je n'ai pas besoin de t'écouter ; Pour l'amour de Dieu, mon ami, arrêtez-le. (Sortie.)"")",,297,-,1.0,Insertion
353,"('ANGELA', 'Comme tu as peu de couragede vouloir entendre et voir ça !')",,298,-,1.0,Insertion
354,"('LUIS', 'Oh, ma sœur ! Que dois-je faire?')",,299,-,1.0,Insertion
355,"('ANGELA', ""Donner ses peines à l'oubli,aimer ce qui est détestéc'est mourir et ne pas aimer. (Il part avec ISABEL.)"")",,300,-,1.0,Insertion
356,"('LUIS', ""La plaignante, comment puis-jel'oublier ? C'est une erreur.Dites-lui de me rendre serviceet, forcé, j'oublierai;pas offensé, carle plus prudent, le plus sagedonne son sentiment au lèvre; Si la faveur est habituellement oubliée, c’est que la faveur ne fait pas mal de la même manière que la blessure.  (Rodrigue sort.)"")","('Angelique', 'Oüy, je luy veux mander que l’on m’en a priée, Qu’il y vienne, et d’autant que je suis espiée, Qu’il me pardonnera, si je n’ose pas là Me descouvrir à luy.')",301,269,0.28,Substitution
357,"('RODRIGO', ""D'où viens-tu ?"")",,302,-,1.0,Insertion
358,"('LUIS', 'Je ne sais pas.')",,303,-,1.0,Insertion
359,"('RODRIGO', ""Tu as l'air triste.Tu ne veux pas m'en dire la cause ?"")",,304,-,1.0,Insertion
360,"('LUIS', 'J’ai parlé avec Mme Beatriz.')",,305,-,1.0,Insertion
361,"('RODRIGO', ""N’en dis pas plus ; Vous pouvez déjà voir ce qu'il a répondu.Mais où est-il ?, que je Je ne l'ai pas vu."")","('Lucinde', 'Mais à quoy bon cela ? Puis que vous sçavez bien que vous ne pouvez faire Ce que vous promettez ?')",306,270,1.05,Substitution
362,"('RODRIGO', ""Regarde, Don Manuel t'entendil arrive.  (DON MANUEL sort.)"")","('Angelique', 'Il est tres necessaire, Pour luy troubler encor d’avantage l’esprit, Laissez-moy promptement respondre à son escrit.')",307,271,1.56,Substitution
363,"('LUIS', 'Monsieur  Don Manuel.')",,308,-,1.0,Insertion
364,"('MANUEL', 'Monsieurdon Luis.')",,309,-,1.0,Insertion
365,"('LUIS', ""D'où viens-tu ?"")","('Lucinde', 'Je veux ce qu’il vous plaist ; cependant Isabelle Plions bien cette escharpe, ajustons la dentelle, Donne moy ce panier, mettons tout proprement.')",310,272,1.7,Substitution
366,"('MANUEL', 'Du palais.')",,311,-,1.0,Insertion
367,"('LUIS', ""Grosseerreur la mienne a été de demanderde quelles prétentions il aoù il va et d'où il vient,car c'est une force qui doit donnern'importe quelle ligne dans le palais,comme centre de son sphère."")","('Isabelle', 'Sans doute qu’il sera saisi d’ Alors qu’il trouvera ce present sur sa table')",312,273,1.39,Substitution
368,,"('Lucinde', 'Qui ne trouveroit pas cette chose  Couvrons-le maintenant avec ce tafetas. ')",-,274,1.0,Deletion
369,"('MANUEL', ""Si seulement j'allais au palais,il y aurait plus d'espace;mais mon désir immortela demandé un but plus grand:Sa Majesté est sortiecet après-midi à l'Escurialet il faut y aller ce soir avec mes dépêches là-bas,cela sera important."")","('Isabelle', 'Depeschez-vous, Madame, on a souppé là-bas.')",313,275,1.12,Substitution
370,"('LUIS', ""Si je peux t'aider à serviren quoi que ce soit, tu sais déjàque je suis, de toute façon,à toi."")",,314,-,1.0,Insertion
371,"('MANUEL', ""Lesmains je t'embrasse  pour la faveur que tu me fais."")","('Angelique', 'C’est faict, mettons encor ma lettre avec ses hardes, Depesche toy, va-tost, qu’est-ce que tu regardes ?')",315,276,1.08,Substitution
372,"('LUIS', ""Vous voyez que ce n'est pas flatteur."")",,316,-,1.0,Insertion
373,"('MANUEL', ""Je vois quec'est volonté  de mon augmentation."")","('Lucinde', 'J’aurois un grand desir d’apprendre du destin, A quoy reüssira cette histoire à la fin.')",317,277,1.07,Substitution
374,"('LUIS', ""C'est vrai //(car vous négociez plus vite)."")",,318,-,1.0,Insertion
375,"('MANUEL', ""Mais pour un galant de cour, autant que vous, il n'est pas justede l'amuser à son goût,car je crois clairementque vous serez diverti,et ce serait un grand désaccordqu'il ait l'intention de tu es absent."")","('Lizandre', 'Voulez-vous voir le bal ? vous en prend-il envie ? Nous vous y conduirons ; croyez qu’en vostre vie Vos sens n’ont point esté tellement  Comme ils seront de voir tant de rares beautez, Vous y verrez la Cour, et de long-temps peut-estre Personne ne l’a veüe en tel estat paroistre ; Mais pourrons-nous de vous cette grace obtenir, De nous donner congé de nous en revenir, Quand vous serez entré ; car c’est nostre ordinaire De nous retirer tost.')",319,278,0.66,Substitution
376,"('LUIS', 'Même si tu avais entendude quoi Rodrigo parlait,tu ne réagirais pas comme ça.')",,320,-,1.0,Insertion
377,"('MANUEL', ""Alors, est-ce que je l'ai bien dit ?"")",,321,-,1.0,Insertion
378,"('MANUEL', 'Comme vous avez l’air impuissant !')",,322,-,1.0,Insertion
379,"('LUIS', ""J'aime une grande beautésans étoile et sans fortune."")",,323,-,1.0,Insertion
380,"('MANUEL', '¿Disimulez avec moi  maintenant?')",,324,-,1.0,Insertion
381,"('LUIS', ""Pluguieraau paradis ! Mais je suis née si malheureuseque cette beauté me fuit,comme le voile de la nuitde la belle lumière du jour,dans les rayons duquel je brûle.Voulez-vous voir à quel point mon triste sort est extrême ?  Eh bien, pourquoi ne la suivrais-je pas, aimante et jalouse,J'ai demandé à une personned'arrêter mes pas.Voyez s'il y a des rigueurs plus féroces,car tout le monde a tendance à chercherdes tiers à atteindreet elle s'enfuit pour des tiers. (Lui et RODRIGO partent.)"")","('Florestan', 'Je serois temeraire, Si j’avois le dessein de vous incommoder, J’irois plustost sans vous.')",325,279,0.69,Substitution
382,"('MANUEL', ""Qu'est-ce qu'il faut déclarer d'autre ?Une femme qui s'est enfuie de sa vueet une autre personne a demandépour gêner...Elle le dit pour moi et pour elle.Au moins, j'ai déjà vaincuun sans doute, eh bien, j'ai déjà vuque, même s'il est vrai que c'est elle,elle n'est pas sa dame, parce que la personne méprisée ne vivrait pass'il l'avait dans sa maison.C'est déjà mon plus cruel doute.Si elle n'est pas sa dame et qu'elle n'habite pas À la maison, comment écrivez-vous et répondez-vous ? Iciune tromperie meurt et conçoitune autre tromperie. Que dois-je faire,car je suis dans mes opinionsconfusion de confusions ?Dieu m'utilise comme femme !  (COSME sort.)"")","('Lizandre', 'Vous y pourrez tarder Autant qu’il vous plaira, vous auriez de la peine D’entrer en ce lieu là, si l’on ne vous y meine. Il faut estre cognu, c’est à vingt pas d’icy, Vous reviendrez bien seul.')",326,280,0.84,Substitution
383,"('COSME', ""Monsieur, qu'en est-il des elfes ? L'avez-vous déjà vu ici ? Si je sais qu'il n'est pas là, je serai heureux..."")","('Florestan', 'Laissez-m’en le  Aussi bien comme vous je n’y veux pas tant estre ; Mais parce qu’en ce lieu je veux un peu paroistre, Vous me permettez bien de m’aller ajuster, Et de changer d’habit.')",327,281,1.29,Substitution
384,"('MANUEL', 'Parlerpas.')","('Licidas', 'Sans vous precipiter, Vous avez trop de temps.')",328,282,1.77,Substitution
385,"('COSME', ""...J'ai beaucoup à faire  dans notre chambreet je ne peux pas  Montez."")","('Florestan', 'Donc sans plus de demeure Je vous iray trouver chez vous avant une heure.')",329,283,1.25,Substitution
386,"('MANUEL', ""Eh bien, qu'est-ce que tu as ?"")","('Florestan', 'Carrille, que fais-tu ?')",330,284,0.14,Substitution
387,"('COSME', 'Peur.')",,331,-,1.0,Insertion
388,"('MANUEL', 'Un homme doit-il avoir peur ?')","('Carille', 'Dieux ! je tremble de peur.')",332,285,0.46,Substitution
389,,"('Florestan', 'Pourquoy n’es-tu là haut ?')",-,286,1.0,Deletion
390,"('COSME', ""Vous ne devriez pas l'avoir, monsieur,mais vous voyez ici qu'il l'a,car cela convient à l'événement."")","('Carrille', 'Je n’oserois, Monsieur.')",333,287,1.42,Substitution
391,,"('Florestan', 'Pour quel sujet, qu’as-tu ?')",-,288,1.0,Deletion
392,,"('Carrille', 'Dois-je pas avoir crainte Que cét  Je crains trop d’esprouver ce que pese sa main.')",-,289,1.0,Deletion
393,"('MANUEL', 'Laisse cet humour idiotet apporte la lumière, parce que je doispréparer et écrire,et ce soir je dois sortir de Madrid.')","('Florestan', 'L’impertinent maraut, tu le fais à dessein De faire le plaisant.')",334,290,0.92,Substitution
394,"('COSME', ""Je m'en tiens à cela, parce que vous dites avec cela icique vous avez peur de l'événement."")","('Carrille', 'Quand on me devroit pendre, Faschez-vous-en, ou non, je ne m’en puis deffendre, J’y fais ce que je puis, qu’importe si j’ay peur, Par menace croit-on me relever On ne sçauroit m’oster aysément ces ombrages, Non pas quand on devroit me retrancher mes gages, J’ayme mieux perdre tout.')",335,291,1.24,Substitution
395,"('MANUEL', ""Avant, je te disais avec çaque je ne fais pas attention à toi,parce que je me souviens d'autres chosesqui sont différentes ; Quand tu me parles, je perds du temps pendant que je te dis au revoir. de la part de don Juan, ayez la lumière. (Sortie.)"")","('Florestan', 'Mais voyez ce maraut, Allume la chandelle, et la porte là haut, Apreste mon habit, le diable te confonde.')",336,292,1.5,Substitution
396,,"('Carrille', 'Je n’irois pas tout seul, pour tous les biens du monde, Ne me l’ordonnez pas, je sçay fort bien pourquoy.')",-,293,1.0,Deletion
397,"('COSME', ""OuiJe le ferai, J'apporterai la lumière à l'elfe,il est temps qu'il soit serviet ne soit pas dans le noir. Iciil doit y avoir une allumette;dans cette petite lampequi murmure làJe peux l'allumer maintenant.Oh, comme je suis prévenu!Et entre ceux-ci et ceux-là, je vaisfrissonnant de peur. (Il part et ISABEL sortà travers le placard avec une armoire couverte.)"")","('Florestan', 'Va, j’y seray, te dis-je, aussi-tost comme toy, Va querir un flambeau, je t’attens à la porte.')",337,294,0.22,Substitution
398,,"('Carrille ', 'Ah Dieux ! c’est à ce coup, Monsieur, qu’il nous emporte')",-,295,1.0,Deletion
399,"('ISABEL', ""Ils sont dehors, c'est ce que m'a dit la servante. Il est maintenant temps de placer ce portant de vêtements blancs à l’endroit désigné. Malheur à moi, triste ! Car, comme il fait nuit, je suis étonné et effrayé par ma grande obscurité. Dieu me vienne en aide, je tremble ! L'elfe d'abordC'est moi qui me confie à Dieu.Je ne trouve pas le bureau. Qu'est-ce que c'est ?Avec confusion et peurJ'ai perdu la notion de la pièce.Je ne sais pas où je suis et je ne trouve pasla table. Que dois-je faire? Mon Dieu !Si je n'arrivais pas à sortiret qu'ils me trouvaient ici,nous finirions avec toute l'affaireen ruines. J'ai une grande peuret plus maintenant que d'ouvrirla porte de la chambre, je senset celui qui l'ouvre apporte la lumière.Ici l'événement s'est terminé,je ne peux plus me cacherni sortir. (COSME sort avec de la lumière.)"")","('Isabelle', 'Je sçay qu’ils sont dehors, on m’en vient d’advertir, Mais j’ignore à present par où je dois sortir, Ne pouvant remarquer par où je suis entrée, Dans cette obscurité je me suis esgarée, Que deviendray-je, ô Dieux ? j’en suis fort en soucy, Ny mesme où je mettray ce present que voicy ; Car je ne puis trouver la porte, ny la table ; Juste Ciel, soyez moy maintenant favorable, Si quelqu’un survenoit, de quels  Pourrois-je me servir pour ebloüyr ses yeux ? Tout seroit descouvert, la chose est infaillible ; Car de passer plus outre, il seroit impossible ; J’en tremble en y pensant, c’est à ce coup, j’entends Qu’on ouvre cette porte, ah ! je perds tous les sens* ; Celuy qui l’ouvre encor, porte de la lumiere, Que deviendray-je ? il faut me cacher là derriere.')",338,296,0.12,Substitution
400,"('COSME', 'Duende, mon seigneur, si par hasardrendoblige les elfes bien nés,je vous prie humblementde ne pas vous souvenir de moidans vos nombreux prétextes,et cela pour quatre raisons :la première, je, comprendre ; (Il marche et ISABEL est derrière lui, fuyant pour qu\'il ne la voie pas.) le deuxième, tu sais;le troisième, à cause de çaça au bon entendeur...;le quatrième, à cause de ces versets : ""M. Lady Goblin,pleurez-moi,car je suis un enfant et seulet je ne me suis jamais vu comme tel.""')","('Carrille, ', 'Esprit je te conjure en toute humilité  (Car tu n’es pas, je croy, de basse qualité) Si ta mauvaise humeur icy ne se transporte, Si la sumission d’un homme de ma sorte, Peut en cét accident quelque chose sur toy, Aujourd’huy pour le moins ne songes Je suis le serviteur, tu n’en veux qu’à mon Maistre. (Isabelle se met derriere luy, de peur qu’il ne la voye.)')",339,297,0.24,Substitution
401,"('COSME', 'Quelle grande peur du musicien !')",,340,-,1.0,Insertion
402,"('ISABEL', '(Ça doit être comme ça).(Donnez-lui un coup et éteignez la lumière.)')","('Isabelle ', 'La lumiere m’a faict aysément recognoistre.')",341,298,1.24,Substitution
403,"('COSME', ""VerbeCaro... fiteor Deo!  Ils m'ont tué !"")","('Carrille', 'Aye pitié de moy, tout mal-heur me poursuit, Je suis las, laissez-moy reposer cette nuit')",342,299,1.6,Substitution
404,,"('Isabelle', 'Je me puis aysément desrober à sa veuë, Il ne m’a point encor dans la chambre aperceuë ; Joüons luy d’une fourbe, ayons-en le plaisir, Tüons luy la chandelle De l’aller rallumer, je seray repassée.')",-,300,1.0,Deletion
405,"('ISABEL', ""(Maintenant je vais pouvoir m'échapper).(Quand ISABEL veut fuir, DON MANUEL sort.)"")","('Carrille', 'Je sens mon ame, ô Dieux ! de cent craintes glacée ; Mon Maistre tarde bien, ah ! qu’il est aujourd’huy Bien aisé de railler, mesme aux depens d’autruy. (Isabelle luy tuë la chandelle et luy donne un grand coup de poing.)')",343,301,1.4,Substitution
406,,"('Carrille', 'On m’assomme, grands Dieux ! misericorde, à l’ayde, Tout de bon, ce Demon à present me possede ; Il m’emporte, il m’estrangle, ah Dieux ! j’ay beau prier, Invoquant tous les Dieux.')",-,302,1.0,Deletion
407,"('MANUEL', ""Qu'est-ce que c'est ?  Cosme, comment vas-tu sans électricité ?"")","('Florestan', 'Dy qui te fait crier ? Qu’as-tu ?')",344,303,1.33,Substitution
408,,"('Carrille', 'Monsieur, ils sont tous sourds à ma priere.')",-,304,1.0,Deletion
409,,"('Florestan', 'T’ay-je pas commandé d’avoir de la lumiere, Pourquoy n’en as-tu pas ?')",-,305,1.0,Deletion
410,"('COSME', ""Comme nous sommes morts tous les deuxl'elfe : la lumière d'un souffle et moi d'un seul coup."")","('Carrille', 'Ah ! cét  Nous a tuez tous deux, moy d’un si grand souflet Qu’il m’a, fort peu s’en faut, fait cracher la cervelle, Et d’un souffle aussi-tost a tué la chandelle.')",345,306,0.69,Substitution
411,"('COSME', 'Et bien à mes dépens je les crois.')","('Florestan', 'Comme la peur te fait avoir ces visions.')",346,307,1.88,Substitution
412,"('ISABEL', '(Oh, si la porte cogne !).')","('Carrille', 'Ce ne sont pas, Monsieur, imaginations, Diable, je ne suis point, tout à fait insensible.')",347,308,1.7,Substitution
413,"('MANUEL', ""Qui est ici ? (ISABEL tombe sur DON MANUEL et il la prend chez l'intendant.)"")","('Isabelle ', 'Maintenant par ces ais, r’entrons s’il est possible.')",348,309,1.59,Substitution
414,"('ISABEL', ""(C'est pire que ça,qu'avec le maître que j'ai trouvé)."")",,349,-,1.0,Insertion
415,"('MANUEL', ""Apporte la lumière, Cosme, je l'ai déjà  à qui."")","('Florestan', 'Qui va là, je la tiens, va promptement là-bas, R’allumer ta chandelle. (Il rencontre Isabelle.)')",350,310,0.82,Substitution
416,"('COSME', 'Eh bienne le laisse pas partir.')","('Carrille ', 'Ah ! ne le laschez pas. (Carrille sort.)')",351,311,1.11,Substitution
417,"('MANUEL', 'Je ne vais pas; allez-y vite.')",,352,-,1.0,Insertion
418,"('COSME', 'Tenle bien. (Vase.)')","('Isabelle ', 'Justes Dieux ; c’est bien pis, j’ay rencontré le Maistre.')",353,312,1.31,Substitution
419,,"('Florestan', 'Qui que tu sois, atten, car si tu fais paroistre De vouloir eschaper, je te poignarderay.')",-,313,1.0,Deletion
420,"('ISABEL', ""(Il a saisi le placard ; je l'ai laissé entre ses mains.J'ai trouvé le placard. Au revoir !). (Il part et il prendle placard.)"")","('Isabelle ', 'Que deviendray-je, ô Dieux ! qu’est-ce que je feray ? Il a pris le panier, je luy laisse, il n’importe, Je m’en vay me sauver, j’ay remarqué la porte Par où je suis entrée, allons y vitement. (Elle rentre par les ais.)')",354,314,0.76,Substitution
421,"('MANUEL', ""Qui que ce soit restejusqu'à ce qu'ils apportent la lumière,car sinon le ciel vit,qu'il le poignarde !Mais j'embrasse seulement le ventet je ne trouve qu'une chosede vêtements et de peu de poids. Qu'est-ce que ce sera ? Que Dieu m'aide, il m'a mis encore plus dans la confusion !  (COSME sort avec la lumière.)"")","('Florestan', 'Elle s’est eschapée, et je ne sçay comment. Ce n’est point une femme en effect que je touche, Que veut dire cela ? vrays Dieux ! plus qu’une souche Je demeure immobile, et ne sçay que penser.')",355,315,0.65,Substitution
422,,"('Carrille, (', 'Esprit malin, qui croit icy nous traverser, Tu n’eschaperas pas.')",-,316,1.0,Deletion
423,,"('Florestan', 'Aporte la lumiere.')",-,317,1.0,Deletion
424,"('COSME', ""Que l'elfe soit dans la lumière.Eh bien, que devient-il ? N'était-il pas en prison ?Qu'a-t-on fait ? Où est-il ?  Qu'est-ce que c'est, monsieur ?"")","('Carrille', 'Qu’est-il donc devenu ?')",356,318,0.46,Substitution
425,,"('Florestan', 'Regarde là derriere, Je le tenois tantost ; mais il m’est eschapé.')",-,319,1.0,Deletion
426,,"('Carrille', 'Aussi bien comme moy vous estes attrapé, Et bien qu’en dites-vous ? ne vouliez-vous pas croire Que c’estoit une fable, et non pas une histoire ? Vous disiez que c’estoient imaginations, Que la peur me faisoit avoir ces visions, Cela suffit-il pas encor pour vous confondre ? Ne le teniez-vous pas ?')",-,320,1.0,Deletion
427,"('MANUELI', ""n'a pas raison de répondre. Ces vêtements m'ont abandonné et se sont enfuis."")","('Florestan', 'Je ne puis que respondre, Il me vient de laisser ces  Et puis s’est eschapé.')",357,321,0.82,Substitution
428,,"('Carrille', 'Voyez donc si je crains, Que c’est avec raison Ne vous en mocquez point.')",-,322,1.0,Deletion
429,,"('Florestan', 'C’est une raillerie, De croire que jamais on me puisse ')",-,323,1.0,Deletion
430,"('COSME', ""Et que dites-vous de cette situation ?Même si tout à l'heure vous-mêmedisiez que vous l'aviezet que c'est parti au vent."")","('Carrille', 'Mais qu’en croyez-vous donc ?')",358,324,0.82,Substitution
431,"('MANUEL', ""Je dirai que cette personne,qui avec art et ingéniositéentre et sort ici, ce soirétait enfermée à l'intérieur;que pour sortirla lumière t'a tué et ensuiteil m'a laissé l'hôtesseet Je me suis échappé en fuyant."")","('Florestan', 'Il est à presumer, Que dis-je à presumer ? sans doute qu’il doit estre Que c’est celle qui craint de se faire cognoistre, Et qu’un de ses valets m’apportant ses escrits, Estoit entré ceans, et se trouvant surpris, T’ a tué ta chandelle, et traicté de la sorte, Et s’est enfuy apres.')",359,325,0.5,Substitution
432,"('COSME', 'Par où?')","('Carrille', 'Par où ?')",360,326,0.0,Match
433,,"('Florestan', 'Par cette porte.')",-,327,1.0,Deletion
434,"('COSME', ""Tu vas me faire perdre la tête.Vive Dieu!Je l'ai vudans les dernières réflexionsque l'étincelle a laisséde la lumière qui était morte en moi."")","('Carrille', 'Vous me feriez mourir, bien mocquez-vous de moy, Je l’ay veu, je vous jure, ainsi que je vous voy.')",361,328,1.38,Substitution
435,"('MANUEL', ""De quelle forme s'agissait-il ?"")","('Florestan', 'Dy donc comme il est fait ?')",362,329,0.92,Substitution
436,,"('Carrille', 'Ah ! de crainte j’en tremble, Laissez-moy respirer ; il est fait ce me semble Comme un coq-d’Inde')",-,330,1.0,Deletion
437,"('MANUEL', ""Ce que fait la peur !Elle brille ici et ce qu'elle a apporténous verrons le petit macareux.Vous avez cet intendant."")","('Florestan', 'Voyez comme la peur saisit cét ignorant. Tien, pren.  (Luy donnant le panier.)')",363,331,0.65,Substitution
438,"('COSME', ""Suis-je les hôtesses de l'enfer ?"")","('Carrille', 'Moy manier des choses infernales ?')",364,332,1.5,Substitution
439,"('MANUEL', 'Ayez-le  alors.')","('Florestan', 'Pren, te dis-je, pendart.')",365,333,1.45,Substitution
440,"('COSME', 'Mes mains sont sales, monsieur, avec le suifde la bougie et je tacheraile taffetas qui la recouvre; Ce serait mieux si vous le mettiez au sol.')","('Carrille', 'Monsieur, j’ay les mains salles. Comme vous le voyez toutes pleines de suif.')",366,334,0.55,Substitution
441,"('MANUEL', ""Ce sont des vêtements blancs et un morceau de papier.Voyons si le frère est discret.(lit.)« Depuis le peu de temps que vous vivez dans cette maison, il n'a pas été possible de confectionner plus de vêtements ; Une fois fait, cela sera réalisé. A ce que vous dites de votre ami, persuadé que je suis la dame de Don Luis, je vous assure que non seulement je ne le suis pas, mais que je ne peux pas l'être ; et je laisse cela en vue, que ce sera bientôt. Dieu te protège. Baptisé est cet elfe,  car Dieu se souvient."")","('Florestan', 'Je ne cognu jamais un maraut si craintif, Dy moy, de quoy peux-tu jamais estre capable ?')",367,335,1.11,Substitution
442,"('COSME', 'Le voyez-vous  Comment existe-t-il un elfe religieux ?')",,368,-,1.0,Insertion
443,"('MANUEL', ""Il est bien tard ; va faireles valises et les coussins,et dans un sac mets ceux-ci(Donnez-lui des papiers.) papiers, qui sont toutce que nous cherchons, que j'essaietant que je laisse une réponseà mon elfe. (Mettez-les sur une chaise et DON MANUEL écrit.)"")","('Carrille', 'Ce n’est pas pour cela, mettez-le sur la table, Vous le verrez bien mieux.')",369,336,1.72,Substitution
444,"('COSME', ""IciJe les veux, pour ne pas les oublieret qu'ils soient à portée de main, pose-lespendant que je m'arrête un momentjuste pour dire ceci:as-tu déjà cru qu'il y avait des lutins ?"")",,370,-,1.0,Insertion
445,"('MANUEL', 'Quelle absurdité !')",,371,-,1.0,Insertion
