,regnard-arlequin-bonnes-fortunes,regnard-filles-errantes,Cost,Operation Type
0,"('#le-vicomte', ""Holà, quelqu'un de mes gens !  Champagne, Picard, la Violette, Tortillon, Basque, mes pantoufles, ma robe de chambre, mon carrosse, à dîner, un bouillon. Ne suis-je pas bien malheureux qu'un homme de ma qualité soit obligé d'éveiller ses gens lui-même ?  Où sont donc ces marauds-là ?  Ouais ! Et toi, ne te lèveras-tu point ?  Si je prends un bâton, maraud, je te ferai bien lever.  C'est un trésor en hiver qu'un laquais au pied d'un lit ; son ventre sert de bassinoire.  Il sort du lit avec une robe d'aveugle des Quinze-Vingts.  À Mezzetin. Il donne un coup de pied à Mezzetin, qui est encore couché. Mezzetin, s'éveillant en sursaut, baille et se lève.  À part. "")","('#isabelle', 'Que vous plaît-il, monsieur ?')",1.67,Substitution
1,"('#mezzetin', ""Vous faites l'entendu, parce que les bonnes fortunes vous suivent partout ; mais souvenez-vous que nous sommes deux laquais, et qu'il n'y a point d'autre différence entre nous que celle que j'y veux bien mettre : ainsi, un peu plus de douceur, s'il vous plaît, et un peu moins d'emportement avec votre camarade. "")","('#arlequin', ""Écoute, Claudine ; voici un gentilhomme qui vient loger chez moi avec sa soeur ; il faut que tu leur donnes deux chambres l'une contre l'autre."")",1.01,Substitution
2,,"('#isabelle', ""Ciel !  Que vois-je ?  Cinthio avec une autre que moi, qu'il fait passer pour sa soeur !"")",1.0,Deletion
3,,"('#arlequin', 'Claudine, tu ne me réponds point.')",1.0,Deletion
4,,"('#isabelle', ""Le traître !  Il ne fait pas semblant de me connaître.  J'ai tout quitté pour le chercher, et il ne daigne pas seulement me regarder."")",1.0,Deletion
5,"('#le-vicomte', ""Ce n'est point pour te quereller, Mezzetin, que je t'éveille de si bon matin ; c'est seulement pour te dire que toutes ces bonnes fortunes me donnent fort à penser.  À l'égard de celles qui me viennent par les présents que l'on m'envoie de toutes parts, passe ; mais pour celles que nous faisons en volant des montres, en enfonçant des boutiques, et en coupant des bourses ; ma foi, j'ai peur que toutes ces bonnes fortunes-là ne nous fassent faire notre mauvaise fortune à la Grève. "")","('#arlequin', ""N'entends-tu, Claudine ?  Ce gentilhomme vient loger chez moi ; il lui faut deux chambres l'une auprès de l'autre.  Entends-tu bien ?"")",1.11,Substitution
6,"('#mezzetin', 'Hé !  Nous travaillons pour cela. ')","('#isabelle', ""Est-ce là le prix de tant d'amour ?  Ingrat !  Devais-je être traitée de cette manière ?"")",1.32,Substitution
7,"('#le-vicomte', 'Voila une méchante besogne. ')","('#arlequin', 'Que la peste te crève !  Claudine, me répondras-tu à la fin ?')",1.69,Substitution
8,"('#mezzetin', 'Tenez, voilà-t-il pas encore la robe que vous volâtes à cet aveugle des Quinze-Vingts, qui vous sert de robe de chambre ? ')","('#isabelle', ""Je vous demande pardon, monsieur ; ce sont des vapeurs dont je suis attaquée, et je ne sais ce que je dis. Tu m'abandonnes, scélérat !  Et tu n'oses arrêter sur moi tes regards. À part."")",1.38,Substitution
9,"('#le-vicomte', ""Il y a longtemps qu'elle était neuve.  J'ai déjà dit trois ou quatre femmes que j'avais besoin d'un surtout de toilette : il y a bien du relâchement dans la galanterie ; et les femmes commencent à se décrier furieusement dans mon esprit.  Oh !  Nous ne vivrons pas longtemps bien ensemble. "")","('#arlequin', ""Ah !  Je te casserai, ma foi, la gueule, et je ferai bien passer tes pestes de vapeurs.  Je te dis qu'il faut deux chambres l'une contre l'autre.  M'entends-tu à cette heure ?  Dis donc, parle."")",0.84,Substitution
10,"('#mezzetin', 'À propos de robe de chambre, tandis que vous dormiez, madame la marquise de Noirchignon vous en a envoyé une. ')",,1.0,Insertion
11,"('#le-vicomte', 'Voyons-la. ')",,1.0,Insertion
12,"('#mezzetin', ""Passe.  La pauvre créature fait tout ce qu'elle peut pour m'égratigner le coeur, "")",,1.0,Insertion
13,"('#mezzetin', ""Il est aussi venu' un laquais de la part de madame la comtesse de Charbonglacé, qui a laissé un paquet dans une toilette.  Diable !  Celle-ci est bien mieux étoffée que l'autre.  La Comtesse pourrait bien me faire faire la sottise de l'aimer.  Mais il ne fait pas si cher vivre à Paris ; tout s'y donne.  Il tire une toilette où est encore une robe de chambre.  On frappe rudement à la porte. "")","('#isabelle', 'Oui, monsieur, je vous entends : vous pouvez vous en aller ; je vais accommoder tout cela.')",1.23,Substitution
14,"('#mezzetin', ""Monsieur, c'est le laquais de la Veuve de ce procureur. "")",,1.0,Insertion
15,"('#le-vicomte', 'Laisse-le entrer. ')","('#cinthio', 'Allons, ma soeur, entrez.')",0.28,Substitution
16,,"('#colombine', 'Voilà une fille qui me semble bien surprise ! Elle entre.')",1.0,Deletion
17,,"('#isabelle', 'Cinthio ?')",1.0,Deletion
18,"('#le-vicomte', 'Que diable me veut-elle ? ')","('#cinthio', 'Que voulez-vous ?')",0.45,Substitution
19,"('#le-laqauis', ""Monsieur, voilà ce que madame vous envoie ; elle dit comme çà que vous aurez l'honneur de la voir bientôt. "")","('#isabelle', 'Vous ne me dites rien ?')",1.53,Substitution
20,"('#le-vicomte', ""Mon enfant, dis-lui qu'elle ne s'en donne pas la peine. Je vais prendre un remède pour me débrouiller le teint.  Le laquais sort. "")","('#cinthio', ""Je n'ai rien à vous dire."")",1.58,Substitution
21,"('#le-vicomte', 'Comment !  Encore une robe de chambre !  Il faut avouer que les femmes nous aiment bien en déshabillé.  On frappe à la porte. ')","('#isabelle', 'Vous ne reconnaissez pas Isabelle ?')",1.9,Substitution
22,"('#mezzetin', ""Monsieur, c'est la Marquise. "")","('#cinthio', 'Vous, Isabelle ?  Je ne vous connais point.')",1.74,Substitution
23,"('#le-vicomte', 'Donne-moi vite la robe de chambre de la Marquise. Mezzetin prend la robe de chambre de la Marquise, et le Vicomte la met par-dessus la sienne. On refrappe à la porte. ')","('#isabelle', ""Tu me méprises, perfide !  Mais je saurai me venger. Elle entre dans l'hôtellerie."")",1.24,Substitution
24,"('#mezzetin', ""Ce n'est pas la Marquise, monsieur, c'est la Comtesse.  Il faut remarquer qu'à chaque fois que l'on heurte, Mezzetin va voir à la porte, et revient sur-le-champ."")","('#mezzetin', ""Que vois-je, Pierrot ?  Ai-je la berlue ?  Oui...  Non...  Si fait : c'est elle ; c'est ma soeur."")",0.94,Substitution
25,"('#le-vicomte', 'Et vite, la robe de chambre de la Comtesse ! Tout serait perdu si elle me trouvait sans cela.  Il met encore cette robe de chambre sur les deux autres. On continue de frapper. ')",,1.0,Insertion
26,"('#mezzetin', ""Oh !  Monsieur, c'est la veuve du procureur. "")","('#pierrot', ""Votre soeur ?  Je n'en crois rien, monsieur, si je n'y touche."")",1.32,Substitution
27,"('#le-vicomte', ""Que le diable l'emporte !  Ne saurait-elle donner une robe de chambre sans venir l'essayer ?  Donne.  Il met la troisième robe de chambre avec beaucoup de peine, ne pouvant presque plus se remuer à cause des trois autres qu'il a déjà sur lui ; à la fin, après plusieurs lazzis, il tombe, et à peine est-il relevé que la Veuve entre. "")",,1.0,Insertion
28,"('#le-vicomte', ""Hé !  Morbleu, madame !  Ne vous avais-je pas fait dire que je n'étais pas visible aujourd'hui ?  Hé, ventrebleu !  Ne saurait-on rendre un lavement sans femme ? "")","('#mezzetin', ""C'est elle-même.  Et que faites-vous donc ici, madame la coureuse ?"")",1.07,Substitution
29,"('#la-veuve', 'Pour vous trouver, monsieur, il faut vous prendre au saut du lit ; le reste du jour vous êtes inabordable. ')","('#colombine', 'Ah, mon frère !  Ne vous emportez point ; je vous dirai...')",1.27,Substitution
30,"('#le-vicomte', ""Il est vrai que je n'ai pas une heure à moi.  Je suis si courbatu de ces aventures que le vulgaire appelle bonnes fortunes, que mon superflu suffirait à vingt fainéants de la cour. "")",,1.0,Insertion
31,"('#la-veuve', ""Je crois, monsieur, que c'est aujourd'hui un de vos jours de conquête ; vous voilà fleuri comme un petit Cupidon. "")",,1.0,Insertion
32,"('#le-vicomte', ""Je n'ai pourtant encore fait la conquête que d'un bouillon postérieur qui me cause des épreintes horribles : il faut que ma femme de chambre ne me l'ait pas donné de droit fil. "")",,1.0,Insertion
33,"('#la-veuve', ""J'ai été aussi incommodée toute la nuit de tranchées ; je suis aujourd'hui à faire peur. "")",,1.0,Insertion
34,"('#le-vicomte', ""En vérité, madame, cela est vrai : il y a aujourd'hui bien des erreurs à votre teint ; mais il est resté là-bas un peu de décoction, ne vous en faites point de nécessité. "")",,1.0,Insertion
35,"('#la-veuve', ""Ce n'est pas avec des simples que l'âcreté de mon mal peut se guérir : ma maladie est là.  Elle se touche au coeur."")",,1.0,Insertion
36,"('#le-vicomte', ""On sait bien qu'une femme grosse a toujours de petits maux de coeur. "")",,1.0,Insertion
37,"('#la-veuve', 'Moi, grosse !  Moi !  Ah, quelle ordure !  Il y a trois ans que Monsieur Gratefeuille, mon mari, est mort !  Grosse !  Quelle obscénité ! ')","('#mezzetin', 'Et que me diras-tu, effrontée ?  Tiens, il me prend envie de faire une capilotade de ton foie, de ta fressure, de ton gésier.')",0.9,Substitution
38,,"('#colombine', 'Mon pauvre Pierrot !...')",1.0,Deletion
39,"('#le-vicomte', ""Ah, madame !  Je vous demande pardon ; je vous croyais fille.  On s'y trompe quelquefois. "")","('#pierrot', ""Mon pauvre Pierrot !  Votre frère a raison ; j'aime l'honneur, moi ; et je ne veux pas qu'une fille coure le guilledou."")",0.93,Substitution
40,"('#la-veuve', ""Mais, monsieur, je vous trouve bien gros ; qu'avez-vous ? "")",,1.0,Insertion
41,"('#le-vicomte', ""Je n'ai rien, c'est que je soupai furieusement hier au soir. "")","('#mezzetin', 'Parle donc ; dis-moi, quelle raison as-tu eue de sortir de la maison paternelle, carogne, carognissime ?')",1.33,Substitution
42,"('#la-veuve', ""Il faut qu'il y ait autre chose : N'êtes-vous point hydropique ? "")",,1.0,Insertion
43,"('#le-vicomte', ""J'en serais bien fâché. "")",,1.0,Insertion
44,"('#la-veuve', ""Voyons.  Elle lui lève ses robes de chambre l'une après l'autre. "")","('#pierrot', ""Voulez-vous parier, monsieur, que c'est l'amour qui l'a mise en campagne ?  Les filles sont des vaisseaux qui ne vont d'ordinaire que de ce vent-là."")",1.87,Substitution
45,"('#le-vicomte', ""Hé, fi, Madame !  Que faites-vous là ?  Cela n'est point honnête. "")","('#colombine', ""Je vous dirai, mon frère, que sitôt que vous fûtes parti, il vint un jeune cavalier, le plus civil du inonde, demander à loger dans notre hôtellerie : pour ne pas paraître moins civile que lui, je lui fis toutes les honnêtetés dont j'étais capable.  Aussi pourquoi me laissez-vous seule ? Elle pleure en disant ces derniers mots."")",0.89,Substitution
46,"('#la-veuve', ""Une, deux, trois robes de chambre, c'est-à-dire trois maîtresses.  Ah, traître !  C'est donc ainsi que tu me joues ?  Tu dis que tu n'aimes que moi."")","('#pierrot', ""Je vous l'ai toujours dit, monsieur ; il faut de la compagnie aux filles, quand ce ne serait qu'un manche à balai."")",1.14,Substitution
47,"('#le-vicomte', ""Madame, je n'en puis plus. "")",,1.0,Insertion
48,"('#la-veuve', ""Voilà l'effet de tes serments !... "")","('#mezzetin', 'Hé bien ?')",1.44,Substitution
49,"('#le-vicomte', 'Madame, je vais tout rendre, si je ne sors. ')","('#colombine', ""Sitôt qu'il fut arrivé, il me pria, mais le plus honnêtement du monde, de lui donner une chambre.  Pour lui faire plaisir, je le menai moi-même, par civilité, dans la belle chambre qui est de plain-pied à la cour."")",1.44,Substitution
50,"('#la-veuve', 'Scélérat ! ')",,1.0,Insertion
51,"('#le-vicomte', 'Madame, je ne réponds plus de la discrétion de mon derrière. ')",,1.0,Insertion
52,"('#la-veuve', ""N'as-tu point de honte ?... "")","('#pierrot', 'Par civilité ?')",1.14,Substitution
53,"('#le-vicomte', ""Il ne tient plus qu'à un petit filet. "")","('#colombine', ""Par civilité.  Mais il ne voulut point y demeurer, appréhendant qu'elle ne fût malsaine, à cause de l'humidité."")",1.7,Substitution
54,,"('#mezzetin', 'Il avait raison.')",1.0,Deletion
55,"('#la-veuve', ""Non, je ne veux plus de commerce avec toi ; rends-moi ma robe de chambre.  Elle lui veut arracher sa robe de chambre : ils se battent ; le Vicomte la décoiffe ; une de ses jupes tombe, et elle s'en va. "")","('#colombine', ""Voyant qu'il faisait difficulté de rester dans cette chambre-là, et qu'il était si civil, je le conduisis dans une autre, qui donne sur la rue, au-dessus de l'écurie."")",0.83,Substitution
56,"('#isabelle', ""En vérité, vous êtes bien folle de farcir votre tête de vos sottes imaginations d'amour et de mariage. Est-ce là le parti que doit prendre une cadette, et ne devriez-vous pas avoir renoncé au monde ? "")","('#pierrot', 'Par civilité ?')",1.8,Substitution
57,"('#colombine', 'Mon_Dieu, ma soeur, cela est bien aisé à dire ; mais vous ne parleriez pas comme vous faites, si vous sentiez ce que je sens. ')","('#colombine', ""Par civilité.  Il me témoigna encore qu'il ne pourrait pas y coucher, à cause qu'étant fatigué et ayant besoin de repos, les chevaux pourraient interrompre son sommeil pendant la nuit."")",1.55,Substitution
58,,"('#mezzetin', 'Ouais !  Voilà un homme bien difficile à coucher.')",1.0,Deletion
59,"('#isabelle', ""Et que sentez-vous donc, s'il vous plaît ?  Vraiment, je vous trouve une jolie mignonne, pour sentir quelque chose !  Et que sentirai-je donc, moi qui suis votre aînée ?  Est-ce que l'on m'entend plaindre des envies que cause I'état de fille ?  Vous êtes encore une plaisante morveuse ! "")","('#pierrot', 'Peut-être pas tant que vous pensez.')",1.47,Substitution
60,"('#colombine', ""Plaisante morveuse !  Mon_Dieu !  Je ne suis pas si morveuse que je le parais, et il y aurait déjà longtemps que je serais femme si mon père avait voulu ; car on m'a dit qu'on pouvait l'être à douze ans. "")","('#colombine', ""Je trouvai qu'il n'avait pas mauvaise raison ; car quand on repose, comme vous savez, on n'est pas bien aise d'être interrompu.  Voyant donc qu'il avait besoin de repos, et qu'il continuait toujours avec les manières les plus civiles du monde, je me crus obligée de le mettre dans un lieu éloigné du bruit : vous savez que ma chambre est au bout du jardin ; je l'y menai,"")",1.07,Substitution
61,"('#isabelle', ""Mais savez-vous bien ce que c'est qu'un mari, pour parler comme vous faites ? "")",,1.0,Insertion
62,"('#colombine', ""Bon !  Si je ne le savais pas, est-ce que j'en voudrais avoir un ? "")",,1.0,Insertion
63,"('#isabelle', 'Hé !  Qui vous a donc appris de si belles choses ? ')","('#pierrot', 'Par civilité ?')",1.38,Substitution
64,"('#colombine', ""Cela ne s'apprend-il pas tout seul ?  Quand je songe que je serai mariée, je suis si aise, si aise !  Oh !  Il faut que ce soit quelque chose de fort joli que le mariage, puisque la pensée seule fait tant de plaisir. "")","('#colombine', ""Assurément.  Est-ce que tu ne l'aurais pas fait à ma place, dis, Pierrot ?"")",1.2,Substitution
65,"('#isabelle', ""Vous vous trompez fort à votre calcul, si vous vous figurez tant de plaisir dans le mariage.  Le beau régal qu'un mari qui gronde toujours !  Les soins des domestiques, l'incommodité d'une grossesse : non, quand il n'y aurait que la peur d'avoir des enfants, je renoncerais au mariage pour toute ma vie. "")","('#pierrot', ""Sans doute, et j'enragerais qu'un autre fût plus civil que moi."")",0.78,Substitution
66,"('#colombine', ""La peur d'avoir des enfants !  Bon !  On dit que c'est pour cela qu'il faut se marier. "")",,1.0,Insertion
67,"('#isabelle', 'Bon Dieu !  Quelle petitesse de raisonnement !  Que votre esprit est à rez-de-chaussée ! ')",,1.0,Insertion
68,"('#colombine', 'Mais vous, ma saur, qui êtes si raisonnable, est-ce que vous ne voulez pas vous marier ? ')","('#mezzetin', 'Voilà du civil qui pourrait bien nous mener au criminel.')",1.84,Substitution
69,"('#isabelle', ""Oh !  Ce n'est pas de même, moi ; je suis votre aînée, et la raison qui veut que vous ne vous mariiez pas, veut que je me marie.  Vous n'êtes point propre au mariage ; ce n'est point un jeu d'enfant. "")",,1.0,Insertion
70,"('#colombine', ""Et moi, je vous dis que j'y suis aussi propre que vous.  Je supporterai fort bien toutes les fatigues du ménage ; et quoique je sois jeune, si j'étais mariée présentement, je suis sûre que je n'en mourrais pas. "")","('#colombine', ""Il trouva que ma chambre l'accommodait assez, et me fit entendre qu'il serait ravi d'y rester.  Je lui dis aussitôt que, puisque cet endroit lui plaisait, j'y ferais mettre un lit pour lui à côté du mien."")",0.69,Substitution
71,,"('#pierrot', 'Par civilité ?')",1.0,Deletion
72,"('#isabelle', ""En vérité, il faut que j'aie bien de la bonté de souffrir tous les travers de votre esprit.  Tout ce que je puis faire encore pour vous, c'est de vous conseiller de bannir de votre cerveau toutes vos idées matrimoniales, et de croire qu'il n'y a personne assez dépourvu de bon sens pour vouloir se charger de votre peau. "")","('#colombine', ""Comment l'entendez-vous donc ?  Mais comme il est extrêmement honnête, il refusa l'offre que je lui faisais, de peur de m'incommoder, et dit qu'il ne souffrirait point que ma chambre fût embarrassée pour l'amour de lui, et qu'il coucherait plutôt dans l'écurie que de me causer la moindre incommodité."")",0.29,Substitution
73,,"('#pierrot', 'Oh !  Dans une écurie !  Le pauvre jeune homme !  Cela me fait pitié.')",1.0,Deletion
74,"('#colombine', ""Hé !  La la, cette charge-là n'est pas si pesante et ne fait pas peur à tout le monde : il n'y a pas encore huit jours que je trouvai dans une boutique, au Palais, un monsieur de condition, qui me dit que j'étais bien à son gré, et qu'il serait bien aise de m'épouser. "")","('#colombine', ""Son honnêteté me fendit le coeur : une fille n'est pas de bois ; et voyant que ma chambre lui plaisait si fort, je lui dis...  Mais vous allez vous fâcher."")",0.76,Substitution
75,"('#isabelle', 'Et que lui répondîtes-vous ? ')","('#mezzetin', 'Non, non...')",1.62,Substitution
76,"('#colombine', ""Je lui dis que j'étais encore bien petite pour cela ; mais que l'année qui vient, j'espérais d'être plus grande. "")",,1.0,Insertion
77,"('#isabelle', ""Vous serez plus grande et plus folle.  Vous ne voyez donc pas qu'il se moquait de vous, et que vous vous donnez un ridicule dans le monde ?  Allez, vous devriez mourir de honte."")",,1.0,Insertion
78,"('#colombine', 'Ne voilà-t-il pas ?  Vous me grondez toujours.  Vous voulez bien vous marier, vous, et vous ne voulez pas que je me marie.  Est-ce que je ne suis pas fille comme vous ? ')","('#colombine', 'Je lui dis...  Me promettez-vous que vous ne vous mettrez pas en colère ?')",0.81,Substitution
79,"('#isabelle', ""Une petite fille qui n'a pas quinze ans, donner à corps perdu au travers du mariage ! "")","('#pierrot', 'Ouf !  Gare la civilité !')",1.51,Substitution
80,"('#colombine', ""Mon_Dieu !  Je vous dis, encore une fois, que j'ai plus d'âge qu'il ne faut ; mais puisque vous me trouvez trop jeune, faisons une chose ; vous avez quatre années plus que moi, donnez-m'en deux ; cela ne gâtera rien ni pour l'une, ni pour l'autre. "")",,1.0,Insertion
81,"('#isabelle', ""Allez, allez ; vous ne savez ce que vous dites. Vous me croyez bien embarrassée de trois ou quatre années que j'ai plus que vous ; mais je veux bien que vous sachiez que pour dix ans de moins je ne voudrais pas être faite comme vous, ni de corps, ni d'esprit."")","('#colombine', ""Je lui dis qu'il n'avait qu'à se coucher dans mon lit."")",1.5,Substitution
82,"('#pierrot', ""Qu'est-ce donc, mesdemoiselles ?  Voilà bien du bruit : il me semble que vous vous flattez comme chiens et chats.  Est-ce que vous ne sauriez vous égratigner plus doucement ? "")","('#pierrot', 'Par civilité ?  Ma foi, monsieur, vous avez là une soeur bien élevée.')",1.33,Substitution
83,"('#colombine', ""Pierrot, c'est ma soeur qui se fiche : elle veut qu'il n'y ait de mari que pour elle. "")","('#mezzetin', ""Oh !  Ma soeur sait vivre ; ce n'est pas là un grand malheur...  Tu allas coucher dans une autre chambre ?"")",1.38,Substitution
84,"('#pierrot', 'Ho !  La goulue ! ')",,1.0,Insertion
85,"('#isabelle', ""Viens çà, Pierrot ; toi qui es un homme d'esprit, et qui sais le monde, n'est-il pas du dernier bourgeois de marier plus d'une fille dans une maison, et ne devrais-je pas déjà l'être ? "")","('#colombine', ""Bon !  Je n'en fus pas la maîtresse : il ne voulut jamais permettre que je m'incommodasse pour l'amour de lui ; il dit qu'il serait au désespoir de m'avoir découchée, et..."")",1.0,Substitution
86,,"('#pierrot', 'Que voilà un garçon bien honnête !')",1.0,Deletion
87,,"('#mezzetin', ""Comment donc !  Qu'est-ce que cela veut dire ?"")",1.0,Deletion
88,"('#pierrot', ""Cela est vrai, et je dis tous les jours à votre père, que, s'il ne vous marie au plus tôt, vous lui ferez quelque stratagème. "")","('#colombine', ""Il me dit qu'il y avait longtemps qu'il m'aimait, qu'il voulait être mon mari ; et il m'en donna sa promesse, que j'ai encore."")",1.27,Substitution
89,"('#colombine', ""Mon pauvre Pierrot, toi qui es si joli, est-ce qu'il faut que je demeure toute ma vie fille ? "")","('#mezzetin', ""Ah, malheureuse !  Faut-il, juste ciel !...  Mais tu n'échapperas pas à ma vengeance, et..."")",0.88,Substitution
90,"('#pierrot', ""Bon !  Est-ce que cela se peut ?  Voyez-vous, mademoiselle, il faut marier les filles quand elles sont jeunes.  Ce gibier-là ne se garde pas : la mouche s'y met.  À Isabelle. "")","('#pierrot', 'Allez, monsieur, un bon mariage raccommodera tout cela.')",1.0,Substitution
91,,"('#colombine', ""Je ne vois pas qu'il y ait un grand mal de coucher avec son mari."")",1.0,Deletion
92,"('#isabelle', 'Mais aussi, est-il juste que je cède mes droits à ma cadette ? ')",,1.0,Insertion
93,"('#pierrot', ""Il est vrai que vous n'êtes encore qu'un embryon, et j'en ai vu dans des bouteilles de bien plus grandes que vous. "")",,1.0,Insertion
94,"('#colombine', ""Je conviens, Pierrot, que je suis encore petite ; mais si tu savais ce que j'ai déjà "")",,1.0,Insertion
95,"('#isabelle', 'Petite fille, vous plaît-il de vous taire ? ')",,1.0,Insertion
96,"('#pierrot', ""Hé ! Pardi, laissez-la dire.  Hé bien donc, qu'avez-vous ?  À Colombine. "")","('#mezzetin', 'Il faut tâcher de remédier à tout ceci. Entrez dans cette hôtellerie-là, et prenez garde de dire que vous me connaissez. À Colombine.')",0.45,Substitution
97,"('#colombine', ""J'ai... mais je n'oserais le dire."")",,1.0,Insertion
98,"('#isabelle', 'Vous avez raison, car vous allez dire une sottise. ')","('#pierrot', ""Ma foi, je n'en saurais revenir : voilà une fille bien civile.  Donner jusqu'à la moitié de son lit à un garçon ; la pauvre enfant !  La pauvre enfant ! Il y a ici quelques scènes italiennes."")",1.55,Substitution
99,"('#pierrot', 'Eh !  Palsangué, laissez-la donc parler : vous lui rembourrez les paroles dans le ventre. ')","('#le-valet', ""Parbleu !  Monsieur, je ne puis plus aller ; j'ai les fesses tout écorchées.  La peste soit du voyage !  On vous envoie solliciter un procès, et vous allez voir l'armée. Ghérardi jouait ce rôle à visage découvert."")",1.28,Substitution
100,"('#colombine', 'Me te moqueras-tu point de moi ? ')",,1.0,Insertion
101,"('#pierrot', 'Eh !  Non, non : dites. ')",,1.0,Insertion
102,"('#colombine', ""J'ai de la gorge, Pierrot, puisque tu le veux savoir. "")","('#monsieur-croquignolet', ""C'est que j'ai le coeur martial."")",1.86,Substitution
103,,"('#le-valet', ""Je crois que monsieur Croquignolet votre père et madame Croquignolet votre mère vont être bien surpris, quand ils verront arriver dans leur boutique monsieur Mathurin Blaise Croquignolet, leur fils l'avocat, qui vient de Flandre."")",1.0,Deletion
104,"('#pierrot', 'Oh !  Voyons cela, voyons. ')","('#monsieur-croquignolet', 'Oh !  Je le crois.')",1.36,Substitution
105,"('#colombine', ""Oh, nenni, nenni ; je ne la montre pas encore : j'attends qu'elle soit plus venue. "")","('#le-valet', 'Tous les badauds du quartier vont venir fondre dans votre boutique, pour savoir de vous des nouvelles du combat.')",1.65,Substitution
106,"('#isabelle', ""Il n'y a plus moyen de tenir à vos impertinences : je vous laisse ; et si je faisais bien, j'avertirais mon père de mettre ordre à votre conduite. "")",,1.0,Insertion
107,"('#pierrot', 'Elle est bien rudanière. ')","('#monsieur-croquignolet', ""Cela est assez drôle, da !  À un jeune praticien comme moi d'avoir déjà vu une bataille contradictoire, et d'en être revenu sain et entier."")",1.76,Substitution
108,"('#colombine', ""Oh !  Va, va, je ne m'en soucie pas.  Elle veut faire la madame, et me traiter comme une petite fille ; mais nous verrons.  Oh !  Çà, çà, Pierrot, il faut que tu me fasses un plaisir. "")","('#le-valet', ""Oh !  Parbleu, monsieur, vous pouvez aller à toutes les occasions du monde comme à celle-là, je vous suis garant que vous n'y serez jamais blessé."")",0.92,Substitution
109,,"('#monsieur-croquignolet', 'Il y faisait pourtant chaud.')",1.0,Deletion
110,"('#pierrot', 'Je ne demande pas mieux.  Ne suis-je pas fait pour faire plaisir aux filles ? ')",,1.0,Insertion
111,"('#colombine', 'Il faut que tu me portes cette lettre à ce monsieur que je trouvai dernièrement au Palais. ')","('#le-valet', 'Cela est vrai ; mais vous preniez le frais sur le mont Pagnotte, à trois bonnes portées du canon.')",1.75,Substitution
112,"('#pierrot', 'Une lettre ! ')",,1.0,Insertion
