,moliere-amants-magnifiques,quinault-alceste,Cost,Operation Type
303,"('#eriphile', ""Oui, Madame, mais il me semble que je ne puis assez reculer ce choix dont on me presse, et que je ne saurais le faire sans mériter quelque blâme.  Je me sens également obligée à l'amour, aux empressements, aux services de ces deux Princes, et je trouve une espèce d'injustice bien grande à me montrer ingrate, ou vers l'un, ou vers l'autre, par le refus qu'il m'en faudra faire dans la préférence de son rival."")","('#alcide', ""J'aime Alceste, il est temps de ne m'en plus défendre :  Elle meurt, ton amour n'a plus rien à prétendre ;  Admète, cède-moi la beauté que tu perds :  Au Palais de Pluton j'entreprends de descendre :  J'irai jusqu'au fond des Enfers  Forcer la mort à me la rendre. "")",0.47,Substitution
304,"('#iphicrate', ""Cela s'appelle, Madame, un fort honnête compliment pour nous refuser tous deux."")",,1.0,Insertion
305,"('#aristione', 'Ce scrupule, ma Fille, ne doit point vous inquiéter, et ces Princes tous deux se sont soumis il y a longtemps à la préférence que pourra faire votre inclination.')","('#admete', ""Je verrais encor ses beaux yeux !  Allez Alcide, allez, revenez glorieux,  Obtenez qu'Alceste vous suive ;  Le Fils du plus puissant des Dieux  Est plus digne que moi du bien dont on me prive.  Allez, allez, ne tardez pas,  Arrachez Alceste au trépas ;  Et ramenez au jour son Ombre fugitive ;  Qu'elle vive pour vous avec tous ses appas,  Admète est trop heureux, pourvu qu'Alceste vive. "")",0.86,Substitution
306,,"('#ensemble', 'Allez, allez, ne tardez pas,  Arrachez Alceste au trépas ; ')",1.0,Deletion
307,"('#eriphile', ""L'inclination, Madame, est fort sujette à se tromper, et des yeux désintéressés sont beaucoup plus capables de faire un juste choix."")",,1.0,Insertion
308,"('#aristione', 'Vous savez que je suis engagée de parole à ne rien prononcer là-dessus, et, parmi ces deux Princes, votre inclination ne peut point se tromper, et faire un choix qui soit mauvais.')","('#diane', ""Le Dieu dont tu tiens la naissance  Oblige tous les Dieux d'être d'intelligence ;  En faveur d'un dessein si beau,  Je viens t'offrir mon assistance ;  Et Mercure s'avance  Pour t'ouvrir aux Enfers, un passage nouveau.  Mercure vient en volant frapper la terre de son Caducée, l'Enfer s'ouvre, et Alcide y descend."")",0.74,Substitution
309,"('#eriphile', ""Pour ne point violenter votre parole, ni mon scrupule, agréez, Madame, un moyen que j'ose proposer."")","('#caron', ""Il faut passer tôt ou tard,  Il faut passer dans ma Barque.  On y vient jeune, ou vieillard,  Ainsi qu'il plaît à la Parque :  On y reçoit sans égard,  Le Berger, et le Monarque.  Il faut passer tôt ou tard,  Il faut passer dans ma Barque.  Vous qui voulez passer, venez, Mânes errants,  Venez, avancez, tristes Ombres,  Payer le tribut que je prends,  Ou retournez errer sur ces Rivages sombres. "")",0.73,Substitution
310,"('#aristione', 'Quoi, ma Fille ?')","('#les-ombres', 'Passe-moi, Caron, passe-moi. ')",1.26,Substitution
311,"('#eriphile', ""Que Sostrate décide de cette préférence.  Vous l'avez pris pour découvrir le secret de mon coeur : souffrez que je le prenne pour me tirer de l'embarras où je me trouve."")","('#caron', ""Il faut auparavant que l'on me satisfasse,  On doit payer les soins d'un si pénible emploi. "")",1.32,Substitution
312,"('#aristione', ""J'estime tant Sostrate que, soit que vous vouliez vous servir de lui pour expliquer vos sentiments, ou soit que vous vous en remettiez absolument à sa conduite ; je fais, dis-je, tant d'estime de sa vertu et de son jugement, que je consens de tout mon coeur, à la proposition que vous me faites."")",,1.0,Insertion
313,"('#iphicrate', ""C'est-à-dire, Madame, qu'il nous faut faire notre cour à Sostrate ?"")",,1.0,Insertion
314,"('#sostrate', ""Non, Seigneur, vous n'aurez point de cour à me faire, et avec tout le respect que je dois aux Princesses, je renonce à la gloire où elles veulent m'élever."")","('#les-ombres', 'Passe-moi, Caron, passe-moi.  CARON fait entrer dans sa Barque les Ombres qui ont de quoi le payer.')",1.27,Substitution
315,"('#aristione', ""D'où vient cela, Sostrate ?"")",,1.0,Insertion
316,"('#sostrate', ""J'ai des raisons, Madame, qui ne permettent pas que je reçoive l'honneur que vous me présentez."")",,1.0,Insertion
317,"('#iphicrate', 'Craignez-vous, Sostrate, de vous faire un ennemi ?')",,1.0,Insertion
318,"('#sostrate', 'Je craindrais peu, Seigneur, les ennemis que je pourrais me faire en obéissant à mes souveraines.')","('#caron', ""Donne, passe ; donne, passe ;  Demeure toi,  Tu n'as rien, il faut qu'on te chasse. "")",1.45,Substitution
319,"('#timocles', ""Par quelle raison donc refusez-vous d'accepter le pouvoir qu'on vous donne, et de vous acquérir l'amitié d'un Prince qui vous devrait tout son bonheur ?"")",,1.0,Insertion
320,"('#sostrate', ""Par la raison que je ne suis pas en état d'accorder à ce Prince ce qu'il souhaiterait de moi."")",,1.0,Insertion
321,"('#iphicrate', 'Quelle pourrait être cette raison ?')","('#une-ombre', 'Une Ombre tient si peu de place. ')",1.75,Substitution
322,,"('#caron', 'Ou paye, ou tourne ailleurs tes pas. ')",1.0,Deletion
323,"('#sostrate', ""Pourquoi me tant presser là-dessus ?  Peut-être ai-je, Seigneur, quelque intérêt secret qui s'oppose aux prétentions de votre amour.  Peut-être ai-je un ami qui brûle sans oser le dire, d'une flamme respectueuse pour les charmes divins dont vous êtes épris.  Peut-être cet ami me fait-il tous les jours confidence de son martyre ; qu'il se plaint à moi tous les jours des rigueurs de sa destinée, et regarde l'hymen de la Princesse, ainsi que l'arrêt redoutable qui le doit pousser au tombeau ; et si cela était, Seigneur, serait-il raisonnable que ce fût de ma main qu'il reçût le coup de sa mort ?"")","('#l-ombre', 'De grâce, par pitié, ne me rebute pas. ')",1.01,Substitution
324,"('#iphicrate', ""Vous auriez bien la mine, Sostrate, d'être vous-même cet ami dont vous prenez les intérêts."")",,1.0,Insertion
325,"('#sostrate', ""Ne cherchez point, de grâce, à me rendre odieux aux personnes qui vous écoutent ; je sais me connaître, Seigneur, et les malheureux comme moi n'ignorent pas jusques où leur fortune leur permet d'aspirer."")","('#caron', ""La pitié n'est point ici-bas,  Et Caron ne fait point de grâce. "")",1.09,Substitution
326,,"('#l-ombre', 'Hélas ! Caron, hélas ! Hélas ! ')",1.0,Deletion
327,"('#aristione', ""Laissons cela, nous trouverons moyen de terminer l'irrésolution de ma fille."")",,1.0,Insertion
328,"('#anaxarque', ""En est-il un meilleur, Madame, pour terminer les choses au contentement de tout le monde, que les lumières que le Ciel peut donner sur ce mariage ?  J'ai commencé, comme je vous ai dit, à jeter pour cela les figures mystérieuses que notre art nous enseigne, et j'espère vous faire voir tantôt ce que l'avenir garde à cette union souhaitée.  Après cela pourra-t-on balancer encore ?  La gloire et les prospérités que le Ciel promettra, ou à l'un, ou à l'autre choix, ne seront-elles pas suffisantes pour le déterminer, et celui qui sera exclus, pourra-t-il s'offenser quand ce sera le Ciel qui décidera cette préférence ?"")","('#caron', ""Crie, hélas ! Tant que tu voudras,  Rien pour rien, en tous lieux, est une loi suivie :  Les mains vides sont sans appas ;  Et ce n'est point assez de payer dans la vie :  Il faut encor payer au-delà du trépas. "")",1.01,Substitution
329,"('#iphicrate', ""Pour moi, je m'y soumets entièrement, et je déclare que cette voie me semble la plus raisonnable."")","('#l-ombre', 'Hélas ! Caron, hélas ! Hélas ! ')",1.93,Substitution
330,"('#timocles', 'Je suis de même avis, et le Ciel ne saurait rien faire où je ne souscrive sans répugnance.')","('#caron', ""Il importe peu que l'on crie :  Hélas ! Caron, hélas ! Hélas !  Il faut encor payer au-delà du trépas. "")",1.24,Substitution
331,"('#eriphile', 'Mais, Seigneur Anaxarque, voyez-vous si clair dans les destinées, que vous ne vous trompiez jamais, et ces prospérités, et cette gloire que vous dites que le Ciel nous promet, qui en sera caution, je vous prie ?')","('#alcide', ""Sortez, Ombres, faites-moi place,  Vous passerez une autre fois.  Les Ombres s'enfuient."")",0.97,Substitution
332,"('#aristione', 'Ma fille, vous avez une petite incrédulité qui ne vous quitte point.')",,1.0,Insertion
333,"('#anaxarque', ""Les épreuves, Madame, que tout le monde a vues de l'infaillibilité de mes prédictions, sont les cautions suffisantes des promesses que je puis faire.  Mais enfin, quand je vous aurai fait voir ce que le Ciel vous marque, vous vous réglerez là-dessus, à votre fantaisie, et ce sera à vous à prendre la fortune de l'un, ou de l'autre choix."")","('#caron', 'Ah ! Ma Barque ne peut offrir un si grand poids ! ')",1.5,Substitution
334,"('#eriphile', ""Le Ciel, Anaxarque, me marquera les deux fortunes qui m'attendent ?"")","('#alcide', ""Allons, il faut que l'on me passe. "")",1.5,Substitution
335,"('#anaxarque', ""Oui, Madame, les félicités qui vous suivront, si vous épousez l'un, et les disgrâces qui vous accompagneront, si vous épousez l'autre."")",,1.0,Insertion
336,"('#eriphile', ""Mais comme il est impossible que je les épouse tous deux, il faut donc qu'on trouve écrit dans le Ciel, non seulement ce qui doit arriver, mais aussi ce qui ne doit pas arriver."")",,1.0,Insertion
337,"('#clitidas', 'Voilà mon astrologue embarrassé.')",,1.0,Insertion
338,"('#anaxarque', ""Il faudrait vous faire, Madame, une longue discussion des principes de l'astrologie pour vous faire comprendre cela."")",,1.0,Insertion
339,"('#clitidas', ""Bien répondu.  Madame, je ne dis point de mal de l'astrologie, l'astrologie est une belle chose, et le Seigneur Anaxarque est un grand homme."")",,1.0,Insertion
340,"('#iphicrate', ""La vérité de l'astrologie est une chose incontestable, et il n'y a personne qui puisse disputer contre la certitude de ses prédictions."")",,1.0,Insertion
341,"('#clitidas', 'Assurément.')",,1.0,Insertion
342,"('#timocles', ""Je suis assez incrédule pour quantité de choses, mais pour ce qui est de l'astrologie, il n'y a rien de plus sûr et de plus constant, que le succès des horoscopes qu'elle tire."")",,1.0,Insertion
343,"('#clitidas', 'Ce sont des choses les plus claires du monde.')",,1.0,Insertion
344,"('#iphicrate', 'Cent aventures prédites arrivent tous les jours, qui convainquent les plus opiniâtres.')","('#caron', ""Retire-toi d'ici, Mortel, qui que tu sois,  Les Enfers irrités puniront ton audace. "")",1.31,Substitution
345,"('#clitidas', 'Il est vrai.')",,1.0,Insertion
346,"('#timocles', 'Peut-on contester sur cette matière les incidents célèbres, dont les histoires nous font foi ?')","('#alcide', 'Passe-moi sans tant de façons. ')",1.09,Substitution
347,"('#clitidas', ""Il faut n'avoir pas le sens commun.  Le moyen de contester ce qui est moulé."")",,1.0,Insertion
348,"('#aristione', ""Sostrate n'en dit mot, quel est son sentiment là-dessus ?"")","('#caron', ""L'eau nous gagne, ma Barque crève. "")",1.76,Substitution
349,"('#sostrate', ""Madame, tous les esprits ne sont pas nés avec les qualités qu'il faut pour la délicatesse de ces belles sciences, qu'on nomme curieuses, et il y en a de si matériels, qu'ils ne peuvent aucunement comprendre ce que d'autres conçoivent le plus facilement du monde.  Il n'est rien de plus agréable, Madame, que toutes les grandes promesses de ces connaissances sublimes.  Transformer tout en or, faire vivre éternellement, guérir par des paroles, se faire aimer de qui l'on veut, savoir tous les secrets de l'avenir, faire descendre comme on veut du ciel sur des métaux des impressions de bonheur, commander aux démons, se faire des armées invisibles et des soldats invulnérables.  Tout cela est charmant, sans doute, et il y a des gens qui n'ont aucune peine à en comprendre la possibilité, cela leur est le plus aisé du monde à concevoir ; mais pour moi, je vous avoue que mon esprit grossier a quelque peine à le comprendre, et à le croire, et j'ai toujours trouvé cela trop beau pour être véritable.  Toutes ces belles raisons de sympathie, de force magnétique et de vertu occulte, sont si subtiles et délicates, qu'elles échappent à mon sens matériel, et sans parler du reste, jamais il n'a été en ma puissance de concevoir comme on trouve écrit dans le ciel jusqu'aux plus petites particularités de la fortune du moindre homme.  Quel rapport, quel commerce, quelle correspondance peut-il y avoir entre nous et des globes, éloignés de notre terre d'une distance si effroyable, et d'où cette belle science, enfin, peut-elle être venue aux hommes ?  Quel dieu l'a révélée, ou quelle expérience l'a pu former, de l'observation de ce grand nombre d'astres qu'on n'a pu voir encore deux fois dans la même disposition ?"")",,1.0,Insertion
350,"('#anaxarque', 'Il ne sera pas difficile de vous le faire concevoir.')",,1.0,Insertion
351,"('#sostrate', 'Vous serez plus habile que tous les autres.')",,1.0,Insertion
352,"('#clitidas', 'Il vous fera une discussion de tout cela quand vous voudrez.')","('#alcide', 'Allons, rame, dépêche, achève. ')",1.57,Substitution
353,"('#iphicrate', ""Si vous ne comprenez pas les choses, au moins les pouvez-vous croire, sur ce que l'on voit tous les jours."")",,1.0,Insertion
354,"('#sostrate', ""Comme mon sens est si grossier qu'il n'a pu rien comprendre, mes yeux aussi sont si malheureux qu'ils n'ont jamais rien vu."")",,1.0,Insertion
355,"('#iphicrate', ""Pour moi j'ai vu, et des choses tout à fait convaincantes."")","('#caron', 'Nous enfonçons. ')",1.58,Substitution
356,"('#timocles', 'Et moi aussi.')","('#alcide', 'Passons, passons. ')",1.42,Substitution
357,"('#sostrate', 'Comme vous avez vu, vous faites bien de croire, et il faut que vos yeux soient faits autrement que les miens.')",,1.0,Insertion
358,"('#iphicrate', ""Mais enfin, la Princesse croit à l'astrologie, et il me semble qu'on y peut bien croire après elle.  Est-ce que Madame, Sostrate, n'a pas de l'esprit et du sens ?"")",,1.0,Insertion
359,"('#sostrate', ""Seigneur, la question est un peu violente, l'esprit de la Princesse n'est pas une règle pour le mien, et son intelligence peut l'élever à des lumières où mon sens ne peut pas atteindre."")","('#pluton', ""Reçois le juste prix de ton amour fidèle ;  Que ton dessein nouveau soit heureux à jamais :  Commence de goûter la douceur éternelle  D'une profonde paix. "")",1.52,Substitution
360,"('#aristione', ""Non, Sostrate, je ne vous dirai rien sur quantité de choses, auxquelles je ne donne guère plus de créance que vous.  Mais pour l'astrologie on m'a dit, et fait voir des choses si positives que je ne la puis mettre en doute."")",,1.0,Insertion
361,"('#sostrate', ""Madame, je n'ai rien à répondre à cela."")",,1.0,Insertion
362,"('#aristione', ""Quittons ce discours, et qu'on nous laisse un moment.  Dressons notre promenade, ma Fille, vers cette belle grotte, où j'ai promis d'aller.  Des galanteries à chaque pas."")","('#suivants-de-pluton', ""Commence de goûter la douceur éternelle  D'une profonde paix. "")",0.9,Substitution
363,"('#aristione', ""De qui que cela soit, on ne peut rien de plus galant et de mieux entendu.  Ma Fille, j'ai voulu me séparer de tout le monde pour vous entretenir, et je veux que vous ne me cachiez rien de la vérité.  N'auriez-vous point dans l'âme quelque inclination secrète que vous ne voulez pas nous dire ?"")","('#proserpine', ""L'épouse de Pluton te retient auprès d'elle :  Tous tes voeux seront satisfaits. "")",1.56,Substitution
364,"('#eriphile', 'Moi, Madame ?')","('#suivants-de-pluton', ""Commence de goûter la douceur éternelle  D'une profonde paix. "")",1.54,Substitution
365,"('#aristione', ""Parlez à coeur ouvert, ma Fille, ce que j'ai fait pour vous mérite bien que vous usiez avec moi de franchise.  Tourner vers vous toutes mes pensées, vous préférer à toutes choses, et fermer l'oreille en l'état où je suis, à toutes les propositions que cent princesses en ma place écouteraient avec bienséance, tout cela vous doit assez persuader que je suis une bonne mère, et que je ne suis pas pour recevoir avec sévérité les ouvertures que vous pourriez me faire de votre coeur."")","('#pluton #proserpine', ""En faveur d'une Ombre si belle,  Que l'Enfer fasse voir tout ce qu'il a d'attraits.  Les suivants de PLUTON répètent les deux derniers vers, et se réjouissent de la venue d'ALCESTE dans les Enfers, par une espèce de Fête."")",1.08,Substitution
366,"('#eriphile', ""Si j'avais si mal suivi votre exemple que de m'être laissée aller à quelques sentiments d'inclination que j'eusse raison de cacher, j'aurais, Madame, assez de pouvoir sur moi-même pour imposer silence à cette passion, et me mettre en état de ne rien faire voir qui fût indigne de votre sang."")","('#suivants-de-pluton', ""En faveur d'une Ombre si belle,  Que l'Enfer fasse voir tout ce qu'il a d'attraits.  Tout Mortel doit ici paraître,  On ne peut naître  Que pour mourir :  De cent maux le Trépas délivre ;  Qui cherche à vivre  Cherche à souffrir.  Venez tous sur nos sombres bords,  Le repos qu'on désire  Ne tient son Empire  Que dans le Séjour des morts.  On danse."")",0.45,Substitution
367,"('#aristione', ""Non, non, ma fille : vous pouvez sans scrupule m'ouvrir vos sentiments.  Je n'ai point renfermé votre inclination dans le choix de deux princes : vous pouvez l'étendre où vous voudrez, et le mérite auprès de moi tient un rang si considérable, que je l'égale à tout ; et, si vous m'avouez franchement les choses, vous me verrez souscrire sans répugnance au choix qu'aura fait votre coeur."")","('#choeur', ""Chacun vient ici-bas prendre place ;  Sans cesse on y passe,  Jamais on n'en sort.  C'est pour tous une loi nécessaire ;  L'effort qu'on peut faire  N'est qu'un vain effort :  Est-on sage  De fuir ce passage ?  C'est un orage  Qui mène au Port.  Chacun vient ici-bas prendre place ;  Sans cesse on y passe,  Jamais on n'en sort.  Tous les charmes,  Plaintes, cris, larmes,  Tout est sans armes  Contre la mort.  Chacun vient ici-bas prendre place ;  Sans cesse on y passe,  Jamais on n'en sort.  On danse."")",0.99,Substitution
368,"('#eriphile', ""Vous avez des bontés pour moi, Madame, dont je ne puis assez me louer ; mais je ne les mettrai point à l'épreuve sur le sujet dont vous me parlez, et tout ce que je leur demande, c'est de ne point presser un mariage où je ne me sens pas encore bien résolue."")",,1.0,Insertion
369,"('#aristione', ""Jusqu'ici je vous ai laissée assez maîtresse de tout, et l'impatience des Princes vos amants...  Mais quel bruit est-ce que j'entends : ah !  Ma fille, quel spectacle s'offre à nos yeux, quelque Divinité descend ici, et c'est la Déesse Vénus qui semble nous vouloir parler."")","('#alecton', ""Quittez, quittez les Jeux, songez à vous défendre,  Contre un Audacieux unissons nos efforts :  Le Fils de Jupiter vient ici de descendre  Seul, il ose attaquer tout l'Empire des morts. "")",0.77,Substitution
370,"('#venus', ""Princesse dans tes soins brille un zèle exemplaire, Qui par les Immortels doit être couronné, Et pour te voir un gendre, illustre et fortuné, Leur main te veut marquer le choix que tu dois faire ; Ils t'annoncent tous par ma voix, La gloire et les grandeurs, que par ce digne choix, Ils feront pour jamais entrer dans ta famille, De tes difficultés termine donc le cours ; Et pense à donner ta fille À qui sauvera tes jours."")","('#pluton', ""Qu'on arrête ce Téméraire,  Armez-vous, Amis, armez-vous,  Qu'on déchaîne Cerbère,  Courez tous, courez tous.  On entend aboyer CERBERE."")",1.44,Substitution
371,"('#aristione', ""Ma Fille, les Dieux imposent silence à tous nos raisonnements.  Après cela, nous n'avons plus rien à faire, qu'à recevoir ce qu'ils s'apprêtent à nous donner, et vous venez d'entendre distinctement leur volonté.  Allons dans le premier temple les assurer de notre obéissance, et leur rendre grâce de leurs bontés."")","('#alecton', ""Son bras abat tout ce qu'il frappe,  Tout cède à ses horribles coups,  Rien ne résiste, rien n'échappe. "")",1.06,Substitution
372,"('#cleon', ""Voilà la Princesse qui s'en va, ne voulez-vous pas lui parler ?"")",,1.0,Insertion
373,"('#anaxarque', ""Attendons que sa fille soit séparée d'elle, c'est un esprit que je redoute, et qui n'est pas de trempe à se laisser mener, ainsi que celui de sa mère.  Enfin, mon Fils, comme nous venons de voir par cette ouverture, le stratagème a réussi, notre Vénus a fait des merveilles ; et l'admirable ingénieur qui s'est employé à cet artifice, a si bien disposé tout, a coupé avec tant d'adresse le plancher de cette grotte, si bien caché ses fils de fer et tous ses ressorts, si bien ajusté ses lumières, et habillé ses personnages, qu'il y a peu de gens qui n'y eussent été trompés.  Et comme la Princesse Aristione est fort superstitieuse, il ne faut point douter qu'elle ne donne à pleine tête dans cette tromperie.  Il y a longtemps, mon fils, que je prépare cette machine, et me voilà tantôt au but de mes prétentions."")","('#pluton', ""Insolent, jusqu'ici braves-tu mon courroux ?  Quelle injuste audace t'engage  À troubler la paix de ces lieux? "")",0.92,Substitution
374,"('#cleon', 'Mais pour lequel des deux princes au moins dressez-vous tout cet artifice ?')","('#alcide', 'Je suis né pour dompter la rage  Des Monstres les plus furieux. ')",1.54,Substitution
375,"('#anaxarque', ""Tous deux ont recherché mon assistance, et je leur promets à tous deux la faveur de mon art ; mais les présents du Prince Iphicrate, et les promesses qu'il m'a faites, l'emportent de beaucoup sur tout ce qu'a pu faire l'autre.  Ainsi ce sera lui qui recevra les effets favorables de tous les ressorts que je fais jouer ; et comme son ambition me devra toute chose, voilà mon fils notre fortune faite.  Je vais prendre mon temps pour affermir dans son erreur l'esprit de la Princesse, pour la mieux prévenir encore par le rapport que je lui ferai voir adroitement des paroles de Vénus, avec les prédictions des figures célestes, que je lui dis que j'ai jetées.  Va-t'en tenir la main au reste de l'ouvrage, préparer nos six hommes à se bien cacher dans leur barque derrière le rocher ; à posément attendre le temps que la Princesse Aristione vient tous les soirs se promener seule sur le rivage, à se jeter bien à propos sur elle, ainsi que des corsaires, et donner lieu au Prince Iphicrate de lui apporter ce secours, qui sur les paroles du Ciel doit mettre entre ses mains la Princesse Ériphile.  Ce prince est averti par moi, et sur la foi de ma prédiction, il doit se tenir dans ce petit bois qui borde le rivage.  Mais sortons de cette grotte, je te dirai en marchant toutes les choses qu'il faut bien observer.  Voilà la Princesse Ériphile : évitons sa rencontre."")","('#pluton', ""Est-ce le Dieu jaloux qui lance lez tonnerre,  Qui t'oblige à porter la guerre  Jusqu'au centre de l'Univers ?  Il tient sous son pouvoir et le Ciel et la Terre,  Veut-il encor ravir l'Empire des Enfers ? "")",0.89,Substitution
376,"('#eriphile', ""Hélas !  Quelle est ma destinée, et qu'ai-je fait aux Dieux pour mériter les soins qu'ils veulent prendre de moi ?"")",,1.0,Insertion
377,"('#cleonice', ""Le voici, Madame, que j'ai trouvé, et à vos premiers ordres, il n'a pas manqué de me suivre."")",,1.0,Insertion
378,"('#eriphile', ""Qu'il approche, Cléonice, et qu'on nous laisse seuls un moment.  Sostrate, vous m'aimez ?"")",,1.0,Insertion
379,"('#sostrate', 'Moi, Madame ?')",,1.0,Insertion
