,moliere-amants-magnifiques,quinault-alceste,Cost,Operation Type
0,"('#clitidas', 'Il est attaché à ses pensées ?')",,1.0,Insertion
1,"('#sostrate', ""Non, Sostrate, je ne vois rien où tu puisses avoir recours, et tes maux sont d'une nature à ne te laisser nulle espérance d'en sortir."")",,1.0,Insertion
2,"('#clitidas', 'Il raisonne tout seul.')",,1.0,Insertion
3,"('#sostrate', 'Hélas !')",,1.0,Insertion
4,"('#clitidas', 'Voilà des soupirs qui veulent dire quelque chose, et ma conjecture se trouvera véritable.')","('#la-nymphe-de-la-seine', ""LE HÉROS que j'attends, ne reviendra-t-il pas ?  Serai-je toujours languissante  Dans une si cruelle attente ?  LE HÉROS que j'attends, ne reviendra-t-il pas ?  On n'entend plus d'Oiseau qui chante,  On ne voit plus de Fleurs qui naissent sous nos pas :  LE HÉROS que j'attends, ne reviendra-t-il pas ?  L'herbe naissante  Paraît mourante,  Tout languit avec moi dans ces lieux plein d'appas :  LE HÉROS que j'attends, ne reviendra-t-il pas ?  Serai-je toujours languissante  Dans une si cruelle attente ?  LE HÉROS que j'attends, ne reviendra-t-il pas ?  Bruit de Guerre. Quel bruit de guerre m'épouvante ?  Quelle Divinité va descendre ici-bas. "")",1.36,Substitution
5,"('#sostrate', ""Sur quelles chimères, dis-moi, pourrais-tu bâtir quelque espoir, et que peux-tu envisager, que l'affreuse longueur d'une vie malheureuse, et des ennuis à ne finir que par la mort."")","('#la-nymphe-de-la-seine', ""Hélas ! Superbe Gloire, hélas !  Ne dois-tu point être contente !  LE HEROS que j'attends, ne reviendra-t-il pas ?  Il ne te suit que trop dans l'horreur des Combats ;  Laisse en paix un moment sa Valeur triomphante  LE HEROS que j'attends, ne reviendra-t-il pas ? "")",0.64,Substitution
6,"('#clitidas', 'Cette tête-là est plus embarrassée que la mienne ?')",,1.0,Insertion
7,"('#sostrate', ""Ah !  Mon coeur, ah !  Mon coeur, où m'avez-vous jeté ?"")",,1.0,Insertion
8,"('#clitidas', 'Serviteur, Seigneur Sostrate.')",,1.0,Insertion
9,"('#sostrate', 'Où vas-tu, Clitidas ?')",,1.0,Insertion
10,"('#clitidas', ""Mais vous plutôt, que faites-vous ici, et quelle secrète mélancolie, quelle humeur sombre, s'il vous plaît, vous peut retenir dans ces bois, tandis que tout le monde a couru en foule à la magnificence de la fête, dont l'amour du prince Iphicrate vient de régaler sur la mer la promenade des Princesses ; tandis qu'elles y ont reçu des cadeaux merveilleux de musique et de danse, et qu'on a vu les rochers et les ondes se parer de Divinités pour faire honneur à leurs attraits ?"")","('#la-gloire', ""Pourquoi tant de murmure ? Nymphe, ta plainte est vaine,  Tu ne peux voir sans moi LE HEROS que tu sers,  Si son éloignement te coûte tant de peine,  Il récompense assez les douceurs que tu perds,  Vois ce qu'il fait pour Toi, quand la Gloire l'emmène ;  Vois comme sa Valeur a soumis à la Seine  Le Fleuve le plus fier qui soit dans l'Univers. "")",0.35,Substitution
11,"('#sostrate', ""Je me figure assez, sans la voir, cette magnificence, et tant de gens d'ordinaire s'empressent à porter de la confusion dans ces sortes de fêtes, que j'ai cru à propos de ne pas augmenter le nombre des importuns."")","('#la-nymphe-de-la-seine', 'On ne voit plus ici paraître  Que des Ornements imparfaits ;  Ah ! Rends-nous notre AUGUSTE MAITRE,  Tu nous rendras tous nos attraits. ')",1.11,Substitution
12,"('#clitidas', ""Vous savez que votre présence ne gâte jamais rien, et que vous n'êtes point de trop, en quelque lieu que vous soyez.  Votre visage est bien venu partout, et il n'a garde d'être de ces visages disgraciés, qui ne sont jamais bien reçus des regards souverains.  Vous êtes également bien auprès des deux princesses ; et la mère et la fille vous font assez connaître l'estime qu'elles font de vous pour n'appréhender pas de fatiguer leurs yeux ; et ce n'est pas cette crainte, enfin, qui vous a retenu."")",,1.0,Insertion
13,"('#sostrate', ""J'avoue que je n'ai pas naturellement grande curiosité pour ces sortes de choses."")",,1.0,Insertion
14,"('#clitidas', ""Mon_Dieu !  Quand on n'aurait nulle curiosité pour les choses, on en a toujours pour aller où l'on trouve tout le monde, et quoi que vous puissiez dire, on ne demeure point tout seul pendant une fête à rêver parmi des arbres comme vous faites, à moins d'avoir en tête quelque chose qui embarrasse."")",,1.0,Insertion
15,"('#sostrate', ""Que voudrais-tu que j'y pusse avoir ?"")","('#la-gloire', ""Il revient, et tu dois m'en croire ;  Je lui sers de guide avec soin :  Puisque tu vois la Gloire,  Ton Héros n'est pas loin.  Il laisse respirer tout le Monde qui tremble ;  Soyons ici d'accord pour combler ses désirs. "")",0.75,Substitution
16,"('#clitidas', ""Ouais, je ne sais d'où cela vient, mais il sent ici l'amour ; ce n'est pas moi.  Ah !  Par ma foi c'est vous."")","('#ensemble', ""Qu'il est doux d'accorder ensemble  La Gloire, et les Plaisirs. "")",1.07,Substitution
17,"('#sostrate', 'Que tu es fou, Clitidas.')","('#la-nymphe-de-la-seine', ""Naïades, Dieux des Bois, Nymphes, que tout s'assemble,  Qu'on entende nos chants après tant de soupirs. "")",1.9,Substitution
18,"('#clitidas', ""Je ne suis point fou, vous êtes amoureux, j'ai le nez délicat, et j'ai senti cela d'abord."")","('#choeur', ""Qu'il est doux d'accorder ensemble  La Gloire, et les Plaisirs. "")",1.0,Substitution
19,"('#sostrate', 'Sur quoi prends-tu cette pensée.')",,1.0,Insertion
20,"('#clitidas', 'Sur quoi ?  Vous seriez bien étonné si je vous disais encore de qui vous êtes amoureux.')",,1.0,Insertion
21,"('#sostrate', 'Moi ?')",,1.0,Insertion
22,"('#clitidas', ""Oui, je gage que je vais deviner tout à l'heure celle que vous aimez.  J'ai mes secrets aussi bien que notre astrologue, dont la princesse Aristione est entêtée ; et s'il a la science de lire dans les astres la fortune des hommes, j'ai celle de lire dans les yeux le nom des personnes qu'on aime.  Tenez-vous un peu, et ouvrez les yeux.  É, par soi, é, r, i, ri, éri, p, h, i, phi, ériphi ; l, e, le : Ériphile.  Vous êtes amoureux de la Princesse Ériphile."")","('#la-nymphe-des-tuileries', ""L'art d'accord avec la Nature  Sert l'Amour dans ces lieux charmants :  Ces Eaux qui font rêver par un si doux murmure,  Ces Tapis où les Fleurs forment tant d'ornements,  Ces Gazons, ces Lits de verdure,  Tout n'est fait que pour les Amants."")",1.05,Substitution
23,"('#sostrate', ""Ah !  Clitidas ; j'avoue que je ne puis cacher mon trouble, et tu me frappes d'un coup de foudre."")","('#la-nymphe-de-la-marne', ""L'onde se presse  D'aller sans cesse  Jusqu'au bout de son cours :  S'il faut qu'un coeur suive une pente,  En est-il qui soit plus charmante  Que le doux penchant des Amours ?  On danse."")",1.15,Substitution
24,"('#clitidas', 'Vous voyez si je suis savant ?')",,1.0,Insertion
25,"('#sostrate', 'Hélas !  Si, par quelque aventure, tu as pu découvrir le secret de mon coeur, je te conjure au moins de ne le révéler à qui que ce soit, et surtout de le tenir caché à la belle princesse dont tu viens de dire le nom.')","('#la-gloire #la-nymphe-de-la-seine', 'Que tout retentisse,  Que tout réponde à nos voix. ')",1.53,Substitution
26,"('#clitidas', ""Et sérieusement parlant, si dans vos actions j'ai bien pu connaître, depuis un temps, la passion que vous voulez tenir secrète, pensez-vous que la princesse Ériphile puisse avoir manqué de lumière pour s'en apercevoir ?  Les belles, croyez-moi, sont toujours les plus clairvoyantes à découvrir les ardeurs qu'elles causent, et le langage des yeux et des soupirs se fait entendre mieux qu'à tout autre à celles à qui il s'adresse."")","('#la-nymphe-de-la-tuileries', 'Que tout fleurisse  Dans nos jardins et dans nos bois. ')",1.66,Substitution
27,,"('#la-nymphe-de-la-marne', ""Que le Chant des Oiseaux s'unisse  Avec le doux son des Hautbois. "")",1.0,Deletion
28,"('#sostrate', ""Laissons-la, Clitidas, laissons-la voir si elle peut dans mes soupirs et mes regards l'amour que ses charmes m'inspirent, mais gardons bien que par nulle autre voie, elle en apprenne jamais rien."")","('#tous-ensemble', ""Que tout retentisse,  Que tout réponde à nos voix :  Que le Chant des Oiseaux s'unisse  Avec le doux son des hautbois. Que tout retentisse,  Que tout réponde à nos voix.  On danse."")",1.44,Substitution
29,"('#clitidas', ""Et qu'appréhendez-vous ?  Est-il possible que ce même Sostrate qui n'a pas craint ni Brennus, ni tous les Gaulois et dont le bras a si glorieusement contribué à nous défaire de ce déluge de barbares qui ravageait la Grèce ?  Est-il possible, dis-je, qu'un homme si assuré dans la guerre soit si timide en amour, et que je le voie trembler à dire seulement qu'il aime ? "")","('#choeur', ""Quel coeur sauvage  Ici ne s'engage ?  Quel coeur sauvage  Ne sent point l'amour ?  Nous allons voir les Plaisirs de retour ;  Ne manquons pas d'en faire un doux usage :  Pour rire un peu, l'on n'est pas moins sage.  Ah, quel dommage  De fuir ce rivage !  Ah, quel dommage  De perdre un beau jour !  Nous allons voir les Plaisirs de retour ;  Ne manquons pas d'en faire un doux usage :  Pour rire un peu, l'on n'est pas moins sage.  On danse."")",0.78,Substitution
30,"('#sostrate', 'Ah !  Clitidas, je tremble avec raison, et tous les Gaulois du monde ensemble sont bien moins redoutables, que deux beaux yeux pleins de charmes.')","('#choeurs', 'Revenez, Plaisirs exilés,  Volez de toutes parts, volez.  Les Plaisirs volent, et viennent préparer des Divertissements.')",0.8,Substitution
31,,"('#choeur', 'Vivez, vivez, heureux époux. ')",1.0,Deletion
32,"('#clitidas', ""Je ne suis pas de cet avis, et je sais bien pour moi qu'un seul Gaulois l'épée à la main, me ferait beaucoup plus trembler que cinquante beaux yeux ensemble les plus charmants du monde.  Mais dites-moi un peu, qu'espérez-vous faire ?"")","('#licas', 'Votre Ami le plus cher, épouse la Princesse  La plus charmante de la Grèce :  Lorsque chacun les suit, Seigneur, les fuyez-vous ? ')",1.25,Substitution
33,,"('#choeur', 'Vivez, vivez, heureux Époux. ')",1.0,Deletion
34,"('#sostrate', 'Mourir sans déclarer ma passion.')","('#licas', ""Vous paraissez troublé des cris qui retentissent ?  Quand deux Amants heureux s'unissent  Le coeur du grand Alcide en serait-il jaloux ? "")",0.97,Substitution
35,"('#clitidas', ""L'espérance est belle.  Allez, allez, vous vous moquez, un peu de hardiesse réussit toujours aux amants ; il n'y a en amour que les honteux qui perdent, et je dirais ma passion à une Déesse moi, si j'en devenais amoureux."")","('#choeur', 'Vivez, vivez, heureux Époux. ')",1.17,Substitution
36,"('#sostrate', 'Trop de choses, hélas !  Condamnent mes feux à un éternel silence.')","('#licas', 'Seigneur, vous soupirez, et gardez le silence ? ')",0.55,Substitution
37,"('#clitidas', 'Hé quoi ?')",,1.0,Insertion
38,"('#sostrate', ""La bassesse de ma fortune, dont il plaît au Ciel de rabattre l'ambition de mon amour, le rang de la Princesse qui met entre elle et mes désirs une distance si fâcheuse, la concurrence de deux princes appuyés de tous les grands titres qui peuvent soutenir les prétentions de leurs flammes ; de deux princes qui par mille et mille magnificences, se disputent, à tous moments, la gloire de sa conquête, et sur l'amour de qui on attend tous les jours de voir son choix se déclarer, mais plus que tout, Clitidas, le respect inviolable où ses beaux yeux assujettissent toute la violence de mon ardeur."")",,1.0,Insertion
39,"('#clitidas', ""Le respect bien souvent n'oblige pas tant que l'amour, et je me trompe fort, ou la jeune princesse a connu votre flamme, et n'y est pas insensible."")","('#alcide', 'Ah ! Licas, laisse-moi partir en diligence. ')",1.68,Substitution
40,"('#sostrate', ""Ah !  Ne t'avise point de vouloir flatter par pitié le coeur d'un misérable."")",,1.0,Insertion
41,"('#clitidas', ""Ma conjecture est fondée.  Je lui vois reculer beaucoup le choix de son époux, et je veux éclaircir un peu cette petite affaire-là.  Vous savez que je suis auprès d'elle en quelque espèce de faveur, que j'y ai les accès ouverts, et qu'à force de me tourmenter je me suis acquis le privilège de me mêler à la conversation, et parler à tort et à travers de toutes choses.  Quelquefois cela ne me réussit pas, mais quelquefois aussi cela me réussit.  Laissez-moi faire, je suis de vos amis, les gens de mérite me touchent, et je veux prendre mon temps pour entretenir la Princesse de..."")","('#licas', 'Quoi ! Dès ce même jour presser votre départ ? ')",1.54,Substitution
42,"('#sostrate', ""Ah !  De grâce, quelque bonté que mon malheur t'inspire, garde-toi bien de lui rien dire de ma flamme.  J'aimerais mieux mourir que de pouvoir être accusé par elle de la moindre témérité, et ce profond respect où ses charmes divins..."")","('#alcide', ""J'aurai beau me presser, je partirai trop tard.  Ce n'est point avec toi que je prétends me taire ;  Alceste est trop aimable, elle a trop su me plaire ;  Un autre en est aimé, rien ne flatte mes voeux :  C'en est fait, Admète l'épouse,  Et c'est dans ce moment qu'on les unit tous deux.  Ah ! Qu'une âme jalouse  Éprouve un tourment rigoureux !  J'ai peine à l'exprimer moi-même :  Figure-toi, si tu le peux,  Quelle est l'horreur extrême  De voir ce que l'on aime,  Au pouvoir d'un Rival heureux. "")",0.0,Match
43,"('#clitidas', 'Taisons-nous, voici tout le monde.')",,1.0,Insertion
44,"('#aristione', ""Prince, je ne puis me lasser de le dire, il n'est point de spectacle au monde qui puisse le disputer en magnificence à celui que vous venez de nous donner. Cette fête a eu des ornements qui l'emportent sans doute sur tout ce que l'on saurait voir, et elle vient de produire à nos yeux quelque chose de si noble, de si grand et de si majestueux, que le Ciel même ne saurait aller au delà, et je puis dire assurément qu'il n'y a rien dans l'univers qui s'y puisse égaler."")","('#licas', ""L'Amour est-il plus fort qu'un Héros indomptable ? L'Univers n'a point eu de Monstre redoutable  Que vous n'ayez pu surmonter. "")",0.77,Substitution
45,"('#timocles', ""Ce sont des ornements dont on ne peut pas espérer que toutes les fêtes soient embellies, et je dois fort trembler, Madame, pour la simplicité du petit divertissement que je m'apprête à vous donner dans le bois de Diane."")","('#alcide', ""Eh, crois-tu que l'Amour soit moins à redouter ?  Le plus grand coeur a sa faiblesse.  Je ne puis me sauver de l'ardeur qui me presse  Qu'en quittant ce fatal Séjour :  Contre d'aimables charmes  La valeur est sans armes,  Et ce n'est qu'en fuyant qu'on peut vaincre l'Amour. "")",0.63,Substitution
46,"('#aristione', ""Je crois que nous n'y verrons rien que de fort agréable, et certes il faut avouer que la campagne a lieu de nous paraître belle, et que nous n'avons pas le temps de nous ennuyer dans cet agréable séjour qu'ont célébré tous les poètes sous le nom de Tempé.  Car enfin, sans parler des plaisirs de la chasse que nous y prenons à toute heure, et de la solennité des jeux Pythiens que l'on y célèbre tantôt, vous prenez soin l'un et l'autre de nous y combler de tous les divertissements qui peuvent charmer les chagrins des plus mélancoliques.  D'où vient, Sostrate, qu'on ne vous a point vu dans notre promenade ?"")","('#licas', ""Vous devez vous forcer, au moins à voir la Fête  Qui déjà dans ce Port, vous paraît toute prête.  Votre fuite à présent ferait un trop grand bruit ;  Différez jusqu'à la nuit. "")",0.76,Substitution
47,,"('#alcide', 'Ah Licas ! Quelle nuit ! Ah quelle nuit funeste ! ')",1.0,Deletion
48,"('#sostrate', ""Une petite indisposition, Madame, m'a empêché de m'y trouver."")","('#licas', 'Tout le reste du jour voyez encore Alceste. ')",1.75,Substitution
49,"('#iphicrate', ""Sostrate est de ces gens, Madame, qui croient qu'il ne sied pas bien d'être curieux comme les autres, et il est beau d'affecter de ne pas courir où tout le monde court."")",,1.0,Insertion
50,"('#sostrate', ""Seigneur, l'affectation n'a guère de part à tout ce que je fais, et sans vous faire compliment, il y avait des choses à voir dans cette fête, qui pouvaient m'attirer, si quelque autre motif ne m'avait retenu."")","('#alcide', ""La voir encore !... Hé bien différons mon départ,  Je vous l'avais bien dit, je partirai trop tard.  Je vais la voir aimer un Époux qui l'adore,  Je verrai dans leurs yeux un tendre empressement :  Que je vais payer chèrement  Le plaisir de la voir encore ! "")",0.87,Substitution
51,"('#aristione', 'Et Clitidas a-t-il vu cela ?')",,1.0,Insertion
52,"('#clitidas', 'Oui, Madame, mais du rivage.')",,1.0,Insertion
53,"('#aristione', 'Et pourquoi du rivage ?')",,1.0,Insertion
54,"('#clitidas', ""Ma foi !  Madame, j'ai craint quelqu'un des accidents qui arrivent d'ordinaire dans ces confusions.  Cette nuit, j'ai songé de poisson mort, et d'oeufs cassés, et j'ai appris du Seigneur Anaxarque que les oeufs cassés et le poisson mort signifient malencontre."")","('#ensemble', ""L'Amour a bien des maux, mais le plus grand de tous,  C'est le tourment d'être jaloux. "")",1.58,Substitution
55,"('#anaxarque', ""Je remarque une chose, que Clitidas n'aurait rien à dire s'il ne parlait de moi."")","('#straton', ""Licas, j'ai deux mots à te dire. "")",0.41,Substitution
56,"('#clitidas', ""C'est qu'il y a tant de choses à dire de vous, qu'on n'en saurait parler assez."")",,1.0,Insertion
57,"('#anaxarque', ""Vous pourriez prendre d'autres matières, puisque je vous en ai prié."")","('#licas', ""Que veux-tu ? Parle je t'entends. "")",1.13,Substitution
58,"('#clitidas', ""Le moyen, ne dites-vous pas que l'ascendant est plus fort que tout ; et s'il est écrit dans les astres que je sois enclin à parler de vous, comment voulez-vous que je résiste à ma destinée ?"")","('#straton', ""Nous sommes amis de tout temps ;  Céphise, tu le sais, me tient sous son empire,  Tu suis partout ses pas : qu'est-ce que tu prétends ? "")",0.8,Substitution
59,"('#anaxarque', 'Avec tout le respect, Madame, que je vous dois, il y a une chose qui est fâcheuse dans votre Cour que tout le monde y prenne liberté de parler, et que le plus honnête homme y soit exposé aux railleries du premier méchant plaisant.')","('#licas', 'Je prétends rire. ')",1.31,Substitution
60,"('#clitidas', ""Je vous rends grâce de l'honneur."")",,1.0,Insertion
61,"('#aristione', ""Que vous êtes fou de vous chagriner de ce qu'il dit !"")","('#straton', 'Pourquoi veux-tu troubler deux coeurs qui sont contents ? ')",1.21,Substitution
62,"('#clitidas', ""Avec tout le respect que je dois à Madame, il y a une chose qui m'étonne dans l'astrologie, comment des gens qui savent tous les secrets des Dieux, et qui possèdent des connaissances à se mettre au-dessus de tous les hommes, aient besoin de faire leur cour, et de demander quelque chose."")",,1.0,Insertion
63,"('#anaxarque', 'Vous devriez gagner un peu mieux votre argent, et donner à Madame de meilleures plaisanteries.')",,1.0,Insertion
64,"('#clitidas', ""Ma foi !  On les donne telles qu'on peut.  Vous en parlez fort à votre aise, et le métier de plaisant n'est pas comme celui d'astrologue.  Bien mentir et bien plaisanter sont deux choses fort différentes, et il est bien plus facile de tromper les gens que de les faire rire."")","('#licas', ""Je prétends rire.  Tu peux à ton gré t'enflammer ;  Chacun a sa façon d'aimer ;  Qui voudra soupirer, soupire,  Je prétends rire. "")",0.58,Substitution
65,"('#aristione', ""Eh !  Qu'est-ce donc que cela veut dire ?"")",,1.0,Insertion
66,"('#clitidas', ""Paix !  Impertinent que vous êtes.  Ne savez-vous pas bien que l'astrologie est une affaire d'État, et qu'il ne faut point toucher à cette corde-là ?  Je vous l'ai dit plusieurs fois, vous vous émancipez trop, et vous prenez de certaines libertés qui vous joueront un mauvais tour : je vous en avertis ; vous verrez qu'un de ces jours on vous donnera du pied au cul, et qu'on vous chassera comme un faquin.  Taisez-vous, si vous êtes sage."")",,1.0,Insertion
67,"('#aristione', 'Où est ma fille ?')",,1.0,Insertion
68,"('#timocles', ""Madame, elle s'est écartée, et je lui ai présenté une main qu'elle a refusé d'accepter."")",,1.0,Insertion
69,"('#aristione', ""Princes, puisque l'amour que vous avez pour Ériphile, a bien voulu se soumettre aux lois que j'ai voulu vous imposer, puisque j'ai su obtenir de vous que vous fussiez rivaux sans devenir ennemis, et qu'avec pleine soumission aux sentiments de ma fille, vous attendez un choix dont je l'ai faite seule maîtresse ; ouvrez-moi tous deux le fond de votre âme, et me dites sincèrement quel progrès vous croyez l'un et l'autre avoir fait sur son coeur."")","('#straton', ""J'aime, et je suis aimé ; laisse en paix nos amours. "")",0.73,Substitution
70,"('#timocles', ""Madame, je ne suis point pour me flatter, j'ai fait ce que j'ai pu pour toucher le coeur de la princesse Ériphile, et je m'y suis pris, que je crois, de toutes les tendres manières dont un amant se peut servir.  Je lui ai fait des hommages soumis de tous mes voeux ; j'ai montré des assiduités ; j'ai rendu des soins chaque jour ; j'ai fait chanter ma passion aux voix les plus touchantes, et l'ai exprimer en vers aux plumes les plus délicates ; je me suis plaint de mon martyre en des termes passionnés ; j'ai fait dire à mes yeux aussi bien qu'à ma bouche le désespoir de mon amour ; j'ai poussé à ses pieds, des soupirs languissants ; j'ai même répandu des larmes, mais tout cela inutilement, et je n'ai point connu qu'elle ait dans l'âme aucun ressentiment de mon ardeur."")","('#licas', ""Rien ne doit t'alarmer, s'il est bien vrai qu'on t'aime ;  Un rival rebuté donne un plaisir extrême. "")",1.06,Substitution
71,"('#aristione', 'Et vous, Prince ?')","('#straton', ""Un Rival tel qu'il soit importune toujours. "")",1.64,Substitution
72,"('#iphicrate', ""Pour moi, Madame, connaissant son indifférence et le peu de cas qu'elle fait des devoirs qu'on lui rend, je n'ai voulu perdre auprès d'elle ni plaintes, ni soupirs, ni larmes.  Je sais qu'elle est toute soumise à vos volontés, et que ce n'est que de votre main seule qu'elle voudra prendre un époux.  Aussi n'est-ce qu'à vous que je m'adresse pour l'obtenir, à vous plutôt qu'à elle que je rends tous mes soins et tous mes hommages.  Et plût au Ciel, Madame, que vous eussiez pu vous résoudre à tenir sa place ; que vous eussiez voulu jouir des conquêtes que vous lui faites, et recevoir pour vous les voeux que vous lui renvoyez."")","('#licas', ""Je vois ton amour sans colère,  Tu devrais en user ainsi :  Puisque Céphise t'a su plaire,  Pourquoi ne veux-tu pas qu'elle me plaise aussi ? "")",0.74,Substitution
73,"('#aristione', ""Prince, le compliment est d'un amant adroit, et vous avez entendu dire qu'il fallait cajoler les mères pour obtenir les filles ; mais ici, par malheur, tout cela devient inutile, et je me suis engagée à laisser le choix entier à l'inclination de ma fille."")","('#straton', ""À quoi sert-il d'aimer ce qu'il faut que l'on quitte ?  Tu ne peux demeurer longtemps dans cette Cour. "")",1.5,Substitution
74,,"('#licas', ""Moins on a de moments à donner à l'Amour.  Et plus il faut qu'on en profite. "")",1.0,Deletion
75,"('#iphicrate', ""Quelque pouvoir que vous lui donniez pour ce choix, ce n'est point compliment, Madame, que ce que je vous dis.  Je ne recherche la princesse Ériphile, que parce qu'elle est votre sang ; je la trouve charmante par tout ce qu'elle tient de vous, et c'est vous que j'adore en elle."")","('#straton', ""J'aime depuis deux ans avec fidélité :  Je puis croire sans vanité,  Que tu ne dois pas être un Rival qui m'alarme. "")",1.09,Substitution
76,"('#aristione', 'Voilà qui est fort bien.')",,1.0,Insertion
77,"('#iphicrate', 'Oui, Madame, toute la terre voit en vous des attraits et des charmes que je...')","('#licas', ""J'ai pour moi la nouveauté ;  En amour c'est un grand charme. "")",0.94,Substitution
78,,"('#straton', ""Céphise m'a promis un coeur tendre et constant. "")",1.0,Deletion
79,,"('#licas', ""Céphise m'en promet autant. "")",1.0,Deletion
80,,"('#straton', ""Ah si je le croyais !... Mais tu n'es pas croyable. "")",1.0,Deletion
81,"('#aristione', ""De grâce, Prince, ôtons ces charmes et ces attraits : vous savez que ce sont des mots que je retranche des compliments qu'on veut me faire.  Je souffre qu'on me loue de ma sincérité, qu'on dise que je suis une bonne princesse, que j'ai de la parole pour tout le monde, de la chaleur pour mes amis, et de l'estime pour le mérite et la vertu, je puis tâter de tout cela ; mais pour les douceurs de charmes et d'attraits, je suis bien aise qu'on ne m'en serve point, et quelque vérité qui s'y pût rencontrer, on doit faire quelque scrupule d'en goûter la louange, quand on est mère d'une fille comme la mienne."")","('#licas', ""Crois-moi, fais ton profit d'un reste d'amitié,  Sers-toi d'un avis charitable  Que je te donne par pitié. "")",0.43,Substitution
82,"('#iphicrate', ""Ah !  Madame, c'est vous qui voulez être mère malgré tout le monde, il n'est point d'yeux qui ne s'y opposent, et si vous le vouliez la princesse Ériphile ne serait que votre soeur."")",,1.0,Insertion
