,chevalier-amours-de-calotin,chevalier-barbons-amoureux,Cost,Operation Type
0,"('#le-marquis', ""Enfin me voici donc dans l'Hôtel du Marais Et dessus un théâtre où je ne viens jamais."")",,1.0,Insertion
1,"('#le-baron', ""Et moi, mon cher Marquis, ici je te déclare Que le Palais-Royal me devient aussi rare ; Nul n'y saurait aller, sans se faire draper ! Ah qu'heureux est celui qui s'en peut échapper ! Pour moi, qui n'aime pas à souffrir qu'on me drape, Je veux être berné, si plus on m'y rattrape."")","('#clidamant', ""Que je serais à plaindre en l'état où je suis,  Si je ne t'avais pas pour dire mes ennuis. Apprends, mon cher Guillot, que j'aime Polixène,  Que ce charmant objet cause toute ma peine.  Et Lucidor son frère, aimant ma soeur aussi,  Nous pourrons, que je crois, nous rendre heureux ainsi."")",0.06,Substitution
2,"('#le-marquis', 'Pourquoi donc ? Qui te peut causer un tel courroux ?')",,1.0,Insertion
3,"('#le-baron', ""Pourquoi ? C'est qu'on nous fait tous passer pour des fous. Comte, Duc, et Baron, et Marquis, et Marquise, Ne peuvent s'exempter qu'on ne les tympanise. Nous n'oserions parler, ni desserrer les dents, Qu'on ne nous traite pis que des extravagants. Dès que par notre bouche il passe un mot folâtre, Nous nous voyons d'abord jouer sur le théâtre. Comment ? Quand nous serions sûrement insensés, Nous ne pourrions jamais être mieux redressés."")",,1.0,Insertion
4,"('#le-marquis', 'Mais de quoi te plains-tu ?')",,1.0,Insertion
5,"('#le-baron', ""D'un diable de Molière, Dont l'esprit goguenard ne laisse rien derrière, Et réussit si bien dedans tout ce qu'il fait, Qu'il sait donner à tous chacun son petit fait. Nous sommes tous cocus, si nous l'en voulons croire, Appelez-vous cela des vers à notre gloire ? Mais s'il m'en croit, Marquis, loin de nous railler tous, Il se taira, s'il veut éviter mon courroux. Quoi si nous nous souffrons traiter de ces manières, Nous aurons de sa part bientôt les étrivières."")","('#guillot', ""Courage, nous voilà tous remplis d'amourette,  Lucidor aime Aminte, et son valet Lisette,  Vous aimez Polixène, et j'aime Béatrix,  À ce que je puis voir, nous sommes tous d'un prix. Mais ce n'est pas là tout ce qu'amour a su prendre. Vos deux pères, je crois, sont aussi pris du tendre ;  Car je les vois toujours ensemble conférer,  Et tout leur entretien n'est que de soupirer. Vous les verrez bientôt en ce lieu l'un et l'autre,  Parler de leur amour, daignez songer au vôtre,  Empaumez Lucidor, il doit venir ici,  Pour moi de Béatrix je fais tout mon souci. "")",0.16,Substitution
6,"('#le-marquis', ""Tu te moques, Baron, sache que cet esprit Ne cherche qu'à nous plaire en tout ce qu'il écrit, Et que tu passeras, si l'on te voit crédule Jusqu'à t'en offenser, pour homme ridicule; Comme il est approuvé de tous les gens d'honneur, Ton approbation doit se joindre à la leur."")","('#clidamant', ""Nos pères amoureux ? Cela n'est pas croyable,  Un Amant à leur âge, est toujours méprisable,  Les soupirs des vieillards sont soupirs superflus,  Ils ont beau soupirer, on ne les entend plus ;  Mais pour les jeunes gens il n'en est pas de même :  Enfin, tu sais Guillot, ma passion extrême... "")",0.74,Substitution
7,"('#le-baron', ""Moi je l'approuverais ? Qu'un sort le plus étrange M'accable, si plutôt de lui je ne me venge."")","('#guillot', 'Et bien pour la savoir, en suis-je bien plus gras. ')",1.03,Substitution
8,"('#le-marquis', 'Mais dis-moi donc comment tu prétends te venger?')","('#clidamant', ""Non, mais j'espère bien que tu m'y serviras. "")",0.59,Substitution
9,"('#le-baron', ""En n'allant plus chez lui, pour le faire enrager. Lorsque je n'irai plus, qu'est-ce qu'il pourra dire De moi ?"")",,1.0,Insertion
10,"('#le-marquis', ""C'est le moyen d'attirer sa satire ; Et s'il vient à savoir le dessein que tu fais, Tu te feras jouer plus qu'on ne fut jamais. Évite, si tu peux, d'en faire la sorte, Si tu ne veux sur toi voir une Comédie : Je suis certain qu'après tu t'en repentirais."")","('#guillot', ""C'est fort bien espérer. "")",1.24,Substitution
11,"('#le-baron', ""Sur moi, s'il l'avait fait, je le fustigerais."")","('#clidamant', 'Ne suis-je pas ton Maître ? ')",1.45,Substitution
12,"('#le-marquis', ""Quelqu'autre la ferait."")",,1.0,Insertion
13,"('#le-baron', ""Poisson aussi s'amuse À s'ébaudir l'esprit parfois avec sa Muse, À ce que j'ai pu voir, et loin de nous priser, Il se mêle à son tour de nous satiriser : Mais qu'il sache sur moi si quelque chose il trace Qu'il n'aura pas affaire au Baron de la Crasse, Puisque je l'en ferais diablement repentir."")","('#guillot', ""Vous ne savez que trop me le faire connaître.  D'abord que quelque avis vous est donné par moi.  Coquin, me dites-vous, c'est bien à faire à toi,  De venir discourir, il vaudrait mieux te taire,  Ce faquin veut ici trancher du nécessaire,  Faire l'olibrius, cessez petit mignon,  De traiter avec moi de pair à compagnon,  Et gardez le respect d'une telle manière,  Que nous ne vivions plus tant à la familière ; Voilà le beau régal que me font vos discours ;  Mais alors qu'il vous faut servir dans vos amours,  Peste, que vous savez bientôt changer de note !  Vous vous radoucissez d'une façon bigote,  Cher Guillot, dites-vous, rien n'est égal à toi,  Tu mérites beaucoup, je t'aime plus que moi :  Quoique simple valet, tu ne tiens rien du rustre,  Mille perfections qui te rendent illustre,  Me font avoir pour toi tout à fait du penchant ;  Et puis quand vous avez fait le bon chien couchant,  Que vous croyez de moi n'avoir jamais affaire,  Vous m'envoyez au diable, et sans autre mystère :  Monsieur, je ne suis plus d'humeur à le souffrir,  Rêvez, mourrez d'amour, je vous verrai mourir. "")",0.01,Substitution
14,"('#le-marquis', ""Ce qu'ils en font n'est rien que pour nous divertit, Tu t'emportes à tort."")","('#clidamant', ""Tu n'as point de pitié d'un Amant misérable ? "")",0.92,Substitution
15,"('#le-baron', ""Vous aimez la méthode De vous souffrir railler toujours sur chaque mode: Qu'un Molière sans cesse en vos habillements Vous fasse les objets de tous ces bernements ; Et que quand nous avons quelques modes jolies, Il les fasse passer toutes pour des folies. Oui, vous aimez cela, car pour vous voir berner, Vous n'avez pas assez d'argent pour luy donner. Quand je vous dis : Allons à l'Hôtel de Bourgogne, Vous recevez ces mots ainsi qu'une vergogne Et me dites d'abord : Moi rarement je vais À l'Hôtel de Bourgogne, à l'Hôtel du Marais, Ma satisfaction n'est jamais plus entière Qu'alors que je me vois chez l'illustre Molière."")","('#guillot', ""N'en ayant point pour moi, je suis impitoyable. "")",1.36,Substitution
16,"('#le-marquis', ""Des divertissements c'est aussi le seul but."")","('#clidamant', 'Quoi, sans être touché tu verrais mon trépas ? ')",1.75,Substitution
17,"('#le-baron', ""Hors Molière, pour vous il n'est point de salut, Tous les autres auteurs vous sont insupportables, Les Corneilles auprès sont auteurs détestables, Ce qu'ils mettent au jour est par trop sérieux, Et bien loin de vous plaire, ils vous sont ennuyeux Peut-on voir, dites-vous, une pièce parfaite, Comme celle où l'on voit Alain avec Georgette ? Mais raisonnant ainsi, messeigneurs les benêts, C'est passer pour autant d'Alains et de Georgets."")","('#guillot', ""Monsieur, je vous connais, que vous n'en mourrez pas.  La mort est un chemin qu'il nous faudra tous suivre ;  Mais pour mourir d'amour, vous aimez trop à vivre :  Vous me direz encor, je me meurs, bien des fois,  Pendant que je vous voie arriver aux abois ;  Vous êtes tous les jours près de quelque Maîtresse,  Faire le transi, l'Amant plein de tendresse,  Et puis tout aussi tôt qu'elle a le dos tourné,  Une autre qui survient vous rend passionné ;  Si bien que l'on vous voit mourir pour la dernière,  Comme vous aviez fait déjà pour la première :  Et vous ne trépassez jamais qu'en vos amours,  Monsieur, je crois ma foi, que vous vivrez toujours. "")",0.85,Substitution
18,"('#le-marquis', ""Mais, Baron, tu te vas ériger en folâtre, Si l'on te voit blâmer ce foudre de théâtre, Cet auteur si fertile en ouvrages puissants, Qu'on le nomme en tous lieux la merveille du temps ; Et pour te faire voir sa valeur infinie, Il tire quatre parts dedans sa Compagnie : Enfin c'est un esprit au dessus de l'humain."")","('#clidamant', ""C'est bien à vous maraud, à me railler de même.  Savez-vous bien qu'après votre insolence extrême  Je devrais vous casser les jambes et les bras ? "")",0.84,Substitution
19,"('#le-baron', ""Je sais qu'il fait venir l'eau dedans le moulin, Et même que sans craindre être au rang des profanes Il vous y fait passer joliment pour des ânes. Dieu me damne, Marquis, ce célèbre garçon Sait dauber le prochain de la bonne façon."")","('#guillot', ""Vous m'obligerez fort en ne le faisant pas. "")",1.71,Substitution
20,"('#le-marquis', ""Ton obstination, cher Baron, est extrême. Sais-tu que la satyre est la cause qu'on l'aime ? Comme il sait étaler nos défauts à nos yeux, Nous pouvons, les voyant, nous en corriger mieux. Ainsi quand ce savant prononce une parole, Ce doit être pour nous une éternelle école."")","('#clidamant', 'Parlant comme tu fais, je le devrais bien faire. ')",1.47,Substitution
21,"('#le-baron', ""Ce grand maître d'école a beaucoup d'écoliers Dont il sait, les raillant, attraper les deniers ; Et tandis que le monde est sa dupe et sa buse, En lui-même il se dit : prends-les, je les amuse. Pour moi, je vous promets qu'il ne m'y prendra pas ; Si l'on m'y peut trouver, qu'on m'y casse les bras."")","('#guillot', ""Vous n'auriez puis après qu'à me mettre en galère  N'ayant jambes ni bras, je ramerais fort bien. "")",0.77,Substitution
22,"('#le-marquis', ""Pour moi, je suis ravi lorsque je vois paraître Un esprit qui s'efforce à se faire connaître. S'il nous raille, il nous sait railler si galamment, Que ce nous est à tous un divertissement. Mais je suis sûr qu'à tort on se le persuade, Que cette vision vient d'un esprit malade, Et que jamais Molière en traitant son sujet, Ne fit dessein d'avoir la Cour pour son objet ; Et tant que je pourrai je verrai ce grand homme."")","('#clidamant', ""Tais-toi, double coquin, et ne me dis plus rien,  Je suis las d'écouter tes sottes railleries,  Finis donc promptement toutes ces momeries,  Et songe seulement que j'ai besoin de toi. "")",0.97,Substitution
23,"('#le-baron', ""Moi, si je le vais voir, je veux bien qu'on m'assomme ; Vous aimez qu'on vous berne en donnant votre argent, Et moi je n'aime pas que l'on m'en fasse autant."")","('#guillot', ""Votre commandement fait ma règle et ma loi,  Je prétends vous servir en valet admirable,  Et suis autant à vous, qu'un Sergent est au Diable. "")",0.89,Substitution
24,"('#le-marquis', ""Baron, sur ce sujet n'ayons point de querelle; Mais je crains qu'on ne voie une pièce nouvelle Sur ta façon d'agir, si l'on la peut savoir."")","('#clidamant', ""Paix-là, j'entends quelqu'un, viens-t-en prendre un billet,  Que tu feras tenir à mon aimable objet. "")",0.95,Substitution
25,"('#le-baron', ""Et moi je ne crains pas en ce lieu de la voir Et s'il faut par hasard que quelque auteur la fasse, Elle ne sera pas exposée à ma face, Puisque si nous n'allons, vous, ni moi, qu'en ces lieux, Nous ne nous verrons point taquiner à nos yeux. La comédie ici me paraît aussi bonne ; Ils la font aussi bien et ne raillent personne ; Si bien qu'on la peut voir sans se mortifier."")",,1.0,Insertion
26,"('#le-marquis', ""On m'a parlé pourtant d'un certain Chevalier, Qui parfois dans ses vers."")","('#lucidor', ""Ah ! Mon cher Ragotin, que l'amour me tourmente. "")",1.64,Substitution
27,"('#le-baron', ""Il se mêle d'écrire, Mais on ne le voit point mêler de la satire ; Il ne drape personne en tout ce qu'il écrit."")",,1.0,Insertion
28,"('#le-marquis', ""C'est donc assurément qu'il n'en a pas l'esprit; Car sois certain, Baron, que s'il le pouvait faire, Il le ferait, sachant que c'est ce qui sait plaire."")","('#ragotin', ""Monsieur, je crois plutôt que le Diable vous tente,  Depuis que votre Aminte enfin vous a parlé,  Vous êtes plus chagrin qu'un homme ensorcelé :  Vous ne sauriez durer un seul moment en place,  Vous allez devenir plus sec qu'une carcasse,  Et votre Ragotin plus maigre qu'un hareng ;  Monsieur, ne courons plus en Chevalier errant,  Demeurons en repos, j'aime aussi bien qu'un autre ;  Mais courir sans manger, il y va trop du nôtre : Encor alors qu'on a bien dîné, bien dormi,  On peut faire l'amour lors en diable et demi ;  Faites-le donc ainsi, c'est la belle manière,  Sinon nous nous voyons à notre heure dernière,  Nous allons trépasser, il n'est rien plus certain,  Car vous mourez d'amour, et moi je meurs de faim. "")",0.79,Substitution
29,"('#le-chevalier', ""Une chaise, l'ami ; commence-t-on bientôt ?"")",,1.0,Insertion
30,"('#le-portier', ""Sans chaise vous pouvez vous placer comme il faut ; Vous avez là des bancs où l'on est à son aise."")",,1.0,Insertion
31,"('#le-chevalier', ""Et moi je n'en veux point, qu'on me donne une chaise."")",,1.0,Insertion
32,"('#le-portier', ""L'on y va. De l'argent, Monsieur, car je m'en vais."")",,1.0,Insertion
33,"('#le-chevalier', 'Tu te railles, mon cher, je ne paye jamais ; Apprends à me connaître.')","('#lucidor', ""Est-on jamais gourmant... mais j'aperçois mon père,  Entrons, je t'instruirai de ce qu'il faudra faire. "")",0.73,Substitution
34,"('#le-portier', ""Hé bien, avant qu'on sorte~ Si vous ne me payez, que le diable m'emporte."")",,1.0,Insertion
35,"('#le-chevalier', 'Ah ! Marquis, te voilà.')","('#boniface', ""Amour, jeune insolent, petit enfant brutal,  Qui m'embrases le coeur ainsi qu'un arsenal,  Tu ranimes mon corps d'une naissante flamme,  Pourquoi venir encor t'emparer de mon âme ?  À mon âge, amoureux ! C'est sur le tard Jacquet ;  Eh quoi, ne suis-je pas un vieillard guilleret ? Portrait : de belle humeur ? De bonne compagnie ?  Qui peut donc empêcher que je ne me marie ?  Puis-je pas être encor par l'amour enchaîné,  Beau comme Cupidon ? Mais enfin c'est l'aîné,  Car je ne puis passer, quoi que je puisse faire,  Pour autre que l'aîné, si je ne suis son père ;  De sorte que j'ai beau paraître goguenard,  Je ne passerai plus que pour un vieux pénard ;  Si faut-il toutefois que dans ce jour je harpe,  L'objet qui m'a ravi, mais le vois Policarpe,  Que diable pourrait-il venir chercher ici ? "")",1.17,Substitution
36,"('#le-marquis', ""C'est donc toi, Chevalier ; Et que faisais-tu là ?"")",,1.0,Insertion
37,"('#le-chevalier', ""Ce faquin de portier Qui se met en courroux, qui tempête et qui peste, De ce que j'ai voulu sur l'heure avoir mon reste : Hé, n'est-ce pas assez lorsque l'on paye bien ?"")","('#policarpe', ""Amour, pourquoi viens-tu me donner du souci ?  Qui t'oblige, dis-moi, d'être si téméraire,  De me venir chercher ? Mais quel remède y faire ?  Ce n'est pas d'aujourd'hui que l'amour nous apprend  Qu'il n'épargne non plus le petit que le grand,  Puisqu'il est assuré qu'aussi bien il attrape,  Le vieillard que le jeune, et qu'aucun n'en échappe,  Je me console donc de m'en voir accablé ;  Me voilà, Dieu merci, pris comme dans un blé,  Et si je ne sais pas si ce qui m'a su prendre,  Aura bien la bonté de me vouloir entendre,  Boniface, qui peut vous amener ici ? "")",0.41,Substitution
38,"('#le-marquis', ""Rend-on le reste ici lorsqu'on ne donne rien ?"")",,1.0,Insertion
39,"('#le-chevalier', 'Quoi, rien! il est content.')","('#boniface', ""C'est mon amour, et vous."")",1.61,Substitution
40,"('#le-baron', ""Je crois qu'il le peut être, Si c'est payer, que dire : Apprends à me connaître."")","('#policarpe', ""Et c'est le mien aussi."")",1.54,Substitution
41,"('#le-chevalier', ""Ah ! C'est toi, cher Baron, hé qui te croyait là ?"")","('#boniface', 'Vous êtes amoureux, ô mon cher Policarpe ? ')",1.62,Substitution
42,"('#le-baron', ""Moi, je m'y crois sans doute, et puisque m'y voilà, Bonjour."")","('#policarpe', ""L'amour nage en mon corps, comme dans l'eau la carpe."")",1.63,Substitution
43,,"('#boniface', 'Et moi, ce même amour dont je suis prisonnier,  Me trotte au corps aussi comme rats au grenier.')",1.0,Deletion
44,"('#le-marquis', 'Que fis-tu hier ?')","('#policarpe', 'Vous aimez donc bien fort ? ')",1.57,Substitution
45,"('#le-chevalier', ""Sombre et mélancolique, Pour me déchagriner, je fus voir la critique, Où je trouvai moyen de chasser mon ennui. Ce diable de Molière entraîne tout chez lui, Tout y crevait de peuple, et fort peu, je t'assure, Se purent exempter des traits de sa censure ; Il critiqua tous ceux qui l'avaient critiqué, Et se moqua de qui de lui s'était moqué. Ceux qui s'étaient raillé de l'Ecole des femmes, Se voyaient là chanter fort joliment leurs gammes. Quelqu'un de l'assemblée en paraissait content, Mais bien d'autres aussi riaient en enrageant ; Et tel criait tout haut que c'était des merveilles, Qui s'entendait dauber de façons sans pareilles. Moi qui n'en avais dit jamais ni bien, ni mal, J'envisageais cela d'un plaisir sans égal, Voyant que les objets d'une telle satire Ne savaient s'ils devaient ou se fâcher, ou rire. Ce qui plus me charma, c'est qu'en ces entretiens Il berna les auteurs, et les comédiens, Et je les voyais là faire fort bon visage, Quoi qu'au fond de leur âme ils fussent pleins de rage. Admirez cependant comme quoi cet esprit Sait nous amadouer alors qu'il nous aigrit : Pour nous montrer combien son adresse est extrême, Nous donnèrent en suivant dans le tarte à la crème ; Afin que si quelqu'un s'en était mutiné, On vit que le berneur lui-même était berné : De sorte que chacun voyant son industrie, Tourna, quoique fâché, tout en galanterie, Et demeura d'accord, que pour plaire aujourd'hui, Il faut être Molière, ou faire comme lui."")","('#boniface', 'Fort comme tous les diables.  Et vous, comme aimez-vous ? ')",1.56,Substitution
46,"('#le-marquis', 'Ah ! Comte, je te vois.')","('#policarpe', 'Mes ardeurs sont semblables. ')",1.75,Substitution
47,,"('#boniface', 'Nous voilà donc tous deux amoureux comme il faut. ')",1.0,Deletion
48,"('#le-comte', ""Ici je me transporte Pour te voir, ayant vu ta calèche à la porte, Si bien que je pourrai, contentant mon désir, Du divertissement prendre encor le plaisir. Mais avant qu'on commence ici la comédie, Il faut que je te conte une histoire jolie, Dont Molière à causé la conversation, Et digne assurément de ton attention. Dernièrement étant à la contre-critique, Je reçus là, Marquis, un plaisir angélique. Comme de notre peintre on faisait le Portrait, Et que l'on le croyait tirer là trait pour trait, Tu sauras que lui-même en cette conjoncture Était présent alors que l'on fit sa peinture ; De sorte que ce fut un charme sans égal, De voir et la copie, et son original. On prit par tous endroits son École des femmes, Où pour la critiquer, quelqu'une de ces dames Alla dans ce moment appliquer tout son choix À l'endroit de la soupe où l'on trempe les doigts ; Puis de là ces Messieurs, d'une satire extrême, Donnèrent en suivant dans la Tarte à la crème ; Et le plus enjoué qu'ils drapèrent après, Ce fut celui du Le, ce charmant Le d'Agnès. Quoi n'est-ce pas malice à nulle autre seconde, D'oser blâmer ce Le, ce délice du monde ? Ce n'est pas encor tout, ils blâmèrent l'auteur Des pièces dont il a réveillé l'auditeur, Et de cette façon dont Alain et Georgette S'appellent l'un et l'autre, et que drapa le poète. Ce qui fut plus plaisant, c'est qu'un certain d'entre eux Dit que la pièce était un poème sérieux ; Que bien loin que ce fut une pièce comique, Qu'il ne s'en pouvait voir aucune plus tragique : Les autres de ce point ne restant pas d'accord, Il leur dit là-dessus: Le petit chat est mort, Et soutient hautement que c'était tragédie, Puisque le petit chat avait perdu la vie. Ayant de notre peintre attaqué la vertu, Quelqu'un lui demanda : Molière, qu'en dis-tu Lui répondit d'abord, de son ton agréable : Admirable, morbleu ! du dernier admirable ; Et je me trouve là tellement bien tiré, Qu'avant qu'il soit huit jours, certes, j'y répondrai."")","('#policarpe', ""L'amour n'a point encor produit un feu si chaud. "")",1.51,Substitution
49,"('#le-baron', ""Mais l'on m'a dit à moi, qu'il fit à quelques dames La réponse qu'il fait à l'École des femmes, Lorsqu'il n'en riait pas assez à leur avis, Il leur dit : Moi j'en ris tout autant que je puis."")","('#guillot', 'Voici le mois de Mai que les Ânes hennissent,  Car je crois que je vois deux qui se divertissent. ')",1.04,Substitution
50,"('#le-comte', ""Tu sauras que depuis cet illustre Molière Les a tous ajustés de la bonne manière, Et cet esprit en soi qui n'a rien que de haut, A su tailler beaucoup de besogne à Boursault."")","('#boniface', ""Partons, j'entends quelqu'un qui nous pourrait troubler. "")",1.54,Substitution
51,,"('#policarpe', 'Cherchons quelque autre endroit où nous pouvoir parler. Ils sortent et Guillot demeure seul.')",1.0,Deletion
52,"('#le-chevalier', ""Moi, je sais bien où tend toute cette satire, Ces Messieurs n'ont dessein que de nous faire rire, Et quand vous les voyez se faire à qui pis pis, Ce n'est que pour avoir notre demi-louis."")","('#guillot', ""Comment donc ces vieux fous, cadets à barbe blanche,  Veulent tâter d'amour encore quelque tranche !  C'est bien à vous, ma foi, trop débiles Bardons,  De vous amouracher, froids comme des glaçons.  Ah ! Monsieur Policarpe, et monsieur Boniface,  Pour de l'amour, je crois que l'on vous en fricasse.  Cessez donc vos ardeurs, car il est peu d'objets,  Qui veuillent s'enrôler avec de tels cadets.  Et qui diable seraient les pauvres créatures,  Qui se voudraient charger de vos vieilles fressures,  Celles qui vous auraient feraient tous leurs efforts  À vous faire passer promptement chez les morts.  Messieurs les Roquentins, si vous m'en voulez croire,  Loin de faire l'amour, amusez-vous à boire :  Le bon vin, ce dit-on, est le lait des vieillards  Buvez-en votre saoul, plutôt qu'être cornards,  Car un vieillard qui prend une jeune fillette,  De syndic de cocus une charge il achète.  Le vieillard pourrait-il jamais s'en exempter,  Si le jeune homme même a peine à l'éviter ?  Non, demeurons d'accord dans cette conjoncture,  Que quiconque en échappe, est aimé de Nature. "")",0.13,Substitution
53,"('#le-portier', 'Monsieur, un gentilhomme est là qui vous demande.')",,1.0,Insertion
54,"('#le-comte', ""Marquis, pour lui parier il faut que je descende : Si je ne pouvais pas revenir en ce lieu, Je prends congé de toi jusqu'à ce soir."")",,1.0,Insertion
55,"('#le-marquis', 'Adieu.')","('#ragotin', 'Serviteur. ')",0.4,Substitution
56,"('#le-baron', 'Puisque quand il vous joue, il fait tant de merveilles, Sans doute il vous plairait, vous coupant les oreilles. Ah ! Pauvres abusés.')",,1.0,Insertion
57,"('#le-chevalier', 'Quoi ! Ne fait-il pas bien ?')",,1.0,Insertion
58,"('#le-marquis', ""Dessus cet obstiné tu ne gagneras rien ; Car en tout et partout Molière il désapprouve, Et périra plutôt que chez lui l'on le trouve."")","('#guillot', ""Dieu te gard, qui t'amène en ce lieu ? "")",1.45,Substitution
59,"('#le-chevalier', ""D'où vient que tu te veux ce plaisir dérober ?"")","('#ragotin', ""Désires-tu l'apprendre ? "")",0.73,Substitution
60,"('#le-baron', ""C'est que je n'aime pas à m'entendre dauber. Entendez-vous, Messieurs ? Finissons ce langage."")",,1.0,Insertion
61,"('#le-chevalier', ""Nous n'en parlerons pas, cher Baron, davantage; Suffit que nous sachions que cela te déplaît. La pièce d'aujourd'hui sais-tu point quelle elle est, Et quel en est l'auteur ?"")","('#guillot', ""Et je t'en prie. "")",1.57,Substitution
62,"('#le-baron', 'Chevalier.')","('#ragotin', 'Adieu.')",0.3,Substitution
63,"('#le-chevalier', 'Sans scandale, Je crois que cet auteur est un auteur de balle.')",,1.0,Insertion
64,"('#le-baron', 'Si ton opinion te le fait croire ainsi, Dis-moi, que prétends-tu venir chercher ici ?')","('#guillot', ""D'où vient que tu t'en vas quand je te le demande ? "")",0.3,Substitution
65,"('#le-chevalier', ""Ayant vu dans l'affiche une pièce nouvelle, Je viens voir ce que c'est."")",,1.0,Insertion
66,"('#le-baron', 'Elle peut être belle, Et nous bien divertir.')","('#ragotin', 'Ta curiosité paraît un peu trop grande ;  Et pourquoi me viens-tu questionner ainsi ? ')",1.22,Substitution
67,"('#le-marquis', ""Je n'en crois rien ; ma foi."")","('#guillot', 'Pour savoir ton dessein. ')",1.4,Substitution
68,"('#le-chevalier', 'Pour une comédie, hors Molière, crois-moy.')","('#ragotin', 'Tu prends trop de souci,  De quoi te mêles-tu ? ')",1.22,Substitution
69,"('#le-baron', ""Voilà de nos Messieurs dont l'âme prévenue Blâme une comédie avant que l'avoir vue. Si d'une de Molière on vous donnait l'espoir, Vous la croiriez fort belle, avant que de la voir."")",,1.0,Insertion
70,"('#le-marquis', 'On le peut, ayant vu de lui des coups de maître.')",,1.0,Insertion
71,"('#le-baron', ""Mais ne blâmez donc rien sans l'avoir vu paraître. Cet auteur n'a-t-il pas un esprit comme lui ? Et ne vous peut-il pas faire voir aujourd'hui, Quand sans sujet sur lui votre blâme se porte, Que vous ôtes des fous de parler de la sorte ?"")",,1.0,Insertion
72,"('#le-marquis', ""Comme il n'a pas encor de réputation, Ne peut-on pas errer dedans l'opinion ?"")",,1.0,Insertion
73,"('#le-baron', ""N'allez donc pas si vite où votre sens abonde."")",,1.0,Insertion
74,"('#le-chevalier', ""Mais je crois qu'ils auront aujourd'hui quelque monde, Voyant que l'on se fait plusieurs places garder."")",,1.0,Insertion
75,"('#le-marquis', 'Mais pour qui pourrait-ce être ?')","('#guillot', 'De ce que je désire. ')",1.1,Substitution
