,corneillep-melite,corneillep-melite-33,Cost,Operation Type
0,"('#eraste', ""Je te l'avoue, ami, mon mal est incurable ; Je n'y sais qu'un remède, et j'en suis incapable : Le change serait juste, après tant de rigueur ; Mais malgré ses dédains, Mélite a tout mon coeur ; Elle a sur tous mes sens une entière puissance ; Si j'ose en murmurer, ce n'est qu'en son absence, Et je ménage en vain dans un éloignement Un peu de liberté pour mon ressentiment ; D'un seul de ses regards l'adorable contrainte Me rend tous mes liens, en resserre l'étreinte, Et par un si doux charme aveugle ma raison, Que je cherche mon mal et fuis ma guérison. Son oeil agit sur moi d'une vertu si forte, Qu'il ranime soudain mon espérance morte, Combat les déplaisirs de mon coeur irrité, Et soutient mon amour contre sa cruauté ; Mais ce flatteur espoir qu'il rejette en mon âme N'est qu'un doux imposteur qu'autorise ma flamme, Et qui, sans m'assurer ce qu'il semble m'offrir, Me fait plaire en ma peine, et m'obstine à souffrir."")","('#eraste', ""Parmi tant de rigueurs n'est-ce pas chose étrange  Que rien n'est assez fort pour me résoudre au change ?  Jamais un pauvre amant ne fut si maltraité,  Et jamais un amant n'eût tant de fermeté :  Mélite a sur mes sens une entière puissance,  Si sa rigueur m'aigrit, ce n'est qu'en son absence,  Et j'ai beau ménager dans un éloignement  Un peu de liberté pour mon ressentiment,  Un seul de ses regards l'étouffe, et le dissipe,  Un seul de ses regards me séduit et me pipe,  Et d'un tel ascendant maîtrise ma raison,  Que je chéris mon mal, et fuis ma guérison :  Son oeil agit sur moi d'une vertu si forte  Qu'il ranime soudain mon espérance morte,  Combat les déplaisirs de mon coeur irrité,  Et soutient mon amour contre sa cruauté :  Mais ce flatteur espoir qu'il rejette en mon âme,  N'est rien qu'un vent qui souffle, et rallume ma flamme, Et reculant toujours ce qu'il semble m'offrir  Me fait plaire en ma peine, et m'oblige à souffrir. "")",0.0,Match
1,"('#tircis', ""Que je te trouve, ami, d'une humeur admirable ! Pour paraître éloquent tu te feins misérable : Est-ce à dessein de voir avec quelles couleurs Je saurais adoucir les traits de tes malheurs ? Ne t'imagine pas qu'ainsi, sur ta parole, D'une fausse douleur un ami te console ; Ce que chacun en dit ne m'a que trop appris Que Mélite pour toi n'eut jamais de mépris."")","('#tirsis', ""Que je te trouve, ami, d'une humeur admirable,  Pour paraître éloquent tu te feins misérable,  Est-ce à dessein de voir avec quelles couleurs  Je saurais adoucir les traits de tes malheurs ?  Ne t'imagine pas que dessus ta parole  D'une fausse douleur un ami te console,  Ce que chacun en dit ne m'a que trop appris  Que Mélite pour toi n'eut jamais de mépris. "")",0.0,Match
2,"('#eraste', ""Son gracieux accueil et ma persévérance Font naître ce faux bruit d'une vaine apparence : Ses mépris sont cachés, et s'en font mieux sentir ; Et n'étant point connus, on n'y peut compatir."")","('#eraste', ""Son gracieux accueil, et ma persévérance  Font naître ce faux bruit d'une vaine apparence,  Ses dédains sont cachés, encor que continus,  Et d'autant plus cruels que moins ils sont connus. "")",0.0,Match
3,"('#tircis', ""En étant bien reçu, du reste que t'importe ? C'est tout ce que tu veux des filles de sa sorte."")","('#tirsis', ""En étant bien reçu du reste que t'importe ?  C'est tout ce que tu veux des filles de sa sorte. "")",0.0,Match
4,"('#eraste', ""Cet accès favorable, ouvert et libre à tous, Ne me fait pas trouver mon martyre plus doux : Elle souffre aisément mes soins et mon service ; Mais loin de se résoudre à leur rendre justice, Parler de l'hyménée à ce coeur de rocher, C'est l'unique moyen de n'en plus approcher."")","('#eraste', ""Cet accès favorable, ouvert, et libre à tous  Ne me fait pas trouver mon martyre plus doux,  Sa hantise me perd, mon mal en devient pire,  Vu que loin d'obtenir le bonheur où j'aspire  Parler de mariage à ce coeur de rocher  C'est l'unique moyen de n'en plus approcher. "")",0.0,Match
5,"('#tircis', ""Ne dissimulons point ; tu règles mieux ta flamme, Et tu n'es pas si fou que d'en faire ta femme."")","('#tirsis', ""Ne dissimulons point, tu règles mieux ta flamme,  Et tu n'es pas si fou que d'en faire ta femme. "")",0.0,Match
6,"('#eraste', 'Quoi ! Tu sembles douter de mes intentions ?')","('#eraste', 'Quoi ! Tu sembles douter de mes intentions ? ')",0.0,Match
7,"('#tircis', ""Je crois malaisément que tes affections, Sur l'éclat d'un beau teint qu'on voit si périssable, Règlent d'une moitié le choix invariable. Tu serais incivil, de la voir chaque jour Et ne lui pas tenir quelques propos d'amour ; Mais d'un vain compliment ta passion bornée Laisse aller tes desseins ailleurs pour l'hyménée. Tu sais qu'on te souhaite aux plus riches maisons, Que les meilleurs partis..."")","('#tirsis', ""Je crois malaisément que tes affections  Arrêtent en un lieu si peu considérable  D'une chaste moitié le choix invariable :  Tu serais incivil de la voir chaque jour  Et ne lui tenir pas quelques propos d'amour,  Mais d'un vain compliment ta passion bornée  Laisse aller tes desseins ailleurs pour l'Hyménée ;  Tu sais qu'on te souhaite aux plus riches maisons  Où de meilleurs partis [...] "")",0.0,Match
8,"('#eraste', ""Trêve de ces raisons ; Mon amour s'en offense, et tiendrait pour supplice De recevoir des lois d'une sale avarice : Il me rend insensible aux faux attraits de l'or, Et trouve en sa personne un assez grand trésor."")","('#eraste', ""Trêve de ces raisons,  Mon amour s'en offense, et tiendrait pour supplice  D'avoir à prendre avis d'une sale avarice,  Je ne sache point d'or capable de mes voeux  Que celui dont Nature a paré ses cheveux. "")",0.0,Match
9,"('#tircis', ""Si c'est là le chemin qu'en aimant tu veux suivre, Tu ne sais guère encor ce que c'est que de vivre. Ces visages d'éclat sont bons à cajoler, C'est là qu'un apprenti doit s'instruire à parler ; J'aime à remplir de feux ma bouche en leur présence ; La mode nous oblige à cette complaisance ; Tous ces discours de livre alors sont de raison : Il faut feindre des maux, demander guérison, Donner sur le Phébus, promettre des miracles, Jurer qu'on brisera toutes sortes d'obstacles ; Mais du vent et cela doivent être tout un."")","('#tirsis', ""Si c'est là le chemin qu'en aimant tu veux suivre,  Tu ne sais guère encor ce que c'est que de vivre,  Ces visages d'éclat sont bons à cajoler,  C'est là qu'un jeune oiseau doit s'apprendre à parler,  J'aime à remplir de feux ma bouche en leur présence,  La mode nous oblige à cette complaisance,  Tous ces discours de livre alors sont de saison,  Il faut feindre du mal, demander guérison,  Donner sur le Phoebus, promettre des miracles,  Jurer qu'on brisera toutes sortes d'obstacles,  Mais du vent et cela doivent être tout un. "")",0.0,Match
10,"('#eraste', ""Passe pour des beautés qui sont dans le commun ; C'est ainsi qu'autrefois j'amusai Chrysolithe : Mais c'est d'autre façon qu'on doit servir Mélite. Malgré tes sentiments, il me faut accorder Que le souverain bien n'est qu'à la posséder. Le jour qu'elle naquit, Vénus, bien qu'immortelle, Pensa mourir de honte en la voyant si belle ; Les Grâces, à l'envi, descendirent des cieux Pour se donner l'honneur d'accompagner ses yeux ; Et l'Amour, qui ne put entrer dans son courage, Voulut obstinément loger sur son visage."")","('#eraste', ""Passe pour des beautés qui soient dans le commun,  C'est ainsi qu'autrefois j'amusai Crisolite,  Mais c'est d'autre façon qu'on doit servir Mélite,  Malgré tes sentiments, il me faut accorder  Que le souverain bien gît à la posséder :  Le jour qu'elle naquit, Vénus quoiqu'immortelle  Pensa mourir de honte en la voyant si belle :  Les Grâces, au séjour qu'elles faisaient aux Cieux,  Préférèrent l'honneur d'accompagner ses yeux,  Et l'Amour, qui ne put entrer dans son courage,  Voulut à tout le moins loger sur son visage. "")",0.0,Match
11,"('#tircis', ""Tu le prends d'un haut ton, et je crois qu'au besoin Ce discours emphatique irait encore bien loin. Pauvre amant, je te plains qui ne sais pas encore Que bien qu'une beauté mérite qu'on l'adore, Pour en perdre le goût, on n'a qu'à l'épouser. Un bien qui nous est dû se fait si peu priser, Qu'une femme, fût-elle entre toutes choisie, On en voit en six mois passer la fantaisie. Tel au bout de ce temps n'en voit plus la beauté Qu'avec un esprit sombre, inquiet, agité ; Au premier qui lui parle, ou jette l'oeil sur elle, Mille sottes frayeurs lui brouillent la cervelle ; Ce n'est plus lors qu'une aide à faire un favori, Un charme pour tout autre, et non pour un mari."")","('#tirsis', ""Te voilà bien en train, si je veux t'écouter  Sur ce même ton là tu m'en vas bien conter.  Pauvre amant, je te plains, qui ne sais pas encore  Que bien qu'une beauté mérite qu'on l'adore,  Pour en perdre le goût on n'a qu'à l'épouser.  Un bien qui nous est dû se fait si peu priser, Qu'une femme fût-elle entre toutes choisie,  On en voit en six mois passer la fantaisie,  Tel au bout de ce temps la souhaite bien loin,  La beauté n'y sert plus que d'un fantasque soin  À troubler le repos de qui se formalise,  S'il advient qu'à ses yeux quelqu'un la galantise :  Ce n'est plus lors qu'un aide à faire un favori,  Un charme pour tout autre, et non pour un mari. "")",0.0,Match
12,"('#eraste', ""Ces caprices honteux et ces chimères vaines Ne sauraient ébranler des cervelles bien saines ; Et quiconque a su prendre une fille d'honneur N'a point à redouter l'appât d'un suborneur."")","('#eraste', ""Ces caprices honteux, et ces chimères vaines  Ne sauraient ébranler des cervelles bien saines,  Et quiconque a su prendre une fille d'honneur  N'a point à redouter l'appât d'un suborneur. "")",0.0,Match
13,"('#tircis', ""Peut-être dis-tu vrai, mais ce choix difficile Assez et trop souvent trompe le plus habile ; Et l'hymen de soi-même est un si lourd fardeau, Qu'il faut l'appréhender à l'égal du tombeau. S'attacher pour jamais aux côtés d'une femme ! Perdre pour des enfants le repos de son âme ! Voir leur nombre importun remplir une maison ! Ah ! Qu'on aime ce joug avec peu de raison !"")","('#tirsis', ""Peut-être dis-tu vrai, mais ce choix difficile  Assez et trop souvent trompe le plus habile,  Et l'Hymen de soi-même est un si lourd fardeau  Qu'il faut l'appréhender à l'égal du tombeau.  S'attacher pour jamais aux côtés d'une femme !  Perdre pour des enfants le repos de son âme,  Quand leur nombre importun accable la maison !  Ah ! Qu'on aime ce joug avec peu de raison ! "")",0.0,Match
14,"('#eraste', ""Mais il y faut venir ; c'est en vain qu'on recule, C'est en vain qu'on refuit, tôt ou tard on s'y brûle ; Pour libertin qu'on soit, on s'y trouve attrapé : Toi-même, qui fais tant le cheval échappé, Nous te verrons un jour songer au mariage."")","('#eraste', ""Mais il y faut venir, c'est en vain qu'on recule,  C'est en vain que l'on fuit, tôt ou tard on s'y brûle,  Pour libertin qu'on soit, on s'y trouve attrapé :  Toi-même qui fais tant le cheval échappé  Un jour nous te verrons songer au mariage. "")",0.0,Match
15,"('#tircis', ""Alors ne pense pas que j'épouse un visage : Je règle mes désirs suivant mon intérêt. Si Doris me voulait, toute laide qu'elle est, Je l'estimerais plus qu'Aminte et qu'Hippolyte ; Son revenu chez moi tiendrait lieu de mérite : C'est comme il faut aimer. L'abondance des biens Pour l'amour conjugal a de puissants liens : La beauté, les attraits, l'esprit, la bonne mine, Échauffent bien le coeur, mais non pas la cuisine ; Et l'hymen qui succède à ces folles amours, Après quelques douceurs, a bien de mauvais jours. Une amitié si longue est fort mal assurée Dessus des fondements de si peu de durée. L'argent dans le ménage a certaine splendeur Qui donne un teint d'éclat à la même laideur ; Et tu ne peux trouver de si douces caresses Dont le goût dure autant que celui des richesses."")","('#tirsis', ""Alors ne pense pas que j'épouse un visage,  Je règle mes désirs suivant mon intérêt,  Si Doris me voulait, toute laide qu'elle est  Je l'estimerais plus qu'Aminthe, et qu'Hippolyte,  Son revenu chez moi tiendrait lieu de mérite :  C'est comme il faut aimer, l'abondance des biens  Pour l'amour conjugal a de puissants liens,  La beauté, les attraits, le port, la bonne mine,  Échauffent bien les draps, mais non pas la cuisine,  Et l'Hymen qui succède à ces folles amours  Pour quelques bonnes nuits, a bien de mauvais jours ;  Une amitié si longue est fort mal assurée  Dessus des fondements de si peu de durée :  C'est assez qu'une femme ait assez d'entregent,  La laideur est trop belle étant teinte en argent.  Et tu ne peux trouver de si douces caresses,  Dont le goût dure autant que celui des richesses. "")",0.0,Match
16,"('#eraste', 'Auprès de ce bel oeil qui tient mes sens ravis, A peine pourrais-tu conserver ton avis.')","('#eraste', 'Auprès de ce bel oeil qui tient mes sens ravis  À peine pourrais-tu conserver ton avis.  Mélite paraît.')",0.0,Match
17,"('#tircis', 'La raison en tous lieux est également forte.')","('#tirsis', 'La raison en tous lieux est également forte. ')",0.0,Match
18,"('#eraste', ""L'essai n'en coûte rien ; Mélite est à sa porte ; Allons, et tu verras dans ses aimables traits Tant de charmants appas, tant de brillants attraits, Que tu seras forcé toi-même à reconnaître Que si je suis un fou, j'ai bien raison de l'être."")","('#eraste', ""L'essai n'en coûte rien, Mélite est à sa porte,  Allons, et tu verras dans ses aimables traits  Tant de charmants appas, tant de brillants attraits,  Que tu seras contraint d'avouer à ta honte,  Que si je suis un fou je le suis à bon compte. "")",0.0,Match
19,"('#tircis', 'Allons, et tu verras que toute sa beauté Ne saura me tourner contre la vérité.')","('#tirsis', 'Allons, et tu verras que toute sa beauté  Ne me saura tourner contre la vérité. ')",0.0,Match
20,"('#eraste', ""De deux amis, madame, apaisez la querelle. Un esclave d'amour le défend d'un rebelle, Si toutefois un coeur qui n'a jamais aimé, Fier et vain qu'il en est, peut être ainsi nommé. Comme, dès le moment que je vous ai servie, J'ai cru qu'il était seul la véritable vie, Il n'est pas merveilleux que ce peu de rapport Entre nos deux esprits sème quelque discord. Je me suis donc piqué contre sa médisance Avec tant de malheur, ou tant d'insuffisance, Que des droits si sacrés et si pleins d'équité N'ont pu se garantir de sa subtilité, Et je l'amène ici, n'ayant plus que répondre, Assuré que vos yeux le sauront mieux confondre."")","('#eraste', ""Au péril de vous faire une istoire importune  Je viens vous raconter ma mauvaise fortune :  Ce jeune cavalier autant qu'il m'est ami  Autant est-il d'amour implacable ennemi,  Et pour moi, qui depuis que je vous ai servie  Ne l'ai pas moins prisé qu'une seconde vie,  Jugez si nos esprits se rapportant si peu  Pouvaient tomber d'accord, et parler de son feu ;  Je me suis donc piqué contre sa médisance  Avec tant de malheur, ou tant d'insuffisance,  Que les droits de l'amour bien que pleins d'équité  N'ont pu se garantir de sa subtilité,  Et je l'amène à vous n'ayant plus que répondre,  Assuré que vos yeux le sauront mieux confondre. "")",0.0,Match
21,"('#melite', ""Vous deviez l'assurer plutôt qu'il trouverait, En ce mépris d'amour, qui le seconderait."")","('#melite', ""Vous deviez l'assurer plutôt qu'il trouverait,  En ce mépris d'amour qui le seconderait. "")",0.0,Match
22,"('#tircis', ""Si le coeur ne dédit ce que la bouche exprime, Et ne fait de l'amour une plus haute estime, Je plains les malheureux à qui vous en donnez, Comme à d'étranges maux par leur sort destinés."")","('#tirsis', ""Si le coeur ne dédit ce que la bouche exprime  Et ne fait de l'amour une meilleure estime,  Je plains les malheureux à qui vous en donnez  Comme à d'étranges maux par leur sort destinés. "")",0.0,Match
23,"('#melite', ""Ce reproche sans cause avec raison m'étonne : Je ne reçois d'amour et n'en donne à personne. Les moyens de donner ce que je n'eus jamais ?"")","('#melite', ""Ce reproche sans cause inopiné m'étonne,  Je ne reçois d'amour, et n'en donne à personne,  Les moyens de donner ce que je n'eus jamais ? "")",0.0,Match
24,"('#eraste', 'Ils vous sont trop aisés ; et par vous désormais La nature pour moi montre son injustice À pervertir son cours pour me faire un supplice.')","('#eraste', 'Ils vous sont trop aisés et par vous désormais  La nature pour moi montre son injustice  À pervertir son cours pour croître mon supplice. ')",0.0,Match
25,"('#melite', 'Supplice imaginaire, et qui sent son moqueur.')","('#melite', 'Supplice imaginaire, et qui sent son moqueur. ')",0.0,Match
26,"('#eraste', 'Supplice qui déchire et mon âme et mon coeur.')","('#eraste', 'Supplice qui déchire, et mon âme et mon coeur. ')",0.0,Match
27,"('#melite', ""Il est rare qu'on porte avec si bon visage L'âme et le coeur ensemble en si triste équipage."")","('#melite', ""D'ordinaire on n'a pas avec si bon visage  Ni l'âme ni le coeur en un tel équipage. "")",0.0,Match
28,"('#eraste', 'Votre charmant aspect suspendant mes douleurs, Mon visage du vôtre emprunte les couleurs.')","('#eraste', 'Votre divin aspect suspendant mes douleurs  Mon visage du vôtre emprunte les couleurs. ')",0.0,Match
29,"('#melite', ""Faites mieux ; pour finir vos maux et votre flamme, Empruntez tout d'un temps les froideurs de mon âme."")","('#melite', ""Faites mieux, pour finir vos maux et votre flamme  Empruntez tout d'un temps les froideurs de mon âme. "")",0.0,Match
30,"('#eraste', ""Vous voyant, les froideurs perdent tout leur pouvoir ; Et vous n'en conservez que faute de vous voir."")","('#eraste', ""Vous voyant les froideurs perdent tout leur pouvoir,  Et vous n'en conservez qu'à faute de vous voir. "")",0.0,Match
31,"('#melite', 'Eh quoi ! Tous les miroirs ont-ils de fausses glaces ?')","('#melite', 'Eh quoi ! Tous les miroirs ont-ils de fausses glaces ? ')",0.0,Match
32,"('#eraste', ""Penseriez-vous y voir la moindre de vos grâces ? De si frêles sujets ne sauraient exprimer Ce que l'amour aux coeurs peut lui seul imprimer ; Et quand vous en voudrez croire leurs impuissances, Cette légère idée et faible connaissance Que vous aurez par eux de tant de raretés Vous mettra hors de pair de toutes les beautés."")","('#eraste', ""Penseriez-vous y voir la moindre de vos grâces ?  De si frêles sujets ne sauraient exprimer  Ce qu'amour dans les coeurs peut lui seul imprimer,  Et quand vous en voudrez croire leur impuissance,  Encor cette légère, et faible connaissance  Que vous aurez par eux de tant de raretés  Vous mettra hors du pair de toutes les beautés. "")",0.0,Match
33,"('#melite', ""Voilà trop vous tenir dans une complaisance Que vous dussiez quitter, du moins en ma présence, Et ne démentir pas le rapport de vos yeux, Afin d'avoir sujet de m'entreprendre mieux."")","('#melite', ""Voilà trop vous tenir dans une complaisance  Que vous dussiez quitter du moins en ma présence,  Et ne démentir pas le rapport de vos yeux  Afin d'avoir sujet de m'entreprendre mieux. "")",0.0,Match
34,"('#eraste', ""Le rapport de mes yeux, aux dépens de mes larmes, Ne m'a que trop appris le pouvoir de vos charmes."")","('#eraste', ""Le rapport de mes yeux aux dépens de mes larmes  Ne m'a que trop appris le pouvoir de vos charmes. "")",0.0,Match
35,"('#tircis', ""Sur peine d'être ingrate, il faut de votre part Reconnaître les dons que le ciel vous départ."")","('#tirsis', ""Sur peine d'être ingrate il faut de votre part  Reconnaître les dons que le Ciel vous départ. "")",0.0,Match
36,"('#eraste', ""Voyez que d'un second mon droit se fortifie."")","('#eraste', ""Voyez que d'un second mon droit se fortifie. "")",0.0,Match
37,"('#melite', ""Voyez que son secours montre qu'il s'en défie."")","('#melite', ""Mais plutôt son secours fait voir qu'il s'en défie. "")",0.0,Match
38,"('#tircis', ""Je me range toujours d'avec la vérité."")","('#tirsis', ""Je me range toujours d'avec la vérité. "")",0.0,Match
39,"('#melite', 'Si vous la voulez suivre, elle est de mon côté.')","('#melite', 'Si vous la voulez suivre, elle est de mon côté. ')",0.0,Match
40,"('#tircis', 'Oui, sur votre visage, et non en vos paroles. Mais cessez de chercher ces refuites frivoles ; Et prenant désormais des sentiments plus doux, Ne soyez plus de glace à qui brûle pour vous.')","('#tirsis', 'Oui, sur votre visage, et non en vos paroles :  Mais cessez de chercher ces refuites frivoles,  Et prenant désormais des sentiments plus doux  Ne soyez plus de glace à qui brûle pour vous. ')",0.0,Match
41,"('#melite', ""Un ennemi d'amour me tenir ce langage ! Accordez votre bouche avec votre courage ; Pratiquez vos conseils, ou ne m'en donnez pas."")","('#melite', ""Un ennemi d'amour me tenir ce langage !  Accordez votre bouche avec votre courage,  Pratiquez vos conseils, ou ne m'en donnez pas. "")",0.0,Match
42,"('#tircis', ""J'ai connu mon erreur auprès de vos appas. Il vous l'avait bien dit."")","('#tirsis', ""J'ai reconnu mon tort auprès de vos appas,  Il vous l'avait bien dit. "")",0.02,Substitution
43,"('#eraste', ""Ainsi donc, par l'issue Mon âme sur ce point n'a point été déçue ?"")","('#eraste', 'Ainsi ma prophétie  Est, à ce que je vois, de tout point réussie. ')",0.97,Substitution
44,"('#tircis', 'Si tes feux en son coeur produisaient même effet, Crois-moi, que ton bonheur serait bientôt parfait.')","('#tirsis', 'Si tu pouvais produire en elle un même effet  Crois-moi, que ton bonheur serait bientôt parfait. ')",0.0,Match
45,"('#melite', ""Pour voir si peu de chose aussitôt vous dédire, Me donne à vos dépens de beaux sujets de rire ; Mais je pourrais bientôt à m'entendre flatter Concevoir quelque orgueil qu'il vaut mieux éviter. Excusez ma retraite."")","('#melite', ""Pour voir si peu de chose aussitôt vous dédire  Me donne à vos dépens de beaux sujets de rire,  Mais outre qu'il m'est doux de m'entendre flatter  Ma mère qui m'attend m'oblige à vous quitter,  Excusez ma retraite. "")",0.0,Match
46,"('#eraste', 'Adieu, belle inhumaine, De qui seule dépend, et ma joie, et ma peine.')","('#eraste', 'Adieu belle inhumaine, De qui seule dépend, et mon aise et ma peine. ')",0.0,Match
47,"('#melite', ""Plus sage à l'avenir, quittez ces vains propos, Et laissez votre esprit et le mien en repos."")","('#melite', ""Plus sage à l'avenir quittez ces vains propos,  Et laissez votre esprit et le mien en repos. "")",0.0,Match
48,"('#eraste', ""Maintenant suis-je un fou ? Méritai-je du blâme ? Que dis-tu de l'objet ? Que dis-tu de ma flamme ?"")","('#eraste', ""Maintenant suis-je un fou ? Méritai-je du blâme ?  Que dis-tu de l'objet, que dis-tu de ma flamme ? "")",0.0,Match
49,"('#tircis', ""Que veux-tu que j'en die ? Elle a je ne sais quoi Qui ne peut consentir que l'on demeure à soi. Mon coeur, jusqu'à présent à l'amour invincible, Ne se maintient qu'à force aux termes d'insensible ; Tout autre que Tircis mourrait pour la servir."")","('#tirsis', ""Que veux-tu que j'en die ? Elle a je ne sais quoi  Qui ne peut consentir que l'on demeure à soi :  Mon coeur jusqu'à présent à l'amour invincible  Ne se maintient qu'à force aux termes d'insensible,  Tout autre que Tirsis mourrait pour la servir. "")",0.0,Match
50,"('#eraste', ""Confesse franchement qu'elle a su te ravir, Et que tu ne veux pas prendre pour cette belle Avec le nom d'amant le titre d'infidèle. Rien que notre amitié ne t'en peut détourner ; Mais ta muse du moins, facile à suborner, Avec plaisir déjà prépare quelques veilles A de puissants efforts pour de telles merveilles."")","('#eraste', ""Confesse franchement qu'elle a su te ravir,  Et que tu ne veux pas prendre pour cette belle  Avec le nom d'amant le titre d'infidèle.  Rien que notre amitié ne t'en peut détourner ;  Mais ta Muse du moins s'en lairra suborner, N'est-il pas vrai Tirsis, déjà tu la disposes  À de puissants efforts pour de si belles choses ? "")",0.0,Match
51,"('#tircis', 'En effet, ayant vu tant et de tels appas, Que je ne rime point, je ne le promets pas.')","('#tirsis', 'En effet ayant vu tant et de tels appas,  Que je ne rime point, je ne le promets pas. ')",0.0,Match
52,"('#eraste', ""Tes feux n'iront-ils point plus avant que la rime ?"")","('#eraste', ""Garde aussi que tes feux n'outrepassent la rime. "")",0.14,Substitution
53,"('#tircis', 'Si je brûle jamais, je veux brûler sans crime.')","('#tirsis', 'Si je brûle jamais, je veux brûler sans crime. ')",0.0,Match
54,"('#eraste', 'Mais si sans y penser tu te trouvais surpris ?')","('#eraste', 'Mais si sans y penser tu te trouvais surpris ? ')",0.0,Match
55,"('#tircis', ""Quitte pour décharger mon coeur dans mes écrits. J'aime bien ces discours de plaintes et d'alarmes, De soupirs, de sanglots, de tourments et de larmes ; C'est de quoi fort souvent je bâtis ma chanson, Mais j'en connais, sans plus, la cadence et le son. Souffre qu'en un sonnet je m'efforce à dépeindre Cet agréable feu que tu ne peux éteindre : Tu le pourras donner comme venant de toi."")","('#tirsis', ""Quitte pour décharger mon coeur dans mes écrits.  J'aime bien ces discours de plaintes, et d'alarmes,  De soupirs, de sanglots, de tourments et de larmes,  C'est de quoi fort souvent je bâtis ma chanson,  Mais j'en connais, sans plus, la cadence et le son.  Souffre qu'en un Sonnet, je m'efforce à dépeindre  Cet agréable feu que tu ne peux éteindre,  Tu le pourras donner comme venant de toi. "")",0.0,Match
