,corneillep-andromede,quinault-isis,Cost,Operation Type
130,"('#phinee', ""Et vous mourrez contente ! Et j'ai pu mériter Qu'avec contentement vous puissiez me quitter ! Détacher sans regret votre âme de la mienne ! Vouloir que je le voie, et que je m'en souvienne ! Et mon fidèle amour qui reçut votre foi Vous trouve indifférente entre la mort et moi ! Oui, je m'en souviendrai, vous le voulez, madame ; J'accepte le supplice où vous livrez mon âme ; Mais quelque peu d'amour que vous me fassiez voir, Le mien n'oubliera pas les lois de son devoir. Je dois, malgré le sort, je dois, malgré vous-même, Si vous aimez si mal, vous montrer comme on aime, Et faire reconnaître aux yeux qui m'ont charmé Que j'étais digne au moins d'être un peu mieux aimé. Vous l'avouerez bientôt, et j'aurai cette gloire, Qui dans tout l'avenir suivra notre mémoire, Que pour se voir quitter avec contentement, Un amant tel que moi n'en est pas moins amant."")","('#junon', ""Je ne vous suivrai pas plus loin. Je viens de votre amour Attendre un nouveau soin : Ne vous étonnez pas qu'on vous quitte avec peine, Et que de Jupiter on ait toujours besoin. Vous m'aimez, et j'en suis certaine."")",0.0,Match
131,"('#andromede', ""C'est donc trop peu pour moi que des malheurs si proches, Si vous ne les croissez par d'injustes reproches ! Vous quitter sans regret ! Les dieux me sont témoins Que j'en montrerais plus si je vous aimais moins. C'est pour vous trop aimer que je parois toute autre : J'étouffe ma douleur pour n'aigrir pas la vôtre ; Je retiens mes soupirs de peur de vous fâcher, Et me montre insensible afin de moins toucher. Hélas ! Si vous savez faire voir comme on aime, Du moins vous voyez mal quand l'amour est extrême ; Oui, Phinée, et je doute, en courant à la mort, Lequel m'est plus cruel, ou de vous, ou du sort."")","('#jupiter', 'Souhaitez, je promets que vos voeux seront satisfaits.')",1.29,Substitution
132,"('#phinee', ""Hélas ! Qu'il était grand quand je l'ai cru s'éteindre, Votre amour ! Et qu'à tort ma flamme osait s'en plaindre ! Princesse, vous pouvez me quitter sans regret : Vous ne perdez en moi qu'un amant indiscret, Qu'un amant téméraire, et qui même a l'audace D'accuser votre amour quand vous lui faites grâce ; Mais pour moi, dont la perte est sans comparaison, Qui perds en vous perdant et lumière et raison, Je n'ai que ma douleur qui m'aveugle et me guide : Dessus toute mon âme elle seule préside ; Elle y règne, et je cède entier à son transport ; Mais je ne cède pas aux caprices du sort. Que le roi par scrupule à sa rigueur défère, Qu'une indigne équité le fasse injuste père, La reine et mon amour sauront bien empêcher Qu'un choix si criminel ne coûte un sang si cher. J'ose tout, je puis tout après un tel oracle."")","('#junon', ""J'ai fait choix d'une nymphe et déjà la Déesse De l'aimable Jeunesse Se prépare à la recevoir; Mais je n'ose, sans vous, disposer de personne. Si j'ai quelque pouvoir, Je n'en prétends avoir Qu'autant que votre amour m'en donne Ce don de votre main me sera précieux."")",0.32,Substitution
133,"('#timante', ""La reine est hors d'état d'y joindre aucun obstacle : Surprise comme vous d'un tel événement, Elle en a de douleur perdu tout sentiment ; Et sans doute le roi livrera la princesse Avant qu'on l'ait pu voir sortir de sa faiblesse."")","('#jupiter', ""J'approuve vos désirs ; Que rien n'y soit contraire; Mercure ayez soin de lui plaire, Et portez à son gré, mes ordres en tous lieux; Que tout suive les lois de la reine des cieux."")",1.14,Substitution
134,"('#phinee', ""Eh bien ! Mon amour seul saura jusqu'au trépas, malgré tous..."")","('#iris #mercure', 'Que tout suive les lois de la reine des Cieux.')",1.71,Substitution
135,"('#andromede', 'Le roi vient ; ne vous emportez pas.')","('#jupiter', ""Parlez, et qu'hautement votre choix se déclare."")",1.66,Substitution
136,"('#cephee', ""Ma fille, si tu sais les nouvelles funestes De ce dernier effort des colères célestes, Si tu sais de ton sort l'impitoyable cours, Qui fait le plus cruel du plus beau de nos jours, épargne ma douleur, juges-en par sa cause, Et va sans me forcer à te dire autre chose."")","('#junon', ""La nymphe qui me plaît ne vous déplaira pas, Vous ne verrez pas ici-bas De mérite plus grand ni beauté plus rare; Les honneurs que je lui prépare Ne lui sont que trop dûs, Enfin, Junon choisit la fille d'Inachus."")",0.54,Substitution
137,,"('#jupiter', ""La fille d'Inachus."")",1.0,Deletion
138,"('#andromede', ""Seigneur, je vous l'avoue, il est bien rigoureux De tout perdre au moment qu'on se doit croire heureux ; Et le coup qui surprend un espoir légitime Porte plus d'une mort au coeur de la victime. Mais enfin il est juste, et je le dois bénir : La cause des malheurs les doit faire finir. Le ciel, qui se repent sitôt de ses caresses, Verra plus de constance en moi qu'en ses promesses : Heureuse, si mes jours un peu précipités Satisfont à ces dieux pour moi seule irrités, Si je suis la dernière à leur courroux offerte, Si le salut public peut naître de ma perte ! Malheureuse pourtant de ce qu'un si grand bien Vous a déjà coûté d'autre sang que le mien, Et que je ne suis pas la première et l'unique Qui rende à votre état la sûreté publique !"")","('#junon', ""Déclarez pour elle. Peut-on voir à ma suite une nymphe plus belle, Plus capable d'orner ma cour, Et de marquer pour moi,  Le soin de votre amour; Vous me l'avez promise et je vous le demande."")",0.22,Substitution
139,"('#phinee', 'Quoi ? Vous vous obstinez encore à me trahir ?')",,1.0,Insertion
140,"('#andromede', 'Je vous plains, je me plains, mais je dois obéir.')","('#jupiter', ""Vous ne sauriez combler d'une gloire trop grande La nymphe que vous choisissez; Junon commande  Allez, allez, Mercure obéissez."")",0.71,Substitution
141,"('#phinee', 'Honteuse obéissance à qui votre amour cède !')","('#junon', 'Junon commande Allez, allez, Mercure obéissez.')",0.52,Substitution
142,"('#cephee', ""Obéissance illustre, et digne d'Andromède ! Son nom comblé par là d'un immortel honneur..."")","('#hebe', ""Les plaisirs les plus doux Sont faits pour la jeunesse. Venez, venez jeux charmants, venez tous; Cardez vous bien d'amener avec vous La sévère Sagesse. Fuyez, fuyez, sombre tristesse Noirs chagrins, fuyez loin de nous Vous êtes destinés pour l'affreuse vieillesse Les plaisirs les plus doux Sont faits pour la jeunesse."")",1.73,Substitution
143,"('#phinee', ""Je l'empêcherai bien, ce funeste bonheur. Andromède est à moi, vous me l'avez donnée ; Le ciel pour notre hymen a pris cette journée ; Vénus l'a commandé : qui me la peut ôter ? Le sort auprès des dieux se doit-il écouter ? Ah ! Si j'en vois ici les infâmes ministres S'apprêter aux effets de ses ordres sinistres..."")","('#le-choeur', 'Les plaisirs les plus doux Sont faits pour la jeunesse. Les jeux, les plaisirs et les nymphes de Junon se divertissent par des danses et par des chansons, en attendant la nouvelle nymphe dont Junon vont faire choix.')",0.78,Substitution
144,"('#cephee', ""Apprenez que le sort n'agit que sous les dieux, Et souffrez comme moi le bonheur de ces lieux. Votre perte n'est rien au prix de ma misère : Vous n'êtes qu'amoureux, Phinée, et je suis père. Il est d'autres objets dignes de votre foi ; Mais il n'est point ailleurs d'autres filles pour moi. Songez donc mieux qu'un père à ces affreux ravages Que partout de ce monstre épandirent les rages ; Et n'en rappelez pas l'épouvantable horreur, Pour trop croire et trop suivre une aveugle fureur."")","('#deux-nymphes', ""Aimez, profitez du temps, Jeunesse charmante Rendez vos désirs contents. Tout rit tout enchante Dans les plus beaux ans: L'amour vous éclaire Marchez sur ses pas Cherchez à vous faire Des noeuds pleins d'appas. Que vous sert de plaire, Si vous n'aimez pas ?"")",0.76,Substitution
145,"('#phinee', ""Que de nouveau ce monstre entré dessus vos terres Fasse à tous vos sujets d'impitoyables guerres, Le sang de tout un peuple est trop bien employé Quand celui de ses rois en peut être payé ; Et je ne connais point d'autre perte publique Que celle où vous condamne un sort si tyrannique."")","('#choeurs', ""Que ces lieux ont d'attraits ! Goûtons-en bien les charmes, L'Amour n'y fait jamais verser de tristes larmes Les soins et les alarmes,  N'en troublent point la paix. Jouissons dans ces retraites Des douceurs les plus parfaites; Suivez-nous, charmants plaisirs, Comblez tous nos désirs."")",0.71,Substitution
146,"('#cephee', 'Craignez ces mêmes dieux qui président au sort.')",,1.0,Insertion
147,"('#phinee', ""Qu'entre eux-mêmes ces dieux se montrent donc d'accord. Quelle crainte après tout me pourrait y résoudre ? S'ils m'ôtent Andromède, ont-ils quelque autre foudre ? Il n'est plus de respect qui puisse rien sur moi ; Andromède est mon sort, et mes dieux, et mon roi ; Punissez un impie, et perdez un rebelle ; Satisfaites le sort en m'exposant pour elle : J'y cours ; mais autrement je jure ses beaux yeux, Et mes uniques rois, et mes uniques Dieux... Ici le tonnerre commence à rouler avec un si grand bruit, et accompagné d'éclairs redoublés avec tant de promptitude, que cette feinte donne de l'épouvante aussi bien que de l'admiration, tant elle approche du naturel. On voit cependant descendre Éole avec huit vents, dont quatre sont à ses deux côtés, en sorte toutefois que les deux plus éloignés sont comme volants en l'air tout conte ce même nuage. Les quatre autres paraissent deux à deux au milieu de l'air sur les ailes du théâtre, deux à la main gauche et deux à la main droite : ce qui n'empêche pas Phinée de continuer ses blasphèmes."")","('#mercure', 'Servez, Nymphe, servez avec un soin fidèle, La puissante reine des Cieux. Suivez dans ces aimables lieux La jeunesse immortelle Tout plaît et tout rit avec elle. Hébé et les nymphes reçoivent Io.')",0.61,Substitution
148,,"('#hebe', ""Que c'est un plaisir charmant  D'être jeune et belle ! Triomphez à tout moment D'une conquête nouvelle. Que c'est un plaisir charmant  D'être jeune et belle !"")",1.0,Deletion
149,"('#cephee', ""Arrêtez : ce nuage enferme une tempête Qui peut-être déjà menace votre tête. N'irritez plus les dieux déjà trop irrités."")","('#argus', 'Dans ce solitaire séjour Vous êtes sous ma garde, Junon vous y laisse: Mes yeux veilleront tour à tour Et vous observeront sans cesse.')",1.01,Substitution
150,"('#phinee', ""Qu'il crève, ce nuage, et que ces déités..."")","('#io', ""Est-ce là le bonheur que Junon m'a promis. Argus apprenez-moi quel crime j'ai commis."")",1.5,Substitution
151,"('#cephee', 'Ne les irritez plus, vous dis-je, et prenez garde...')","('#argus', ""Vous êtes aimable Vos yeux devaient moins charmer. Vous êtes coupable De faire trop aimer Ne me déguisez rien, de quoi m'accuse-t-elle Quelle offenses à ses yeux me rend si criminelle ? Ne pourrai-je apaiser son funeste courroux."")",0.62,Substitution
152,,"('#argus', ""C'est une offense cruelle De paraître belle À ses yeux jaloux L'amour de Jupiter a trop paru pour vous"")",1.0,Deletion
153,"('#phinee', ""À les trop irriter qu'est-ce que je hasarde ? Que peut craindre un amant quand il voit tout perdu ? Tombe, tombe sur moi leur foudre, s'il m'est dû ! Mais s'il est quelque main assez lâche et traîtresse Pour suivre leur caprice et saisir ma princesse, Seigneur, encore un coup, je jure ses beaux yeux, Et mes uniques rois, et mes uniques dieux..."")","('#io', 'Je suis perdue, ô ciel ! si Junon est jalouse.')",0.48,Substitution
154,"('#eole', ""Téméraire mortel, n'en dis pas davantage ; Tu n'obliges que trop les dieux à te haïr : Quoi que pense attenter l'orgueil de ton courage, Ils ont trop de moyens de se faire obéir. Connais-moi pour ton infortune ; Je suis Éole, roi des vents. Partez, mes orageux suivants, Faites ce qu'ordonne Neptune."")","('#argus', ""On ne plaît guère à l'épouse Lorsqu'on plaît trop à l'époux. Vous n'en serez pas mieux d'être ingrate et volage Vous quittez un fidèle amant, Pour recevoir un plus brillant hommage Mais c'est un avantage Que vous payerez chèrement. J'ai l'ordre d'enfermer vos dangereux appas La Déesse se défend que vous voyez personne"")",0.61,Substitution
155,,"('#io', ""Aux rigueurs de Junon Jupiter m'abandonne. Non, non Jupiter ne m'aime pas."")",1.0,Deletion
156,,"('#hierax', ""La perfide craint ma présence Elle me fuit en vain et j'irai la chercher."")",1.0,Deletion
157,"('#andromede', 'ô ciel !')","('#argus', 'Non !')",0.7,Substitution
158,"('#cephee', ""Ils l'ont saisie, et l'enlèvent en l'air."")",,1.0,Insertion
159,"('#phinee', 'Ah ! Ne présumez pas ainsi me la voler : Je vous suivrai partout malgré votre surprise.')","('#hierax', 'Laissez moi lui reprocher  Sa cruelle inconstance')",0.95,Substitution
160,"('#persee', 'Seigneur, un tel péril ne veut point de remise ; Mais espérez encor, je vole à son secours, Et vais forcer le sort à prendre un autre cours.')","('#argus', 'Non, non, on ne la doit point voir')",1.8,Substitution
161,,"('#hierax', 'Quoi ! Junon me devient contraire ?')",1.0,Deletion
162,"('#cephee', ""Vingt amants pour Nérée en firent l'entreprise ; Mais il n'est point d'effort que ce monstre ne brise. Tous voulurent sauver ses attraits adorés, Tous furent avec elle à l'instant dévorés."")","('#argus', ""L'ordre est exprès pour tous, perdez un vain espoir."")",1.17,Substitution
163,"('#persee', ""Le ciel aime Andromède, il veut son hyménée, Seigneur ; et si les vents l'arrachent à Phinée, Ce n'est que pour la rendre à quelque illustre époux Qui soit plus digne d'elle, et plus digne de vous ; À quelque autre par là les dieux l'ont réservée. Vous saurez qui je suis quand je l'aurai sauvée. Adieu : par des chemins aux hommes inconnus Je vais mettre en effet l'oracle de Vénus. Le temps nous est trop cher pour le perdre en paroles."")",,1.0,Insertion
164,"('#cephee', ""Moi, qui ne puis former d'espérances frivoles, Pour ne voir point courir ce grand coeur au trépas, Je vais faire des voeux qu'on n'écoutera pas."")","('#hierax', ""L'amitié fraternelle a si peur de pouvoir ?"")",1.31,Substitution
165,"('#timante', ""Allons voir, chers amis, ce qu'elle est devenue, La princesse, et mourir, s'il se peut, à sa vue."")","('#argus', ""Non, je ne connais plus ni d'ami, ni de frère, Je ne connais que mon devoir Laissez la nymphe en paix, Ce n'est plus vous qu'elle aime."")",1.09,Substitution
166,"('#le-choeur', ""La voilà que ces vents achèvent d'attacher, En infâmes bourreaux, à ce fatal rocher."")","('#hierax', ""Quel est l'heureux amant qui s'en est fait aimer ? Nommez le moi."")",1.57,Substitution
167,"('#timante', ""Oui, c'est elle sans doute. Ah ! L'indigne spectacle !"")",,1.0,Insertion
168,"('#le-choeur', ""Si le ciel n'est injuste, il lui doit un miracle."")","('#argus', ""Tremblez à l'entendre nommer.  C'est un Dieu tout puissant, c'est Jupiter lui-même."")",1.2,Substitution
169,"('#timante', ""Il en fera voir un, s'il en croit nos désirs."")",,1.0,Insertion
170,"('#andromede', 'ô dieux !')","('#hierax', 'Ô Dieux !')",0.0,Match
171,"('#timante', 'Avec respect écoutons ses soupirs ; Et puissent les accents de ses premières plaintes Porter dans tous nos coeurs de mortelles atteintes !')",,1.0,Insertion
172,"('#andromede', ""Affreuse image du trépas Qu'un triste honneur m'avait fardée, Surprenantes horreurs, épouvantable idée, Qui tantôt ne m'ébranliez pas, Que l'on vous conçoit mal quand on vous envisage Avec un peu d'éloignement ! Qu'on vous méprise alors ! Qu'on vous brave aisément ! Mais que la grandeur de courage Devient d'un difficile usage Lorsqu'on touche au dernier moment ! Ici seule, et de toutes parts À mon destin abandonnée, Ici que je n'ai plus ni parents, ni Phinée, Sur qui détourner mes regards, L'attente de la mort de tout mon coeur s'empare, Il n'a qu'elle à considérer ; Et quoi que de ce monstre il s'ose figurer, Ma constance qui s'y prépare Le trouve d'autant plus barbare Qu'il diffère à me dévorer. Étrange effet de mes malheurs ! Mon âme traînante, abattue, N'a qu'un moment à vivre, et ce moment me tue À force de vives douleurs. Ma frayeur a pour moi mille mortelles feintes, Cependant que la mort me fuit : Je pâme au moindre vent, je meurs au moindre bruit ; Et mes espérances éteintes N'attendent la fin de mes craintes Que du monstre qui les produit. Qu'il tarde à suivre mes désirs ! Et que sa cruelle paresse À ce coeur dont ma flamme est encore la maîtresse Coûte d'amers et longs soupirs ! Ô toi, dont jusqu'ici la douceur m'a suivie, Va-t'en, souvenir indiscret ; Et cessant de me faire un entretien secret De ce prince qui m'a servie, Laisse-moi sortir de la vie Avec un peu moins de regret. C'est assez que tout l'univers Conspire à faire mes supplices ; Ne les redouble point, toi qui fus mes délices, En me montrant ce que je perds ; Laisse-moi..."")","('#argus', ""Dégagez vous d'un amour si fatal Sans balancer il faut vous y résoudre C'est un redoutable rival Qu'un amant qui lance la foudre."")",0.47,Substitution
173,"('#cassiope', ""Me voici, qui seule ai fait le crime ; Me voici, justes dieux, prenez votre victime : S'il est quelque justice encore parmi vous, C'est à moi seule, à moi qu'est dû votre courroux. Punir les innocents, et laisser les coupables, Inhumains ! Est-ce en être, est-ce en être capables ? À moi tout le supplice, à moi tout le forfait. Que faites-vous, cruels ? Qu'avez-vous presque fait ? Andromède est ici votre plus rare ouvrage ; Andromède est ici votre plus digne image ; Elle rassemble en soi vos attraits divisés : On vous connaîtra moins si vous la détruisez. Ah ! Je découvre enfin d'où provient tant de haine : Vous en êtes jaloux plus que je n'en fus vaine ; Si vous la laissiez vivre, envieux tout-puissants, Elle aurait plus que vous et d'autels et d'encens ; Chacun préférerait le portrait au modèle, Et bientôt l'univers n'adorerait plus qu'elle."")","('#hierax', ""Dieux tout puissants ! ah ! vous étiez jaloux De la félicité que vous m'avez ravie, Dieux tout puissants ! ah ! vous étiez jaloux De me voir plus heureux que vous. Vous n'avez pu souffrir le bonheur de la vie Et je voyais vos grandeurs sans envie. J'aimais, j'étais aimé.  Mon sort était trop doux."")",0.25,Substitution
174,"('#andromede', ""En l'état où je suis le sort m'est-il trop doux, Si vous ne me donnez de quoi craindre pour vous ? Faut-il encore ce comble à des malheurs extrêmes ? Qu'espérez-vous, madame, à force de blasphèmes ?"")","('#argus', ""Heureux qui peut briser Qui peut briser sa chaîne Finissez une plainte vaine Méritez l'infidélité; Un coeur ingrat vaut-il la peine D'être tant regretté."")",1.16,Substitution
175,"('#cassiope', ""Attirer et leur monstre et leur foudre sur moi ; Mais je ne les irrite, hélas ! Que contre toi : Sur ton sang innocent retombent tous mes crimes ; Seule tu leur tiens lieu de mille autres victimes ; Et pour punir ta mère ils n'ont, ces cruels dieux, Ni monstre dans la mer, ni foudre dans les cieux. Aussi savent-ils bien que se prendre à ta vie, C'est percer de mon coeur la plus tendre partie ; Que je souffre bien plus en te voyant périr, Et qu'ils me feraient grâce en me faisant mourir. Ma fille, c'est donc là cet heureux hyménée, Cette illustre union par Vénus ordonnée, Qu'avec tant de pompe il fallait préparer, Et que ces mêmes dieux devaient tant honorer ! Ce que nos yeux ont vu n'était-ce donc qu'un songe, Déesse ? Ou ne viens-tu que pour dire un mensonge ? Nous aurais-tu parlé sans l'aveu du destin ? Est-ce ainsi qu'à nos maux le ciel trouve une fin ? Est-ce ainsi qu'Andromède en reçoit les caresses ? Si contre elle l'envie émeut quelques déesses, L'amour en sa faveur n'arme-t-il point de dieux ? Sont-ils tous devenus ou sans coeur, ou sans yeux ? Le maître souverain de toute la nature Pour de moindres beautés a changé de figure ; Neptune a soupiré pour de moindres appas ; Elle en montre à Phébus que Daphné n'avait pas ; Et l'Amour en Psyché voyait bien moins de charmes, Quand pour elle il daigna se blesser de ses armes. Qui dérobe à tes yeux le droit de tout charmer, Ma fille ? Au vif éclat qu'ils sèment dans la mer, Les tritons amoureux, malgré leurs Néréides, Devraient déjà sortir de leurs grottes humides, Aux fureurs de leur monstre à l'envi s'opposer, Contre ce même écueil eux-mêmes l'écraser, Et de ses os brisés, de sa rage étouffée, Au pied de ton rocher t'élever un trophée."")","('#hierax #argus', 'Heureux qui peut briser Qui peut briser sa chaîne')",1.66,Substitution
176,,"('#argus', 'Liberté, liberté.')",1.0,Deletion
177,,"('#syrinx #choeurs', 'Liberté, liberté ! Une partie des nymphes dansent dans le temps que les autres chantent.')",1.0,Deletion
178,,"('#hierax #argus', 'Quelles danses ! quels chants et quelle nouveauté !')",1.0,Deletion
179,,"('#syrinx #choeurs', ""S'il est quelque bien au monde C'est la liberté."")",1.0,Deletion
180,"('#andromede', ""Renouveler le crime, est-ce pour les fléchir ? Vous hâtez mon supplice au lieu de m'affranchir. Vous appelez le monstre. Ah ! Du moins à sa vue Quittez la vanité qui m'a déjà perdue. Il n'est mortel ni dieu qui m'ose secourir. Il vient : consolez-vous, et me laissez mourir."")","('#hierax #argus', 'Que voulez-vous ?')",1.44,Substitution
181,,"('#choeur-des-nymphes', 'Liberté, liberté.')",1.0,Deletion
182,,"('#hierax #argus', ""Que voulez-vous ? il faut qu'on nous réponde."")",1.0,Deletion
183,,"('#syrinx #choeurs', ""S'il est quelque bien au monde, C'est la liberté."")",1.0,Deletion
184,,"('#mercure #choeurs-de-nymphes #bergers #satyres #sylvains', ""Liberté, liberté S'il est quelque bien au monde C'est la liberté. Liberté, liberté"")",1.0,Deletion
185,"('#cassiope', ""Je le vois, c'en est fait. Parois du moins, Phinée, Pour sauver la beauté qui t'était destinée ; Parais, il en est temps ; viens en dépit des dieux Sauver ton Andromède, ou périr à ses yeux ; L'amour te le commande, et l'honneur t'en convie ; Peux-tu, si tu la perds, aimer encore la vie ?"")","('#mercure', ""De la Nymphe Syrinx l'on chérit la mémoire, Il en regrette encor la perte chaque jour; Pour célébrer une fête à sa gloire Ce Dieu lui même assemble ici sa cour Il veut que du malheur de son fidèle amour. Un spectacle touchant représente l'histoire"")",0.56,Substitution
186,"('#andromede', ""Il n'a manque d'amour, ni manque de valeur ; Mais sans doute, madame, il est mort de douleur ; Et comme il a du coeur et sait que je l'adore, Il périrait ici, s'il respirait encore."")",,1.0,Insertion
187,"('#cassiope', ""Dis plutôt que l'ingrat n'ose te mériter. Toi donc, qui plus que lui t'osais tantôt vanter, Viens, amant inconnu, dont la haute origine, Si nous t'en voulons croire, est royale ou divine ; Viens en donner la preuve, et par un prompt secours, Fais-nous voir quelle foi l'on doit à tes discours ; Supplante ton rival par une illustre audace ; Viens à droit de conquête en occuper la place : Andromède est à toi si tu l'oses gagner. Quoi ? Lâches, le péril vous la fait dédaigner ! Il éteint en tous deux ces flammes sans secondes ! Allons, mon désespoir, jusqu'au milieu des ondes Faire servir l'effort de nos bras impuissants D'exemple et de reproche à leurs feux languissants ; Faisons ce que tous deux devraient faire avec joie ; Détournons sa fureur dessus une autre proie : Heureuse si mon sang la pouvait assouvir ! Allons. Mais qui m'arrête ? Ah ! C'est mal me servir."")","('#argus', ""C'est un plaisir pour nous; poursuivez j'y consens Je ne m'oppose point à ces jeux innocents. Argus va prendre place sur un siège de gazon proche de l'endroit où Io est enfermée et fait planer Hiérax de l'autre côté."")",0.5,Substitution
188,"('#timante', 'Courez-vous à la mort quand on vole à votre aide ? Voyez par quels chemins on secourt Andromède ; Quel héros, ou quel dieu sur ce cheval ailé...')","('#mercure', ""Il donne dans le piège, achevez sans remise Achevez de surprendre Argus et tous ses yeux. Si vous tentez une grande entreprise, Mercure vous conduit, l'amour vous favorise Et vous servez le plus puissant des Dieux. Mercure, les berges, les satyres, et les sylvains rentrent derrière le théâtre."")",0.77,Substitution
189,"('#cassiope', ""Ah ! C'est cet inconnu par mes cris appelé, C'est lui-même, seigneur, que mon âme étonnée..."")","('#syrinx', ""Liberté, liberté S'il est quelque bien au monde C'est la liberté."")",1.35,Substitution
190,"('#persee', ""Reine, voyez par là si je vaux bien Phinée, Si j'étais moins que lui digne de votre choix, Et si le sang des dieux cède à celui des rois."")","('#syrinx', ""L'empire de l'Amour n'est pas moins agité Que l'empire de l'onde Ne cherchons point d'autre félicité Qu'un doux loisir dans une paix profonde S'il est quelque bien au monde  C'est la liberté. Liberté, liberté ! Dans le temps qu'une partie des Nymphes chante, le reste de la troupe danse."")",1.38,Substitution
