,campistron-achille,corneillep-andromede,Cost,Operation Type
0,"('#mercure', ""Savantes Soeurs, arbitres de la scène, Quel accident funeste a fait cesser vos jeux ? Je ne vois plus ici votre appareil pompeux, Et je ne reconnais qu'a peine, Thalie et Melpomène ;. Et vous dont les charmants concerts, En ces lieux autrefois, raisonneront dans les Airs ; Quel trouble, ou quelle indifférence Cause aujourd'hui votre silence ?"")","('#melpomene', ""Arrête un peu ta course impétueuse : Mon théâtre, Soleil, mérite bien tes yeux ; Tu n'en vis jamais en ces lieux La pompe plus majestueuse : J'ai réuni, pour la faire admirer, Tout ce qu'ont de plus beau la France et l'Italie ; De tous leurs arts mes soeurs l'ont embellie : Prête-moi tes rayons pour la mieux éclairer. Daigne à tant de beautés, par ta propre lumière, Donner un parfait agrément, Et rends cette merveille entière En lui servant toi-même d'ornement."")",0.09,Substitution
1,,"('#soleil', ""Charmante muse de la scène, Chère et divine Melpomène, Tu sais de mon destin l'inviolable loi : Je donne l'âme à toutes choses, Je fais agir toutes les causes ; Mais quand je puis le plus, je suis le moins à moi ; Par une puissance plus forte Le char que je conduis m'emporte : Chaque jour sans repos doit et naître et mourir. J'en suis esclave alors que j'y préside ; Et ce frein que je tiens aux chevaux que je guide Ne règle que leur route, et les laisse courir."")",1.0,Deletion
2,"('#melpomene', 'Ignorez vous que le plus grand des rois Étendant chaque jour ses conquêtes Et signalant son bras, par de nouveaux exploits A négligé nos plus superbes fêtes.')","('#melpomene', ""La naissance d'Hercule et le festin d'Atrée T'ont fait rompre ces lois ; Et tu peux faire encore ce qu'on t'a vu deux fois Faire en même contrée. Je dis plus : tu le dois en faveur du spectacle Qu'au monarque des lis je prépare aujourd'hui ; Le ciel n'a fait que miracles en lui : Lui voudrais-tu refuser un miracle ?"")",0.22,Substitution
3,"('#thalie', ""Depuis ce fatal moment, Nos Spectacles privés de leur magnificence, Ne sauraient plus avoir l'éclat et l'agrément Qu'ils ne devaient qu'à sa présence,"")","('#soleil', ""Non ; mais je le réserve à ces bienheureux jours Qu'ennoblira sa première victoire : Alors j'arrêterai mon cours, Pour être plus longtemps le témoin de sa gloire. Prends cependant le soin de le bien divertir, Pour lui faire avec joie attendre les années Qui feront éclater les belles destinées Des peuples que son bras lui doit assujettir. Calliope ta soeur déjà d'un oeil avide Cherche dans l'avenir les faits de ce grand roi, Dont les hautes vertus lui donneront emploi Pour plus d'une Illiade et plus d'une Énéide."")",0.49,Substitution
4,"('#terpsicore', 'La tristesse règne en ces lieux, Nous rougissons de ne pouvoir lui plaîre ; Hélas ! Ne saurions-nous rien faire Digne de paraître à ses yeux.')","('#melpomene', ""Que je porte d'envie à cette illustre soeur, Quoique j'aie à craindre pour elle Que sous ce grand fardeau sa force ne chancelle ! Mais quel qu'en soit enfin le mérite et l'honneur, J'aurai du moins cet avantage, Que déjà je le vois, que déjà je lui plais, Et que de ses vertus, et que de ses hauts faits Déjà dans ses pareils je lui trace une image. Je lui montre Pompée, Alexandre, César, Mais comme des héros attachés à son char ; Et tout ce haut éclat où je les fais paraître Lui peint plus qu'ils n'étaient, et moins qu'il ne doit être."")",0.77,Substitution
5,,"('#soleil', ""Il en effacera les plus glorieux noms, Dès qu'il pourra lui-même animer son armée ; Et tout ce que d'eux tous a dit la renommée Te fera voir en lui le plus grand des Bourbons. Son père et son aïeul tous rayonnants de gloire, Ces grands rois qu'en tous lieux a suivis la victoire, Lui voyant emporter sur eux le premier rang, En deviendraient jaloux s'il n'était pas leur sang. Mais vole dans mon char, muse ; je veux t'apprendre Tout l'avenir d'un roi qui t'est si précieux."")",1.0,Deletion
6,,"('#melpomene', ""Je sais déjà ce qu'on doit en attendre, Et je lis chaque jour son destin dans les cieux."")",1.0,Deletion
7,,"('#soleil', ""Viens donc, viens avec moi faire le tour du monde ; Qu'unissant ensemble nos voix, Nous fassions résonner sur la terre et sur l'onde Qu'il est et le plus jeune et le plus grand des rois."")",1.0,Deletion
8,,"('#melpomene', ""Soleil, j'y vole ; attends-moi donc, de grâce."")",1.0,Deletion
9,,"('#soleil', ""Viens, je t'attends, et te fais place. Mélpomène vole dans le char du soleil, et y ayant pris place auprès de lui, ils unissent leurs voix, et chantent cet air à la louange du roi. Le dernier vers de chaque couplet est répété par le choeur de la musique."")",1.0,Deletion
10,"('#melpomene #thalie #terpsicore', 'Hélas ! Ne saurions-nous rien faire Digne de paraître à ses yeux ?')","('#melpomene #soleil', 'Cieux, écoutez ; écoutez, mers profondes ; Et vous, antres et bois, Affreux déserts, rochers battus des ondes, Redites après nous d\'une commune voix : "" Louis est le plus jeune et le plus grand des rois. "" La majesté qui déjà l\'environne Charme tous ses François ; Il est lui seul digne de sa couronne ; Et quand même le ciel l\'aurait mise à leur choix, Il serait le plus jeune et le plus grand des rois. C\'est à vos soins, reine, qu\'on doit la gloire De tant de grands exploits ; Ils sont partout suivis de la victoire ; Et l\'ordre merveilleux dont vous donnez ses lois Le rend et le plus jeune et le plus grand des rois.')",1.18,Substitution
11,"('#mercure', ""Terminez vos regrets que votre douleur cesse. Dans vôtre sort Jupiter s'intéresse, Et veut ici revoir, dès ce même moment Un spectacle charmant, Ou'un changement favorable Redonne à ces tristes lieux Tout ce qu'ils ont est d'aimable?' C'est l'ordre irrévocable Du souverain des Dieux. Ce lieu désert se détruit reprend tout d'un coup sa première magnificence."")","('#soleil', ""Voilà ce que je dis sans cesse Dans tout mon large tour. Mais c'est trop retarder le jour ; Allons, muse, l'heure me presse, Et ma rapidité Doit regagner le temps que sur cette province, Pour contempler ce prince, Je me suis arrêté. Le Soleil part avec rapidité, et enlève Melpomène avec lui dans son char pour aller publier ensemble la même chose au reste de l'univers."")",0.17,Substitution
12,"('#melpomene', 'Vous, secourables Génies,  Nécessaire à nos jeux,  Hâtez-vous, secondez nos voeux ; Venez, et prêtez-nous vos grâces infinies.')","('#cassiope', ""Généreux inconnu, qui chez tous les monarques Portez de vos vertus les éclatantes marques, Et dont l'aspect suffit à convaincre nos yeux Que vous sortez du sang ou des rois ou des dieux, Puisque vous avez vu le sujet de ce crime Que chaque mois expie une telle victime, Cependant qu'en ce lieu nous attendrons le roi, Soyez-y juste juge entre les dieux et moi. Jugez de mon forfait, jugez de leur colère ; Jugez s'ils ont eu droit d'en punir une mère, S'ils ont dû faire agir leur haine au même instant."")",0.43,Substitution
13,"('#melpomeme #terpsicore', ""Animez d'une ardeur nouvelle Venez remplir nos desseins, Et faites que nos plaisirs Doivent leur charme à votre zèle."")","('#persee', ""J'en ai déjà jugé, reine, en vous imitant ; Et si de vos malheurs la cause ne procède Que d'avoir fait justice aux beautés d'Andromède, Si c'est là ce forfait digne d'un tel courroux, Je veux être à jamais coupable comme vous. Mais comme un bruit confus m'apprend ce mal extrême, Ne le puis-je, madame, apprendre de vous-même, Pour mieux renouveler ce crime glorieux Où soudain la raison est complice des yeux ?"")",0.34,Substitution
14,"('#choeur-de-genies', ""Animez d'une ardeur nouvelle Nous venons remplir vos désirs,  Nous nous flattons que vos plaisirs  Devront leur charme à notre zèle."")","('#cassiope', 'écoutez : la douleur se soulage à se plaindre ; Et quelques maux qu\'on souffre ou que l\'on aie à craindre, Ce qu\'un coeur généreux en montre de pitié Semble en notre faveur en prendre la moitié. Ce fut ce même jour qui conclut l\'hyménée De ma chère Andromède avec l\'heureux Phinée : Nos peuples, tous ravis de ces illustres noeuds, Sur les bords de la mer dressèrent force jeux ; Elle en donnait les prix. Dispensez ma tristesse De vous dépeindre ici la publique allégresse ; On décrit mal la joie au milieu des malheurs, Et sa plus douce idée est un sujet de pleurs. Ô jour, que ta mémoire encore m\'est cruelle ! Andromède jamais ne me parut si belle ; Et voyant ses regards s\'épandre sur les eaux Pour jouir et juger d\'un combat de vaisseaux : "" telle, dis-je, Vénus sortit du sein de l\'onde, Et promit à ses yeux la conquête du monde, Quand elle eut consulté sur leur éclat nouveau Les miroirs vagabonds de son flottant berceau. "" À ce fameux spectacle on vit les Néréides Lever leurs moites fronts de leurs palais liquides, Et pour nouvelle pompe à ces nobles ébats À l\'envi de la terre étaler leurs appas. Elles virent ma fille ; et leurs regards à peine Rencontrèrent les siens sur cette humide plaine, Que par des traits plus forts se sentant effacer, éblouis et confus je les vis s\'abaisser, Examiner les leurs, et sur tous leurs visages En chercher d\'assez vifs pour braver nos rivages. Je les vis se choisir jusqu\'à cinq et six fois, Et rougir aussitôt nous comparant leur choix ; Et cette vanité qu\'en toutes les familles On voit si naturelle aux mères pour leurs filles, Leur cria par ma bouche : "" en est-il parmi vous, Ô nymphes ! Qui ne cède à des attraits si doux ? Et pourrez-vous nier, vous autres immortelles, Qu\'entre nous la nature en forme de plus belles ? "" Je m\'emportais sans doute, et c\'en était trop dit : Je les vis s\'en cacher de honte et de dépit ; J\'en vis dedans leurs yeux les vives étincelles : L\'onde qui les reçut s\'en irrita pour elles ; J\'en vis enfler la vague, et la mer en courroux Rouler à gros bouillons ses flots jusques à nous. C\'eût été peu des flots : la soudaine tempête, Qui trouble notre joie et dissipe la fête, Enfante en moins d\'une heure et pousse sur nos bords Un monstre contre nous armé de mille morts. Nous fuyons, mais en vain ; il suit, il brise, il tue ; Chaque victime est morte aussitôt qu\'abattue. Nous ne voyons qu\'horreur, que sang de toutes parts ; Son haleine est poison, et poison ses regards : Il ravage, il désole et nos champs et nos villes, Et contre sa fureur il n\'est aucuns asiles. Après beaucoup d\'efforts et de voeux superflus, Ayant souffert beaucoup, et craignant encore plus, Nous courons à l\'oracle en de telles alarmes ; Et voici ce qu\'Ammon répondit à nos larmes : "" pour apaiser Neptune, exposez tous les mois Au monstre qui le venge une fille à son choix, Jusqu\'à ce que le calme à l\'orage succède ; Le sort vous montrera Celle qu\'il agréera : Différez cependant les noces d\'Andromède."" Comme dans un grand mal un moindre semble doux, Nous prenons pour faveur ce reste de courroux. Le monstre disparu nous rend un peu de joie : On ne le voit qu\'aux jours qu\'on lui livre sa proie. Mais ce remède enfin n\'est qu\'un amusement : Si l\'on souffre un peu moins, on craint également ; Et toutes nous tremblons devant une infortune Qui toutes nous menace avant qu\'en frapper une. La peur s\'en renouvelle au bout de chaque mois ; J\'en ai cru de frayeur déjà mourir cinq fois. Déjà nous avons vu cinq beautés dévorées, Mais des beautés, hélas ! Dignes d\'être adorées, Et de qui tous les traits, pleins d\'un céleste feu, Ne cédaient qu\'à ma fille, et lui cédaient bien peu : Comme si choisissant de plus belle en plus belle, Le sort par ces degrés tâchait d\'approcher d\'elle, Et que pour élever ses traits jusques à nous, Il essayât sa force et mesurât ses coups. Rien n\'a pu jusqu\'ici toucher ce dieu barbare ; Et le sixième choix aujourd\'hui se prépare : On le va faire au temple ; et je sens malgré moi Des mouvements secrets redoubler mon effroi. Je fis hier à Vénus offrir un sacrifice, Qui jamais à mes voeux ne parut si propice ; Et toutefois mon coeur, à force de trembler, Semble prévoir le coup qui le doit accabler. Vous donc, qui connaissez et mon crime et sa peine, Dites-moi s\'il a pu mériter tant de haine, Et si le ciel devait tant de sévérité Aux premiers mouvements d\'un peu de vanité.')",0.63,Substitution
15,,"('#persee', ""Oui, madame, il est juste ; et j'avouerai moi-même Qu'en le blâmant tantôt j'ai commis un blasphème. Mais vous ne voyez pas, dans votre aveuglement, Quel grand crime il punit d'un si grand châtiment. Les nymphes de la mer ne lui sont pas si chères Qu'il veuille s'abaisser à suivre leurs colères ; Et quand votre mépris en fit comparaison, Il voyait mieux que vous que vous aviez raison. Il venge, et c'est de là que votre mal procède, L'injustice rendue aux beautés d'Andromède. Sous les lois d'un mortel votre choix l'asservit ! Cette injure est sensible aux dieux qu'elle ravit, Aux dieux qu'elle captive ; et ces rivaux célestes S'opposent à des noeuds à sa gloire funestes, En sauvent les appas qui les ont éblouis, Punissent vos sujets qui s'en sont réjouis. Jupiter, résolu de l'ôter à Phinée, Exprès par son oracle en défend l'hyménée. À sa flamme peut-être il veut la réserver ; Ou s'il peut se résoudre enfin à s'en priver, À quelqu'un de ses fils sans doute il la destine ; Et voilà de vos maux la secrète origine. Faites cesser l'offense, et le même moment Fera cesser ici son juste châtiment."")",1.0,Deletion
16,"('#thalie', 'Vous qui savez si bien, par une heureuse adresse Calmer les noirs chagrins, bannir les soins fâcheux, Favorisez mes soeurs, et mêlez dans leur quelques traits de votre allégresse.')","('#cassiope', ""Vous montrez pour ma fille une trop haute estime, Quand pour la mieux flatter vous me faites un crime, Dont la civilité me force de juger Que vous ne m'accusez qu'afin de m'obliger. Si quelquefois les dieux pour des beautés mortelles Quittent de leur séjour les clartés éternelles, Ces mêmes dieux aussi, de leur grandeur jaloux, Ne font pas chaque jour ce miracle pour nous ; Et quand pour l'espérer je serais assez folle, Le roi, dont tout dépend, est homme de parole ; Il a promis sa fille, et verra tout périr Avant qu'à se dédire il veuille recourir. Il tient cette alliance et glorieuse et chère : Phinée est de son sang, il est fils de son frère."")",0.34,Substitution
17,,"('#persee', 'Reine, le sang des dieux vaut bien celui des rois... Mais nous en parlerons encore quelque autre fois. Voici le roi qui vient.')",1.0,Deletion
18,"('#melpomene #thalie #terpsicore', ""Que nos jeux vont avoir de charmes ! Tous nos chants vont inciter l'Amour. Venez tous, rendez-lui les armes,  Il est doux dans cet heureux séjour. Que nos jeux vont avoir de charmes ! Tous nos chants vont inspirer l'Amour. Ce n'est plus le temps des alarmes,  Les Plaisirs sont enfin de retour. Que nos jeux vont avoir de charmes ! Tous nos chants vont inspirer l'Amour."")","('#cephee', ""N'en parlons plus, Phinée, Et laissons d'Andromède aller la destinée. Votre amour fait pour elle un inutile effort : Je la dois comme une autre au triste choix du sort. Elle est cause du mal, puisqu'elle l'est du crime : Peut-être qu'il la veut pour dernière victime, Et que nos châtiments deviendraient éternels, S'ils ne pouvaient tomber sur les vrais criminels."")",1.27,Substitution
19,,"('#phinee', ""Est-ce un crime en ces lieux, seigneur, que d'être belle ?"")",1.0,Deletion
20,,"('#cephee', 'Elle a rendu par là sa mère criminelle.')",1.0,Deletion
21,,"('#phinee', ""C'est donc un crime ici que d'avoir de bons yeux Qui sachent bien juger d'un tel présent des cieux ?"")",1.0,Deletion
22,,"('#cephee', ""Qui veut en bien juger n'a point le privilège D'aller jusqu'au blasphème et jusqu'au sacrilège."")",1.0,Deletion
23,,"('#cassiope', ""Ce blasphème, seigneur, de quoi vous m'accusez..."")",1.0,Deletion
24,"('#mercure', 'Jupiter va paraître,  Redoublez vos efforts pour plaire à votre Maître.')","('#cephee', ""Madame, après les maux que vous avez causés, C'est à vous à pleurer, et non à vous défendre. Voyez, voyez quel sang vous avez fait répandre ; Et ne laissez paraître en cette occasion Que larmes, que soupirs, et que confusion. Je vous le dis encore, elle la crut trop belle ; Et peut-être le sort l'en veut punir en elle : Dérober Andromède à cette élection, C'est dérober sa mère à sa punition."")",1.2,Substitution
25,,"('#phinee', ""Déjà cinq fois, seigneur, à ce choix exposée, Vous voyez que cinq fois le sort l'a refusée."")",1.0,Deletion
26,,"('#cephee', ""Si le courroux du ciel n'en veut point à ses jours, Ce qu'il a fait cinq fois il le fera toujours."")",1.0,Deletion
27,"('#le-choeur', 'Jupiter va paraître. Redoublons nos efforts pour plaire à notre Maître. Dans ce moment Jupiter paraît dans son char.')","('#phinee', ""Le tenter si souvent, c'est lasser sa clémence : Il pourra vous punir de trop de confiance : Vouloir toujours faveur, c'est trop lui demander, Et c'est un crime enfin que de tant hasarder. Mais quoi ? N'est-il, seigneur, ni bonté paternelle, Ni tendresse du sang qui vous parle pour elle ?"")",1.52,Substitution
28,"('#jupiter', ""Il ne manque aux apprêts de la fête nouvelle, Que Mercure a fait préparé, Que le choix du Héros qu'on y doit célébrer, Le soin de le choisir auprès de vous m'appelle. Renouvelez dans vos jeux Le souvenir de l'invincible Achille, Et rappelez dans une Cour tranquille,  L'Histoire et les combats de ce guerrier fameux."")","('#cephee', ""Ah ! Ne m'arrachez point mon sentiment secret. Phinée, il est tout vrai, je l'expose à regret. J'aime que votre amour en sa faveur me presse ; La nature en mon coeur avec lui s'intéresse ; Mais elle ne saurait mettre d'accord en moi Les tendresses d'un père et les devoirs d'un roi ; Et par une justice à moi-même sévère, Je vous refuse en roi ce que je veux en père."")",0.58,Substitution
29,"('#melpomene #thalie #terpsicore', ""Renouvelons dans vos jeux, Le souvenir de l'invincible Achille, Et rappelons dans une Cour tranquille. L'Histoires et les combats de ce guerrier fameux."")","('#phinee', ""Quelle est cette justice, et quelles sont ces lois Dont l'aveugle rigueur s'étend jusques aux rois ?"")",1.13,Substitution
30,"('#jupiter', ""Consacrez tous vos jeux au plus grand Roi du monde, Formez sur lui tous les Portraits De vos Héros les plus parfaits, Sa valeur, sa bonté, sa sagesse profonde, Vous prêteront d'inimitables traits."")","('#cephee', ""Celles que font les dieux, qui, tous rois que nous sommes, Punissent nos forfaits ainsi que ceux des hommes, Et qui ne nous font part de leur sacré pouvoir Que pour le mesurer aux règles du devoir. Que diraient mes sujets si je me faisais grâce, Et si, durant qu'au monstre on expose leur race, Ils voyaient, par un droit tyrannique et honteux, Le crime en ma maison, et la peine sur eux ?"")",0.63,Substitution
31,,"('#phinee', 'Heureux sont les sujets, heureuses les provinces Dont le sang peut payer pour celui de leurs princes !')",1.0,Deletion
32,"('#le-choeur', ""Consacrons tous nos jeux au plus grand Roi du monde Sa valeur, sa bonté, sa sagesse profonde Nous prêterons d'inimitables traits, Consacrons tous nos jeux au plus grand Roi du monde."")","('#cephee', ""Mais heureux est le prince, heureux sont ses projets, Quand il se fait justice ainsi qu'à ses sujets ! Notre oracle, après tout, n'excepte point ma fille : Ses termes généraux comprennent ma famille ; Et ne confondre pas ce qu'il a confondu, C'est se mettre au-dessus du dieu qui l'a rendu."")",0.89,Substitution
33,"('#patrocle', ""Non, je ne saurais plus me taire, Je vous dois un conseil sincère. Ne rougissez-vous point d'un indigne repos ? Quand les Grecs agités de mortelles alarmes, Implorent à genoux le secours de vos armes, Contre Hector, après vous, le plus grand des Héros. Tantôt ce guerrier terrible, Des Grecs épouvantés, embrase les vaisseaux ; Tantôt son bras invincible,  Fait rougir de leur sang et la terre et les eaux, Il court de victoire en victoire, Chaque jour, le bruit de la gloire,  Va remplir l'univers et vole jusqu'à vous, Des honneurs qu'il obtient, n'êtes vous point jaloux ?"")","('#persee', ""Seigneur, s'il m'est permis d'entendre votre oracle, Je crois qu'à sa prière il donne peu d'obstacle ; Il parle d'Andromède, il la nomme, il suffit, Arrêtez-vous pour elle à ce qu'il vous en dit : La séparer longtemps d'un amant si fidèle, C'est tout le châtiment qu'il semble vouloir d'elle. Différez son hymen sans l'exposer au choix. Le ciel assez souvent, doux aux crimes des rois, Quand il leur a montré quelque légère haine, Répand sur leurs sujets le reste de leur peine."")",0.0,Match
34,,"('#cephee', ""Vous prenez mal l'oracle ; et pour l'expliquer mieux, Sachez... Mais quel éclat vient de frapper mes yeux ? D'où partent ces longs traits de nouvelles lumières ?"")",1.0,Deletion
35,,"('#persee', ""Du ciel qui vient d'ouvrir ses luisantes barrières, D'où quelque déité vient, ce semble, ici-bas Terminer elle-même entre vous ces débats."")",1.0,Deletion
36,,"('#cassiope', ""Ah ! Je la reconnais, la déesse d'Éryce ; C'est elle, c'est Vénus, à mes voeux si propice : Je vois dans ses regards mon bonheur renaissant. Peuple, faites des voeux, tandis qu'elle descend."")",1.0,Deletion
37,"('#achille', ""Je vois avec plaisir les pertes de la Grèce,  La valeur d'Hector m'a vengé,  Le fier Agamemnon connaîtra sa faiblesse,  Et se repentira de m'avoir outragé."")","('#le-choeur', ""Reine de Paphe et d'Amathonte, Mère d'amour, et fille de la mer, Peux-tu voir sans un peu de honte Que contre nous elle ait voulu s'armer, Et que du même sein qui fut ton origine Sorte notre ruine ? Peux-tu voir que de la même onde Il ose naître un tel monstre après toi ? Que d'où vint tant de bien au monde Il vienne enfin tant de mal et d'effroi, Et que l'heureux berceau de ta beauté suprême Enfante l'horreur même ? Venge l'honneur de ta naissance Qu'on a souillé par un tel attentat ; Rends-lui sa première innocence, Et tu rendras le calme à tout l'état ; Et nous dirons enfin que d'où le mal procède Part aussi le remède."")",0.7,Substitution
38,,"('#cassiope', ""Peuple, elle veut parler : silence à la déesse ; Silence, et préparez vos coeurs à l'allégresse. Elle a reçu nos voeux, et les daigne exaucer ; écoutez-en l'effet qu'elle va prononcer."")",1.0,Deletion
39,"('#patrocle', ""De quoi sert à ce Roi coupable D'avoir osé vous ravir Briséis ? Son attentat reçoit un digne prix,  Et pour lui Briséis paraît inexorable, Quand un rival puissant vient troubler nos amours, Si l'objet de nos voeux lui résiste toujours, Est-il de plus douce vengeance Que de voir ce rival aimer sans espérance ?"")","('#venus', ""Ne tremblez plus, mortels ; ne tremble plus, ô mère ! On va jeter le sort pour la dernière fois, Et le ciel ne veut plus qu'un choix Pour apaiser de tout point sa colère. Andromède ce soir aura l'illustre époux Qui seul est digne d'elle, et dont seule elle est digne. Préparez son hymen, où, pour faveur insigne, Les dieux ont résolu de se joindre avec vous."")",0.34,Substitution
40,,"('#phinee', ""Souffrez que sans tarder je porte à ma Princesse, Seigneur, l'heureux arrêt qu'a donné la déesse."")",1.0,Deletion
41,,"('#cephee', ""Allez, l'impatience est trop juste aux amants."")",1.0,Deletion
42,,"('#cassiope', ""Suivons-la dans le ciel par nos remerciements ; Et d'une voix commune adorant sa puissance, Montrons à ses faveurs notre reconnaissance."")",1.0,Deletion
43,"('#achille', ""Connais mieux les raisons de mon juste courroux, Ce n'est point seulement par un dépit jaloux, Que je refuse aux Grecs un secours nécessaire, Ils ont marqué trop de mépris pour moi,  Ils m'ont laissé subir la violente loi  De leur chef téméraire. Non, jamais leurs malheurs ne sauraient m'émouvoir. Leurs vaisseaux embrasés, leurs troupes fugitives ; Leur camp détruit, tout leurs Rois sans pouvoir, Leurs corps épars sur ces sanglantes rives Szraient encor des objets impuissants,  Pour surprendre un moment la fureur que je sens."")","('#le-choeur', ""Ainsi toujours sur tes autels Tous les mortels Offrent leurs coeurs en sacrifice ! Ainsi le Zéphyre en tout temps Sur tes palais de Cythère et d'Éryce Fasse régner les grâces du printemps ! Daigne affermir l'heureuse paix Qu'à nos souhaits Vient de promettre ton oracle ; Et fais pour ces jeunes amants, Pour qui tu viens de faire ce miracle, Un siècle entier de doux ravissements. Dans nos campagnes et nos bois Toutes nos voix Béniront tes douces atteintes ; Et dans les rochers d'alentour, La même écho qui redisait nos plaintes Ne redira que des soupirs d'amour."")",0.39,Substitution
44,"('#patrocle', ""Eh bien ! D'un oeil content regardez nos alarmés, Mais quand vous nous méritez tous,  Du moins accordez-moi ces armes Que Vulcain prépara pour vous ; J'irai combattre Hector, et me combler de gloire,  Je remporterai la victoire,  Ou j'expirerai sous ces coups."")","('#cephee', ""C'est assez... La déesse est déjà disparue ; Ses dernières clartés se perdent dans la nue ; Allons jeter le sort pour la dernière fois. Malheureux le dernier que foudroiera son choix, Et dont en ce grand jour la perte domestique Souillera de ses pleurs l'allégresse publique ! Madame, cependant, songez à préparer Cet hymen que les dieux veulent tant honorer : Rendez-en l'appareil digne de ma puissance, Et digne, s'il se peut, d'une telle présence."")",0.0,Match
45,,"('#cassiope', ""J'obéis avec joie, et c'est me commander Ce qu'avec passion j'allais vous demander."")",1.0,Deletion
