,quinault-cadmus-hermione,quinault-persee,Cost,Operation Type
265,"('#arbas', 'Ah ! Quelle violence, Seigneur exigez-vous de mon obéissance.')","('#cephee', 'Ah ! quel effroyable supplice ! Dieux, ô dieux ! quelle cruauté !')",0.51,Substitution
266,"('#l-amour', ""Cadmus reçoit le don que je viens t'apporter ! C'est l'ouvrage du Dieu qui forge le tonnerre ; Ne manque pas de le jeter ; Il faut faire voir en ce jour Ce que peut un grand coeur secondé par l'Amour. Achève le dessein où mon ardeur t'engage."")","('#cassiope #cephee', ""Que j'expire en mourant un si funeste crime."")",1.55,Substitution
267,"('#cadmus', 'Je te vais obéir dans tarder davantage.')",,1.0,Insertion
268,"('#l-amour #cadmus', ""Il faut faire voir en ce jour Ce que peut un grand coeur secondé par l'Amour. L'Amour s'envole, et Cadmus sème les dents du Dragon, dont la terre produit des soldats armés qui se préparent d'abord à tourner leurs armes contre Cadmus, mais il jette au milieu d'eux une manière de grenade, que l'Amour lui a apporté, qui se brise en plusieurs éclats, et qui inspire aux combattants une fureur qui les oblige à combattre les uns contre les autres, et à s'entregorger eux-mêmes. Huit soldats armés nés de la Terre. Les cinq derniers qui demeurent vivants, viennent apporter leurs armes aux pieds de Cadmus. "")",,1.0,Insertion
269,"('#echion', 'Arrêtons un transport funeste ; Pourquoi nous immoler en naissant dans ces lieux ? Réservons le sang qui nous reste, Pour servir un héros favorisé des Dieux.')","('#cassiope', ""Que par pitié j'obtienne une mort légitime. Cruels ! n'attachez pas ma fille à ce rocher, C'est moi qu'il y faut attacher !"")",0.92,Substitution
270,"('#cadmus', ""Allez : que dans ces murs chacun de vous s'empresse De rendre hommage à la princesse Qui doit donner ici des ordres absolus ; Vos premiers respects lui sont dûs, Je vous suivrai de près, c'est ma plus douce envie. Cherchons nos tiriens, ils tremblent pour ma vie.  Allons les rassurer, voyons de toutes parts. Les combattants obéissent à Cadmus qui demeure pour chercher et pour rassembler les tyriens. "")","('#choeur', 'Divinités des Flots, Quel courroux vous anime Contre une innocente victime ?')",0.81,Substitution
271,"('#le-geant', ""Non, ce n'est point assez d'avoir satisfait Mars : Tu vois un ennemi qu'il faut encore abbattre, Au lieu de triompher recommence à combattre."")","('#cassiope #cephee', 'Divinités des Flots, Quel courroux vous anime Contre une innocente victime ?')",1.57,Substitution
272,"('#cadmus', 'Combattons.')",,1.0,Insertion
273,"('#le-geant', ""J'ai pitié du péril que tu cours : Il m'est honteux de vaincre avec tant d'avantage, Va, fuir, et cède moi l'objet de nos amours. Tu n'auras plus de Dieux qui défendent tes jours."")","('#choeur', ""C'est notre unique espoir, Faut-il vous l'arracher ? Nos voeux, nos pleurs, nos cris, Rien ne vous peut toucher"")",0.67,Substitution
274,,"('#cassiope #cephee', ""C'est notre unique espoir, Faut-il vous l'arracher ? Nos voeux, nos pleurs, nos cris, Rien ne vous peut toucher"")",1.0,Deletion
275,"('#cadmus', ""Les dieux m'ont donné du courgae, Et c'est un assez grand secours."")",,1.0,Insertion
276,"('#le-geant', ""Voyons s'il n'est rien qui t'étonne."")",,1.0,Insertion
277,"('#le-geant', ""Qu'on vienne à moi, qu'on l'environne ! Qu'on le perce de tous côtés !"")","('#andromede', ""Dieux ! Qui me destinez une mort si cruelle Hélas ! Pourquoi flattiez-vous  De l'espoir d'un destin si doux ? Vous dont je tiens la vie Et vous peuple fidèle, Jouissez parmi vous d'une paix éternelle, Je vais fléchir les dieux irrités contre vous. Et si ma mère est criminelle, C'est moi qui dois calmer le céleste courroux ! Par le sang que j'ai reçu d'elle, Heureuse de périr pour le salut de tous. Un souvenir charmant qu'en mourant je rappelle. Les appas, les douceurs d'une amour maternelle Sont de mon triste sort les plus terribles coups. Le fils de Jupiter eut été mon époux ! Ah ! Que ma vie eut été belle ! Dieux ! Qui me destinez une mort si cruelle Hélas ! Pourquoi me flattiez-vous De l'espoir d'un destin si doux ? Tremblez ! Superbe Reine. Tremblez ! Mortels audacieux ! Que votre orgueil apprenne Combien votre grandeur est vaine : Tremblez mortels audacieux ! Redoutez le courroux de Dieux"")",1.02,Substitution
278,"('#pallas', 'Cadmus fermez les yeux. Perfides arrêtez. Pallas découvre son bouclier et le présente aux yeux des quatre géants, qui demeurent immobiles et deviennent dans un instant quatre statues de pierre.')","('#choeur-des-tritons', 'Tremblez mortels audacieux ! Redoutez le courroux de Dieux')",0.97,Substitution
279,"('#pallas', 'Vois, Cadmus, vois quel supplice A puni leur injustice.')","('#cassiope', 'Ah ! Quelle vengeance inhumaine !')",0.76,Substitution
280,"('#cadmus', 'Que vois-je ! Les géants armés Ne sont plus des corps animés.')",,1.0,Insertion
281,"('#pallas', ""Je t'ai promis mon assistance, Je vais te préparer un superbe Palais : Je veux joindre aux douceurs d'un hymen plein d'attraits, L'éclat, et la magnificence. Goûte en paix un sort glorieux. Va, n'écoute plus rien que l'amour qui t'anime ; Hermione vient dans ces lieux."")","('#cephee', 'Andromède !')",1.07,Substitution
282,"('#cadmus', ""Par quel remerciement faut-il que je m'exprime ?"")",,1.0,Insertion
283,"('#pallas', ""Protéger la vertu d'un prince magnanime, C'est le plus doux emploi des Dieux."")",,1.0,Insertion
284,"('#cadmus', 'Ma princesse !')","('#cassiope', 'Ma fille !')",0.51,Substitution
285,,"('#andromede', 'Ô cieux !')",1.0,Deletion
286,,"('#cassiope', ""Que les dieux sont cruels ! qu'ils sont ingénieux À faire ressentir leur haine !"")",1.0,Deletion
287,"('#hermione', 'Cadmus !')","('#cephee', 'Andromède !')",0.0,Match
288,"('#cadmus', 'Quel bonheur !')","('#cassiope', 'Ma fille !')",1.5,Substitution
289,"('#hermione', 'Quelle gloire !')","('#andromede', 'Ô cieux ! Le monstre paraît.')",0.8,Substitution
290,,"('#cephee #cassiope #ethiopiens', 'Le monstre approche de ces lieux, Ah, quelle vengeance inhumaine !')",1.0,Deletion
291,"('#cadmus', 'Je vous vois libre enfin !')","('#nereides #tritons', 'Tremblez, mortels audacieux, etc.')",1.07,Substitution
292,,"('#andromede', ""A s'exposer pour moi c'est en vain qu'il s'obstine. Persée vole, et combat le monstre."")",1.0,Deletion
293,"('#hermione', 'Je vous revois vainqueur ?')","('#nereides #tritons', 'Téméraire Persée, arrêtez ; respectez La vengeance divine.')",1.49,Substitution
294,"('#hermione', 'Quelle favorable victoire !')",,1.0,Insertion
295,"('#hermione', ""Qu'elle a coûté cher à mon coeur !"")",,1.0,Insertion
296,"('#cadmus', ""Que c'est un charmant avantage Que de pouvoir sauver d'un cruel esclavage La beauté dont on est charmé !"")",,1.0,Insertion
297,"('#hermione', ""Que c'est un sort digne d'envie Que de pouvoir tenir le bonheur de sa vie, De la main d'un vainqueur aimé !"")","('#cephee #cassiope #ethiopiens', ""Magnanime héros, combattez, remportez Le prix que l'amour vous destine."")",0.64,Substitution
298,,"('#nereides #tritons', 'Le fils de Jupiter brave notre courroux.')",1.0,Deletion
299,,"('#tous-ensemble', 'Le monstre expire sous ses coups.')",1.0,Deletion
300,"('#hermione #cadmus', 'Après des rigueurs inhumaines, Le ciel favorise nos voeux ; Ah ! Que le souvenir des peines Est doux quand on devient heureux.')","('#nereide #triton', ""Junon a vainement cherché notre assistance ; Nous nous vantions en vain d'achever sa vengeance. Et Persée a pour lui des dieux plus forts que nous,"")",1.16,Substitution
301,"('#cadmus', ""Dieux ! Je ne vois plus Hermione ! Quel nuage épais l'environne ! Un nuage s'élève de la Terre qui enveloppe Hermione."")","('#nereides #tritons', ""Descendons sous les ondes : Notre honte se doit cacher ; Allons chercher Des retraites profondes, Descendons sous les ondes. La mer s'apaise ; les flots s'abaissent et se retirent. Les Néréides et les Tritons disparaissent."")",1.28,Substitution
302,"('#junon', ""Tu vois l'effet de mon courroux, Il faut combattre encore Junon et sa puissance. Le soin que prend pour toi mon infidèle époux Attire sur tes feux l'éclat de ma vengeance. Iris, détruis l'espoir de cet audacieux ! Enlève sur ton arc Hermione à ses yeux. Exécute à l'instant ce que Junon t'ordonne."")","('#ethiopiens', 'Le monstre est mort ; Persée en est vainqueur ;  Persée est invincible.')",0.89,Substitution
303,,"('#cephee #cassiope', ""Quand l'amour anime un grand coeur, Il ne trouve rien d'impossible."")",1.0,Deletion
304,"('#hermione', 'Ô Ciel !')","('#cephee #andromede', 'Ah ! Que votre danger me paraissait terrible !')",1.48,Substitution
305,"('#tous-ensemble', 'Ô Ciel, ô ciel ! Hermione, Hermione.')","('#ethiopens', 'Le monstre est mort, etc. Les Éthiopiens descendent des rochers, et témoignent leur joie en chantant et en dansant. Des matelots et des matelottes se mêlent dans la réjouissance publique. Un des éthiopiens chante au milieu des matelots qui dansent.')",1.97,Substitution
306,"('#cadmus', ""Belle Hermione, hélas, puis-je être heureux sans vous ? Que sert dans ce palais la pompe qu'on prépare ? Tout espoir est perdu pour nous ? Le bonheur d'un amour si fidèle, et si rare, Jusques entre les Dieux a trouvé des jaloux. Belle Hermione, hélas, puis-je être heureux sans vous ? Nous nous étions flattés que notre sort barbare Avait épuisé son courroux : Quelle rigueur quand on sépare Deux coeurs prêts d'être unis par des Liens si doux ? Belle Hermione, hélas, puis-je être heureux sans vous."")","('#un-des-ethiopiens', ""Notre espoir allait faire naufrage ; Nous goûtons enfin un heureux sort. Quel bonheur d'échapper à l'orage ! Quel plaisir d'en retracer l'image, Quand on est au port !"")",0.35,Substitution
307,"('#pallas', ""Tes voeux vont être satisfaits ; Jupiter et Junon ont fini leur querelle, L'Amour lui-même a fait leur paix ; Ton Hermione enfin descend dans ce palais, Des Dieux s'avancent avec elle ; Le Ciel veut que ce jour soit célébré à jamais."")","('#cephee', ""Honorons à jamais le glorieux héros Qui nous donne un heureux repos. Sa valeur, à son gré, fait voler la victoire : Tour-à-tour la terre et les flots Sont le théâtre de sa gloire. Honorons à jamais, etc. Andromède, Cassiope et les Éthiopiens, répètent les vers que Céphée a chantés et les Matelots et les Matelottes dansent en réjouissance de la délivrance d'Andromède."")",0.13,Substitution
308,"('#jupiter', ""Que ce qui suit les lois du Maître du tonnerre, Que les Cieux, et la Terre, S'accordent pour combler vos voeux. Après un sort si rigoureux, Après tant de peines cruelles, Amants fidèles, Vivez heureux."")","('#un-des-ethiopiens', ""Que n'aimez-vous ? Coeurs insensibles ! Que n'aimez-vous ? Rien n'est si doux ! Non, ne vous vantez pas d'être invincibles ; Les dieux, les plus grands dieux, ont aimé tous."")",0.6,Substitution
309,"('#tous-les-choeurs', 'Après un sort si rigoureux, Après tant de peines cruelles, Amants fidèles, Vivez heureux.')","('#le-choeur', ""Que n'aimez-vous, etc."")",0.95,Substitution
310,,"('#un-des-ethiopiens', ""L'amour n'a plus de traits terribles Pour un coeur qui cède à ses coups."")",1.0,Deletion
311,,"('#le-choeur', ""Que n'aimez-vous, etc."")",1.0,Deletion
312,"('#l-hymen', ""L'Hymen veut vous offrir ses chaines les plus belles."")","('#un-des-ethiopiens', ""Pour un amant Tendre et fidèle ; Pour un amant Tout est charmant. L'espoir nourrit ses feux ; sa chaîne est belle ; Il se fait un plaisir de son tourment."")",1.12,Substitution
313,"('#junon', 'Junon en veut former les noeuds.')","('#le-choeur', 'Pour un amant, etc.')",1.8,Substitution
314,"('#les-choeurs', 'Amants fidèles,  Vivez heureux.')","('#une-des-ethiopiennes', ""Heureux un coeur qu'amour appelle ! Malheureux, s'il tarde un moment !"")",1.2,Substitution
315,"('#venus', 'Vénus vous donnera des douceurs éternelles.')","('#le-choeur', 'Pour un amant, etc.')",0.77,Substitution
316,,"('#merope', ""Ô mort ! Venez finir mon destin déplorable. Ma rivale jouit d'un sort trop favorable, Et je souffrirais trop, si je ne mourais pas. Son bonheur m'a rendu le jour insupportable ; La nuit affreuse du trépas Me paraît moins épouvantable. Ô mort ! Venez finir mon destin déplorable. Hélas ! Funeste mort, hélas ! Pour les coeurs fortunés vous êtes effroyable ; Mais vos horreurs ont des appas Pour un coeur que l'amour a rendu misérable. Ô mort ! Venez finir mon destin déplorable."")",1.0,Deletion
317,,"('#phinee', ""Ce n'est point à des pleurs qu'il faut avoir recours. Junon veut qu'aujourd'hui je me venge avec elle. Iris, de son vouloir l'interprète fidèle, Vient, par son ordre exprès, de m'offrir son secours."")",1.0,Deletion
318,,"('#merope', ""Du secours de Junon que faut-il qu'on espère ? Persée a triomphé deux fois de son courroux."")",1.0,Deletion
319,"('#mars', ""J'écarterai de vous les fatales querelles, Et les ennemis dangereux."")","('#phinee', ""Que ne pourra point sa colère Unie à mon transport jaloux ? Heureux qui peut goûter une douce vengeance ! C'est l'unique espérance Des malheureux amants. Pour servir ma fureur on s'arme en diligence. Mon rival n'aura pas mon bien pour récompense ; S'il triomphe de moi, c'est pour peu de moments. C'est en vain qu'Andromède a trahi ma constance ; L'Amour est avec eux en vain d'intelligence ; Je briserai ses noeuds charmants. L'Hymen me livrera l'ingrate qui m'offense ; Elle a vu ma douleur avec indifférence : Je veux être sensible à ses gémissements ; Et, si je ne puis voir son coeur en ma puissance, Je jouirai de ses tourments. Heureux qui peut goûter une douce vengeance, etc. ! Il faut nous éloigner du peuple qui s'avance ; Ce superbe appareil, ces riches ornements, Tout ici de ma rage accroît la violence : Allons hâter l'éclat de nos ressentiments."")",0.72,Substitution
320,"('#les-choeurs', 'Amants fidèles,  Vivez heureux.')","('#merope #phinee', 'Heureux qui peut goûter une douce vengeance,etc. ! Ils sortent.')",1.16,Substitution
321,"('#pallas', 'Attendez de Pallas mille faveurs nouvelles.')",,1.0,Insertion
322,"('#l-amour', ""L'amour conservera toujours de si beaux feux."")","('#le-grand-pretre', ""Hymen ! Ô doux Hymen ! sois propice à nos voeux ; Viens unir ces amants fidèles, Viens les rendre à jamais heureux. Prends soin de conserver leurs ardeurs mutuelles, Allume en leur faveur les plus beaux de tes feux : Que leurs coeurs soient comblés de douceurs éternelles ; Qu'ils soient toujours contents et toujours amoureux. Charmant hymen, que tes chaînes sont belles, Lorsque l'amour en a formé les noeuds ! Hymen ! Ô doux Hymen ! Sois propice à nos voeux, etc. Le choeur répète les trois derniers vers. Les cérémonies du mariage de Persée et d'Andromède que le grand-prêtre de l'Hyménée et sa suite veulent commencer, sont interrompues par Mérope."")",0.46,Substitution
323,,"('#merope', ""Persée, il n'est plus temps de garder le silence : J'avais cru vouloir votre mort ; Mais mon coeur avec vous est trop d'intelligence, Et, prêtre à me venger, je ressens un transport Cent fois plus pressant et plus fort Que le transport de la vengeance. Votre rival approche, il en veut à vos jours : Mille ennemis vous environnent. Évitez leur fureur, servez-vous du secours Que les dieux propices vous donnent. Volez ne trouverez plus d'autres chemins ouverts."")",1.0,Deletion
324,,"('#cephee', ""Armons-nous ; punissons plus l'audace des rebelles."")",1.0,Deletion
325,,"('#merope', ""Sauvez-vous ; profitez de mes avis fidèles : C'est à fuir seulement que vous devez songer."")",1.0,Deletion
326,,"('#cephee', ""Si les dieux m'ont prêté des ailes, Ce n'est pas pour fuir le danger."")",1.0,Deletion
327,,"('#phinee #sa-suite', ""Persée, il faut périr ; meurs, et laisse Andromède Au pouvoir d'un heureux rival !"")",1.0,Deletion
328,,"('#cephee #cephee #leurs-suites', ""Perfides ! Recevez le châtiment fatal De la fureur qui vous possède ! Tous les combattants Cédez, cédez à notre effort ; Vous n'éviterez pas la mort. Persée, Céphée et leur suite poursuivent Phinée et sa suite."")",1.0,Deletion
329,"('#les-choeurs', 'Après un sort si rigoureux, Après tant de peines cruelles, Amants fidèles,  Vivez heureux.')","('#cassiope #andromede', ""Quelles horreurs ! quelles alarmes ! Dieux ! soyez touchés de mes larmes ! Tous les combattants Cédez, cédez à notre effort, etc. Les combattants s'éloignent."")",0.53,Substitution
330,"('#jupiter', 'Hymen, prend soin ici des Danses et des Jeux.')","('#cephee', ""Le soin de vous défendre en ces lieux me rappelle. Craignez tout d'un peuple rebelle ; Quel sang n'ose-t-il point verser ? Un trait, que sur Persée on a voulu lancer, A frappé votre soeur d'une atteinte mortelle. Junon, implacable pour nous, Anime les mutins de son fatal courroux. Leur rage croît, leur nombre augmente : Persée en vain toujours combat avec chaleur. Que servent les efforts qu'il tente ? Le nombre tôt ou tard accable la valeur."")",1.81,Substitution
331,,"('#phinee #sa-suite', ""Qu'il n'échappe pas, qu'il périsse, Cet étranger audacieux Qui prétend régner en ces lieux !"")",1.0,Deletion
332,"('#les-choeurs', 'Amants fidèles,  Vivez heureux.')","('#cephee #cassiope #andromede', 'Ciel ! Ô ciel soyez-nous propice !')",1.2,Substitution
333,,"('#phinee #sa-suite', ""Qu'il n'échappe, qu'il périsse !"")",1.0,Deletion
334,"('#l-hymen', ""Venez, Dieu des festins, aimables Jeux, venez ; Comblez de vos douceurs ces époux fortunés Tandis que tout le ciel prépare Les dons qu'il leur a destinés, La terre y doit mêler ce qu'elle a de plus rare. Venez, Dieu des festins, aimables jeux, venez ; Comblez de vos douceurs ces époux fortunés. Comus, Dieu des festins, s'avance accompagné de ses suivantes ordinaires, six hamadryades sortent de la terre, avec des corbeilles pleines de fruits. Comus commence à danser seul, ses suivants dansent ensuite, et après que les Hamadryades ont été présenter leurs fruits aux deux époux, elle viennent danser avec les suivants de Comus : cependant Arbas et la nourrice ne peuvent retenir les transports de leur joie et viennent mêler leurs chants avec les danse."")","('#cephee #cassiope #andromede', 'Défendez-nous, ô justes dieux !')",0.75,Substitution
335,,"('#persee', 'Ne craignez rien ; fermez les yeux,  Je vais punir leur injustice. Voyez leur funeste supplice. Persée pétrifie Phinée et sa suite, en leur montrant la tête de Méduse.')",1.0,Deletion
336,,"('#cephee #cassiope #andromede', 'Quel prodige ! Quel changement !')",1.0,Deletion
337,"('#arbas #la-nourrice', ""Serons-nous dans le silence Quand on rit, et quand on danse : Les chagrins ont eu leur temps, Pour jamais le Ciel les chasse, Les plaisirs ont pris leur place ; Lorsque deux coeurs sont constants Tôt ou tard ils sont contents. Qu'il est doux quand on soupire, De sortir d'un long martyre : Les chagrins ont eu leur temps,  Pour jamais le Ciel les chasse, Les plaisirs ont pris leur place ;  Lorsque deux coeurs sont constants  Tôt ou tard ils sont contents. Des Amours font descendre du Ciel sous un espèce de petit pavillon, les présents des Dieux, attachés à des chaînes galantes. Les hamadriades et les suivants de Comus les portent aux deux époux, et forment une danse, où Charite mêle une chanson."")","('#cephee', ""La tête de Méduse a fait leur châtiment... Cessons de redouter la fortune cruelle ; Le ciel nous promet d'heureux jours ; Vénus vient à notre secours ; Elle amène l'Amour et l'Hymen avec elle. Le palais de Vénus descend."")",0.59,Substitution
338,"('#charite', ""Amants, aimez vos chaînes, Vos soins et vos soupirs ; L'Amour suivant vos peines, Mesure vos plaisirs. Il cause des alarmes, Il vend bien cher ses charmes ; Mais pour un si grand bien Tous les maux ne sont rien. Sans une aimable flamme La vie est sans appas ; Qui peut toucher une âme Qu'Amour ne touche pas ? Il cause des alarmes, Il vend bien cher ses charmes ; Mais pour un si grand bien Tous les maux ne sont rien. Tous les Dieux du Ciel et de la Terre recommencent à chanter : les hamadriades et les suivants de Bacchus continuent à danser ; et ce mélange de chants et de danses forme une réjouissance générale, qui achève la fête des noces de Cadmus et Hermione."")","('#venus', 'Mortels, vivez en paix ; vos malheurs sont finis. Jupiter vous protège en faveur de son fils ; À ce dieu si puissant tous les dieux veulent plaire, Et Junon même enfin apaise sa colère. Cassiope, Céphée, et vous, heureux époux, Prenez place au ciel avec nous. Les souverains destins ordonnent Que des feux éclatants toujours vous environnent. Céphée, Cassiope, Persée, et Andromède, sont élevés dans le ciel, et des étoiles brillantes les environnent.')",0.29,Substitution
339,"('#tous-les-choeurs', 'Après un sort si rigoureux, Après tant de peines cruelles, Amants fidèles, Vivez heureux.')","('#venus #l-amour #l-hymenee #choeurs', ""Héros victorieux, Andromède est à vous ; Votre Valeur et l'Hymen vous la donnent : La gloire et l'Amour vous couronnent ; Fut-il jamais un triomphe plus doux ? Héros victorieux, Andromède est à vous. Les courtisans de Céphée, les Éthiopiens et les Éthiopiennes témoignent leur joie par leurs danses."")",0.84,Substitution
