,la-fontaine-daphne,quinault-isis,Cost,Operation Type
174,"('#le-sacrificateur', ""Hymen, Amour, joignez vos noeuds, Et rendez ces amants heureux. Des pas de Florise Loin, bien loin les loups ; Et de ceux d'Amphrise Les soupçons jaloux ! Que leur destinée N'ait rien que de doux, Et que la lignée Ressemble à l'époux. Hymen, Hyménée. Jamais la constance Aux amants ne nuit ; On vit d'espérance, Puis le reste suit. L'amour obstinée Porte fleur et fruit. Ô douce journée ! Ô plus douce nuit ! Hymen, Hyménée. Les gens de la noce dansent, et pendant qu'ils se reposent on chante ces deux autres couplets de l'épithalame :  Le choeur répète à chaque fois ces deux dernières paroles. "")","('#syrinx', ""L'empire de l'Amour n'est pas moins agité Que l'empire de l'onde Ne cherchons point d'autre félicité Qu'un doux loisir dans une paix profonde S'il est quelque bien au monde  C'est la liberté. Liberté, liberté ! Dans le temps qu'une partie des Nymphes chante, le reste de la troupe danse."")",0.46,Substitution
175,"('#clymene', ""Tout me semble parler d'amour En ces lieux amis du silence : Ici les oiseaux nuit et jour Célèbrent de ses traits la douce violence. Tout me semble parler d'amour En ces lieux amis du silence. Heureux les habitants de ces ombrages verts, S'ils n'avaient que ce mal à craindre ! Mais nous troublons leur paix par cent moyens divers : Humains, cruels humains, tyrans de l'Univers, C'est de vous seuls qu'on se doit plaindre. Vois-je pas Télamon, confident de Tharsis ? Hélas ! il vient en vain me conter les soucis D'un prince que Daphné devrait trouver aimable. Plût au Ciel qu'elle fut à ses voeux favorable ! Après ces paroles, on entend un bruit de cors et de cris de chasse. "")","('#deux-bergers', ""Quel bien devez-vous attendre Beautés qui chassez dans ces lieux Que pouvez-vous prendre Qui vaille un coeur tendre Soumis à vos lois ? Ce n'est qu'en aimant Qu'on trouve un sort charmant Aimez enfin à votre tour Il faut que tout cède à l'amour. Il sait frapper d'un coup certain Le cerf léger qui fuit en vain  Jusque dans les antres secrets Au fond des forêts  Tout doit sentir ses traits. Lorsque l'amour vous appelle, Pourquoi fuyez-vous ses plaisirs ? La Rose nouvelle N'en est que plus belle D'aimer les Zéphirs. Ce n'est qu'en aimant Qu'on trouve un sort charmant, Aimez enfin, à votre tour; Il faut que tout cède à l'amour : Il sait frapper d'un coup certain Le cerf léger qui fuit en vain : Jusques dans les antres secrets Au fonds des forêts, Tout doit sentir ses traits,"")",0.12,Substitution
176,"('#telamon', 'Que vous avez de grâce à porter un carquois ! Rien ne vous sied si bien.')","('#pan', 'Je vous aime Nymphe charmante; Un amant, un mortel cherche à plaire à vos yeux ')",1.73,Substitution
177,"('#clymene', ""On me l'a dit cent fois."")","('#syrinx', ""Pan est un Dieu puissant, je révère les Dieux; Mais le nom d'amour m'épouvante."")",1.63,Substitution
178,"('#telamon', ""On ne vous l'a pas dit peut-être au fond d'un bois. En ces forets, je vous prie, Écartons-nous un moment, Et mettons de la partie L'ombre et l'amour seulement."")","('#pan', ""Pour vous faire retrouver le nom d'amant plus doux. J'y joindrai le titre d'époux. Je n'aurai pas de peine  A m'engager dans une aimable chaîne Pour ne jamais changer. Aimez un Dieu qui vous adore."")",1.34,Substitution
179,"('#clymene', ""Tout rendez-vous un peu sombre Doit toujours être évité : Quand je vois l'amour et l'ombre, Je vais d'un autre côté."")","('#syrinx', ""Un époux doit être encore Plus à craindre qu'un amant"")",0.72,Substitution
180,"('#telamon', ""C'est trop s'en défier. Mais, dites-moi, Clymène, Daphné montre en ses yeux une secrète peine ; Qui la cause ? Leucippe est-il ce bienheureux ? Ou plutôt est-ce un dieu qui s'attire ces voeux ? Je m'y connais, l'Amour la touche."")","('#pan', ""Dissipez de vaines alarmes, Éprouvez l'amour et ses charmes Connaissez les plus doux appas. Non, ce ne peut être  que faute de la connaître Qu'il ne vous plaît pas."")",0.26,Substitution
181,"('#clymene', ""On se laisse assez toucher, Mais on aime à le cacher ; Et d'une jeune farouche L'Amour est plus tôt vainqueur Qu'il n'a tiré de sa bouche Le nom qu'elle a dans le coeur."")","('#syrinx', ""Les maux d'autrui me rendront sage. Ah ! Quel malheur  De laisser engager son coeur ! Pourquoi faut-il le plus beau de son âge Dans une mortelle langueur ? Ah, quel malheur !  Pourquoi n'avoir pas le courage De s'affranchir de la rigueur D'un funeste esclavage ? Ah ! Quel malheur De laisser engager son coeur !"")",0.6,Substitution
182,"('#telamon', ""N'en saurai-je pas plus ?"")",,1.0,Insertion
183,"('#clymene', ""Je n'ai rien appris d'elle."")",,1.0,Insertion
184,"('#telamon', ""Vous voulez garder ce secret : Je serais importun aussi bien qu'indiscret Si je vous pressais trop, et la chasse m'appelle. Adieu, Nymphe cruelle."")","('#pan', ""Ah ! Quel dommage Que vous ne sachiez pas aimer ! Que vous sert-il d'avoir tant d'attraits en partage, Si vous en négligez le plus grand avantage ? Que vous sert-il de savoir tout charmer ? Ah, quel dommage Que vous ne sachiez pas aimer !"")",0.98,Substitution
185,,"('#choeurs', 'Aimons sans cesse.')",1.0,Deletion
186,,"('#choeur-des-nymphes', ""N'aimons jamais."")",1.0,Deletion
187,"('#daphne', 'Je vous ai tous deux entendus : Heureuse, si Tharsis ne me pressait pas plus !')","('#choeur-de-silvains #satyres #bergers', ""Pour vivre en paix. N'aimons jamais."")",1.46,Substitution
188,,"('#syrinx', ""Le chagrin suit toujours les coeurs que l'amour blesse."")",1.0,Deletion
189,"('#leucippe', ""Puis-je interrompre le silence Qu'en ces paisibles lieux peut-être vous cherchez ? Me le permettez-vous ?"")","('#pan', ""La tranquille sagesse N'a que des plaisirs imparfaits."")",1.17,Substitution
190,,"('#choeur-de-silvains #satyres #bergers', 'Aimons sans cesse.')",1.0,Deletion
191,"('#daphne', 'Oui, Leucippe, approchez ; On ne craint pas votre présence ; Venez me consoler de celle de Tharsis.')",,1.0,Insertion
192,"('#leucippe', ""Et qu'ordonnerez-vous de mes propres soucis ? Mon rival ne peut plaire à l'objet qu'il adore, Un sentiment jaloux ne me peut alarmer : C'est beaucoup ; mais que dis-je ? ah ! ce n'est rien encore Vous savez bien haïr, mais pourriez-vous aimer ?"")","('#choeur-des-nymphes', ""N'aimons jamais."")",1.07,Substitution
193,"('#daphne', ""J'ai souffert votre amour ; répondez-vous vous-même."")","('#syrinx', 'On ne peut aimer sans faiblesse.')",1.12,Substitution
194,"('#leucippe', ""Ô dieux ! qu'ai-je entendu ? quelle gloire suprême ! Quel bonheur ! Doux transports qui venez me saisir, Exprimez, s'il se peut, ma joie et mon plaisir, Et votre juste violence. Princesse, après l'aveu qui vient de me charmer, Je ne sais rien, pour m'exprimer, Que le langage du silence."")","('#pan', ""Que cette faiblesse a d'attraits !"")",1.17,Substitution
195,,"('#choeur-de-silvains #satyres #bergers', 'Aimons sans cesse.')",1.0,Deletion
196,,"('#choeur-des-nymphes', ""N'aimons jamais."")",1.0,Deletion
197,"('#daphne #leucippe', ""Ô bienheureux soupirs, favorables moments Où l'un et l'autre coeur, plein de doux sentiments, Aime, et le dit, et se fait croire ! Les dieux, dans leurs ravissements, Les dieux, au milieu de leur gloire, Sont moins dieux quelquefois que ne sont les amants."")","('#choeur-de-silvains #satyres #bergers', ""Cédons à l'Amour qui nous presse Pour vivre heureux aimons sans cesse"")",0.64,Substitution
198,,"('#choeur-des-nymphes', ""Pour vivre en paix N'aimons jamais"")",1.0,Deletion
199,"('#leucippe', 'Je bénis mon destin, et cependant Pénée Favorise mon rival.')","('#choeur-de-silvains #satyres #bergers', 'Aimons sans cesse.')",1.51,Substitution
200,"('#daphne', ""Quand il aurait pour lui le dieu même hyménée, Ce n'est pas son bonheur qui fera votre mal."")","('#choeur-des-nymphes', ""N'aimons jamais Pour vivre en paix"")",1.34,Substitution
201,,"('#syrinx', ""Faut-il qu'en vain discours un si beau jour se passe ? Mes compagnes courons dans le fond des forêts. Voyons qui d'entre nous se sert mieux de ses traits Courons à la chasse."")",1.0,Deletion
202,,"('#double-choeurs', 'À la chasse ! Courons à la chasse, à la chasse.')",1.0,Deletion
203,"('#leucippe', 'Et mon bien ?')","('#syrinx', 'Pourquoi me suivre de si près.')",1.17,Substitution
204,"('#daphne', ""Attendez la réponse d'Ismèle : Peut-être elle sera favorable à nos voeux. Allez : il reviendra quelque moment heureux ; Daphné craint qu'on ne trouve un amant avec elle."")","('#pan', 'Pourquoi fuir qui vous aime ?')",1.03,Substitution
205,"('#daphne', ""Que notre sexe a d'ennemis ! A combien de tyrans le destin l'a soumis ! Des amants importuns, un père inexorable, Un devoir impitoyable ; Tout combat nos désirs : trop heureuses encor Si nous n'avions que cette peine ! Mais il faut, par un double effort, Ainsi que notre amour, surmonter notre haine."")","('#syrinx', ""Un amant m'embarrasse."")",1.42,Substitution
206,,"('#syrinx #choeurs', 'Courons à la chasse, à la chasse.')",1.0,Deletion
207,"('#penee', 'Daphné, rendez grâces aux dieux : Cet ours fatal aux bergeries, Fatal aux autres ours, teint de sang nos prairies ; Tharsis a vaincu seul ce monstre furieux.')","('#pan', ""Je ne puis vous quitter, mon coeur s'attacher à vous Par des noeuds trop forts et trop deux."")",1.65,Substitution
208,"('#tharsis', ""L'Amour m'accompagnait ; lui seul en a la gloire : Ce n'est pas à mes mains qu'on doit cette victoire, Belle Daphné, c'est à vos yeux."")","('#syrinx', ""Mes compagnes, venez... C'est en vain que j'appelle."")",1.26,Substitution
209,"('#penee', ""Ma fille, venez voir aussi l'énorme bête. Réjouissez-vous, bergers ; Que les ours soient de la fête : Ils avaient part aux dangers."")","('#pan', 'Écoutez, ingrate, écoutez  Un Dieu charmé de vos beautés; Qui vous jure un amour fidèle.')",1.22,Substitution
210,"('#tharsis', 'Daphné ne peut souffrir ma flamme. Si je parlais au sort ?')","('#syrinx', ""Je déclare à l'Amour une guerre immortelle."")",1.27,Substitution
211,,"('#troupe-de-bergers', 'Cruelle, arrêtez !')",1.0,Deletion
212,"('#telamon', 'Changera-t-il son âme ?')","('#troupe-de-sylvains-et-de-satyres', 'Arrêtez cruelle.')",1.67,Substitution
213,,"('#syrinx', 'On me retient de tous côtés')",1.0,Deletion
214,"('#tharsis', 'Je vais le consulter. Attends ici Tharsis.')","('#troupe-de-sylvains-et-de-satyres', 'Cruelle, arrêtez !')",1.51,Substitution
215,"('#momus', ""Vous qui de votre sort, voulez être éclaircis, Consultez, comme moi, le démon de la treille ; Mon oracle est Bacchus, quand j'ai quelques soucis, Et ma sibylle est la bouteille. Cette chasse m'altère. Ah ! Si Bacchus... Je crois Que ce dieu m'entendait."")","('#syrinx', ""Dieux, protecteurs de l'innocence,  Naïades, Nymphes des eaux. J'implore ici votre assistance. Syrinx se jette dans les eaux."")",0.8,Substitution
216,"('#bacchus', ""Momus, monte avec moi Viens écouter d'ici tous les chants de victoire. Ces gens m'ont au spectacle invité, les voici. Quoi ! la peau de leur ours aussi ?"")","('#pan', ""Où vous exposez-vous ? Quels prodiges nouveaux La nymphe est changée en roseaux ! Hélas ! hélas ! Quel bruit ! Qu'entends-je ! Ah ! Quelle voix nouvelle ! La Nymphe tâche encor d'exprimer ses regrets. Que son murmure est doux ! Que sa plainte a d'attraits. Ne cessons point de nous plaindre avec elle. Ranimons les restes charmants D'un nymphe qui fut si belle, Elle répond encore à nos gémissements, Ne cessons point de nous plaindre avec elle. Le vent pénètre dans les roseaux, et leur fait former un bruit plaintif. Pan donne des roseaux aux bergers, aux satyres et aux sylvains qui en forment un concert de flûtes."")",1.1,Substitution
217,"('#un-chasseur', 'Tharsis, nous érigeons ce trophée à ta gloire')",,1.0,Insertion
218,"('#un-sylvain', 'Par ta valeur, le monstre a vu finir son sort.')","('#pan', ""Les yeux qui m'ont charmé ne verront plus le jour Était-ce ainsi, cruelle amour, Qu'il fallait te venger d'une beauté rebelle, N'aurait-il pas suffi de t'en rendre vainqueur  Et de voir dans les fers son insensible coeur, Brûler avec le mien d'une ardeur éternelle ? Que tout ressente mes tourments."")",1.29,Substitution
219,"('#un-berger', ""L'ennemi commun est mort."")",,1.0,Insertion
220,"('#momus', 'Noyez-en dans le vin la funeste mémoire.')",,1.0,Insertion
221,"('#un-chasseur', ""N'est-ce pas Télamon qui nous invite à boire ?"")","('#pan #deux-bergers', ""Ranimons les restes charmants D'un nymphe qui fut si belle, Elle répond encore à nos gémissements, Ne cessons point de nous plaindre avec elle. Argus commence à s'assoupir, Mercure déguisé en berger s'approche de lui, et achève de l'endormir en la touchant de son caducée."")",1.19,Substitution
222,"('#tous-ensemble', ""Ô le mortel heureux, d'être aimé de Bacchus !"")","('#pan', 'Que ces roseaux plaintifs soient à jamais aimés.')",0.99,Substitution
223,"('#un-sylvain', ""Amis, laissons à part les discours superflus. L'ours est mort."")","('#mercure', ""Il suffit Argus dort, tous ses yeux sont fermés, Allons, que rien ne nous retarde Délivrons la nymphe qu'il garde."")",1.18,Substitution
224,"('#un-chasseur', ""L'ours ne vit plus."")",,1.0,Insertion
225,"('#un-berger', ""L'ours a passe l'onde noire."")",,1.0,Insertion
226,"('#tous', ""Noyons-en dans le vin la funeste mémoire. Les chasseurs et les Sylvains dansent à l'entour du trophée et font une forme de bacchanales. Les Sylvains sont suivis de leurs ours, qui vont en cadence. Pendant que les danseurs se reposent, Bacchus et Momus, faisant la débauche sous le berceau suspendu, animent toute cette troupe par leur exemple."")","('#mercure', ""Reconnaissez Mercure et fuyez avec nous; Éloignez-vous d'Argus, avant qu'il se réveille."")",1.12,Substitution
227,"('#bacchus', ""Cher compagnon, me veux-tu croire ? Courons ensemble le pays ; Tu sais médire, et je sais boire : Nous ne manquerons point d'amis."")","('#hierax', 'Argus avec cent yeux sommeille; Mais croyez vous endormir un amant jaloux ? Demeurez !')",1.1,Substitution
228,"('#momus', 'Toujours le vin et la satire Tiennent aux tables le haut bout ; Tu sais boire, et je sais médire : Voilà de quoi passer partout.')",,1.0,Insertion
229,"('#clymene', ""Quel étrange et sombre palais ! Je frémis à le voir ; n'as-tu point peur, Aminte ? Va seule dans ces lieux ; pour moi, j'ai trop de crainte."")","('#mercure', ""Malheureux ! d'où te vient cette audace ?"")",0.65,Substitution
230,"('#aminte', ""Qu'y demanderais-tu ? Tes voeux sont satisfaits. Philandre a l'âme blessée Des traits dont tu sais charmer ; Moi, que Tircis a laissée, J'ai sujet d'être empressée Pour savoir qui doit m'aimer."")","('#hierax', ""J'ai tout perdu j'attends le trépas sans effroi. Un coup de foudre est une grâce  Pour un malheureux comme moi. Éveillez vous, Argus, éveillez-vous, vous vous laissez surprendre."")",0.93,Substitution
231,,"('#hierax #argus', 'Puissante reine des cieux  Junon venez nous défendre.')",1.0,Deletion
232,"('#clymene', ""Je te rends ce Tircis ; son ardeur m'importune."")","('#mercure', ""Commencez d'éprouver la colère des Dieux. Argus tombe mort, et Hiérax changé en oiseau de proie s'envole."")",1.48,Substitution
233,"('#aminte', ""J'aurai donc pour toute fortune Ton refus."")","('#choeurs', 'Fuyons.')",1.21,Substitution
234,"('#clymene', ""Que t'importe ? Examine ton coeur ; Et si Tircis te plaît, laisse le point d'honneur."")",,1.0,Insertion
235,"('#aminte', ""Tu ris ; que diras-tu, si je fais qu'il te quitte ?"")","('#io', 'Vous me quittez ? Quel secours puis-je attendre !')",0.99,Substitution
236,"('#clymene', 'Mes rigueurs en cela préviendront ton mérite.')","('#choeurs', 'Fuyons, Junon vient dans ces lieux.')",1.34,Substitution
237,"('#aminte', 'Tu dois aux miennes ce berger Que mes faveurs vont rengager.')",,1.0,Insertion
238,"('#clymene #aminte', 'Une fille a cent adresses Pour rebuter un amant ; Mais de dire ses finesses Pour faire un engagement, On ne le peut nullement.')","('#junon', ""Revois le jour, Argus que ta figure change. Et vous Nymphe apprenez comment Junon se venge. Sors, barbare Erinnis, sors du fond des Enfers ; Viens, prends de servir ma vengeance fatale Et d'en montrer l'horreur en cent climats divers Épouvante tout l'univers Par les tourments de ma rivale Viens la punir au gré de mon courroux; Redoutable ta rage infernale Et fais s'il se peut qu'elle égale La fureur de mon coeur jaloux. La Furie sort des Enfers, elle poursuit Io et l'enlève ; Junon remonte dans le Ciel."")",0.93,Substitution
239,"('#clymene', 'Voilà, sans consulter Ismèle Un oracle bientôt rendu.')",,1.0,Insertion
240,"('#aminte', 'Aurait-elle mieux répondu ?')","('#io', 'Ô Dieux ! Ô Dieux ! Où me réduisez vous ?')",1.82,Substitution
241,"('#clymene', ""Non, et nous nous pouvons désormais passer d'elle : Aussi bien l'intérêt de Daphné nous appelle."")","('#choeur-des-peuples', ""L'hiver qui nous tourmente S'obstine à nous geler Nous ne saurions parler Qu'avec une voix tremblante La neige et les glaçons Nous donnent de mortels frissons Les frimas se répandent  Sur nos corps languissants; Le froid transit nos sens Les plus durs rochers se fendent. La neige et les glaçons Nous donnent de mortels frissons"")",1.59,Substitution
242,"('#penee', ""Ma fille, tout est prêt ; Ismèle va sortir : N'ayez point de repentir, Si le choix des dieux est autre Que le vôtre."")","('#io', ""Laisse-moi, cruelle Furie,  Cruelle, laisse moi respirer un moment Ah ! Barbare, plus je te prie, Et plus tu prends plaisir d'augmenter mon tourment."")",1.27,Substitution
243,"('#ismele', ""Monarque de l'Olympe, en qui sont tous les temps, Qui les fais devant toi passer comme moments, Et pour qui n'est qu'un point toute la destinée, Dis-nous, Ô maître des dieux, À qui doit être donnée La princesse de ces lieux. Où sont tes truchements ? Es-tu sourd aux prières ? Fantômes, qui savez peindre en mille manières Les secrets du destin gravés au haut des cieux, Simulacres volants, frères du dieu des songes, Faites-nous voir sans mensonges Ce qu'ont ordonné les dieux Sur un si digne hyménée ; Dites-nous la destinée De la Nymphe de ces lieux. Que vois-je ! Quel objet ! Quelle image à mes yeux Si vive et si claire Vient se présenter, Et me tourmenter Plus qu'à l'ordinaire ? L'objet Me fait Tressaillir : Je sens Mes sens Défaillir. Après ces paroles, Ismèle, comme possédée du Dieu, danse avec les autres prêtresses, tantôt comme si elles allaient tomber en extase, et tantôt avec des contorsions étranges. Pendant qu'elles dansent, des enfants, en guise de petits démons, et représentant les simulacres et les espèces qui s'offrent aux yeux, viennent de divers endroits du ciel se présenter à Ismèle, portant des branches et des couronnes de laurier. Ismèle, ayant vu ces objets, dit."")","('#la-furie', 'Soupire, gémis, pleure, Crie je me fais de tes peines un spectacle charmant.')",0.53,Substitution
244,"('#amphrise', ""Les dieux à leur interprète Ont fait un étrange don ; Ne peut-on être prophète, Si l'on ne perd la raison ?"")",,1.0,Insertion
245,"('#apidame #sperchee #amphrise', ""Les démons Vont l'agitant, Ses poumons Vont haletant ; Et son coeur va palpitant. Les ressorts De son corps, Son esprit, Tout pâtit."")","('#io', ""Laisse moi, cruelle Furie Cruelle laisse moi respirer un moment Quel horrible séjour ! Quel froid insupportable ! Tes serpents animés par ta rage implacable. Ne sont-ils pas d'assez cruels bourreaux ?  Pour punir un coeur misérable, Viens-tu chercher si loin des supplices nouveaux ?"")",0.79,Substitution
246,"('#ismele', ""Qu'on se taise : soyez attentifs aux mystères. J'épands en l'air ces caractères : C'est ma réponse ; il faut la poser sur l'autel. Démons, peuples légers, ministres de l'oracle, Cherchez-la ; car aucun mortel Ne la peut trouver sans miracle. Approchez-vous, lisez, et que dans ce vallon Un invisible choeur mon oracle répète. À ce commandement d'Ismèle, les esprits habitants de l'air cherchent en dansant les feuilles que la Sibylle a jetées, et les viennent, en dansant aussi, poser sur l'autel. Ismèle assemble ces feuilles, et dit à Pénée et à Daphné."")","('#la-furie', ""Malheureux habitants d'une demeure affreuse,  Connaissez de Junon le funeste courroux: Par sa vengeance rigoureuse Vous voyez une malheureuse Qui souffre cent fois plus que vous."")",0.73,Substitution
247,"('#penee #daphne', ""Daphné doit aujourd'hui couronner Apollon."")",,1.0,Insertion
248,"('#choeur', ""Daphné doit aujourd'hui couronner Apollon."")",,1.0,Insertion
249,"('#penee', ""Ismèle, servez-vous vous-même d'interprète ; Expliquez-nous l'ordre des dieux."")","('#io #la-furie', 'Vous voyez une malheureuse Qui souffre cent fois plus que vous.')",1.71,Substitution
250,"('#amphrise', ""Un prophète entend-il les choses qu'il annonce ? C'est à l'événement d'expliquer sa réponse."")","('#choeur-des-peuples', ""Ah ! Quelle peine  De trembler de languir dans l'horreur des frimas."")",1.87,Substitution
251,"('#ismele', 'Adieu, princesse, adieu, je vous laisse en ces lieux.')","('#io', ""Ah ! Quelle peine D'éprouver tant de maux, sans trouver le trépas Ah ! quelle vengeance inhumaine !"")",1.66,Substitution
252,,"('#la-furie', ""Viens changer de tourments, passe en d'autres climats."")",1.0,Deletion
253,"('#penee', ""Couronner Apollon ! Qu'importe à l'hyménée De la fille de Pénée ? Pour comprendre ces mots, je fais un vain effort."")","('#io', 'Ah ! Quelle peine !')",1.51,Substitution
254,"('#amphrise', ""Nos conseils ont été frivoles ; La seule obscurité fait le prix des paroles Que l'on cherche aux livres du Sort."")","('#choeur-des-peuples', ""Ah ! quelle peine  De trembler de languir dans l'horreur des frimas."")",1.55,Substitution
255,,"('#choeur-des-chabyles', 'Tôt tôt tôt.')",1.0,Deletion
256,,"('#premier-conducteur-des-chabyles', ""Que chacun avec soin s'empresse."")",1.0,Deletion
257,,"('#second-conducteur-chabyles', ""Forgez, qu'on travaille sans cesse."")",1.0,Deletion
258,"('#penee', ""Ma fille, rendez-vous aux volontés d'un père : Qu'il soit votre oracle aujourd'hui Aimez Tharsis ; il vous doit plaire ; Toute notre Cour est pour lui."")","('#les-deux-conducteurs', ""Qu'on prépare tout ce qu'il faut  Tôt tôt tôt. Le choeur des Chabyles répète ces deux derniers vers, dans le temps que plusieurs Chalybes travaillent dans les forges, quelques autres vont et viennent avec empressement pour apporter l'acier des mines et pour disposer ce qui est nécessaire au travail qui se fait."")",1.28,Substitution
259,"('#apidame', ""Tels étaient ces mortels pour qui l'idolâtrie Commença d'introduire au monde son pouvoir."")","('#les-deux-conducteurs #choeur-des-chalybes', ""Que le feu des forges s'allume : Travaillons d'un effort nouveau : Qu'on fasse retentir l'enclume Sous les coups pesants du marteau. Entrée des forgerons."")",0.74,Substitution
260,"('#amphrise', ""Il a tout l'air d'un dieu ; l'on dirait à le voir, Que l'Olympe est sa patrie."")","('#io', ""Quel déluge de feux vient sur moi se répandre. Ô ciel ! Les chalybes passent auprès d'Io avec des morceaux d'épées, de lances et de haches à demi forgées."")",1.52,Substitution
261,,"('#la-furie', ""Le ciel ne peut t'entendre, Tu ne te plains pas assez haut."")",1.0,Deletion
262,,"('#les-deux-conducteurs #le-choeur-des-chalybes', 'Tôt, tôt, tôt.')",1.0,Deletion
263,"('#daphne', ""Hélas ! J'en crus autant, lorsqu'en notre prairie Je le vis arriver inconnu dans ces lieux. Maintenant mon coeur tâche à démentir mes yeux. Ne m'en accusez point : quelque force suprême M'entretient malgré moi dans cette erreur extrême. Que Tharsis soit parfait, qu'il ait l'air qu'ont les dieux, Est-ce par raison que l'on aime ?"")","('#io', 'Junon serait moins inhumaine.  Tu me fais trop souffrir, tu sers trop bien sa haine.')",1.26,Substitution
264,"('#penee', ""L'hymen change les coeurs : suivez mes volontés."")","('#la-furie', 'Au gré de son dépit jaloux Les maux les plus cruels seront encore trop doux.')",1.5,Substitution
265,"('#daphne', ""Quoi ! Seigneur, vous aussi vous me persécutez ! De ses autres tyrans sans peine on se console ; Mais d'un père ! un père m'immole ! Je tiens le jour de vous, Seigneur ; vous me l'ôtez."")","('#io', ""Hélas ! Quelle rigueur extrême C'est en vain que Jupiter m'aime La haine de Junon jouit de mon tourment Que vous haïssez fortement, Grand Dieux ! Qu'il s'en faut bien que vous aimiez de même !"")",0.23,Substitution
266,,"('#conducteurs #choeurs-chalybes', ""Qu'on prépare tout ce qu'il faut  Tôt, tôt, tôt, tôt, tôt. Les feux des forges redoublent et les Chabyles environnent Io avec des morceaux d'acier rouges et brûlants."")",1.0,Deletion
267,"('#penee', ""Moi, je perdrais Daphné ! qu'ai-je à conserver qu'elle ? L'hymen m'a-t-il fait d'autres dons ?"")","('#io', 'Ne pourrai-je cesse de vivre ? Cherchons le trépas dans les flots.')",1.17,Substitution
268,"('#daphne', ""Cependant, quand je vous appelle Du plus tendre de tous les noms, Vous ne vous souvenez que de votre puissance ; Vous regardez l'obéissance, La raison, et jamais d'autres tyrans plus doux ; Il en est toutefois. Leucippe vient à nous : Je lui vais ôter l'espérance. Vous le voulez, Seigneur ; je le lis dans vos yeux."")","('#la-furie', ""Partout ma rage doit te suivre N'attends ni secours ni repos. Io fuit et monte au haut d'un rocher d'où elle se précipite dans la mer. La Furie s'y jette après la Nymphe."")",1.02,Substitution
269,,"('#choeur-chalybes', ""Qu'on prépare tout ce qu'il faut  Tôt tôt tôt."")",1.0,Deletion
270,,"('#choeur-de-la-suite-des-parques', ""Exécutons l'arrêt du sort Suivons ses lois les plus cruelles. Présentons sans cesse à la Mort Des victimes nouvelles"")",1.0,Deletion
