,quinault-isis,quinault-proserpine,Cost,Operation Type
67,"('#choeur-des-divinites', ""Échos retentissez dans ces lieux pleins d'appas, Annoncez qu'aujourd'hui pour le bonheur du monde, Jupiter descends ici-bas."")","('#proserpine #le-choeur', ""Célébrons la victoire Du plus puissant des dieux. Qu'un trophée éternel conserve la mémoire D'un triomphe si glorieux. Célébrons la victoire Du plus puissant des dieux ; Faisons retentir jusqu'aux cieux Le bruit éclatant de sa gloire : Célébrons la victoire Du plus puissant des dieux. Ce palais va tomber ; ô dieux ! La terre s'ouvre ! Quels tremblements affreux ! L'enfer découvre Ses gouffres ténébreux. Jupiter lancez le tonnerre, Renversez par de nouveaux coups Le chef audacieux des enfants de la terre : Il veut se relever pour s'armer contre vous, Achevez d'étouffer la guerre. Jupiter : lancez le tonnerre. On danse autour d'un trophée qu'on élève à l'honneur de Jupiter, et que l'on forme du débris des armes monstrueuses des gens vaincus. Sur la fin de cette fête on entend un tremblement de terre qui fait tomber une partie du palais de Cérès. Le tonnerre tombe sur le mont Etna, qui paraît dans l'éloignement ; et ce coup achève d'accabler le chef des géants, qui s'efforçait de se relever."")",0.23,Substitution
68,"('#mercure', ""C'est ainsi que Mercure Pour abuser les Dieux jaloux Doit parler hautement à toute la nature. Mais il doit s'expliquer Autrement avec vous; C'est pour vous voir, C'est pour vous plaire, Que Jupiter descend du céleste séjour. Et les biens qu'ici bas sa présence va faire Ne seront dûs qu'à son amour."")","('#crinise', ""Jupiter a dompté les Géants pour jamais. Ce beau séjour brille de nouveaux charmes, Tout y ressent le retour de la paix : Ah ! Que le repos a d'attraits Après de mortelles alarmes."")",0.79,Substitution
69,"('#isis', ""Pourquoi du haut des cieux,  Ce Dieu veut-il descendre ?  Mes voeux sont engagés. Mon coeur a fait un choix L'amour tôt ou tard doit prétendre Que tous les coeurs se rangent sous ses lois. C'est un hommage qu'il faut rendre Mais assez de le rendre une fois."")","('#alphee', ""La paix dans ces beaux lieux m'offre en vain mille appas. L'amour en rend pour moi la douceur inutile ; Cruel amour, hélas ! Que me sert-il de voir tout le monde tranquille Si mon coeur ne l'est pas ?"")",1.03,Substitution
70,"('#mercure', ""Ce serait en aimant une contrainte étrange Qu'un coeur pour mieux choisir n'osât se dégager. Quand c'est pour Jupiter qu'on change Il n'est pas honteux de changer. Que tout l'univers se pare De ce qu'il a de plus rare Que tout brille dans ces lieux. Que la terre partage  L'éclat et la gloire des cieux. Que tout rende hommage  Au plus grand des dieux."")","('#crinise', ""Vous changez, vous quittez une nymphe inhumaine. Votre coeur ne risque rien À choisir une autre chaîne, C'est toujours un bien De changer de peine."")",0.92,Substitution
71,"('#jupiter', ""Les armes que je tiens protègent l'innocence. L'effort n'en est fâcheux qu'à l'orgueil des titans. Vous qui suivez les lois, Vivez sous ma puissance, Toujours heureux, toujours contents. Jupiter vient sur la terre. Pour la combler de bienfaits, Il est armé du tonnerre Mais c'est pour donner la paix."")","('#alphee', ""Heureux qui peut être inconstant ! Rebuté des rigueurs d'une haine éternelle, J'ai voulu la quitter cette beauté cruelle, Et j'éprouve qu'en la quittant Mon coeur est encor moins content. J'ai feint de ressentir une flamme nouvelle, J'ai fait voir à ses yeux un dépit éclatant ; Mais hélas ! Dans le même instant Je brûlais en secret, je languissais pour elle, Et je ne l'aimai jamais tant. Qu'il coûte cher d'être fidèle ! Heureux qui peut être inconstant ! Crinise et Alphée répètent ensemble ces deux derniers vers."")",0.76,Substitution
72,"('#choeurs', ""Jupiter vient sur la terre. Pour la combler de bienfaits, Il est armé du tonnerre Mais c'est pour donner la paix."")","('#crinise', ""Quelqu'un vient, gardez le silence."")",1.21,Substitution
73,"('#io', ""Où suis-je ? D'où vient ce nuage ? Les ondes de mon père et son charmant rivage Ont disparu tout_à_coup à mes yeux ! Où puis-je trouver un passage ? La jalouse reine des Cieux Me fait elle si tôt acheter l'avantage De plaire au plus puissant des Dieux ? Que vois-je ? Quel éclat se répand dans ces lieux. Jupiter paraît et les nuages qui obscurcissent le théâtre, sont illuminés et peints des couleurs les plus brillantes et les plus agréables."")","('#alphee', ""C'est Ascalaphe qui s'avance Pour quelque soin pressant il quitte les enfers : Il n'a de mon amour que trop de connaissance, Où n'ai-je point porté la honte de mes fers ?"")",0.42,Substitution
74,,"('#alphee', ""Venez goûter ici le doux air qu'on respire."")",1.0,Deletion
75,"('#jupiter', ""Vous voyez Jupiter; Que rien ne vous étonne. C'est pour tromper Junon et ses regards jaloux Qu'un nuage vous environne; Belle nymphe, rassurez-vous Je vous aime et pour vous le dire, Je sors avec plaisir de mon suprême empire. La foudre est dans mes mains, Les Dieux me font la cour, Je tiens tout l'Univers sous mon obéissance; Mais si je prétends en ce jour Engager votre coeur à m'aimer à son tour, Je fonde moins mon espérance Sur la grandeur de ma puissance Que sur l'excès de mon amour."")","('#ascalaphe', ""Je dois suivre le dieu de l'infernal empire. La terre par ses tremblements Vient d'ébranler les fondements De nos demeures sombres : Pluton a voulu voir si la clarté des cieux Ne s'ouvre point de passage en ces lieux Pour aller aux enfers effaroucher les ombres. Il me permet de voir Arethuse un moment."")",0.16,Substitution
76,"('#io', ""Que sert-il qu'ici-bas votre amour me choisisse ? L'honneur me vient trop tard, j'ai formé d'autres noeuds Il fallait que ce bien pour combler tous nos voeux, Ne me coûtât point d'injustice, Et ne fit point de malheureux"")","('#alphee', ""D'où vous vient tant d'empressement ?"")",1.34,Substitution
77,"('#jupiter', ""C'est une assez grande gloire Pour votre premier vainqueur, D'être encore dans votre mémoire Et de me disputer si longtemps votre coeur."")","('#ascalaphe', ""Je l'ai vue aux enfers ; que je la trouvais belle !"")",1.32,Substitution
78,,"('#alphee', ""L'ingrate me fuyait, elle est toujours cruelle."")",1.0,Deletion
79,"('#io', ""La gloire doit forcer mon coeur à se défendre. Si vous sortez du Ciel pour chercher les douceurs D'une amour tendre, Vous pouvez aisément attaquer d'autres coeurs Qui feront gloire de se rendre."")","('#ascalaphe', 'Ses cruautés pour vous, ses soins pour fuir vos pas Ont encore à mes yeux augmenté ses appas.')",0.6,Substitution
80,"('#jupiter', ""Il n'est rien dans les Cieux il n'est rien ici-bas De si charment que vos appas; Rien ne peut me toucher d'une flamme si forte; Belle Nymphe vous l'emportez Sur les autres beautés, Autant que Jupiter l'emporte Sur les autres Divinités ! Verrez-vous tant d'amour avec indifférence ? Quel trouble vous saisit ? Où tournez vous vos pas ?"")","('#alphee', ""Les flammes amoureuses Descendent-elles jusqu'à vous ? L'amour veut un séjour plus doux Que vos demeures ténébreuses."")",0.37,Substitution
81,"('#io', ""Mon coeur en votre présence Fait trop peu de résistance  Contentez-vous, hélas ! D'étonner ma constance, Et n'en triomphez pas."")","('#ascalaphe', ""L'astre brillant qui vous luit Finit son cours dans les ondes, Il ne peut percer la nuit De nos demeures profondes ; Mais il n'est point de séjour Impénétrable à l'amour."")",0.75,Substitution
82,"('#jupiter', 'Et pourquoi craignez vous Jupiter qui vous aime ?')","('#alphee', ""Qu'espérez-vous d'une âme si sévère ? Mon amour ne peut l'émouvoir."")",1.01,Substitution
83,"('#io', 'Je crains tout, je me crains moi-même.')",,1.0,Insertion
84,"('#jupiter', 'Quoi ! voulez vous me fuir')",,1.0,Insertion
85,"('#io', ""C'est mon dernier espoir."")",,1.0,Insertion
86,"('#jupiter', 'Écoutez mon amour.')","('#ascalaphe', 'Si vous ne savez pas le secret de lui plaire Un autre pourra le savoir.')",1.26,Substitution
87,"('#io', 'Écoutez mon devoir.')",,1.0,Insertion
88,"('#jupiter', 'Vous avez un coeur libre et qui peut de défendre')","('#alphee', ""Saurez-vous de son coeur vaincre la résistance ? Est-ce aux enfers qu'on apprend ce secret ?"")",1.21,Substitution
89,"('#io', 'Non, vous ne laissez pas mon coeur en mon pouvoir')","('#ascalaphe', ""On apprend aux enfers à garder le silence, Et l'on y sait être discret ; La nymphe que je cherche avec soin vous évite, Pour la trouver, il faut que je vous quitte."")",1.29,Substitution
90,"('#jupiter', ""Quoi ! vous ne voulez pas m'entendre"")",,1.0,Insertion
91,"('#io', ""Je n'ai que trop de peine à ne le pas vouloir. Laissez-moi..."")","('#alphee', ""Amants qui n'êtes point jaloux, Que votre sort est doux ! L'amour m'a fait gémir sous une dure chaîne ; Mais quand je me plaignais de ses funestes coups Je ne connaissais pas le plus cruel de tous. Un autre aime Arethuse et ne craint point sa haine ; Et je vois sur moi seul tomber tout son courroux : C'était peu du malheur d'aimer une inhumaine, Le bonheur d'un rival a redoublé ma peine. Amants qui n'êtes point jaloux, Que votre sort est doux !"")",1.07,Substitution
92,"('#jupiter', 'Quoi si tôt.')",,1.0,Insertion
93,"('#io', 'Je devais moins attendre; Que ne fuyais-je hélas ! Avant que de vous voir.')","('#alphee', 'Ingrate, écoutez-moi, je ne veux plus me plaindre, Je ne vous dirai rien qui vous puisse alarmer.')",1.16,Substitution
94,"('#jupiter', ""L'amour pour moi me sollicite Et je vois que vous me quittez"")",,1.0,Insertion
95,"('#io', ""Le devoir veut que je vous quitte, Et je sens que vous m'arrêtez"")","('#arethuse', ""Vous cessez de m'aimer, Je cesse de vous craindre."")",0.49,Substitution
96,"('#mercure', 'Iris est ici-bas et Junon elle-même  Pourrait vous suivre dans ces lieux.')","('#alphee', 'Ascalaphe vous cherche ici, Bientôt vous le verrez paraître ; Arethuse, peut-être, Vous le cherchez aussi.')",1.25,Substitution
97,"('#jupiter', ""Pour la nymphe que j'aime Je crains ses transports furieux."")","('#arethuse', ""L'aimable Proserpine en votre âme a fait naître Une nouvelle ardeur ; Si vous ne m'aimez plus, que vous sert de connaître Le secret de mon coeur ?"")",1.11,Substitution
98,"('#mercure', 'Sa vengeance serait funeste, Si votre amour était surpris.')","('#alphee', ""Faut-il que votre coeur à l'amour moins rebelle Récompense un amant sans éprouver sa foi ? Si ce bien eût été le prix du plus fidèle, Ah ! Vous savez, cruelle, Qu'il n'était dû qu'à moi."")",0.99,Substitution
99,"('#jupiter', ""Va, prends soin d'arrêter Iris, Mon amour prendra soin du reste."")",,1.0,Insertion
100,"('#mercure', ""Arrêtez, belle Iris, différez un moment D'accomplir en ces lieux ce que Junon désire."")",,1.0,Insertion
101,"('#iris', ""Vous m'arrêtez vainement Et vous n'aurez rien à me dire."")",,1.0,Insertion
102,"('#mercure', ""Mais, si je vous disais que je veux vous choisir Pour attacher mon coeur d'une éternelle chaîne ?"")","('#arethuse', ""Votre nouvelle chaîne est si belle et si forte ! Pourquoi songer encore à des liens rompus. Que vous importe Qu'un autre emporte Un prix qui ne vous touche plus ?"")",0.36,Substitution
103,"('#iris', 'Je vous écouterais peut-être avec plaisir, Mais je vous croirais avec peine.')","('#alphee', ""Vous avez fui les soins de mon amour extrême, Vous m'avez ôté tout espoir : Si je disais que je vous aime, Vous m'ôteriez encor le plaisir de vous voir."")",0.45,Substitution
104,,"('#arethuse #alphee', ""C'est une autre que moi qui règne dans votre âme, C'est un autre que moi qui règne dans votre âme, Vous trouvez d'autres noeuds plus doux : En vain je veux cacher ma flamme, Mon amour paraît trop dans mes transports jaloux ; Non, je ne puis aimer que vous."")",1.0,Deletion
105,"('#mercure', ""Refusez vous d'unir votre coeur et le mien."")","('#arethuse', 'Est-il vrai que mon coeur soit en votre puissance ?')",0.14,Substitution
106,"('#iris', ""Jupiter et Junon nous occupent sans cesse Nos soins sont assez grands sans que l'amour nous blesse, Nous n'avons pas tous deux de loisir d'aimer bien."")","('#ascalaphe', ""Je vous aime sans espérance ; J'ai voulu soulager mon mal Par le chagrin de mon rival. Dans les enfers, c'est ainsi qu'on en use : Mes maux n'ont pu trouver d'autre adoucissement. Pardonnez-moi, belle Arethuse, Je ne suis pas le seul qui se vante en aimant De posséder un coeur qu'on lui refuse. Mais Alphée aujourd'hui n'est plus tant rebuté ? Vous ne fuyez plus sa présence ?"")",0.52,Substitution
107,"('#mercure', 'Si je fais ma première affaire De vous voir et de vous plaire.')","('#arethuse', 'Pour punir votre vanité Je veux que vous voyez triompher sa constance.')",1.42,Substitution
108,"('#iris', 'Je ferai mon premier devoir De vous plaire et de vous voir.')","('#ascalaphe', ""En lui donnant la préférence, Vous me rendez la liberté. Le dépit qui me possède Me guérira promptement, Vous en faites mon tourment, Et j'en ferai mon remède."")",1.25,Substitution
109,"('#mercure', ""Un coeur fidèle  A pour moi de charmants appas: Vous avez mille attraits, Vous n'êtes que trop belle: Mais je crains que vous n'ayez pas. Un coeur fidèle."")","('#arethuse #alphee', ""Pour être heureux, il faut qu'on aime bien."")",1.04,Substitution
110,"('#iris', ""Pourquoi craignez-vous tant Que mon coeur se dégage Je vous permets d'être inconstant, Sitôt que je serai volage."")","('#ascalaphe', ""Pour être heureux il faut qu'on n'aime rien. Mais Pluton va bientôt rentrer dans son empire : Il passe en ces lieux, il admire Les charmes d'un séjour si doux."")",0.75,Substitution
111,"('#mercure #iris', 'Promettez moi de constantes amours, Je vous promets de vous aimer toujours.')",,1.0,Insertion
112,"('#mercure', 'Que la feinte entre nous finisse')","('#pluton', ""Demeurez Arethuse, Alphée éloignez-vous. Alphée se retire, et Pluton continue à parler. Les efforts d'un géant qu'on croyait accablé Ont fait encor frémir le ciel, la terre, et l'onde Mon Empire s'en est troublé ; Jusqu'au centre du monde Mon trône en a tremblé. L'affreux Typhoée avec sa vaine rage Trébuche enfin dans des gouffres sans fonds. L'éclat du jour ne s'ouvre aucun passage Pour pénétrer les royaumes profonds Qui me sont échus en partage. Le ciel ne craindra plus que ses fiers ennemis Se relèvent jamais de leur chute mortelle, Et du monde ébranlé par leur fureur rebelle Les fondements sont raffermis : Je puis faire goûter une paix éternelle Aux peuples souterrains que le sort m'a soumis. Mais par vos soins puis-je voir Proserpine Avant que de quitter cet aimable séjour ?"")",1.44,Substitution
113,"('#iris', 'Parlons sans mystère en ce jour;')","('#arethuse', ""Cette fière beauté s'obstine À fuir les amants et l'amour. Dans l'innocent repos de cette solitude Elle évite les dieux De la terre et des cieux : Jugez de son inquiétude Si le Dieu des Enfers paraissait à ses yeux. Caché sous cet épais feuillage Vous pourriez la voir un moment."")",0.89,Substitution
114,"('#mercure #iris', ""Le moindre artifice Offense l'amour."")","('#pluton', ""Allez, il suffira que votre soin l'engage À venir dans ce lieu charmant, Et si je puis la voir il n'importe comment."")",1.31,Substitution
115,"('#iris', 'Quel soin presse ici-bas Jupiter de descendre.')","('#ascalaphe', ""J'ai peine à concevoir d'où vient le trouble extrême Où le coeur de Pluton semble s'abandonner."")",0.95,Substitution
116,"('#mercure', 'Le seul bien des mortels lui fait quitter les cieux; Mais quel soupçons nouveau Junon peut elle prendre ? Ne suivrait elle pas Jupiter en ces lieux.')",,1.0,Insertion
117,"('#iris', ""Dans les jardins d'Hébé Junon vient de descendre."")",,1.0,Insertion
118,"('#mercure', ""Un nuage entrouvert la découvre à mes yeux ; Iris parle ainsi sans mystère ! C'est ainsi que je puis me fier à ta foi."")","('#pluton', ""Tu peux t'en étonner, J'en suis surpris moi-même J'ai trouvé Proserpine en visitant ces lieux. Les pleurs coulaient de ses beaux yeux : Elle fuyait, interdite, et tremblante ; Pour implorer l'assistance des dieux Elle tournait ses regards vers les cieux : Sa douleur et son épouvante Rendaient encor sa beauté plus touchante. Les accents plaintifs de sa voix Ont ému mon coeur inflexible ; Qu'un coeur fier est troublé quand il devient sensible Pour la première fois !"")",0.42,Substitution
119,"('#iris', ""Ne me reprochez pas que je suis peu sincère, Vous ne l'êtes pas plus que moi. Junon paraît au milieu d'un nuage qui s'avance."")",,1.0,Insertion
120,"('#mercure #iris', 'Gardez pour quelque autre Votre amour trompeur, Je reprends mon coeur,  Reprenez le vôtre.')","('#ascalaphe', ""Contre l'amour quel coeur peut se défendre ? Le temps d'aimer n'est pas connu, Il faut l'attendre ; Quand ce temps fatal est venu, Il faut se rendre. Contre l'amour quel coeur peut se défendre ?"")",0.99,Substitution
121,"('#iris', ""J'ai cherché vainement la fille d'Inachus."")",,1.0,Insertion
122,"('#junon', ""Ah ! Je n'ai pas besoin d'en savoir davantage, Non, Isis, ne la cherchons plus. Jupiter dans ces lieux m'a donné de l'ombrage, J'ai traversé les airs, j'ai percé le nuage Qu'il opposait à mes regards ; Mais en vain j'ai tourné les yeux de toutes parts, Ce Dieu par son pouvoir suprême M'a caché la nymphe qu'il aime, Et ne m'a laissé voir que des troupeaux épars ! Non, non, je ne suis pas une incrédule épouse Qu'un puisse tromper aisément; Voyons qui feindra mieux de Jupiter amant Ou de Junon jalouse. Il est maître des Cieux, la terre suit sa loi; Sous sa toute puissance, il faut que tout fléchisse; Mais puisqu'il ne prétend s'armer que d'artifice Tout Jupiter qu'il est, il est moins fort que moi. Dans ces lieux écartés, vois que la terre est belle."")","('#pluton', ""De ce dieu si puissant je méprisais les feux, J'éprouve enfin sa vengeance cruelle. Je l'ai vu ce dieu dangereux, Il suivait Proserpine, il volait après elle. J'ai vu de sa fatale main Partir un trait de flamme, J'ai voulu l'éviter en vain, Le coup a pénétré jusqu'au fond de mon âme."")",0.42,Substitution
123,,"('#ascalaphe', ""L'amour a surmonté le maître des enfers ; Il n'a plus rien à vaincre après cette victoire."")",1.0,Deletion
124,"('#iris', 'Elle honore son maître et brille sous ses pas.')","('#pluton-ascalaphe', ""L'amour comblé de gloire Triomphe de tout l'univers."")",1.16,Substitution
125,,"('#proserpine #nymphes', 'Les beaux jours et la paix Sont revenus ensemble.')",1.0,Deletion
126,,"('#pluton', ""La troupe des nymphes s'assemble, Retirons-nous sous ce feuillage épais. Pluton et Ascalaphe se retirent et se cachent, et Proserpine et ses nymphes s'avancent en dansant et en chantant."")",1.0,Deletion
127,"('#junon', ""L'amour cet amour infidèle, Qui du plus haut des cieux l'appelle, Fait que tout lui rit ici-bas. Près d'une maîtresse nouvelle  Dans le fond des déserts, on trouve des appas. Et le ciel même ne plaît pas Avec une épouse immortelle."")","('#proserpine #nymphes', ""Les beaux jours et la paix On ne voit plus de coeur qui tremble, Tout rit dans ces lieux pleins d'attraits. Les beaux jours et la paix Sont revenus ensemble. Proserpine et ses nymphes continuent leurs danses et leurs chants."")",1.09,Substitution
128,"('#jupiter', ""Dans les jardins d'Hébé vous deviez en ce jour  D'une nouvelle nymphe  Augmenter votre cour; Quel dessein si pressant dans ces lieux vous amène."")","('#proserpine', 'Belles fleurs, charmant ombrage Il ne faut aimer que vous.')",0.63,Substitution
129,,"('#le-choeur', ""On ne trouve rien de doux Quand on est dans l'esclavage."")",1.0,Deletion
130,"('#junon', ""Je ne vous suivrai pas plus loin. Je viens de votre amour Attendre un nouveau soin : Ne vous étonnez pas qu'on vous quitte avec peine, Et que de Jupiter on ait toujours besoin. Vous m'aimez, et j'en suis certaine."")","('#proserpine', 'Belles fleurs, charmant ombrage Il ne faut aimer que vous.')",0.93,Substitution
131,"('#jupiter', 'Souhaitez, je promets que vos voeux seront satisfaits.')","('#le-choeur', ""Les amants n'ont en partage Que langueurs, que soins jaloux."")",1.0,Substitution
132,"('#junon', ""J'ai fait choix d'une nymphe et déjà la Déesse De l'aimable Jeunesse Se prépare à la recevoir; Mais je n'ose, sans vous, disposer de personne. Si j'ai quelque pouvoir, Je n'en prétends avoir Qu'autant que votre amour m'en donne Ce don de votre main me sera précieux."")","('#proserpine', 'Belles fleurs, charmant ombrage Il ne faut aimer que vous.')",0.83,Substitution
133,"('#jupiter', ""J'approuve vos désirs ; Que rien n'y soit contraire; Mercure ayez soin de lui plaire, Et portez à son gré, mes ordres en tous lieux; Que tout suive les lois de la reine des cieux."")","('#le-choeur', 'Belles fleurs charmant ombrage, Il ne faut aimer que vous.')",1.13,Substitution
134,,"('#proserpine', 'Quand un coeur est trop sensible, Rien ne peut le rendre heureux.')",1.0,Deletion
135,"('#iris #mercure', 'Que tout suive les lois de la reine des Cieux.')","('#le-choeur', ""Dans les plus aimables noeuds On n'a point de bien paisible."")",1.58,Substitution
136,,"('#proserpine', 'Quand un coeur est trop sensible, Rien ne peut le rendre heureux.')",1.0,Deletion
137,"('#jupiter', ""Parlez, et qu'hautement votre choix se déclare."")","('#le-choeur', ""C'est toujours un mal terrible Que l'ardeur des plus beaux feux."")",1.47,Substitution
138,,"('#proserpine', 'Quand un coeur est trop sensible, Rien ne peut le rendre heureux.')",1.0,Deletion
139,,"('#le-choeur', 'Quand un coeur est trop sensible Rien ne peut le rendre heureux.')",1.0,Deletion
140,"('#junon', ""La nymphe qui me plaît ne vous déplaira pas, Vous ne verrez pas ici-bas De mérite plus grand ni beauté plus rare; Les honneurs que je lui prépare Ne lui sont que trop dûs, Enfin, Junon choisit la fille d'Inachus."")","('#proserpine', ""Que notre vie Doit faire envie ! Le vrai bonheur Est de garder son coeur. Le jour n'éclaire Que pour nous plaire, Ces arbres verts. Ont leur plus beau feuillage, Et mille oiseaux divers Dans ce bocage Imitent nos concerts Par leur ramage ; Que notre vie Doit faire envie ! Le vrai bonheur Est de garder son coeur. Tout s'intéresse Dans nos désirs, Jamais l'amour ne nous blesse, Les doux plaisirs Sont pour les coeurs sans faiblesse. Que notre vie Doit faire envie ! Le vrai bonheur Est de garder son coeur."")",0.59,Substitution
141,"('#jupiter', ""La fille d'Inachus."")",,1.0,Insertion
142,"('#junon', ""Déclarez pour elle. Peut-on voir à ma suite une nymphe plus belle, Plus capable d'orner ma cour, Et de marquer pour moi,  Le soin de votre amour; Vous me l'avez promise et je vous le demande."")","('#le-choeur', ""Que notre vie Doit faire envie ! Le vrai bonheur Est de garder son coeur. Pour nous défendre D'un amour tendre, Avec fierté, Nous avons pris les armes : Nos biens n'ont point coûté De tristes larmes, La liberté N'a jamais que des charmes : Que notre vie, etc."")",0.66,Substitution
143,"('#jupiter', ""Vous ne sauriez combler d'une gloire trop grande La nymphe que vous choisissez; Junon commande  Allez, allez, Mercure obéissez."")","('#proserpine', 'Nous reverrons bientôt Cérès dans ces beaux lieux, Il faut lui préparer des guirlandes nouvelles. Séparons-nous ; voyons qui sait le mieux Assortir les fleurs les plus belles.')",1.12,Substitution
144,"('#junon', 'Junon commande Allez, allez, Mercure obéissez.')",,1.0,Insertion
145,"('#hebe', ""Les plaisirs les plus doux Sont faits pour la jeunesse. Venez, venez jeux charmants, venez tous; Cardez vous bien d'amener avec vous La sévère Sagesse. Fuyez, fuyez, sombre tristesse Noirs chagrins, fuyez loin de nous Vous êtes destinés pour l'affreuse vieillesse Les plaisirs les plus doux Sont faits pour la jeunesse."")","('#nymphes', ""Voyons qui sait le mieux Assortir les fleurs les plus belles. Les nymphes s'écartent, Proserpine et Cyané cueillent des fleurs."")",0.96,Substitution
146,"('#le-choeur', 'Les plaisirs les plus doux Sont faits pour la jeunesse. Les jeux, les plaisirs et les nymphes de Junon se divertissent par des danses et par des chansons, en attendant la nouvelle nymphe dont Junon vont faire choix.')","('#pluton', 'Infernales divinités Secondez mon amour, sortez. Une troupe de divinités infernales sort de la terre, et le char de Pluton paraît en même temps.')",0.98,Substitution
147,,"('#proserpine', 'Ciel ! Prenez ma défense !')",1.0,Deletion
148,,"('#proserpine #cyane', ""Ô ciel ! Protégez l'innocence !"")",1.0,Deletion
149,"('#deux-nymphes', ""Aimez, profitez du temps, Jeunesse charmante Rendez vos désirs contents. Tout rit tout enchante Dans les plus beaux ans: L'amour vous éclaire Marchez sur ses pas Cherchez à vous faire Des noeuds pleins d'appas. Que vous sert de plaire, Si vous n'aimez pas ?"")","('#pluton #ascalaphe #divinites-infernales', 'Proserpine ne craignez pas Un dieu charmé de vos appas.')",0.56,Substitution
150,,"('#cyane', ""Qu'elle barbare violence !"")",1.0,Deletion
151,"('#choeurs', ""Que ces lieux ont d'attraits ! Goûtons-en bien les charmes, L'Amour n'y fait jamais verser de tristes larmes Les soins et les alarmes,  N'en troublent point la paix. Jouissons dans ces retraites Des douceurs les plus parfaites; Suivez-nous, charmants plaisirs, Comblez tous nos désirs."")","('#pluton', ""Nymphe, crains ma vengeance : Sur peine de perdre la voix. Garde-toi de parler de tout ce que tu vois. L'écharpe de Proserpine demeure dans les mains de Cyané, et Pluton fait placer Proserpine près de lui sur son char."")",1.27,Substitution
152,,"('#proserpine', 'Ciel ! Prenez ma défense !')",1.0,Deletion
153,,"('#proserpine #cyane', ""Ô ciel ! Protégez l'innocence !"")",1.0,Deletion
