,corneillep-andromede,quinault-persee,Cost,Operation Type
122,"('#andromede', ""Assez souvent le ciel par quelque fausse joie Se plaît à prévenir les maux qu'il nous envoie ; Du moins il m'a rendu quelques moments bien doux Par ce flatteur espoir que j'allais être à vous. Mais puisque ce n'était qu'une trompeuse attente, Gardez mon souvenir, et je mourrai contente."")","('#merope', ""Ah ! Vous aimez Persée ; il cause vos alarmes ; N'en désavouez point vos larmes : Vos tendres sentiments se sont trop exprimés. Vous l'aimez."")",0.4,Substitution
123,"('#phinee', ""Et vous mourrez contente ! Et j'ai pu mériter Qu'avec contentement vous puissiez me quitter ! Détacher sans regret votre âme de la mienne ! Vouloir que je le voie, et que je m'en souvienne ! Et mon fidèle amour qui reçut votre foi Vous trouve indifférente entre la mort et moi ! Oui, je m'en souviendrai, vous le voulez, madame ; J'accepte le supplice où vous livrez mon âme ; Mais quelque peu d'amour que vous me fassiez voir, Le mien n'oubliera pas les lois de son devoir. Je dois, malgré le sort, je dois, malgré vous-même, Si vous aimez si mal, vous montrer comme on aime, Et faire reconnaître aux yeux qui m'ont charmé Que j'étais digne au moins d'être un peu mieux aimé. Vous l'avouerez bientôt, et j'aurai cette gloire, Qui dans tout l'avenir suivra notre mémoire, Que pour se voir quitter avec contentement, Un amant tel que moi n'en est pas moins amant."")","('#andromede', ""Vous l'aimez. L'espoir de son hymen avait charmé votre âme, Et je sais les projet que vous aviez formés : Je vois que le dépit n'éteint pas votre flamme ; Persée est en péril, et vous vous alarmez. Vous l'aimez."")",0.3,Substitution
124,,"('#merope', ""Vous l'aimez."")",1.0,Deletion
125,"('#andromede', ""C'est donc trop peu pour moi que des malheurs si proches, Si vous ne les croissez par d'injustes reproches ! Vous quitter sans regret ! Les dieux me sont témoins Que j'en montrerais plus si je vous aimais moins. C'est pour vous trop aimer que je parois toute autre : J'étouffe ma douleur pour n'aigrir pas la vôtre ; Je retiens mes soupirs de peur de vous fâcher, Et me montre insensible afin de moins toucher. Hélas ! Si vous savez faire voir comme on aime, Du moins vous voyez mal quand l'amour est extrême ; Oui, Phinée, et je doute, en courant à la mort, Lequel m'est plus cruel, ou de vous, ou du sort."")","('#andromede #merope', ""Ah ! Qu'un tendre coeur est à plaindre D'être réduit à feindre ! Quel tourment ne fait point souffrir Un malheureux amour que l'on ne peut éteindre, Et que l'on n'ose découvrir ? Ah ! qu'un tendre coeur est à plaindre D'être réduit à feindre !"")",0.03,Substitution
126,"('#phinee', ""Hélas ! Qu'il était grand quand je l'ai cru s'éteindre, Votre amour ! Et qu'à tort ma flamme osait s'en plaindre ! Princesse, vous pouvez me quitter sans regret : Vous ne perdez en moi qu'un amant indiscret, Qu'un amant téméraire, et qui même a l'audace D'accuser votre amour quand vous lui faites grâce ; Mais pour moi, dont la perte est sans comparaison, Qui perds en vous perdant et lumière et raison, Je n'ai que ma douleur qui m'aveugle et me guide : Dessus toute mon âme elle seule préside ; Elle y règne, et je cède entier à son transport ; Mais je ne cède pas aux caprices du sort. Que le roi par scrupule à sa rigueur défère, Qu'une indigne équité le fasse injuste père, La reine et mon amour sauront bien empêcher Qu'un choix si criminel ne coûte un sang si cher. J'ose tout, je puis tout après un tel oracle."")","('#merope', ""Il est vrai, le dépit veut en vain m'animer ; Je sens que la pitié désarme ma colère. Persée est un ingrat qui ne me peut aimer ; Il n'a pas laissé de me plaire. Il vous a trop aimée, hélas ! Comment ne l'aimeriez-vous pas ?"")",0.0,Match
127,"('#timante', ""La reine est hors d'état d'y joindre aucun obstacle : Surprise comme vous d'un tel événement, Elle en a de douleur perdu tout sentiment ; Et sans doute le roi livrera la princesse Avant qu'on l'ait pu voir sortir de sa faiblesse."")","('#andromede', ""L'amour qu'il a pour moi l'engage À chercher à se perdre avec empressement : Ne me reprochez point ce funeste avantage ; Je le paierai bien chèrement."")",0.69,Substitution
128,"('#phinee', ""Eh bien ! Mon amour seul saura jusqu'au trépas, malgré tous..."")","('#merope', ""Unissons nos regrets, le même amour nous lie. Qu'importe à qui de nous Persée offre ses voeux ! Nous allons perdre toutes deux ; Son péril nous réconcilie."")",1.0,Substitution
129,"('#andromede', 'Le roi vient ; ne vous emportez pas.')",,1.0,Insertion
130,"('#cephee', ""Ma fille, si tu sais les nouvelles funestes De ce dernier effort des colères célestes, Si tu sais de ton sort l'impitoyable cours, Qui fait le plus cruel du plus beau de nos jours, épargne ma douleur, juges-en par sa cause, Et va sans me forcer à te dire autre chose."")","('#andromede #merope', ""Ce héros s'expose pour nous : Sa perte est infaillible, Ah ! Qu'il vive, s'il est possible, Quand il vivrait pour vous."")",0.74,Substitution
131,"('#andromede', ""Seigneur, je vous l'avoue, il est bien rigoureux De tout perdre au moment qu'on se doit croire heureux ; Et le coup qui surprend un espoir légitime Porte plus d'une mort au coeur de la victime. Mais enfin il est juste, et je le dois bénir : La cause des malheurs les doit faire finir. Le ciel, qui se repent sitôt de ses caresses, Verra plus de constance en moi qu'en ses promesses : Heureuse, si mes jours un peu précipités Satisfont à ces dieux pour moi seule irrités, Si je suis la dernière à leur courroux offerte, Si le salut public peut naître de ma perte ! Malheureuse pourtant de ce qu'un si grand bien Vous a déjà coûté d'autre sang que le mien, Et que je ne suis pas la première et l'unique Qui rende à votre état la sûreté publique !"")","('#andromede', 'Il faut que mon amour se cache et de trahisse... Ô ciel ! Il va parti ! Il me chercher en ces lieux.')",0.61,Substitution
132,"('#phinee', 'Quoi ? Vous vous obstinez encore à me trahir ?')","('#merope', ""Je veux m'épargner le supplice D'être témoin de vos adieux. Elle sort."")",1.28,Substitution
133,"('#andromede', 'Je vous plains, je me plains, mais je dois obéir.')","('#cephee', 'Belle princesse, enfin vous souffrez ma présence.')",0.75,Substitution
134,"('#phinee', 'Honteuse obéissance à qui votre amour cède !')","('#andromede', ""Seigneur, on me l'ordonne, et je suis mon devoir."")",0.69,Substitution
135,"('#cephee', ""Obéissance illustre, et digne d'Andromède ! Son nom comblé par là d'un immortel honneur..."")",,1.0,Insertion
136,"('#phinee', ""Je l'empêcherai bien, ce funeste bonheur. Andromède est à moi, vous me l'avez donnée ; Le ciel pour notre hymen a pris cette journée ; Vénus l'a commandé : qui me la peut ôter ? Le sort auprès des dieux se doit-il écouter ? Ah ! Si j'en vois ici les infâmes ministres S'apprêter aux effets de ses ordres sinistres..."")","('#cephee', ""Vous voulez me faire savoir Que je ne dois ce bien qu'à votre obéissance. N'importe, rien ne peut ébranler ma constance. J'ai su jusqu'à ce jour vous aimer sans espoir. Je vais avec plaisir prendre notre défense, Quand j'aurais pour récompense Que la seule douceur que je sens à vous voir."")",0.66,Substitution
137,"('#cephee', ""Apprenez que le sort n'agit que sous les dieux, Et souffrez comme moi le bonheur de ces lieux. Votre perte n'est rien au prix de ma misère : Vous n'êtes qu'amoureux, Phinée, et je suis père. Il est d'autres objets dignes de votre foi ; Mais il n'est point ailleurs d'autres filles pour moi. Songez donc mieux qu'un père à ces affreux ravages Que partout de ce monstre épandirent les rages ; Et n'en rappelez pas l'épouvantable horreur, Pour trop croire et trop suivre une aveugle fureur."")","('#andromede', ""Non, ne vous flattez pas ; je peux ne vous rien taire : Vous m'aimez vainement ; Phinée a su ma plaire ; Il est choisi pour être mon époux ; Nos deux coeurs sont unis ; quel prix espérez-vous D'une entreprise dangereuse ? Quand nous seriez dangereuse ? Quand vous seriez vainqueur, votre âme est généreuse, Et vous ne voudrez pas rompre des noeuds si doux."")",0.0,Match
138,"('#phinee', ""Que de nouveau ce monstre entré dessus vos terres Fasse à tous vos sujets d'impitoyables guerres, Le sang de tout un peuple est trop bien employé Quand celui de ses rois en peut être payé ; Et je ne connais point d'autre perte publique Que celle où vous condamne un sort si tyrannique."")","('#cephee', 'Je serai malheureux, désespéré, jaloux ; Mais je mourrai content si vous vivez heureuse.')",1.12,Substitution
139,"('#cephee', 'Craignez ces mêmes dieux qui président au sort.')","('#andromede', 'Ô dieux !')",0.59,Substitution
140,"('#phinee', ""Qu'entre eux-mêmes ces dieux se montrent donc d'accord. Quelle crainte après tout me pourrait y résoudre ? S'ils m'ôtent Andromède, ont-ils quelque autre foudre ? Il n'est plus de respect qui puisse rien sur moi ; Andromède est mon sort, et mes dieux, et mon roi ; Punissez un impie, et perdez un rebelle ; Satisfaites le sort en m'exposant pour elle : J'y cours ; mais autrement je jure ses beaux yeux, Et mes uniques rois, et mes uniques Dieux... Ici le tonnerre commence à rouler avec un si grand bruit, et accompagné d'éclairs redoublés avec tant de promptitude, que cette feinte donne de l'épouvante aussi bien que de l'admiration, tant elle approche du naturel. On voit cependant descendre Éole avec huit vents, dont quatre sont à ses deux côtés, en sorte toutefois que les deux plus éloignés sont comme volants en l'air tout conte ce même nuage. Les quatre autres paraissent deux à deux au milieu de l'air sur les ailes du théâtre, deux à la main gauche et deux à la main droite : ce qui n'empêche pas Phinée de continuer ses blasphèmes."")","('#cephee', 'De mes regards vos beaux yeux sont blessés ; Vous souffrez à me voir, mon amour vous outrage. Je vais chercher Méduse, et je vous aime assez Pour ne vous pas contraindre à souffrir davantage.')",0.34,Substitution
141,"('#cephee', ""Arrêtez : ce nuage enferme une tempête Qui peut-être déjà menace votre tête. N'irritez plus les dieux déjà trop irrités."")",,1.0,Insertion
142,"('#phinee', ""Qu'il crève, ce nuage, et que ces déités..."")",,1.0,Insertion
143,"('#cephee', 'Ne les irritez plus, vous dis-je, et prenez garde...')","('#andromede', 'Quoi ! pour jamais vous me quittez ! Persée, arrêtez, arrêtez.')",0.72,Substitution
144,"('#phinee', ""À les trop irriter qu'est-ce que je hasarde ? Que peut craindre un amant quand il voit tout perdu ? Tombe, tombe sur moi leur foudre, s'il m'est dû ! Mais s'il est quelque main assez lâche et traîtresse Pour suivre leur caprice et saisir ma princesse, Seigneur, encore un coup, je jure ses beaux yeux, Et mes uniques rois, et mes uniques dieux..."")","('#cephee', ""Qu'entends-je ? Ô cieux : belle princesse ! Que vois-je ? vous versez des pleurs !"")",0.88,Substitution
145,"('#eole', ""Téméraire mortel, n'en dis pas davantage ; Tu n'obliges que trop les dieux à te haïr : Quoi que pense attenter l'orgueil de ton courage, Ils ont trop de moyens de se faire obéir. Connais-moi pour ton infortune ; Je suis Éole, roi des vents. Partez, mes orageux suivants, Faites ce qu'ordonne Neptune."")","('#andromede', ""Ah ! par l'excès de mes douleurs Connaissez, s'il se peut, l'excès de ma tendresse. Voyez à quoi j'avais recours Pour vous ôter l'ardeur qui vous fait entreprendre Un combat funeste à vos jours. Hélas ! que l'ai-je pu me rendre Indigne de votre secours ? Que n'êtes-vous magnanime ? Méduse d'un regard porte un trépas certain."")",0.1,Substitution
146,"('#andromede', 'ô ciel !')",,1.0,Insertion
147,"('#cephee', ""Ils l'ont saisie, et l'enlèvent en l'air."")",,1.0,Insertion
148,"('#phinee', 'Ah ! Ne présumez pas ainsi me la voler : Je vous suivrai partout malgré votre surprise.')","('#cephee', 'Vous pourriez être sa victime.')",1.16,Substitution
149,"('#persee', 'Seigneur, un tel péril ne veut point de remise ; Mais espérez encor, je vole à son secours, Et vais forcer le sort à prendre un autre cours.')","('#andromede', ""Tout l'effort des mortels contre elle serait vain."")",1.33,Substitution
150,"('#cephee', ""Vingt amants pour Nérée en firent l'entreprise ; Mais il n'est point d'effort que ce monstre ne brise. Tous voulurent sauver ses attraits adorés, Tous furent avec elle à l'instant dévorés."")","('#cephee', ""Le fils de Jupiter, lorsque l'amour l'anime, Doit aller au delà de tout l'effort humain."")",0.86,Substitution
151,,"('#andromede', ""Par les frayeurs d'un amour tendre Ne serez-vous point désarmé ?"")",1.0,Deletion
152,"('#persee', ""Le ciel aime Andromède, il veut son hyménée, Seigneur ; et si les vents l'arrachent à Phinée, Ce n'est que pour la rendre à quelque illustre époux Qui soit plus digne d'elle, et plus digne de vous ; À quelque autre par là les dieux l'ont réservée. Vous saurez qui je suis quand je l'aurai sauvée. Adieu : par des chemins aux hommes inconnus Je vais mettre en effet l'oracle de Vénus. Le temps nous est trop cher pour le perdre en paroles."")","('#cephee', ""J'ignorais votre amour, et j'aillais vous défendre ; Puis-je à vous secourir être moins animé, Quand je sais que je suis aimé ?"")",0.38,Substitution
153,"('#cephee', ""Moi, qui ne puis former d'espérances frivoles, Pour ne voir point courir ce grand coeur au trépas, Je vais faire des voeux qu'on n'écoutera pas."")","('#andromede', 'Quoi ! vous partez ?')",1.48,Substitution
154,"('#timante', ""Allons voir, chers amis, ce qu'elle est devenue, La princesse, et mourir, s'il se peut, à sa vue."")","('#cephee', ""L'amour m'appelle."")",1.68,Substitution
155,"('#le-choeur', ""La voilà que ces vents achèvent d'attacher, En infâmes bourreaux, à ce fatal rocher."")",,1.0,Insertion
156,"('#timante', ""Oui, c'est elle sans doute. Ah ! L'indigne spectacle !"")",,1.0,Insertion
157,"('#le-choeur', ""Si le ciel n'est injuste, il lui doit un miracle."")",,1.0,Insertion
158,"('#timante', ""Il en fera voir un, s'il en croit nos désirs."")",,1.0,Insertion
159,"('#andromede', 'ô dieux !')",,1.0,Insertion
160,"('#timante', 'Avec respect écoutons ses soupirs ; Et puissent les accents de ses premières plaintes Porter dans tous nos coeurs de mortelles atteintes !')","('#andromede', 'Vous méprisez mes pleurs ! Mes cris sont superflus !')",0.92,Substitution
161,"('#andromede', ""Affreuse image du trépas Qu'un triste honneur m'avait fardée, Surprenantes horreurs, épouvantable idée, Qui tantôt ne m'ébranliez pas, Que l'on vous conçoit mal quand on vous envisage Avec un peu d'éloignement ! Qu'on vous méprise alors ! Qu'on vous brave aisément ! Mais que la grandeur de courage Devient d'un difficile usage Lorsqu'on touche au dernier moment ! Ici seule, et de toutes parts À mon destin abandonnée, Ici que je n'ai plus ni parents, ni Phinée, Sur qui détourner mes regards, L'attente de la mort de tout mon coeur s'empare, Il n'a qu'elle à considérer ; Et quoi que de ce monstre il s'ose figurer, Ma constance qui s'y prépare Le trouve d'autant plus barbare Qu'il diffère à me dévorer. Étrange effet de mes malheurs ! Mon âme traînante, abattue, N'a qu'un moment à vivre, et ce moment me tue À force de vives douleurs. Ma frayeur a pour moi mille mortelles feintes, Cependant que la mort me fuit : Je pâme au moindre vent, je meurs au moindre bruit ; Et mes espérances éteintes N'attendent la fin de mes craintes Que du monstre qui les produit. Qu'il tarde à suivre mes désirs ! Et que sa cruelle paresse À ce coeur dont ma flamme est encore la maîtresse Coûte d'amers et longs soupirs ! Ô toi, dont jusqu'ici la douceur m'a suivie, Va-t'en, souvenir indiscret ; Et cessant de me faire un entretien secret De ce prince qui m'a servie, Laisse-moi sortir de la vie Avec un peu moins de regret. C'est assez que tout l'univers Conspire à faire mes supplices ; Ne les redouble point, toi qui fus mes délices, En me montrant ce que je perds ; Laisse-moi..."")","('#cephee', ""Vous me verrez comblé d'une gloire immortelle."")",0.85,Substitution
162,,"('#andromede', 'Hélas ! nous ne vous verrons plus !')",1.0,Deletion
163,"('#cassiope', ""Me voici, qui seule ai fait le crime ; Me voici, justes dieux, prenez votre victime : S'il est quelque justice encore parmi vous, C'est à moi seule, à moi qu'est dû votre courroux. Punir les innocents, et laisser les coupables, Inhumains ! Est-ce en être, est-ce en être capables ? À moi tout le supplice, à moi tout le forfait. Que faites-vous, cruels ? Qu'avez-vous presque fait ? Andromède est ici votre plus rare ouvrage ; Andromède est ici votre plus digne image ; Elle rassemble en soi vos attraits divisés : On vous connaîtra moins si vous la détruisez. Ah ! Je découvre enfin d'où provient tant de haine : Vous en êtes jaloux plus que je n'en fus vaine ; Si vous la laissiez vivre, envieux tout-puissants, Elle aurait plus que vous et d'autels et d'encens ; Chacun préférerait le portrait au modèle, Et bientôt l'univers n'adorerait plus qu'elle."")","('#persee #andromede', ""Ah ! Le péril est extrême ! Je vois votre danger, je ne vois pas le mien.. Dieux ! sauvez ce que j'aime ! Et pour moi-même Je ne demande rien. Dieux ! sauvez ce que j'aime ! Andromède sort."")",0.03,Substitution
164,"('#andromede', ""En l'état où je suis le sort m'est-il trop doux, Si vous ne me donnez de quoi craindre pour vous ? Faut-il encore ce comble à des malheurs extrêmes ? Qu'espérez-vous, madame, à force de blasphèmes ?"")","('#mercure', ""Persée, où courez-vous ? qu'allez-vous entreprendre ?"")",1.35,Substitution
165,"('#cassiope', ""Attirer et leur monstre et leur foudre sur moi ; Mais je ne les irrite, hélas ! Que contre toi : Sur ton sang innocent retombent tous mes crimes ; Seule tu leur tiens lieu de mille autres victimes ; Et pour punir ta mère ils n'ont, ces cruels dieux, Ni monstre dans la mer, ni foudre dans les cieux. Aussi savent-ils bien que se prendre à ta vie, C'est percer de mon coeur la plus tendre partie ; Que je souffre bien plus en te voyant périr, Et qu'ils me feraient grâce en me faisant mourir. Ma fille, c'est donc là cet heureux hyménée, Cette illustre union par Vénus ordonnée, Qu'avec tant de pompe il fallait préparer, Et que ces mêmes dieux devaient tant honorer ! Ce que nos yeux ont vu n'était-ce donc qu'un songe, Déesse ? Ou ne viens-tu que pour dire un mensonge ? Nous aurais-tu parlé sans l'aveu du destin ? Est-ce ainsi qu'à nos maux le ciel trouve une fin ? Est-ce ainsi qu'Andromède en reçoit les caresses ? Si contre elle l'envie émeut quelques déesses, L'amour en sa faveur n'arme-t-il point de dieux ? Sont-ils tous devenus ou sans coeur, ou sans yeux ? Le maître souverain de toute la nature Pour de moindres beautés a changé de figure ; Neptune a soupiré pour de moindres appas ; Elle en montre à Phébus que Daphné n'avait pas ; Et l'Amour en Psyché voyait bien moins de charmes, Quand pour elle il daigna se blesser de ses armes. Qui dérobe à tes yeux le droit de tout charmer, Ma fille ? Au vif éclat qu'ils sèment dans la mer, Les tritons amoureux, malgré leurs Néréides, Devraient déjà sortir de leurs grottes humides, Aux fureurs de leur monstre à l'envi s'opposer, Contre ce même écueil eux-mêmes l'écraser, Et de ses os brisés, de sa rage étouffée, Au pied de ton rocher t'élever un trophée."")","('#cephee', ""Un peuple infortuné m'engage à le défendre ; C'est à la gloire que je cours. Si je meurs, mon trépas sera digne d'envie ; Je laisse le soin de mes jours Au dieu qui m'a donné la vie."")",0.24,Substitution
166,"('#andromede', ""Renouveler le crime, est-ce pour les fléchir ? Vous hâtez mon supplice au lieu de m'affranchir. Vous appelez le monstre. Ah ! Du moins à sa vue Quittez la vanité qui m'a déjà perdue. Il n'est mortel ni dieu qui m'ose secourir. Il vient : consolez-vous, et me laissez mourir."")","('#mercure', ""Ce dieux juste et puissant favorise vos voeux, Et c'est par ma voix qu'il s'explique : Il reconnaît son sang à l'effort généreux Que vous allez tenter, d'une ardeur héroïque,  Pour secourir des malheureux ; Mais ce n'est point en téméraire Qu'il faut dans le péril précipiter vos pas. L'assistance des dieux vous sera nécessaire : Ils veulent vous l'offrir, ne le négligez pas. Je viens d'apprendre à toute la nature Que Jupiter s'intéresse à vos jours : La jalouse Junon vainement en murmure, Et tout, jusqu'aux enfers, vous promet du secours."")",0.0,Match
167,"('#cassiope', ""Je le vois, c'en est fait. Parois du moins, Phinée, Pour sauver la beauté qui t'était destinée ; Parais, il en est temps ; viens en dépit des dieux Sauver ton Andromède, ou périr à ses yeux ; L'amour te le commande, et l'honneur t'en convie ; Peux-tu, si tu la perds, aimer encore la vie ?"")","('#un-des-cyclopes', ""C'est pour vous que Vulcain, de ses mains immortelles ; A forgé cette épée et préparé ces ailes. Hâtez-vous de vous signaler Par une célèbre victoire : Chacun doit aller à la gloire ; Mais un héros y doit voler."")",0.9,Substitution
168,"('#andromede', ""Il n'a manque d'amour, ni manque de valeur ; Mais sans doute, madame, il est mort de douleur ; Et comme il a du coeur et sait que je l'adore, Il périrait ici, s'il respirait encore."")",,1.0,Insertion
169,"('#cassiope', ""Dis plutôt que l'ingrat n'ose te mériter. Toi donc, qui plus que lui t'osais tantôt vanter, Viens, amant inconnu, dont la haute origine, Si nous t'en voulons croire, est royale ou divine ; Viens en donner la preuve, et par un prompt secours, Fais-nous voir quelle foi l'on doit à tes discours ; Supplante ton rival par une illustre audace ; Viens à droit de conquête en occuper la place : Andromède est à toi si tu l'oses gagner. Quoi ? Lâches, le péril vous la fait dédaigner ! Il éteint en tous deux ces flammes sans secondes ! Allons, mon désespoir, jusqu'au milieu des ondes Faire servir l'effort de nos bras impuissants D'exemple et de reproche à leurs feux languissants ; Faisons ce que tous deux devraient faire avec joie ; Détournons sa fureur dessus une autre proie : Heureuse si mon sang la pouvait assouvir ! Allons. Mais qui m'arrête ? Ah ! C'est mal me servir."")","('#une-nymphe-guerriere', ""Le plus vaillant guerrier s'abuse D'oser tout espérer de l'effort de son bras. Si vous voulez vaincre Méduse, Portez le bouclier de la sage Pallas. Que la valeur et la prudence, Quand elles sont d'intelligence, Achèvent d'exploits glorieux ! Le monstre le plus furieux Leur fait vainement résistance. La paix ne peut régner que par leur assistance ; L'univers leur doit son bonheur. Rien ne peux mieux donner un immortel honneur Que la valeur et la prudence, Quand elles sont d'intelligence."")",0.0,Match
170,"('#timante', 'Courez-vous à la mort quand on vole à votre aide ? Voyez par quels chemins on secourt Andromède ; Quel héros, ou quel dieu sur ce cheval ailé...')",,1.0,Insertion
171,"('#cassiope', ""Ah ! C'est cet inconnu par mes cris appelé, C'est lui-même, seigneur, que mon âme étonnée..."")","('#une-divinite-infernale', ""Ce casque vous est présenté Au nom du souverain de l'empire des Ombres. Au milieu du péril, pour votre sûreté, Il répandra sur vous l'épaisse obscurité Qui règne en nos demeures sombres. Ce don mystérieux doit apprendre aux humains Comme on peut s'assurer d'un succès favorable : Il faut cacher de grands desseins Sous un secret impénétrable."")",0.92,Substitution
172,"('#persee', ""Reine, voyez par là si je vaux bien Phinée, Si j'étais moins que lui digne de votre choix, Et si le sang des dieux cède à celui des rois."")",,1.0,Insertion
173,"('#cassiope', ""Rien n'égale, seigneur, un amour si fidèle ; Combattez donc pour vous en combattant pour elle : Vous ne trouverez point de sentiments ingrats."")","('#mercure #choeurs-de-cyclopes #nymphes-guerrieres #divinites-infernales', ""Que l'enfer, la terre et les cieux, Votre généreuse entreprise ! Que l'enfer, la terre et les cieux, Que tout l'univers favorise Le fils du plus puissant des lieux !"")",1.09,Substitution
174,"('#persee', 'Adorable princesse, avouez-en mon bras.')",,1.0,Insertion
175,"('#le-choeur', ""Courage, enfant des Dieux ! Elle est votre conquête ; Et jamais amant ni guerrier Ne vit ceindre sa tête D'un si beau myrte ou d'un si beau laurier."")","('#mercure', ""Votre conduite à mes soins est commise. L'impatience éclate dans vos yeux ; La gloire qui vous est promise Ne peut plus souffrir de remise. Suivez-moi ; partons de ces lieux. Mercure et Persée s'envolent."")",0.69,Substitution
176,"('#voix', 'Andromède est le prix qui suit votre victoire : Combattez, combattez ; Et vos plaisirs et votre gloire Rendront jaloux les dieux dont vous sortez.')","('#les-choeurs', ""Que l'enfer, la terre et les cieux, etc."")",1.56,Substitution
