,la-fontaine-daphne,quinault-isis,Cost,Operation Type
90,"('#apollon', ""Voici Tempé, cette vallée Dont on vante partout l'ombrage et les beautés ; Et voilà les flots argentés Qu'y fait couler le dieu Penée. Plus loin vers ces sommets mon empire s'étend. N'y veux-tu pas venir, Momus ? On nous attend."")","('#iris', 'Je vous écouterais peut-être avec plaisir, Mais je vous croirais avec peine.')",1.53,Substitution
91,,"('#mercure', ""Refusez vous d'unir votre coeur et le mien."")",1.0,Deletion
92,"('#momus', ""Demeurons encore où nous sommes : Ai-je pu voir en un instant Toutes les sottises des hommes ? Par vos puissants efforts, invincible Apollon, On ne craint plus ici les fureurs de Python. Les habitants de ces rivages DeVÉNUS plus heureux, n'en seront pas plus sages : Le temps de la sottise est celui du bonheur."")","('#iris', ""Jupiter et Junon nous occupent sans cesse Nos soins sont assez grands sans que l'amour nous blesse, Nous n'avons pas tous deux de loisir d'aimer bien."")",0.87,Substitution
93,"('#apollon', 'Mais que dis-tu de ma victoire ?')","('#mercure', 'Si je fais ma première affaire De vous voir et de vous plaire.')",1.34,Substitution
94,"('#momus', ""Elle vous a comblé d'honneur, Et rien n'égale votre gloire."")","('#iris', 'Je ferai mon premier devoir De vous plaire et de vous voir.')",1.08,Substitution
95,"('#apollon', ""Que le fils de VÉNUS cesse de se vanter Qu'ainsi que nous il sait porter Un carquois, un arc, et des flèches ; C'est un enfant qui fait des brèches Dans les coeurs aisés à dompter. Il remporte toujours des victoires faciles ; Je défais des serpents qui dépeuplent des villes."")","('#mercure', ""Un coeur fidèle  A pour moi de charmants appas: Vous avez mille attraits, Vous n'êtes que trop belle: Mais je crains que vous n'ayez pas. Un coeur fidèle."")",1.26,Substitution
96,"('#momus', ""Vous méprisez celui qui tient tout sous sa loi. Si l'Amour vous entend ?"")","('#iris', ""Pourquoi craignez-vous tant Que mon coeur se dégage Je vous permets d'être inconstant, Sitôt que je serai volage."")",0.5,Substitution
97,"('#apollon', 'Et que crains-tu pour moi ?')","('#mercure #iris', 'Promettez moi de constantes amours, Je vous promets de vous aimer toujours.')",1.2,Substitution
98,"('#momus', ""Parlez bas, c'est un dieu ; s'il venait à paraître ?"")","('#mercure', 'Que la feinte entre nous finisse')",1.77,Substitution
99,"('#apollon', ""Un dieu ! c'est un enfant : quitte ce vain souci."")","('#iris', 'Parlons sans mystère en ce jour;')",1.41,Substitution
100,,"('#mercure #iris', ""Le moindre artifice Offense l'amour."")",1.0,Deletion
101,"('#momus', 'Qui donne à Jupiter un maître, Vous en pourrait donner aussi.')","('#iris', 'Quel soin presse ici-bas Jupiter de descendre.')",0.36,Substitution
102,"('#cupidon', ""Quel est l'orgueilleux qui me brave ? Quel téméraire ose attaquer l'Amour ? Ah ! je vous reconnais : vous serez mon esclave Avant la fin du jour. Ces paroles dites, Cupidon s'en revole dans les airs. "")","('#mercure', 'Le seul bien des mortels lui fait quitter les cieux; Mais quel soupçons nouveau Junon peut elle prendre ? Ne suivrait elle pas Jupiter en ces lieux.')",0.91,Substitution
103,,"('#iris', ""Dans les jardins d'Hébé Junon vient de descendre."")",1.0,Deletion
104,"('#momus', ""Que cet enfant est fier ! Voyez comme il menace ! Ne le prendrait-on pas pour l'aîné des Titans ? Je plains le dompteur de serpents ; Il ne fait pas sûr en sa place. Tandis que Momus dit ces paroles, Daphné avec ses compagnes, par une curiosité de jeunes filles, avance un peu la tête sur le théâtre, et fait quelques pas dans la scène pour voir ces deux étrangers. Apollon la voit un moment ; aussitôt l'Amour, qui est demeuré dans l'air, fait son coup, et Daphné avec sa troupe s'enfuit encore une fois."")","('#mercure', ""Un nuage entrouvert la découvre à mes yeux ; Iris parle ainsi sans mystère ! C'est ainsi que je puis me fier à ta foi."")",1.28,Substitution
105,"('#apollon', ""Ah ! Qu'ai je vu, Momus ! Que de traits éclatants ! Que de jeunesse, que de grâce !"")","('#iris', ""Ne me reprochez pas que je suis peu sincère, Vous ne l'êtes pas plus que moi. Junon paraît au milieu d'un nuage qui s'avance."")",1.42,Substitution
106,"('#momus', 'Elle fuit.')",,1.0,Insertion
107,"('#apollon', 'Mille amours avec elle ont paru.')",,1.0,Insertion
108,"('#momus', ""Mille amours ? C'est beaucoup ; je n'en ai pas tant vu. Vous aimez ; vous voyez d'un autre oeil que le nôtre : De quelques qualités qu'un objet soit pourvu, L'amant y voit toujours ou plus_ou_moins qu'un autre."")","('#mercure #iris', 'Gardez pour quelque autre Votre amour trompeur, Je reprends mon coeur,  Reprenez le vôtre.')",0.77,Substitution
109,,"('#iris', ""J'ai cherché vainement la fille d'Inachus."")",1.0,Deletion
110,"('#apollon', ""Déesse, tu me fuis ? T'ai-je déjà déplu ? C'est pourtant Apollon qui t'aime, qui t'adore. Je n'en puis plus, je sens un feu qui me dévore : Reviens, charmant objet ! Et vous, Olympe, cieux, Je vous dis d'éternels adieux ; Je vous méprise, je vous laisse : Qu'êtes-vous près de ma déesse ? Tout votre éclat vaut-il un seul trait de ses yeux ? Ne la verrai-je plus ? Faut-il que cette belle Emporte mes plaisirs et mon coeur avec elle ? Demeurons sur ces bords, je ne les puis laisser."")","('#junon', ""Ah ! Je n'ai pas besoin d'en savoir davantage, Non, Isis, ne la cherchons plus. Jupiter dans ces lieux m'a donné de l'ombrage, J'ai traversé les airs, j'ai percé le nuage Qu'il opposait à mes regards ; Mais en vain j'ai tourné les yeux de toutes parts, Ce Dieu par son pouvoir suprême M'a caché la nymphe qu'il aime, Et ne m'a laissé voir que des troupeaux épars ! Non, non, je ne suis pas une incrédule épouse Qu'un puisse tromper aisément; Voyons qui feindra mieux de Jupiter amant Ou de Junon jalouse. Il est maître des Cieux, la terre suit sa loi; Sous sa toute puissance, il faut que tout fléchisse; Mais puisqu'il ne prétend s'armer que d'artifice Tout Jupiter qu'il est, il est moins fort que moi. Dans ces lieux écartés, vois que la terre est belle."")",0.01,Substitution
111,"('#momus', 'Passerons-nous pour dieux ?')",,1.0,Insertion
112,"('#apollon', 'Et pour qui donc passer')","('#iris', 'Elle honore son maître et brille sous ses pas.')",1.85,Substitution
113,"('#momus', ""Pour mortels, car les dieux, par leur grandeur suprême Ne font souvent qu'embarrasser : On les craint plus qu'on ne les aime. Les vrais amants doivent toujours Sous un maître commun vivre d'égale sorte : Ou monarques ou dieux, n'entrez chez vos amours Qu'après avoir laissé vos grandeurs à la porte"")","('#junon', ""L'amour cet amour infidèle, Qui du plus haut des cieux l'appelle, Fait que tout lui rit ici-bas. Près d'une maîtresse nouvelle  Dans le fond des déserts, on trouve des appas. Et le ciel même ne plaît pas Avec une épouse immortelle."")",0.52,Substitution
114,"('#apollon', ""Je te croirai ; changeons de nom : Je m'appelle Tharsis, satrape de Lycie."")",,1.0,Insertion
115,"('#momus', ""Et moi, son suivant Télamon Que si sur mon chemin quelque Nymphe jolie Se rencontre en passant, je prétends bien aussi La cajoler, m'approcher d'elle, Non pas en amoureux transi : Je vous veux servir de modèle Et cependant, allons conquérir votre belle."")","('#jupiter', ""Dans les jardins d'Hébé vous deviez en ce jour  D'une nouvelle nymphe  Augmenter votre cour; Quel dessein si pressant dans ces lieux vous amène."")",0.55,Substitution
116,"('#venus', ""Qu'est devenu mon fils ? Mortels, le savez-vous ? Je souffre, je languis, je meurs en son absence : Si l'Amour ne me suit, rien ne me semble doux. Heureux les lieux qu'anime sa présence ! Heureux tout l'Univers qui me doit sa naissance ! Qu'est devenu l'Amour ? Échos, le savez-vous ? Quel nouveau coeur aujourd'hui de ses coups Éprouve la puissance ? Qu'est devenu l'Amour ? Échos, le savez-vous ? Je souffre, je languis, je meurs en son absence. Ce récit fait, l'Amour se vient jeter dans le giron de sa mère."")","('#junon', ""Je ne vous suivrai pas plus loin. Je viens de votre amour Attendre un nouveau soin : Ne vous étonnez pas qu'on vous quitte avec peine, Et que de Jupiter on ait toujours besoin. Vous m'aimez, et j'en suis certaine."")",0.09,Substitution
117,"('#venus', ""Ah ! Mon fils, d'où viens-tu ?"")","('#jupiter', 'Souhaitez, je promets que vos voeux seront satisfaits.')",1.65,Substitution
118,"('#amour', ""De blesser Apollon. Je l'ai rendu pour Daphné tout de flamme ; Tandis qu'un autre trait, par un autre poison, Fait que pour lui Daphné n'a que haine dans l'âme."")","('#junon', ""J'ai fait choix d'une nymphe et déjà la Déesse De l'aimable Jeunesse Se prépare à la recevoir; Mais je n'ose, sans vous, disposer de personne. Si j'ai quelque pouvoir, Je n'en prétends avoir Qu'autant que votre amour m'en donne Ce don de votre main me sera précieux."")",0.35,Substitution
119,"('#venus', ""Amour, tu sais dompter les coeurs et les esprits. Que la terre et les cieux célèbrent de mon fils La dernière victoire ! Mortels et dieux, chantez sa gloire. Allez de toutes parts, courez, Amours et Ris ; Faites connaître de mon fils Le doux et le suprême empire : Ne laissez rien qui ne soupire. Allez de toutes parts, courez, Amours et Jeux ; Rendez l'Univers amoureux Aux dieux et aux hommes : Pour obéir à ce commandement de Vénus, on chante et on danse sur la terre, et dans la gloire, qui est au fond du théâtre : sur la terre, des personnes de toutes conditions, et dans la gloire, des enfants qui représentent les Amours, les Jeux et les Ris. La danse achevée, Vénus, dont le char est entouré d'enfants chante ces paroles : "")","('#jupiter', ""J'approuve vos désirs ; Que rien n'y soit contraire; Mercure ayez soin de lui plaire, Et portez à son gré, mes ordres en tous lieux; Que tout suive les lois de la reine des cieux."")",0.64,Substitution
120,"('#penee', 'Dieux tributaires de mon onde, Je veux, par les beautés de ce moite séjour, Arrêter quelque temps deux princes à ma Cour ; Que votre zèle me seconde !')","('#iris #mercure', 'Que tout suive les lois de la reine des Cieux.')",1.43,Substitution
121,"('#fleuves', 'Commandez.')","('#jupiter', ""Parlez, et qu'hautement votre choix se déclare."")",0.95,Substitution
122,"('#penee', ""Que le Sort vous a rendus heureux ! Hyménée et l'Amour fréquentent vos rivages : Vos grottes quelquefois leur prêtent des ombrages : Ces dieux me méprisent tous deux."")","('#junon', ""La nymphe qui me plaît ne vous déplaira pas, Vous ne verrez pas ici-bas De mérite plus grand ni beauté plus rare; Les honneurs que je lui prépare Ne lui sont que trop dûs, Enfin, Junon choisit la fille d'Inachus."")",0.81,Substitution
123,,"('#jupiter', ""La fille d'Inachus."")",1.0,Deletion
124,"('#apidame', ""Laissez agir le temps ; il peut tout auprès d'eux. A peine a-t-il encor fait passer la princesse Des appas de l'enfance à ceux de la jeunesse : Deux soleils ont à peine éclairé son printemps."")","('#junon', ""Déclarez pour elle. Peut-on voir à ma suite une nymphe plus belle, Plus capable d'orner ma cour, Et de marquer pour moi,  Le soin de votre amour; Vous me l'avez promise et je vous le demande."")",0.5,Substitution
125,"('#penee', 'Combien de coeurs depuis ce temps Ont en vain soupiré pour elle ! Ah ! si Tharsis pouvait la rendre moins cruelle !')","('#jupiter', ""Vous ne sauriez combler d'une gloire trop grande La nymphe que vous choisissez; Junon commande  Allez, allez, Mercure obéissez."")",1.17,Substitution
126,"('#sperchee', 'Consultez la Sibylle Ismèle : Les dieux peut-être par sa voix Obligeront Daphné de suivre votre choix')","('#junon', 'Junon commande Allez, allez, Mercure obéissez.')",1.42,Substitution
127,"('#penee', ""Hélas ! Jamais Daphné n'aimera que les bois."")","('#hebe', ""Les plaisirs les plus doux Sont faits pour la jeunesse. Venez, venez jeux charmants, venez tous; Cardez vous bien d'amener avec vous La sévère Sagesse. Fuyez, fuyez, sombre tristesse Noirs chagrins, fuyez loin de nous Vous êtes destinés pour l'affreuse vieillesse Les plaisirs les plus doux Sont faits pour la jeunesse."")",1.63,Substitution
128,"('#amphrise', ""Ces plaisirs passeront : tout passe dans la vie ; De différents désirs elle est entre-suivie ; On y change d'humeur, on y change d'envie ; On y veut goûter de tout. Le plus libre enfin se lie ; Tôt ou tard on s'y résout."")","('#le-choeur', 'Les plaisirs les plus doux Sont faits pour la jeunesse. Les jeux, les plaisirs et les nymphes de Junon se divertissent par des danses et par des chansons, en attendant la nouvelle nymphe dont Junon vont faire choix.')",0.58,Substitution
129,"('#apidame', ""Il faut peu pour changer ces âmes si sévères ; L'exemple à ce doux noeud les amène toujours. Des bergers chantant leurs amours, Dans les bras de l'hymen voir mener des bergères, Et leurs folâtres jeux sur les vertes fougères, Apprivoisent les coeurs, qui, deVÉNUS plus doux, S'accoutument aux mots d'amour, d'amant, d'époux ; Des mots on en vient au mystère."")","('#deux-nymphes', ""Aimez, profitez du temps, Jeunesse charmante Rendez vos désirs contents. Tout rit tout enchante Dans les plus beaux ans: L'amour vous éclaire Marchez sur ses pas Cherchez à vous faire Des noeuds pleins d'appas. Que vous sert de plaire, Si vous n'aimez pas ?"")",0.33,Substitution
130,"('#penee', ""J'approuve vos raisons ; et Daphné, pour me plaire, Doit faire en mon palais les honneurs de ce jour. On y va célébrer l'hymen du jeune Amphrise Il s'engage avecque Florise ; La fête arrêtera ces princes à ma Cour : Allons en prendre soin. Daphné vient, et Clymène ; Entrons dans la grotte prochaine."")","('#choeurs', ""Que ces lieux ont d'attraits ! Goûtons-en bien les charmes, L'Amour n'y fait jamais verser de tristes larmes Les soins et les alarmes,  N'en troublent point la paix. Jouissons dans ces retraites Des douceurs les plus parfaites; Suivez-nous, charmants plaisirs, Comblez tous nos désirs."")",0.25,Substitution
131,"('#daphne', 'Ah, Clymène ! Plains-moi.')","('#mercure', 'Servez, Nymphe, servez avec un soin fidèle, La puissante reine des Cieux. Suivez dans ces aimables lieux La jeunesse immortelle Tout plaît et tout rit avec elle. Hébé et les nymphes reçoivent Io.')",1.22,Substitution
132,"('#clymene', 'Princesse, vous pleurez ; puis-je savoir pourquoi ?')",,1.0,Insertion
133,"('#daphne', ""Je ne me connais plus ; ce n'est plus moi, Clymène : Ces puissants dédains, cette haine, Ces serments contre Amour, que sont-ils deVÉNUS. Un mortel les rend superflus. Hélas ! il vient de me dire sa peine, Et depuis ce moment je ne me connais plus."")","('#hebe', ""Que c'est un plaisir charmant  D'être jeune et belle ! Triomphez à tout moment D'une conquête nouvelle. Que c'est un plaisir charmant  D'être jeune et belle !"")",1.42,Substitution
134,"('#clymene', ""Un des princes, sans doute, a causé ces alarmes. Serait-ce point Tharsis ? Je lui trouve des charmes Contre qui je sens bien que ma sévérité N'emploierait pas toutes ses armes."")","('#argus', 'Dans ce solitaire séjour Vous êtes sous ma garde, Junon vous y laisse: Mes yeux veilleront tour à tour Et vous observeront sans cesse.')",0.86,Substitution
135,"('#daphne', ""Je crois ? Si tu le veux, qu'on en est enchanté, Cependant il me cause une invincible haine ; Contre lui dans mon âme un dieu me semble agir."")","('#io', ""Est-ce là le bonheur que Junon m'a promis. Argus apprenez-moi quel crime j'ai commis."")",1.02,Substitution
136,"('#clymene', ""Je le connais, ce dieu : c'est Leucippe."")",,1.0,Insertion
137,"('#daphne', 'Ah, Clymène ! Ne me regarde point, tu me ferais rougir.')","('#argus', ""Vous êtes aimable Vos yeux devaient moins charmer. Vous êtes coupable De faire trop aimer Ne me déguisez rien, de quoi m'accuse-t-elle Quelle offenses à ses yeux me rend si criminelle ? Ne pourrai-je apaiser son funeste courroux."")",0.59,Substitution
138,"('#clymene', ""Pourquoi rougir ? commettez-vous un crime ? Le Ciel permet-il pas d'aimer ou de haïr ? Est-il rien de si légitime ? Tircis est des plus charmants, Je méprise son martyre ; Cependant sous mon empire Il languit depuis longtemps. Philandre à peine y soupire, Son service est reconnu ; La raison, je vais la dire : Mon temps d'aimer est venu."")","('#argus', ""C'est une offense cruelle De paraître belle À ses yeux jaloux L'amour de Jupiter a trop paru pour vous"")",0.58,Substitution
139,"('#daphne', ""Hélas ! le mien aussi ; mais garde-toi, Clymène De découvrir ma flamme, et l'exposer au jour : Plains-toi que de Tharsis je méprise la peine ; Notre sexe veut bien que l'on sache sa haine, Mais il met tous ses soins à cacher son amour."")","('#io', 'Je suis perdue, ô ciel ! si Junon est jalouse.')",0.93,Substitution
140,"('#clymene', ""Le voila, ce Tharsis ; son malheur vous l'amène."")",,1.0,Insertion
141,"('#tharsis', ""Que je dois au Destin de m'avoir arrête En des lieux ou l'on voit briller votre présence ! Vous y régnez par la beauté, Aussi bien que par la naissance : Souffrez que j'y demeure au rang de vos sujets."")","('#argus', ""On ne plaît guère à l'épouse Lorsqu'on plaît trop à l'époux. Vous n'en serez pas mieux d'être ingrate et volage Vous quittez un fidèle amant, Pour recevoir un plus brillant hommage Mais c'est un avantage Que vous payerez chèrement. J'ai l'ordre d'enfermer vos dangereux appas La Déesse se défend que vous voyez personne"")",0.51,Substitution
142,"('#daphne', ""Non, Seigneur, je ne puis recevoir vos hommages ; Offrez-les à d'autres objets ; Abandonnez nos rivages : Quel plaisir aurez-vous parmi des coeurs sauvages ?"")","('#io', ""Aux rigueurs de Junon Jupiter m'abandonne. Non, non Jupiter ne m'aime pas."")",1.53,Substitution
143,,"('#hierax', ""La perfide craint ma présence Elle me fuit en vain et j'irai la chercher."")",1.0,Deletion
144,"('#tharsis', 'Je vous verrai.')","('#argus', 'Non !')",1.15,Substitution
145,"('#daphne', ""Fuyez cette triste douceur. Il vaut mieux qu'une prompte absence Rende le calme à votre coeur, Que de vous voir enfin guéri par ma rigueur, Ma haine, ou mon indifférence."")","('#hierax', 'Laissez moi lui reprocher  Sa cruelle inconstance')",1.06,Substitution
146,,"('#argus', 'Non, non, on ne la doit point voir')",1.0,Deletion
147,,"('#hierax', 'Quoi ! Junon me devient contraire ?')",1.0,Deletion
148,,"('#argus', ""L'ordre est exprès pour tous, perdez un vain espoir."")",1.0,Deletion
149,"('#tharsis', ""Ô Ciel ! Lui dois-je ajouter foi ? Quoi ! Ne pouvoir m'aimer ! me haïr ! me le dire ! Amour, tyran des coeurs, depuis que sous ta loi On gémit, on pleure, on soupire, Fut-il jamais amant plus malheureux que moi ? Que je sache au moins, inhumaine, Ce qu'a Tharsis en lui de si digne de haine ?"")","('#hierax', ""L'amitié fraternelle a si peur de pouvoir ?"")",1.21,Substitution
150,"('#daphne', ""Son amour ; c'est assez : je le dis à regret. Vous avez dans mon coeur quelque ennemi secret Qui met un voile sur ces charmes A qui d'autres auraient déjà rendu les armes. Enfin quittez nos bords, Seigneur, vous ferez mieux ; Qui ne peut être aimé doit s'éloigner des lieux Où sans cesse il peut voir le sujet de ses peines. Faut-il livrer son coeur à d'éternelles gênes Pour le plaisir de ses yeux ? Je vous laisse, et me tais ; ma fuite et mon silence Vous seront des tourments plus doux."")","('#argus', ""Non, je ne connais plus ni d'ami, ni de frère, Je ne connais que mon devoir Laissez la nymphe en paix, Ce n'est plus vous qu'elle aime."")",0.39,Substitution
151,"('#tharsis', 'Princesse, demeurez : je trouve votre absence Plus cruelle encor que vous.')","('#hierax', ""Quel est l'heureux amant qui s'en est fait aimer ? Nommez le moi."")",1.69,Substitution
152,"('#telamon', 'Ceci vous trouble et vous étonne.')","('#argus', ""Tremblez à l'entendre nommer.  C'est un Dieu tout puissant, c'est Jupiter lui-même."")",1.72,Substitution
153,"('#tharsis', ""Suis-je donc le fils de Latone ? Ai-je dompté Python ? Suis-je un dieu ? Je n'ai pu Gagner une mortelle ! un enfant m'a vaincu ! Qu'il m'ôte mes autels : que sert-il qu'on me donne En ces lieux l'encens qui m'est dû ? Et qu'est-ce que l'encens qu'une chose frivole Près des moindres faveurs que nous font de beaux yeux ? Daphné, vous me pourriez d'une seule parole Mettre au-dessus des autres dieux."")","('#hierax', 'Ô Dieux !')",1.41,Substitution
154,"('#telamon', ""Espérez ce mot favorable : Il n'est amant si misérable Qui n'espère."")","('#argus', ""Dégagez vous d'un amour si fatal Sans balancer il faut vous y résoudre C'est un redoutable rival Qu'un amant qui lance la foudre."")",0.81,Substitution
155,"('#tharsis', 'Tu ris.')",,1.0,Insertion
156,"('#telamon', ""Jupiter vous vaut bien : Je ris aussi quand l'Amour veut qu'il pleure. Vous autres dieux, n'attaquez rien Qui, sans vous étonner, s'ose défendre une heure : Sachez que le temps seul en a plus couronné Que tous les efforts qu'on peut faire."")","('#hierax', ""Dieux tout puissants ! ah ! vous étiez jaloux De la félicité que vous m'avez ravie, Dieux tout puissants ! ah ! vous étiez jaloux De me voir plus heureux que vous. Vous n'avez pu souffrir le bonheur de la vie Et je voyais vos grandeurs sans envie. J'aimais, j'étais aimé.  Mon sort était trop doux."")",0.37,Substitution
157,"('#tharsis', ""Je n'ose plus parler de mes feux à Daphné."")",,1.0,Insertion
158,"('#telamon', ""Laissez dormir sa colère. Après que l'on vous aura Contraint longtemps de vous taire, Un moment arrivera Que l'on vous écoutera."")","('#argus', ""Heureux qui peut briser Qui peut briser sa chaîne Finissez une plainte vaine Méritez l'infidélité; Un coeur ingrat vaut-il la peine D'être tant regretté."")",0.75,Substitution
159,,"('#hierax #argus', 'Heureux qui peut briser Qui peut briser sa chaîne')",1.0,Deletion
160,,"('#argus', 'Liberté, liberté.')",1.0,Deletion
161,"('#tous', ""Hymen, Hyménée. Après que chacun s'est rangé et a pris sa place, les deux bergers chantent ce premier couplet de l'épithalame."")","('#syrinx #choeurs', 'Liberté, liberté ! Une partie des nymphes dansent dans le temps que les autres chantent.')",1.29,Substitution
162,"('#deux-bergers', ""Florise est donnée A l'un des plus beaux Qui porte à Pénée Tribut de ses eaux : Qu'il ait chaque année De nombreux troupeaux, Et chaque journée Des plaisirs nouveaux. Hymen, Hyménée. Daphné présente au sacrificateur l'épousée, et un des fleuves le marié. "")","('#hierax #argus', 'Quelles danses ! quels chants et quelle nouveauté !')",1.39,Substitution
163,,"('#syrinx #choeurs', ""S'il est quelque bien au monde C'est la liberté."")",1.0,Deletion
164,"('#le-sacrificateur', 'Amants, je vous unis ; vivez sous mêmes noeuds.')","('#hierax #argus', 'Que voulez-vous ?')",1.19,Substitution
165,"('#le-choeur', 'Parmi les plaisirs et les jeux.')","('#choeur-des-nymphes', 'Liberté, liberté.')",1.31,Substitution
166,,"('#hierax #argus', ""Que voulez-vous ? il faut qu'on nous réponde."")",1.0,Deletion
167,,"('#syrinx #choeurs', ""S'il est quelque bien au monde, C'est la liberté."")",1.0,Deletion
168,,"('#mercure #choeurs-de-nymphes #bergers #satyres #sylvains', ""Liberté, liberté S'il est quelque bien au monde C'est la liberté. Liberté, liberté"")",1.0,Deletion
169,"('#momus', 'A quelques filles de la noce, près desquelles il se rencontre : Pour un pareil lien formez-vous point des voeux ? Songez-y bien, bergères : Hyménée est un dieu jeune, charmant, et blond ; Mais les jours avec lui ne se ressemblent guères : Le premier est amour, amitié le second, Le troisième froideur ; songez-y bien, bergères.')","('#mercure', ""De la Nymphe Syrinx l'on chérit la mémoire, Il en regrette encor la perte chaque jour; Pour célébrer une fête à sa gloire Ce Dieu lui même assemble ici sa cour Il veut que du malheur de son fidèle amour. Un spectacle touchant représente l'histoire"")",0.81,Substitution
170,"('#meroe', ""Vraiment, Télamon, La leçon Est jolie. Changez de place, Iris ; venez ici, Célie, Pholoé, ne l'écoutez plus. J'en suis d'avis ; mes soins deviendront superflus ; Télamon corrompra cette troupe innocente."")","('#argus', ""C'est un plaisir pour nous; poursuivez j'y consens Je ne m'oppose point à ces jeux innocents. Argus va prendre place sur un siège de gazon proche de l'endroit où Io est enfermée et fait planer Hiérax de l'autre côté."")",0.98,Substitution
171,"('#momus', ""Que vous êtes reprenante, Gouvernante ! Laissez-nous causer en paix : Laissez la jeunesse rire : Elle inspire Toujours d'innocents secrets. Je crois que vous êtes sage : À votre âge On le doit être, ou jamais. Vingt ou trente ans de veuvage, C'est dommage, Ont refroidi vos attraits. Ah ! si selon vos souhaits Vous redeveniez aurore, Vous vous serviriez encore De vos traits."")","('#mercure', ""Il donne dans le piège, achevez sans remise Achevez de surprendre Argus et tous ses yeux. Si vous tentez une grande entreprise, Mercure vous conduit, l'amour vous favorise Et vous servez le plus puissant des Dieux. Mercure, les berges, les satyres, et les sylvains rentrent derrière le théâtre."")",0.79,Substitution
172,"('#meroe', 'Me faudra-t-il aussi souffrir la raillerie ?')",,1.0,Insertion
173,"('#penee', 'Laissez-nous achever cette cérémonie.')","('#syrinx', ""Liberté, liberté S'il est quelque bien au monde C'est la liberté."")",1.88,Substitution
