,corneillep-andromede,quinault-persee,Cost,Operation Type
215,"('#andromede', ""Et vos respects trouvaient une digne matière À me laisser l'honneur de périr la première ! Ah ! C'était à mes yeux qu'il fallait y courir, Si vous aviez pour moi cette ardeur de mourir. Vous ne me deviez pas envier cette joie De voir offrir au monstre une première proie ; Vous m'auriez de la mort adouci les horreurs, Vous m'auriez fait du monstre adorer les fureurs ; Et lui voyant ouvrir ce gouffre épouvantable, Je l'aurais regardé comme un port favorable, Comme un vivant sépulcre où mon coeur amoureux Eût brûlé de rejoindre un amant généreux. J'aurais désavoué la valeur de Persée ; En me sauvant la vie il m'aurait offensée ; Et de ce même bras qu'il m'aurait conservé Je vous immolerais ce qu'il m'aurait sauvé. Ma mort aurait déjà couronné votre perte, Et la bonté du ciel ne l'aurait pas soufferte ; C'est à votre refus que les dieux ont remis En de plus dignes mains ce qu'ils m'avaient promis. Mon coeur eût mieux aimé le tenir de la vôtre ; Mais je vis par un autre, et vivrai pour un autre. Vous n'avez aucun lieu d'en devenir jaloux, Puisque sur ce rocher j'étais morte pour vous. Qui pouvait le souffrir peut me voir sans envie Vivre pour un héros de qui je tiens la vie ; Et quand l'amour encore me parlerait pour lui, Je ne puis disposer des conquêtes d'autrui. Adieu."")","('#phinee', 'Les dieux ont soin de nous venger : Le plaisir que je sens avec peine se cache.')",1.08,Substitution
216,,"('#merope', 'Verrez-vous sans douleur Andromède en danger ?')",1.0,Deletion
217,"('#phinee', ""Vous voulez donc que j'en fasse la mienne, Cruelle, et que ma foi de mon bras vous obtienne ? Eh bien ! Nous l'irons voir, ce bienheureux vainqueur, Qui triomphant d'un monstre, a dompté votre coeur. C'était trop peu pour lui d'une seule victoire, S'il n'eût dedans ce coeur triomphé de ma gloire ! Mais si sa main au monstre arrache un bien si cher, La mienne à son bonheur saura bien l'arracher ; Et vainqueur de tous deux en une seule tête, De ce qui fut mon bien je ferai ma conquête. La force me rendra ce que ne peut l'amour. Allons-y, chers amis, et montrons dès ce jour..."")","('#phinee', ""Est-ce à moi que la mort l'arrache ? C'est à Persée à s'affliger. L'amour meurt dans mon coeur, la rage lui succède ; J'aime mieux voir un monstre affreux Dévorer l'ingrate Andromède, Les appas, les douceurs d'une amour mutuelle, Sont de mon sort fatal les plus terribles coups ; Le fils de Jupiter eût été mon époux ; Ah ! Que ma vie eût été belle ! Dieux ! Qui me destinez une mort si cruelle, etc."")",0.0,Match
218,"('#ammon', ""Seigneur, auparavant d'une âme plus remise Daignez voir le succès d'une telle entreprise. Savez-vous que Persée est fils de Jupiter, Et qu'ainsi vous avez le foudre à redouter ?"")","('#triton', 'Tremblez, superbe reine... Tremblez, mortels audacieux : Que votre orgueil apprenne Combien votre grandeur est vaine, Tremblez, mortels audacieux : Redoutez le courroux des dieux.')",0.19,Substitution
219,,"('#cassiope', 'Ah ! Quelle vengeance inhumaine !')",1.0,Deletion
220,,"('#cephee', 'Andromède !')",1.0,Deletion
221,,"('#cassiope', 'Ma fille !')",1.0,Deletion
222,,"('#andromede', 'Ô cieux !')",1.0,Deletion
223,"('#phinee', ""Je sais que Danaé fut son indigne mère : L'or qui plut dans son sein l'y forma d'adultère ; Mais le pur sang des rois n'est pas moins précieux Ni moins chéri du ciel que les crimes des dieux."")","('#cassiope', ""Que les dieux sont cruels ! Qu'ils sont ingénieux À faire ressentir leur haine !"")",1.35,Substitution
224,,"('#cephee', 'Andromède !')",1.0,Deletion
225,,"('#cassiope', 'Ma fille !')",1.0,Deletion
226,"('#ammon', ""Mais vous ne savez pas, seigneur, que son épée De l'horrible Méduse a la tête coupée, Que sous son bouclier il la porte en tous lieux, Et que c'est fait de vous, s'il en frappe vos yeux."")","('#andromede', 'Ô cieux ! Le monstre paraît.')",1.43,Substitution
227,"('#phinee', ""On dit que ce prodige est pire qu'un tonnerre, Qu'il ne faut que le voir pour n'être plus que pierre, Et que naguère Atlas, qui ne s'en put cacher, À cet aspect fatal devint un grand rocher. Soit une vérité, soit un conte, n'importe ; Si la valeur ne peut, que le nombre l'emporte. Puisque Andromède enfin voulait me voir périr, Ou triompher d'un monstre afin de l'acquérir, Que fière de se voir l'objet de tant d'oracles, Elle veut que pour elle on fasse des miracles, Cette tête est un monstre aussi bien que celui Dont cet heureux rival la délivre aujourd'hui ; Et nous aurons ainsi dans un seul adversaire Et monstres à combattre, et miracles à faire. Peut-être quelques dieux prendront notre parti, Quoique de leur monarque il se dise sorti ; Et Junon pour le moins prendra notre querelle Contre l'amour furtif d'un époux infidèle."")","('#cephee #cassiope #ethiopiens', 'Le monstre approche de ces lieux, Ah, quelle vengeance inhumaine !')",1.02,Substitution
228,,"('#nereides #tritons', 'Tremblez, mortels audacieux, etc.')",1.0,Deletion
229,"('#junon', ""N'en doute point, Phinée, et cesse d'endurer."")","('#andromede', 'Je ne vois point Persée, et je flattais ma peine Du triste espoir de mourir à ses yeux.')",0.91,Substitution
230,"('#phinee', 'Elle-même paraît pour nous en assurer.')","('#cephee #cassiope #ethiopiens', 'Voyez voler ce héros glorieux.')",1.59,Substitution
231,"('#junon', ""Je ne serai pas seule : ainsi que moi Neptune S'intéresse en ton infortune ; Et déjà la noire Alecton, Du fond des enfers déchaînée, A, par les ordres de Pluton, De mille coeurs pour toi la fureur mutinée : Fort de tant de seconds, ose, et sers mon courroux Contre l'indigne sang de mon perfide époux."")","('#cassiope #cephee', ""Ah ! quel effroyable supplice ! Dieux, ô dieux ! quelle cruauté ! Je perds ma fille, hélas ! Le ciel propice Me la donna pour ma félicité, Aujourd'hui le Ciel irrité Veut qu'un monstre me la ravisse. Ciel ! Que j'ai toujours respecté Ne m'avez-vous longtemps conservé la clarté Que pour me faire voir cet affreux sacrifice ? Ah ! Quel effroyable supplice ! Dieux, ô dieux ! Quelle cruauté ! C'est ma funeste vanité, C'est mon crime, grands dieux ! Qu'il faut que l'on punisse. Ma fille n'est pas complice, Et vos foudres vengeurs contre elle ont éclaté ! Dieux ! Pouvez-vous vouloir qu'Andromède périsse ? Sa jeunesse ni sa beauté N'ont-elles rien qui vous fléchisse ? La vertu, l'innocence a-t-elle mérité Les rigueurs de votre justice ?"")",0.12,Substitution
232,"('#phinee', ""Nous te suivons, déesse ; et dessous tes auspices Nous franchirons sans peur les plus noirs précipices. Que craindrons-nous, amis ? Nous avons dieux pour dieux, Oracle pour oracle ; et la faveur des cieux, D'un contre-poids égal dessus nous balancée, N'est pas entièrement du côté de Persée."")","('#cephee', 'Ah ! quel effroyable supplice ! Dieux, ô dieux ! quelle cruauté !')",0.82,Substitution
233,"('#junon', ""Je te le dis encore, ose, et sers mon courroux Contre l'indigne sang de mon perfide époux."")","('#cassiope #cephee', ""Que j'expire en mourant un si funeste crime."")",1.02,Substitution
234,"('#ammon', ""Sous tes commandements nous y courons, déesse, Le coeur plein d'espérance, et l'âme d'allégresse. Allons, seigneur, allons assembler vos amis ; Courons au grand succès qu'elle vous a promis : Aussi bien le roi vient, il faut quitter la place, de peur..."")","('#cassiope', ""Que par pitié j'obtienne une mort légitime. Cruels ! n'attachez pas ma fille à ce rocher, C'est moi qu'il y faut attacher !"")",1.43,Substitution
235,"('#phinee', ""Non, demeurez pour voir ce qui se passe ; Et songez à m'en faire un fidèle rapport, Tandis que je m'apprête à cet illustre effort."")","('#choeur', 'Divinités des Flots, Quel courroux vous anime Contre une innocente victime ?')",1.35,Substitution
236,"('#timante', ""Seigneur, le souvenir des plus âpres supplices, Quand un tel bien les suit, n'a jamais que délices. Si d'un mal sans pareil nous nous vîmes surpris, Nous bénissons le ciel d'un tel mal à ce prix ; Et voyant quel époux il donne à la princesse, La douleur s'en termine en ces chants d'allégresse."")","('#cassiope #cephee', 'Divinités des Flots, Quel courroux vous anime Contre une innocente victime ?')",1.15,Substitution
237,"('#le-choeur', 'Vivez, vivez, heureux amants, Dans les douceurs que l\'amour vous inspire ; Vivez heureux, et vivez si longtemps, Qu\'au bout d\'un siècle entier on puisse encore vous dire : ""Vivez, heureux amants."" Que les plaisirs les plus charmants Fassent les jours d\'une si belle vie ; Qu\'ils soient sans tache, et que tous leurs moments Fassent redire même à la voix de l\'envie : ""Vivez, heureux amants."" Que les peuples les plus puissants Dans nos souhaits à pleins voeux nous secondent ; Qu\'aux dieux pour vous ils prodiguent l\'encens, Et des bouts de la terre à l\'envi nous répondent : ""Vivez, heureux amants.""')","('#choeur', ""C'est notre unique espoir, Faut-il vous l'arracher ? Nos voeux, nos pleurs, nos cris, Rien ne vous peut toucher"")",0.7,Substitution
238,"('#cephee', ""Allons, amis, allons, dans ce comble de joie, Rendre grâces au ciel de l'heur qu'il nous envoie. Allons dedans le temple avec mille voeux De cet illustre hymen achever les beaux noeuds. Allons sacrifier à Jupiter son père, Le prier de souffrir ce que nous pensons faire, Et ne s'offenser pas que ce noble lien Fasse un mélange heureux de son sang et du mien."")","('#cassiope #cephee', ""C'est notre unique espoir, Faut-il vous l'arracher ? Nos voeux, nos pleurs, nos cris, Rien ne vous peut toucher"")",0.81,Substitution
239,"('#cassiope', ""Souffrez qu'auparavant par d'autres sacrifices Nous nous rendions des eaux les déités propices. Neptune est irrité ; les nymphes de la mer Ont de nouveaux sujets encore de s'animer ; Et comme mon orgueil fit naître leur colère, Par mes submissions je dois les satisfaire. Sur leurs sables, témoins de tant de vanités, Je vais sacrifier à leurs divinités ; Et conduisant ma fille à ce même rivage, De ces mêmes beautés leur rendre un plein hommage, Joindre nos voeux au sang des taureaux immolés, Puis nous vous rejoindrons au temple où vous allez."")","('#andromede', ""Dieux ! Qui me destinez une mort si cruelle Hélas ! Pourquoi flattiez-vous  De l'espoir d'un destin si doux ? Vous dont je tiens la vie Et vous peuple fidèle, Jouissez parmi vous d'une paix éternelle, Je vais fléchir les dieux irrités contre vous. Et si ma mère est criminelle, C'est moi qui dois calmer le céleste courroux ! Par le sang que j'ai reçu d'elle, Heureuse de périr pour le salut de tous. Un souvenir charmant qu'en mourant je rappelle. Les appas, les douceurs d'une amour maternelle Sont de mon triste sort les plus terribles coups. Le fils de Jupiter eut été mon époux ! Ah ! Que ma vie eut été belle ! Dieux ! Qui me destinez une mort si cruelle Hélas ! Pourquoi me flattiez-vous De l'espoir d'un destin si doux ? Tremblez ! Superbe Reine. Tremblez ! Mortels audacieux ! Que votre orgueil apprenne Combien votre grandeur est vaine : Tremblez mortels audacieux ! Redoutez le courroux de Dieux"")",0.0,Match
240,"('#persee', ""Souffrez qu'en même temps de ma fière marâtre Je tâche d'apaiser la haine opiniâtre ; Qu'un pareil sacrifice et de semblables voeux Tirent d'elle l'aveu qui peut me rendre heureux. Vous savez que Junon à ce lien préside, Que sans elle l'hymen marche d'un pied timide, Et que sa jalousie aime à persécuter Quiconque ainsi que moi sort de son Jupiter."")","('#choeur-des-tritons', 'Tremblez mortels audacieux ! Redoutez le courroux de Dieux')",0.59,Substitution
241,,"('#cassiope', 'Ah ! Quelle vengeance inhumaine !')",1.0,Deletion
242,,"('#cephee', 'Andromède !')",1.0,Deletion
243,,"('#cassiope', 'Ma fille !')",1.0,Deletion
244,,"('#andromede', 'Ô cieux !')",1.0,Deletion
245,"('#cephee', ""Je suis ravi de voir qu'au milieu de vos flammes De si dignes respects règnent dessus vos âmes. Allez, j'immolerai pour vous à Jupiter, Et je ne vois plus rien enfin à redouter. Des dieux les moins bénins l'éternelle puissance Ne veut de nous qu'amour et que reconnaissance ; Et jamais leur courroux ne montre de rigueurs Que n'abatte aussitôt l'abaissement des coeurs."")","('#cassiope', ""Que les dieux sont cruels ! qu'ils sont ingénieux À faire ressentir leur haine !"")",1.01,Substitution
246,,"('#cephee', 'Andromède !')",1.0,Deletion
247,,"('#cassiope', 'Ma fille !')",1.0,Deletion
248,"('#ammon', ""Vos amis assemblés brûlent tous de vous suivre, Et Junon dans son temple entre vos mains le livre. Ce rival, presque seul au pied de son autel, Semble attendre à genoux l'honneur du coup mortel. Là, comme la déesse agréera la victime, Plus les lieux seront saints, moindre en sera le crime ; Et son aveu changeant de nom à l'attentat, Ce sera sacrifice au lieu d'assassinat."")","('#andromede', 'Ô cieux ! Le monstre paraît.')",1.4,Substitution
249,"('#phinee', ""Que me sert que Junon, que Neptune propice, Que tous les dieux ensemble aiment ce sacrifice, Si la seule déesse à qui je fais des voeux Ne m'en voit que d'un oeil d'autant plus rigoureux, Et si ce coup, sensible au coeur de l'inhumaine, D'un injuste mépris fait une juste haine ? Ami, quelque fureur qui puisse m'agiter, Je cherche à l'acquérir, et non à l'irriter ; Et m'immoler l'objet de sa nouvelle flamme, Ce n'est pas le chemin de rentrer dans son âme."")","('#cephee #cassiope #ethiopiens', 'Le monstre approche de ces lieux, Ah, quelle vengeance inhumaine !')",0.94,Substitution
250,"('#ammon', 'Mais, seigneur, vous touchez à ce moment fatal Qui pour jamais la donne à cet heureux rival. En cette extrémité que prétendez-vous faire ?')","('#nereides #tritons', 'Tremblez, mortels audacieux, etc.')",0.84,Substitution
251,"('#phinee', ""Tout, hormis l'irriter ; tout, hormis lui déplaire : Soupirer à ses pieds, pleurer à ses genoux, Trembler devant sa haine, adorer son courroux."")","('#andromede', ""A s'exposer pour moi c'est en vain qu'il s'obstine. Persée vole, et combat le monstre."")",0.93,Substitution
252,"('#ammon', 'Quittez, quittez, seigneur, un respect si funeste ; Ôtez-vous ce rival, et hasardez le reste : En dût-elle à jamais dédaigner vos soupirs, La vengeance elle seule a de si doux plaisirs...')","('#nereides #tritons', 'Téméraire Persée, arrêtez ; respectez La vengeance divine.')",0.41,Substitution
253,"('#phinee', ""N'en cherchons les douceurs, ami, que les dernières. Rarement un amant les peut goûter entières ; Et quand de sa vengeance elles sont tout le fruit, Ce sont fausses douceurs que l'amertume suit. La mort de son rival, les pleurs de son ingrate, Ont bien je ne sais quoi qui dans l'abord le flatte ; Mais de ce cher objet s'en voyant plus haï, Plus il s'en est flatté, plus il s'en croit trahi. Sous d'éternels regrets son âme est abattue, Et sa propre vengeance incessamment le tue. Ce n'est pas que je veuille enfin la négliger : Si je ne puis fléchir, je cours à me venger ; Mais souffre à mon amour, mais souffre à ma faiblesse Encore un peu d'effort auprès de ma princesse. Un amant véritable espère jusqu'au bout, Tant qu'il voit un moment qui peut lui rendre tout. L'inconstante, peut-être encore toute étonnée, N'était pas bien à soi quand elle s'est donnée ; Et la reconnaissance a fait plus que l'amour En faveur d'une main qui lui rendait le jour. Au sortir du péril, pâle encore et tremblante, L'image de la mort devant les yeux errante, Elle a cru tout devoir à son libérateur ; Mais souvent le devoir ne donne pas le coeur ; Il agit rarement sans un peu d'imposture, Et fait peu de présents dont ce coeur ne murmure. Peut-être, ami, peut-être après ce grand effroi Son amour en secret aura parlé pour moi : Les traits mal effacés de tant d'heureux services, Les douceurs d'un beau feu qui furent ses délices, D'un regret amoureux touchant son souvenir, Auront en ma faveur surpris quelque soupir, Qui s'échappant d'un coeur qu'elle force à ma perte, M'en aura pu laisser la porte encore ouverte. Ah ! Si ce triste hymen se pouvait éloigner !"")","('#cephee #cassiope #ethiopiens', ""Magnanime héros, combattez, remportez Le prix que l'amour vous destine."")",0.82,Substitution
254,,"('#nereides #tritons', 'Le fils de Jupiter brave notre courroux.')",1.0,Deletion
255,"('#ammon', 'Quoi ? Vous voulez encore vous faire dédaigner ? Sous ce honteux espoir votre fureur se dompte ?')","('#tous-ensemble', 'Le monstre expire sous ses coups.')",1.35,Substitution
256,"('#phinee', ""Que veux-tu ? Ne sois point le témoin de ma honte : Andromède revient ; va trouver nos amis, Va préparer leurs bras à ce qu'ils m'ont promis. Ou mes nouveaux respects fléchiront l'inhumaine, Ou ses nouveaux mépris animeront ma haine ; Et tu verras mes feux, changés en juste horreur, Armer mes désespoirs, et hâter ma fureur."")","('#nereide #triton', ""Junon a vainement cherché notre assistance ; Nous nous vantions en vain d'achever sa vengeance. Et Persée a pour lui des dieux plus forts que nous,"")",0.5,Substitution
257,"('#ammon', ""Je vous plains ; mais enfin j'obéis, et vous laisse."")","('#nereides #tritons', ""Descendons sous les ondes : Notre honte se doit cacher ; Allons chercher Des retraites profondes, Descendons sous les ondes. La mer s'apaise ; les flots s'abaissent et se retirent. Les Néréides et les Tritons disparaissent."")",1.71,Substitution
258,,"('#ethiopiens', 'Le monstre est mort ; Persée en est vainqueur ;  Persée est invincible.')",1.0,Deletion
259,"('#phinee', ""Une seconde fois, adorable princesse, Malgré de vos rigueurs l'impérieuse loi..."")","('#cephee #cassiope', ""Quand l'amour anime un grand coeur, Il ne trouve rien d'impossible."")",1.51,Substitution
260,"('#andromede', 'Quoi ? Vous voyez la reine, et vous parlez à moi !')","('#cephee #andromede', 'Ah ! Que votre danger me paraissait terrible !')",1.65,Substitution
261,"('#phinee', 'C\'est de vous seule aussi que j\'ai droit de me plaindre : Je serais trop heureux de la voir vous contraindre, Et n\'accuserais plus votre infidélité, Si vous vous excusiez sur son autorité. Au nom de cette amour autrefois si puissante, Aidez un peu la mienne à vous faire innocente : Dites-moi que votre âme à regret obéit, Qu\'un rigoureux devoir malgré vous me trahit ; Donnez-moi lieu de dire : "" elle-même elle en pleure, Elle change forcée, et son coeur me demeure ; "" Et soudain, de la reine embrassant les genoux, Vous m\'y verrez mourir sans me plaindre de vous. Mais que lui puis-je, hélas ! Demander pour remède, Quand la main qui me tue est celle d\'Andromède, Et que son coeur léger ne court au changement Qu\'avec la vanité d\'y courir justement ?')","('#ethiopens', 'Le monstre est mort, etc. Les Éthiopiens descendent des rochers, et témoignent leur joie en chantant et en dansant. Des matelots et des matelottes se mêlent dans la réjouissance publique. Un des éthiopiens chante au milieu des matelots qui dansent.')",1.62,Substitution
262,"('#cassiope', ""Et quel droit sur ce coeur pouvait garder Phinée, Quand Persée a trouvé la place abandonnée, Et n'a fait autre chose, en prenant son parti, Que s'emparer d'un lieu dont vous étiez sorti ? Mais sorti, le dirai-je, et pourrez-vous l'entendre ? Oui, sorti lâchement, de peur de le défendre. Ainsi nous n'avons fait que le récompenser D'un bien où votre bras venait de renoncer, Que vous cédiez au monstre, à lui-même, à tout autre : Si c'est une injustice, examinons la vôtre. La voyant exposée aux rigueurs de son sort, Vous vous étiez déjà consolé de sa mort ; Et quand par un héros le ciel l'a garantie, Vous ne vous pouvez plus consoler de sa vie."")","('#un-des-ethiopiens', ""Notre espoir allait faire naufrage ; Nous goûtons enfin un heureux sort. Quel bonheur d'échapper à l'orage ! Quel plaisir d'en retracer l'image, Quand on est au port !"")",0.95,Substitution
263,"('#phinee', 'Ah ! Madame...')",,1.0,Insertion
264,"('#cassiope', ""Eh bien ! Soit, vous avez soupiré Autant que l'a pu faire un coeur désespéré. Jamais aucun tourment n'égala votre peine ; Certes, quelque douleur dont votre âme fût pleine, Ce désespoir illustre et ces nobles regrets Lui devaient un peu plus que des soupirs secrets. À ce défaut, Persée..."")","('#cephee', ""Honorons à jamais le glorieux héros Qui nous donne un heureux repos. Sa valeur, à son gré, fait voler la victoire : Tour-à-tour la terre et les flots Sont le théâtre de sa gloire. Honorons à jamais, etc. Andromède, Cassiope et les Éthiopiens, répètent les vers que Céphée a chantés et les Matelots et les Matelottes dansent en réjouissance de la délivrance d'Andromède."")",0.49,Substitution
265,"('#phinee', ""Ah ! C'en est trop, madame ; Ce nom rend, malgré moi, la fureur à mon âme : Je me force au respect ; mais toujours le vanter, C'est me forcer moi-même à ne rien respecter. Qu'a-t-il fait, après tout, si digne de vous plaire, Qu'avec un tel secours tout autre n'eût pu faire ? Et tout héros qu'il est, qu'eût-il osé pour vous, S'il n'eût eu que sa flamme et son bras comme nous ? Mille et mille auraient fait des actions plus belles, Si le ciel comme à lui leur eût prêté des ailes ; Et vous les auriez vus encore plus généreux, S'ils eussent vu le monstre et le péril sous eux : On s'expose aisément quand on n'a rien à craindre. Combattre un ennemi qui ne pouvait l'atteindre, Voir sa victoire sûre et daigner l'accepter, C'est tout le rare exploit dont il se peut vanter ; Et je ne comprends point ni quelle en est la gloire, Ni quel grand prix mérite une telle victoire."")","('#un-des-ethiopiens', ""Que n'aimez-vous ? Coeurs insensibles ! Que n'aimez-vous ? Rien n'est si doux ! Non, ne vous vantez pas d'être invincibles ; Les dieux, les plus grands dieux, ont aimé tous."")",0.09,Substitution
266,"('#cassiope', ""Et votre aveuglement sera bien moins compris, Qui d'un sujet d'estime en fait un de mépris. Le ciel, qui mieux que nous connaît ce que nous sommes, Mesure ses faveurs au mérite des hommes ; Et d'un pareil secours vous auriez eu l'appui, S'il eût pu voir en vous mêmes vertus qu'en lui. Ce sont grâces d'en haut rares et singulières, Qui n'en descendent point pour des âmes vulgaires ; Ou pour en mieux parler, la justice des cieux Garde ce privilège au digne sang des dieux : C'est par là que leur roi vient d'avouer sa race."")","('#le-choeur', ""Que n'aimez-vous, etc."")",1.47,Substitution
267,"('#andromede', 'Je dirai plus, Phinée ; et pour vous faire grâce, Je veux ne rien devoir à cet heureux secours Dont ce vaillant guerrier a conservé mes jours ; Je veux fermer les yeux sur toute cette gloire, Oublier mon péril, oublier sa victoire, Et quel qu\'en soit enfin le mérite ou l\'éclat, Ne juger entre vous que depuis le combat. Voyez ce qu\'il a fait, lorsque après ces alarmes, Me voyant toute acquise au bonheur de ses armes, Ayant pour lui les dieux, ayant pour lui le roi, Dans sa victoire même il s\'est vaincu pour moi. Il m\'a sacrifié tout ce haut avantage ; De toute sa conquête il m\'a fait un hommage ; Il m\'en a fait un don ; et fort de tant de voix, Au péril de tout perdre, il met tout à mon choix : Il veut tenir pour grâce un si juste salaire ; Il réduit son bonheur à ne me point déplaire ; Préférant mes refus, préférant son trépas À l\'effet de ses voeux qui ne me plairait pas. En usez-vous de même ? Et votre violence Garde-t-elle pour moi la même déférence ? Vous avez contre vous et les dieux et le roi, Et vous voulez encore m\'obtenir malgré moi ! Sous ombre d\'une foi qui se tient en réserve, Je dois à votre amour ce qu\'un autre conserve ; À moins que d\'être ingrate à mon libérateur, À moins que d\'adorer un lâche adorateur, Que d\'être à mes parents, aux dieux mêmes rebelle, Vous crierez après moi sans cesse : "" à l\'infidèle ! "" C\'était aux yeux du monstre, au pied de ce rocher, Que l\'effet de ma foi se devait rechercher ; Mon âme, encore pour vous de même ardeur pressée, Vous eût tendu la main au mépris de Persée, Et cru plus glorieux qu\'on m\'eût vue aujourd\'hui Expirer avec vous que régner avec lui. Mais puisque vous m\'avez envié cette joie, Cessez de m\'envier ce que le ciel m\'envoie ; Et souffrez que je tâche enfin à mériter, Au refus de Phinée, un fils de Jupiter.')","('#un-des-ethiopiens', ""L'amour n'a plus de traits terribles Pour un coeur qui cède à ses coups."")",1.1,Substitution
268,,"('#le-choeur', ""Que n'aimez-vous, etc."")",1.0,Deletion
269,"('#phinee', ""Je perds donc temps, madame, et votre âme obstinée N'a plus amour, ni foi, ni pitié pour Phinée ? Un peu de vanité qui flatte vos parents, Et d'un rival adroit les respects apparents, Font plus en un moment, avec leurs artifices, Que n'ont fait en six ans ma flamme et mes services ? Je ne vous dirai point que de pareils respects À tout autre que vous pourraient être suspects, Que qui peut se priver de la personne aimée N'a qu'une ardeur civile et fort mal allumée, Que dans ma violence on doit voir plus d'amour : C'est un présent des cieux, faites-lui votre cour ; Plus fidèle qu'à moi, tenez-lui mieux parole : J'en vais rougir pour vous, cependant qu'il me vole ; Mais ce rival peut-être, après m'avoir volé, Ne sera pas toujours sur ce cheval ailé."")","('#un-des-ethiopiens', ""Pour un amant Tendre et fidèle ; Pour un amant Tout est charmant. L'espoir nourrit ses feux ; sa chaîne est belle ; Il se fait un plaisir de son tourment."")",0.36,Substitution
270,"('#andromede', ""Il n'en a pas besoin s'il n'a que vous à craindre."")",,1.0,Insertion
271,"('#phinee', 'Il peut avec le temps être le plus à plaindre.')",,1.0,Insertion
