287,"('#tircis', ""Traître ! C'est donc ainsi que ma soeur méprisée Sert à ton changement d'un sujet de risée, C'est ainsi qu'à sa foi Mélite osant manquer, D'un parjure si noir ne fait que se moquer ? C'est ainsi que sans honte à mes yeux tu subornes Un amour qui pour moi devait être sans bornes ? Suis-moi tout de ce pas, que l'épée à la main Un si cruel affront se répare soudain ; Il faut que pour tous deux ta tête me réponde."")","('#tirsis', ""Traître, c'est donc ainsi que ma soeur méprisée  Sert à ton changement d'un sujet de risée,  Qu'à tes suasions Mélite osant manquer  À ce qu'elle a promis ne s'en fait que se moquer,  Qu'oubliant tes serments, déloyal, tu subornes  Un amour qui pour moi devait être sans bornes ?  Avise à te défendre, un affront si cruel  Ne se peut réparer à moins que d'un duel,  Il faut que pour tous deux ta tête me réponde. "")",0.0,Match
288,"('#philandre', ""Si pour te voir trompé tu te déplais au Monde, Cherche en ce désespoir qui t'en veuille arracher : Quant à moi, ton trépas me coûterait trop cher."")","('#philandre', ""Si pour te voir trompé, tu te déplais au monde,  Cherche en ce désespoir qui t'en veuille arracher,  Quant à moi, ton trépas me coûterait trop cher,  Il me faudrait après par une prompte fuite  Éloigner trop longtemps les beaux yeux de Mélite. "")",0.0,Match
289,"('#tircis', 'Quoi, tu crains le duel !')",,1.0,Insertion
290,"('#philandre', ""Non ; mais j'en crains la suite, Où la mort du vaincu met le vainqueur en fuite, Et du plus beau succès le dangereux éclat Nous fait perdre l'objet et le prix du combat[.]"")",,1.0,Insertion
291,"('#tircis', ""Tant de raisonnement et si peu de courage Sont de tes lâchetés le digne témoignage. Viens, ou dis que ton sang n'oserait s'exposer."")","('#tirsis', 'Ce discours de bouffon ne me satisfait pas,  Nous sommes seuls ici, dépêchons, pourpoint bas. ')",0.75,Substitution
292,,"('#philandre', ""Vivons plutôt amis, et parlons d'autre chose. "")",1.0,Deletion
293,,"('#tirsis', ""Tu n'oserais, je pense. "")",1.0,Deletion
294,"('#philandre', ""Mon sang n'est plus à moi, je n'en puis disposer. Mais puisque ta douleur de mes raisons s'irrite, J'en prendrai dès ce soir le congé de Mélite. Adieu."")","('#philandre', ""Il est tout vrai, je n'ose,  Ni mon sang, ni ma vie en péril exposer  Ils ne sont plus à moi, je n'en puis disposer,  Adieu, celle qui veut qu'à présent je la serve  Mérite que pour elle ainsi je me conserve. "")",0.0,Match
295,"('#tircis', ""Tu fuis, perfide, et ta légèreté T'ayant fait criminel, te met en sûreté ! Reviens, reviens défendre une place usurpée Celle qui te chérit vaut bien un coup d'épée. Fais voir que l'infidèle, en se donnant à toi A fait choix d'un amant qui valait mieux que moi, Soutiens son jugement, et sauve ainsi de blâme Celle qui pour la tienne a négligé ma flamme. Crois-tu qu'on la mérite à force de courir ? Peux-tu m'abandonner ses faveurs sans mourir ? Ô lettres, ô faveurs indignement placées, À ma discrétion honteusement laissées, Ô gages qu'il néglige ainsi que superflus, Je ne sais qui de nous vous diffamez le plus, Je ne sais qui des trois doit rougir davantage, Car vous nous apprenez qu'elle est une volage, Son amant un parjure, et moi sans jugement De n'avoir rien prévu de leur déguisement. Mais il le fallait bien que cette âme infidèle Changeant d'affection prît un traître comme elle, Et que le digne amant qu'elle a su rechercher À sa déloyauté n'eût rien à reprocher. Cependant j'en croyais cette fausse apparence, Dont elle repaissait ma frivole espérance, J'en croyais ses regards, qui tout remplis d'amour Étaient de la partie en un si lâche tour. Ô ciel ! Vit-on jamais tant de supercherie, Que tout l'extérieur ne fût que tromperie ? Non, non, il n'en est rien, une telle beauté Ne fut jamais sujette à la déloyauté. Faibles et seuls témoins du malheur qui me touche, Vous êtes trop hardis de démentir sa bouche. Mélite me chérit, elle me l'a juré ; Son oracle reçu, je m'en tiens assuré. Que dites-vous là contre ? Êtes-vous plus croyables ? Caractères trompeurs, vous me contez des fables, Vous voulez me trahir ; mais vos efforts sont vains : Sa parole a laissé son coeur entre mes mains. A ce doux souvenir ma flamme se rallume : Je ne sais plus qui croire ou d'elle ou de sa plume : L'une et l'autre en effet n'ont rien que de léger ; Mais du plus ou du moins je n'en puis que juger. Loin, loin, doutes flatteurs que mon feu me suggère ; Je vois trop clairement qu'elle est la plus légère ; La foi que j'en reçus s'en est allée en l'air, Et ces traits de sa plume osent encor parler, Et laissent en mes mains une honteuse image Où son coeur, peint au vif, remplit le mien de rage. Oui, j'enrage, je meurs, et tous mes sens troublés D'un excès de douleur se trouvent accablés ; Un si cruel tourment me gêne et me déchire, Que je ne puis plus vivre avec un tel martyre. Mais cachons-en la honte, et nous donnons du moins Ce faux soulagement, en mourant sans témoins. Que mon trépas secret empêche l'infidèle D'avoir la vanité que je sois mort pour elle."")","('#tirsis', ""Quoi ? Tu t'enfuis, perfide, et ta légèreté  T'ayant fait criminel te met en sûreté ?  Reviens, reviens défendre une place usurpée,  Celle qui te chérit vaut bien un coup d'épée,  Fais voir que l'infidèle en se donnant à toi  A fait choix d'un amant qui valait mieux que moi,  Soutiens son jugement, et sauve ainsi de blâme  Celle qui pour la tienne a négligé ma flamme  Crois-tu qu'on la mérite à force de courir ?  Peux-tu m'abandonner ses faveurs sans mourir ?  Si de les plus garder ton peu d'esprit se lasse,  Viens me dire du moins ce qu'il faut que j'en fasse. Ne t'en veux-tu servir qu'à me désabuser ?  N'ont-elles point d'effet qui soit plus à priser ?  Ô lettres, ô faveurs indignement placées, À ma discrétion honteusement laissées,  Ô gages qu'il néglige ainsi que superflus,  Je ne sais qui des trois vous diffamez le plus,  De moi, de ce perfide, ou bien de sa maîtresse,  Car vous nous apprenez qu'elle est une traîtresse,  Son amant un poltron, et moi sans jugement  De n'avoir rien prévu de son déguisement.  Mais que par ces transports ma raison est surprise !  Pour ce manque de coeur qu'à tort je le méprise !  (Hélas ! À mes dépens, je le puis bien savoir,)  Quand on a vu Mélite on n'en peut plus avoir.  Fuis donc, homme sans coeur, va dire à ta volage  Combien sur ton rival ta fuite a d'avantage,  Et que ton pied léger ne laisse à ma valeur  Que les vains mouvements d'une juste douleur,  Ce lâche naturel qu'elle fait reconnaître  Ne t'aimera pas moins étant poltron que traître.  Traître, et poltron ! Voilà les belles qualités  Qui retiennent les sens de Mélite enchantés  Aussi le fallait-il que cette âme infidèle  Changeant d'affection, prît un traître comme elle,  Et la jeune rusée a bien su rechercher  Un qui n'eût sur ce point rien à lui reprocher,  Cependant que leurré d'une fausse apparence  Je repaissais de vent ma frivole espérance.  Mais je le méritais, et ma facilité  Tentait trop puissamment son infidélité,  Je croyais à ses yeux, à sa mine embrasée,  À ces petits larcins pris d'une force aisée,  Hélas ! Et se peut-il que ces marques d'amour  Fussent de la partie en un si lâche tour ?  Aurait-on jamais vu tant de supercherie  Que tout l'extérieur ne fût que piperie ?  Non, non, il n'en est rien, une telle beauté  Ne fut jamais sujette à la déloyauté :  Faibles, et seuls témoins du malheur qui me touche,  Vous êtes trop hardis de démentir sa bouche,  Mélite me chérit, elle me l'a juré,  Son oracle reçu je m'en tins assuré,  Que dites[-vous] là contre ? Êtes-vous plus croyables ?  Caractères trompeurs, vous me contez des fables,  Vous voulez me trahir, vous voulez m'abuser,  J'ai sa parole en gage, et de plus un baiser.  À ce doux souvenir ma flamme se rallume,  Je ne sais plus qui croire ou d'elle, ou de sa plume,  L'une et l'autre en effet n'ont rien que de léger Mais du plus, ou du moins, je n'en puis que juger.  C'est en vain que mon feu ces doutes me suggère,  Je vois trop clairement qu'elle est la plus légère,  Les serments que j'en ai, s'en vont au vent jetés,  Et ses traits de sa plume, ici me sont restés,  Qui dépeignant au vif son perfide courage  Remplissent de bonheur Philandre, et moi de rage ;  Oui j'enrage, je crève, et tous mes sens troublés  D'un excès de douleur succombent accablés,  Un si cruel tourment me gêne, et me déchire  Que je ne puis plus vivre, avec un tel martyre,  Aussi ma prompte mort le va bientôt finir,  Déjà mon coeur outré, ne cherchant qu'à bannir  Cet amour qui l'a fait si lourdement méprendre  Pour lui donner passage, est tout prêt de se fendre  Mon âme par dépit, tâche d'abandonner  Un corps que sa raison, sût si mal gouverner  Mes yeux jusqu'à présent, couvert de mille nues,  S'en vont les distiller en larmes continues,  Larmes qui donneront pour juste châtiment  À leur aveugle erreur, un autre aveuglement  Et mes pieds qui savaient sans eux, sans leur conduite  Comme insensiblement me porter chez Mélite  Me porteront sans eux en quelque lieu désert  En quelque lieu sauvage à peine découvert,  Où ma main d'un poignard achèvera le reste,  Où pour suivre l'arrêt de mon destin funeste  Le répandrai mon sang, et j'aurai pour le moins  Ce faible et vain soulas en mourant sans témoins  Que mon trépas secret fera que l'infidèle  Ne pourra se vanter que je sois mort pour elle. "")",0.0,Match
296,"('#cloris', ""Mon frère, en ma faveur retourne sur tes pas, Dis-moi la vérité ; tu ne me cherchais pas. Et quoi, tu fais semblant de ne me pas connaître ? Ô dieux ! En quel état te vois-je ici paraître ! Tu pâlis tout_à_coup, et tes louches regards S'élancent incertains presque de toutes parts ! Tu manques à la fois de couleur et d'haleine ! Ton pied mal affermi ne te soutient qu'à peine ! Quel accident nouveau te trouble ainsi les sens ?"")","('#cloris', ""Mon frère en ma faveur retourne sur tes pas,  Dis-moi la vérité, tu ne me cherchais pas  Et quoi ? Tu fais semblant de ne me pas connaître  Ô Dieux ! En quel état, te vois-je ici paraître  Tu pâlis tout_à_coup, et tes louches regards  S'élancent incertains presque de toutes parts  Tu manques à la fois, de poumon et d'haleine  Ton pied mal affermi ne te soutient qu'à peine  Quel accident nouveau te brouille ainsi les sens. "")",0.0,Match
297,"('#tircis', ""Puisque tu veux savoir le mal que je ressens, Avant que d'assouvir l'inexorable envie De mon sort rigoureux qui demande ma vie, Je vais t'assassiner d'un fatal entretien, Et te dire en deux mots mon malheur et le tien : En nos chastes amours de tous deux on se moque, Philandre... Ah ! La douleur m'étouffe et me suffoque. Adieu, ma soeur, adieu, je ne puis plus parler, Lis, et, si tu le peux, tâche à te consoler."")","('#tirsis', ""Puisque tu veux savoir le mal que je ressens,  Avant que d'assouvir l'inexorable envie  De mon sort rigoureux qui demande ma vie,  Je vais t'assassiner d'un fatal entretien,  Et te dire en deux mots mon malheur et le tien.  En nos chastes amours de nous deux on se moque, Philandre, ah la douleur m'étouffe et me suffoque,  Adieu, ma soeur, adieu, je ne peux plus parler,  Lis, puis si tu le peux, tâche à te consoler. "")",0.0,Match
298,"('#cloris', ""Ne m'échappe donc pas."")","('#cloris', ""Ne m'échappe donc pas. "")",0.0,Match
299,"('#tircis', 'Ma soeur, je te supplie...')","('#tirsis', 'Ma soeur, je te supplie [... ]')",0.0,Match
300,"('#cloris', ""Quoi ! Que je t'abandonne à ta mélancolie ? Voyons auparavant ce qui te fait mourir, Et nous aviserons à te laisser courir."")","('#cloris', ""Quoi ! Que je t'abandonne à ta mélancolie ? Non, non, quand j'aurai su ce qui te fait mourir,  Si bon me semble alors, je te lairrai courir.  Elle lit les Lettres que Tirsis lui avait données."")",0.0,Match
301,"('#tircis', 'Hélas ! Quelle injustice !')","('#tirsis', 'Hélas ! Quelle injustice ! ')",0.0,Match
302,"('#cloris', ""Est-ce là tout, fantasque ? Quoi ! Si la déloyale enfin lève le masque, Oses-tu te fâcher d'être désabusé ? Apprends qu'il te faut être en amour plus rusé, Apprends que les discours des filles bien sensées Découvrent rarement le fond de leurs pensées, Et que les yeux aidant à ce déguisement, Notre sexe a le don de tromper finement. Apprends aussi de moi que ta raison s'égare, Que Mélite n'est pas une pièce si rare, Qu'elle soit seule ici qui vaille la servir : Assez d'autres objets, y sauront te ravir. Ne t'inquiète point pour une écervelée, Qui n'a d'ambition que d'être cajolée, Et rend à plaindre ceux qui flattant ses beautés Ont assez de malheur pour en être écoutés. Damon lui plut jadis, Aristandre, et Géronte ; Eraste après deux ans n'y voit pas mieux son compte, Elle t'a trouvé bon seulement pour huit jours, Philandre est aujourd'hui l'objet de ses amours ; Et peut-être déjà (tant elle aime le change) Quelque autre nouveauté le supplante et nous venge. Ce n'est qu'une coquette avec tous ses attraits, Sa langue avec son coeur ne s'accorde jamais. Les infidélités sont ses jeux ordinaires, Et ses plus doux appas sont tellement vulgaires, Qu'en elle homme d'esprit n'admira jamais rien, Que le sujet pourquoi tu lui voulais du bien."")","('#cloris', ""Est-ce là tout, fantasque ?  Quoi ! Si la déloyale enfin lève le masque  Oses-tu te fâcher d'être désabusé ?  Apprends qu'il te faut être en amour plus rusé,  Apprends que les discours des filles mieux sensées  Découvrent rarement le fond de leurs pensées,  Et que les yeux aidant à ce déguisement  Notre sexe a le don de tromper finement :  Apprends aussi de moi que ta raison s'égare,  Que Mélite n'est pas une pièce si rare,  Qu'elle soit seule ici qui vaille la servir,  Tant d'autres te sauront en sa place ravir,  Avec trop plus d'attraits que cette écervelée, Qui n'a d'ambition que d'être cajolée  Par les premiers venus qui flattant ses beautés  Ont assez de malheur pour en être écoutés.  Ainsi Damon lui plut, Aristandre, et Géronte,  Éraste après deux ans n'en a pas meilleur compte,  Elle t'a trouvé bon seulement pour huit jours,  Philandre est aujourd'hui l'objet de ses amours,  Et peut-être demain (tant elle aime le change)  Quelque autre nouveauté le supplante et nous venge.  Ce n'est qu'une coquette, une tête à l'évent,  Dont la langue et le coeur s'accordent peu souvent,  À qui les trahisons deviennent ordinaires,  Et dont tous les appas sont tellement vulgaires,  Qu'en elle homme d'esprit n'admira jamais rien  Que le sujet pourquoi tu lui voulais du bien. "")",0.0,Match
303,"('#tircis', ""Penses-tu m'arrêter par ce torrent d'injures ? Que ce soient vérités, que ce soient impostures, Tu redoubles mes maux au lieu de les guérir : Adieu, rien que la mort ne peut me secourir."")","('#tirsis', ""Penses-tu m'amusant avecques des sottises  Par tes détractions rompre mes entreprises  Non, non ces traits de langue épandus vainement  Ne m'arrêteraient pas, encor un seul moment. "")",0.42,Substitution
304,"('#cloris', ""Mon frère. Il s'est sauvé ; son désespoir l'emporte, Me préserve le ciel d'en user de la sorte, Un volage me quitte, et je le quitte aussi, Je l'obligerais trop de m'en mettre en souci. Pour perdre des amants, celles qui s'en affligent Donnent trop d'avantage à ceux qui les négligent, Il n'est lors que la joie, elle nous venge mieux ; Et la fit-on à faux éclater par les yeux, C'est montrer par bravade à leur vaine inconstance Qu'elle est pour nous toucher de trop peu d'importance. Que Philandre à son gré rende ses voeux contents; S'il attend que j'en pleure, il attendra longtemps, Son coeur est un trésor dont j'aime qu'il dispose, Le larcin qu'il m'en fait me vole peu de chose, Et l'amour qui pour lui m'éprit si follement M'avait fait bonne part de son aveuglement. On enchérit pourtant sur ma faute passée, Dans la même folie une autre embarrassée Le rend encor parjure, et sans âme, et sans foi, Pour se donner l'honneur de faillir après moi. Je meure, s'il n'est vrai, que la moitié du monde Sur l'exemple d'autrui se conduit et se fonde, À cause qu'il parut quelque temps m'enflammer, La pauvre fille a cru qu'il valait bien l'aimer, Et sur cette croyance elle en a pris envie ; Lui pût-elle durer jusqu'au bout de sa vie ; Si Mélite a failli me l'ayant débauché, Dieux, par là seulement punissez son péché. Elle verra bientôt que sa digne conquête N'est pas une aventure à me rompre la tête, Un si plaisant malheur m'en console à l'instant. Ah, si mon fou de frère en pouvait faire autant, Que j'en aurais de joie, et que j'en ferais gloire ! Si je puis le rejoindre, et qu'il me veuille croire, Nous leur ferons bien voir que leur change indiscret Ne vaut pas un soupir, ne vaut pas un regret. Je me veux toutefois en venger par malice ; Me divertir une heure à m'en faire justice ; Ces lettres fourniront assez d'occasion D'un peu de défiance, et de division. Si je prends bien mon temps, j'aurai pleine matière À les jouer tous deux d'une belle manière. En voici déjà l'un qui craint de m'aborder."")","('#cloris', ""Mon frère, il s'est sauvé, son désespoir l'emporte  Me préserve le Ciel d'en user de la sorte.  Un volage me quitte, et je le quitte aussi  Je l'obligerais trop de m'en mettre en souci,  Pour perdre des amants celles qui s'en affligent  Donnent trop d'avantage à ceux qui les négligent.  Il n'est lors que la joie, elle nous venge mieux,  Et la fit-on à faux éclater par les yeux,  C'est toujours témoigner que leur vaine inconstance  Est pour nous émouvoir de trop peu d'importance,  Aussi ne veux-je pas le retenir d'aller  Et si d'autres que moi ne le vont rappeler  Il usera ses jours à courtiser Mélite  Outre que l'infidèle a si peu de mérite  Que l'amour qui pour lui m'éprit si follement  M'avait fait bonne part de son aveuglement  On enchérit pourtant sur ma faute passée  Dans la même sottise une autre embarrassée,  Le rend encor parjure, et sans âme, et sans foi  Pour se donner l'honneur de faillir après moi,  Je meure s'il n'est vrai que la moitié du monde  Sur l'exemple d'autrui se conduit et se fonde,  À cause qu'il parut quelque temps m'enflammer  La pauvre fille a cru qu'il valait bien l'aimer  Et sur cette croyance elle en a pris envie,  Lui peut-elle durer jusqu'au bout de sa vie,  Si Mélite a failli me l'ayant débauché  Dieux par là seulement punissez son péché,  Elle verra bientôt quoi qu'elle se propose  Qu'elle n'a pas gagné, ni moi perdu grand-chose,  Ma perte me console, et m'égaye à l'instant  Ah si mon fou de frère en pouvait faire autant  Qu'en ce plaisant malheur, je serais satisfaite !  Si je puis découvrir le lieu de sa retraite  Et qu'il me veuille croire éteignant tous ses feux  Nous passerons le temps à ne rire que d'eux.  Je la ferai rougir, cette jeune éventée,  Lorsque son écriture à ses yeux présentée  Mettant au jour un crime estimé si secret,  Elle reconnaîtra qu'elle aime un indiscret.  Je lui veux dire alors pour aggraver l'offense,  Qui Philandre avec moi toujours d'intelligence  Me fait des contes d'elle, et de tous les discours  Qui servent d'aliment à ses vaines amours,  Si qu'à peine il reçoit de sa part une lettre,  Qu'il ne vienne en mes mains aussitôt la remettre,  La preuve captieuse, et faite en même temps  Produira sur le champ l'effet que j'en attends. "")",0.0,Match
305,"('#cloris', 'Quoi ! Tu passes, Philandre, et sans me regarder ?')",,1.0,Insertion
306,"('#philandre', ""Pardonne-moi, de grâce, une affaire importune M'empêche de jouir de ma bonne fortune, Et son empressement, qui porte ailleurs mes pas, Me remplissait l'esprit jusqu'à ne te voir pas."")","('#philandre', ""Donc pour l'avoir tenu si longtemps en haleine  Il me faudra souffrir une éternelle peine,  Et payer désormais avecque tant d'ennui  Le plaisir que j'ai pris à me jouer de lui ?  Vit-on jamais amant, dont la jeune insolence  Malmenât un rival, avec tant d'imprudence ?  Vit-on jamais amant, dont l'indiscrétion  Fût de tel préjudice à son affection ?  Les lettres de Mélite en ses mains demeurées  En ses mains, autant vaut à jamais égarées  Ruinent à la fois ma gloire, mon honneur,  Mes desseins, mon espoir, mon repos, et mon heur,  Mon trop de vanité tout au rebours succède,  J'ai reçu des faveurs, et Tirsis les possède,  Et cet amant trahi convaincra sa beauté  Par des signes si clairs de sa déloyauté.  C'est mal avec Mélite être d'intelligence  D'armer son ennemi, d'instruire sa vengeance ;  Me pourra-t-elle après regarder de bon oeil ?  M'oserais-je en promettre un gracieux accueil ?  Non il les faut ravoir des mains de ce bravache,  Et laver de son sang cette honteuse tache,  De force, ou d'amitié, j'en aurai la raison,  Je m'en vais l'affronter jusques dans sa maison,  Et là si je le trouve, il faudra que sur l'heure  En dépit qu'il en ait il les rende, ou qu'il meure. "")",0.41,Substitution
307,,"('#philandre', 'Tirsis. ')",1.0,Deletion
308,,"('#cloris', 'Que lui veux-tu ? ')",1.0,Deletion
309,"('#cloris', ""J'ai donc souvent le don d'aimer plus qu'on ne m'aime, Je ne pense qu'à toi, j'en parlais en moi-même."")","('#philandre', ""Cloris pardonne-moi  Si je cherche plutôt à lui parler qu'à toi,  Nous avons entre nous quelque affaire qui presse. "")",0.92,Substitution
310,,"('#cloris', 'Le crois-tu rencontrer hors de chez sa maîtresse ? ')",1.0,Deletion
311,"('#philandre', 'Me veux-tu quelque chose ?')","('#philandre', ""Sais-tu bien qu'il y soit ? "")",0.22,Substitution
312,,"('#cloris', ""Non pas assurément,  Mais j'ose présumer que l'aimant chèrement  Le plus qu'il peut de temps, il le passe chez elle. "")",1.0,Deletion
313,,"('#philandre', ""Je m'en vais de ce pas, le trouver chez la belle,  Adieu, jusqu'au revoir. Je meurs de déplaisir. "")",1.0,Deletion
314,"('#cloris', ""Il t'ennuie avec moi ; Mais comme de tes feux j'ai pour garant ta foi, Je ne m'alarme point. N'était ce qui te presse, Ta flamme un peu plus loin eût porté la tendresse, Et je t'aurais fait voir quelques vers de Tircis Pour le charmant objet de ses nouveaux soucis. Je viens de les surprendre, et j'y pourrais encore, Joindre quelques billets de l'objet qu'il adore, Mais tu n'a pas le temps. Toutefois, si tu veux Perdre un demi-quart d'heure à les lire nous deux..."")","('#cloris', ""Un mot, Philandre, un mot, n'aurais-tu point loisir  De voir quelques papiers, que je viens de surprendre ? "")",0.09,Substitution
315,,"('#philandre', ""Qu'est-ce qu'au bout du compte, ils me pourraient apprendre ? "")",1.0,Deletion
316,,"('#cloris', ""Peut-être leurs secrets : regarde si tu veux  Perdre un demi-quart d'heure à les lire nous deux. "")",1.0,Deletion
317,"('#philandre', ""Voyons donc ce que c'est, sans plus longue demeure ; Ma curiosité pour ce demi-quart d'heure ; S'osera dispenser."")","('#philandre', ""Hasard, voyons ce que c'est, mais vite, et sans plus demeure,  Ma curiosité pour un demi-quart d'heure  Se pourra dispenser. "")",0.0,Match
318,"('#cloris', ""Aussi tu me promets, Quand tu les auras lus, de n'en parler jamais ; Autrement, ne crois pas..."")","('#cloris', ""Mais aussi garde-bien  Qu'en discourant ensemble, il n'en découvre rien,  Promets-le moi, sinon [... ]"")",0.28,Substitution
319,"('#philandre', ""Cela s'en va sans dire, Donne, donne-les-moi, tu ne les saurais lire, Et nous aurions ainsi besoin de trop de temps[.]"")","('#philandre', ""Cela s'en va sans dire,  Donne, donne-les-moi, tu ne les saurais lire,  Et nous aurions ainsi besoin de trop de temps.  Il reconnaît les lettres et tâche de s'en saisir, mais Cloris les resserre. "")",0.0,Match
320,"('#cloris', ""Philandre, tu n'es pas encore où tu prétends ; Quelque hautes faveurs que ton mérite obtienne, Elles sont aussi bien en ma main qu'en la tienne, Je les garderai mieux, tu peux en assurer La belle qui pour toi daigne se parjurer."")","('#cloris', ""Philandre, tu n'es pas encore où tu prétends,  Assure, assure-toi, que Cloris te dépite  De les ravoir jamais que des mains de Mélite  À qui je veux montrer avant qu'il soit huit jours,  La façon dont tu tiens secrètes ses amours.  Elle lui ferme la porte au nez."")",0.0,Match
321,"('#philandre', ""Un homme doit souffrir d'une fille en colère, Mais je sais comme il faut les ravoir de ton frère, Tout exprès je le cherche, et son sang, ou le mien..."")",,1.0,Insertion
322,"('#cloris', ""Quoi, Philandre est vaillant, et je n'en savais rien ! Tes coups sont dangereux quand tu ne veux pas feindre, Mais ils ont le bonheur de se faire peu craindre, Et mon frère, qui sait comme il s'en faut guérir, Quand tu l'aurais tué, pourrait n'en pas mourir."")","('#philandre', ""Confus, désespéré, que faut-il que je fasse ?  J'ai malheur sur malheur, disgrâce sur disgrâce,  On dirait que le Ciel ami de l'équité  Prend le soin de punir mon infidélité.  Si faut-il néanmoins en dépit de sa haine  Que Tirsis retrouvé me tire hors de peine,  Il faut qu'il me les rende, il le faut et je veux  Qu'un duel accepté les mette entre nous deux,  Et si je suis alors encore ce Philandre  Par un détour subtil qu'il ne pourra comprendre,  Elles demeureront, le laissant abusé,  Sinon au plus vaillant, du moins au plus rusé. "")",0.01,Substitution
323,"('#philandre', ""L'effet en fera foi, s'il en a le courage. Adieu. J'en perds le temps à parler davantage. Tremble."")",,1.0,Insertion
324,"('#cloris', ""J'en ai grand lieu, connaissant ta vertu, Pourvu qu'il y consente, il sera bien battu."")",,1.0,Insertion
