,barante-arlequin-misanthrope,biancolelli-ecole-galante,Cost,Operation Type
488,"('#arlequin', 'Mais encore, sur quoi assignez-vous les trente milles pistoles de rente que vous proposez ?')",,1.0,Insertion
489,"('#monsieur-de-la-cabriole', 'Sur la souplesse de mon jarret. Il saute.')",,1.0,Insertion
490,"('#monsieur-de-geresol', 'Sur la douceur de mon gosier. Il fredonne.')","('#octave', ""Un tel aveu m'enchante."")",1.15,Substitution
491,"('#monsieur-de-la-cabriole', ""Sur la fraîcheur d'Oriane."")",,1.0,Insertion
492,"('#monsieur-de-geresol', 'Sur les petites façons de Corisande.')",,1.0,Insertion
493,"('#monsieur-de-la-cabriole', 'Sur les Minauderies des Chanteuses.')",,1.0,Insertion
494,"('#monsieur-de-geresol', 'Sur le blanc et le rouge des Danseuses.')",,1.0,Insertion
495,"('#arlequin', ""Sur les brouillards de la rivière de Seine, et sur la constance de l'amour.  Je ne vois point mes sûretés là-dedans, et il me semble qu'une Chacone, et une Sarabande ne sont pas des Marchandises de bon débit."")","('#leandre', ""Je l'ai trouvé tantôt, et comme un imprudent Je l'ai de mes secrets rendu le confident, En l'instruisant d'abord de ma flamme nouvelle : Mais que faire ? Mon cher, j'adore cette belle, A ses yeux Arlequin est un monstre odieux, Si j'en crois ses discours, je lui plais beaucoup mieux : M'avoir pour son époux est ce qu'elle désire, Et mon coeur amoureux à ce bonheur aspire. Malgré le noir souci du jaloux Arlequin, J'ai chargé d'un billet mon valet Mezzetin ; Lui-même à cette belle aura soin de le rendre ; Il sait où la conduire, et moi je vais l'attendre."")",0.56,Substitution
496,"('#monsieur-de-la-cabriole', ""Hé, morbleu, si vous êtes si délicat, tant pis pour vous ; mais sachez qu'aujourd'hui dans le commerce, les meilleures Lettres de Change sont celles qu'on tire sur l'Opéra."")",,1.0,Insertion
497,"('#monsieur-de-geresol', ""Et qu'un créancier remet toujours le tiers de la dette, pour une rescription sur la Caisse de l'Académie Royale de Danse et de Musique."")",,1.0,Insertion
498,"('#arlequin', ""Je le crois.  Mais je ne suis point tenté ; je ne veux dans la ville que je bâtis, ni Musiciens, ni Danseurs, il n'y aura que des gens sobres."")","('#octave', ""De grâce, cher ami, ne m'abandonnez pas, Je veux avec Spinette accompagner vos pas, Et dans le même endroit conduisant nos Maîtresses, Nous ferons éclater nos égales tendresses. Le Docteur doit dans peu sortir de la Maison, Vous pouvez me servir en cette occasion."")",0.78,Substitution
499,"('#monsieur-de-la-cabriole', ""Ma foi, Monsieur le petit fondateur, nous y perdrons beaucoup !  La menace est terrible, mais l'Opéra de Lyon nous tend les bras."")",,1.0,Insertion
500,"('#monsieur-de-geresol', ""En tous cas, il ne tiendra qu'à nous d'assister au rétablissement de celui de Rouen."")",,1.0,Insertion
501,"('#arlequin', 'À la bonne heure.')",,1.0,Insertion
502,"('#monsieur-de-la-cabriole', ""Pour votre petite Bicoque, tout y sera de travers, et puisque vous en excluez les Maîtres à Danser, jamais rien n'y sera sur le bon pied."")",,1.0,Insertion
503,"('#arlequin', 'Soit.')","('#leandre', ""Octave j'y consens. Et vôtre amour me touche."")",1.47,Substitution
504,"('#monsieur-de-geresol', 'Que les habitants de cette Ville ne puissent jamais ouvrir la bouche sans détonner.')",,1.0,Insertion
505,"('#monsieur-de-la-cabriole', 'Que quand ils voudront danser la Courante, ils dansent le Rigodon.')",,1.0,Insertion
506,"('#monsieur-de-geresol', ""Qu'ils chantent par bécarre les airs de bémol."")",,1.0,Insertion
507,"('#monsieur-de-la-cabriole', ""En un mot, qu'ils soient impolis, malfaits, et sans goût, comme des gens qui méprisent la danse et la Musique."")",,1.0,Insertion
508,"('#monsieur-de-geresol', 'Que les femmes y aient des maris jaloux, et soupirent inutilement après un Maître à Chanter, pour rendre leurs Billets.')",,1.0,Insertion
509,"('#arlequin', 'Quelles imprécations !  Mais voici mon Architecte.')","('#octave', 'Voici fort à propos mon valet Scaramouche.')",1.2,Substitution
510,"('#madame-de-l-architrave', ""Ma foi, Monsieur, voilà qui ne va point mal, j'ai mis bien des gens en besogne, la Ville s'avance, et nos Ouvriers travaillent comme il faut."")","('#octave', ""Attends ici Spinette. Il faut enlever, Avec elle bien-tôt tu viendras me trouver Au coin de cette rue, où nous allons l'attendre."")",1.07,Substitution
511,"('#arlequin', 'Comment, travaillent ?  À peine avez-vous eu le temps de faire le plan de ce que vous avez à bâtir ?')","('#scaramouche', 'Vous êtes de moitié, vous et Monsieur Léandre, Et vous avez acquis ce bien à fond perdu.')",1.51,Substitution
512,"('#madame-de-l-architrave', ""Bon !  Vous me prenez donc pour un architecte d'eau-douce ?  J'ai déjà fait mettre des Écriteaux pour attirer des Acheteurs et des Locataires."")",,1.0,Insertion
513,"('#arlequin', 'Elle est folle ?  Quoi, des maisons qui ne sont pas encore faites...')",,1.0,Insertion
514,"('#madame-de-l-architrave', ""Vous voilà bien nouveau !  Et ne savez-vous pas qu'il est à présent du bel usage de vendre les maisons dix ans avant d'en jeter les premiers fondements ?"")",,1.0,Insertion
515,"('#arlequin', ""D'accord.  Mais il faut..."")","('#octave', ""Réponds-moi comme il faut, m'as-tu bien entendu ?"")",0.99,Substitution
516,"('#madame-de-l-architrave', 'Et, que diriez-vous donc, si je vous montrais à présent les troisièmes étages tout faits ?')",,1.0,Insertion
517,"('#arlequin', 'Je dirais, je dirais...  Morbleu, je ne dirais rien, et je dis que vous êtes une extravagante.')",,1.0,Insertion
518,"('#madame-de-l-architrave', ""Mais sérieusement je vous dis, que c'est là ma manière, je commence toujours par le haut, on travaille ensuite au reste."")",,1.0,Insertion
519,"('#arlequin', 'La folle !')",,1.0,Insertion
520,"('#madame-de-l-architrave', ""Chacun a son humeur, les uns bâtissent sur la terre, d'autres sur la mer : pour moi l'air est mon élément ; je bâtis toujours en l'air.  Mais parlons d'autre chose.  Ces trois filles, ou soi-disant telles, qui ont deux doigts de plâtre sur le nez, et qui sont arrivées avec un vieux Commandeur dans un Carrosse, dont les chevaux semblaient prêts à rendre l'âme..."")",,1.0,Insertion
521,"('#arlequin', 'Hé bien ?')",,1.0,Insertion
522,"('#madame-de-l-architrave', ""Hé bien, elles disent qu'elles c'accommoderont du troisième étage de la maison qui fera le coin auprès du Marché, à condition que vous leur ferez faire une allée à part, et une porte de derrière sur la petite rue."")",,1.0,Insertion
523,"('#arlequin', ""Les allées à part, et les portes de derrière sont merveilleuses, pour donner de l'air à l'honneur d'une femme.  Mais gare le serein."")",,1.0,Insertion
524,"('#madame-de-l-architrave', ""C'est de l'argent comptant, elles paieront le premier quartier d'avance."")",,1.0,Insertion
525,"('#arlequin', ""Elles feront bien.  Tout le monde n'est pas en humeur de se payer par ses mains comme leur dernier hôte."")",,1.0,Insertion
526,"('#madame-de-l-architrave', ""Il est encore venu un procureur qui prendra la maison la plus élevée de la grande rue : mais il lui faut cinq pièces parquetées au premier étage.  C'est pour loger sa femme."")",,1.0,Insertion
527,"('#arlequin', ""Un Procureur ?  Je ne veux point de cette vermine dans l'enceinte des murs.  Aux Faubourgs, aux Faubourgs."")","('#scaramouche', ""Qui ne vous entendrait serait bien dur d'oreille."")",1.5,Substitution
528,"('#madame-de-l-architrave', 'Ah, Monsieur, gardez-vous en bien ; il ferait payer à ses parties ce qui lui en coûterait pour se faire voiturer au Palais.  Nous ne sommes pas dans un temps où les Procureurs puissent aller à pied.')",,1.0,Insertion
529,"('#arlequin', ""Madame de l'Architrave ?"")",,1.0,Insertion
530,"('#madame-de-l-architrave', 'Monsieur ?')",,1.0,Insertion
531,"('#arlequin', 'Avez-vous fait le plan des petites maisons ?')",,1.0,Insertion
532,"('#madame-de-l-architrave', 'Des petites maisons ?  Et vous ne voulez, dites-vous, que des gens raisonnables.')",,1.0,Insertion
533,"('#arlequin', 'Il me faut des petites maisons, vous dis-je.  Mais je les voudrais petites, petites.')",,1.0,Insertion
534,"('#madame-de-l-architrave', ""Et pourquoi si petites, dès qu'il vous en faut ?"")","('#octave', 'Il la faut enlever...')",1.34,Substitution
535,"('#arlequin', ""C'est que j'y veux enfermer les gens raisonnables, de peur que le commerce des autres ne les gâte.  Vous voyez qu'il ne faut pas pour cela grand espace."")","('#scaramouche', ""Je comprends à merveille. Vous êtes en amour tous deux associés, J'y serais pour un tiers si vous me receviez."")",1.47,Substitution
536,"('#madame-de-l-architrave', ""À propos, que voulez-vous faire de ce grand Hôpital d'Incurables ?"")",,1.0,Insertion
537,"('#arlequin', ""Diable, faites-le grand.  Je le destine pour loger les Marchands qui vendent à crédit aux gens de Cour, les vieilles qui épousent de jeunes gens, s'il y avait place, j'y logerais aussi les amants contemplatifs et les filles qui s'embarquent sur la parole des épouseurs."")","('#octave', ""Si-tôt que le Docteur aura quitté Spinette, Cours l'appeler, et songe à battre la retraite ; Adieu, nous t'attendons."")",1.03,Substitution
538,"('#madame-de-l-architrave', ""On y travaille déjà, il sera au coin de la grande place vis-à-vis de l'horloge."")",,1.0,Insertion
539,"('#arlequin', ""Comment l'horloge ?  Je ne veux dans ma Ville ni horloge ni cadran."")",,1.0,Insertion
540,"('#madame-de-l-architrave', ""Point d'horloge ?"")",,1.0,Insertion
541,"('#arlequin', ""Non, sans doute, je veux qu'on fasse toutes choses selon l'occasion, et l'opportunité, et qu'on ne se règle pas sur un coup de marteau.  D'ailleurs, les femmes des gens de Robe n'entendant pas sonner les heures, ne se précautionneront pas contre l'arrivée de leur mari, qui trouvera au retour du Palais, les Galants à la toilette de sa femme."")","('#scaramouche', ""Allez toujours devant,  Et pendant ce temps là voyez d'où vient le Vent. Voici le dénouement de notre comédie : Quand le Docteur saura que sa fille est partie, D'abord contre mon Maître il fera décréter ; Messieurs les pousse-culs viendront le visiter, Ils me prendront aussi, moi j'avouerai l'affaire Comme étant du complot je ne pourrai rien taire : J'entendrai contre moi prononcer un arrêt, On fera tout d'abord préparer le gibet, Et Scaramouche ira sans en avoir envie, Danser la Sarabande en bonne compagnie. Belle réflexion ; mais voici le Docteur, Retirons nous... Il s'en va."")",0.43,Substitution
542,"('#madame-de-l-architrave', 'Quelle malice !')",,1.0,Insertion
543,"('#arlequin', ""Et les écornifleurs n'entendant jamais sonner midi, ne se précautionneront pas pour dîner en Ville."")",,1.0,Insertion
544,"('#madame-de-l-architrave', ""Oh ; pour cela, précaution inutile, je vous garantis les parasites suffisamment avertis par l'acide de leur estomac, et assez réveillés par l'odeur des viandes.  Mais qui est cet homme qui vient ?  Ne serait-ce point quelque futur habitant ?"")","('#octave', ""Je vais chercher mon débiteur. Et me faire payer la somme qui m'est due. Son Obligation dés longtemps est échue, Il n'aura pas, je crois, de peine à l'acquitter ; D'ici pour un moment il me faut écarter. Il s'en va."")",1.39,Substitution
545,"('#arlequin', 'Nous allons voir.')",,1.0,Insertion
546,"('#madame-de-l-architrave', ""Pour moi je vais donner ordre à tout, afin que les choses s'avancent."")","('#scaramouche', 'Ne perdons point de temps ; hola Mademoiselle ! Descendez au plutôt, la gloire vous appelle.')",1.09,Substitution
547,"('#le-libraire', ""Vous voyez, Monsieur, un homme qui, si la fortune lui en avait dit, se serait tenu en carrosse aussi bien qu'un autre.  Je n'ai jamais manqué de coeur, Dieu merci, et j'ai bien autant d'ambition qu'aucun Libraire de Paris."")","('#scaramouche', ""Suivez-moi, s'il vous plaît, mon Maître vous attend, Je suis son Substitut, son Commis, son Agent, Il m'a passé son ordre, afin qu'en son absence J'acquitte son Billet au temps de l'échéance ; Je vais vous le payer en espèce ayant cours."")",0.8,Substitution
548,"('#arlequin', ""Ce n'est pas peu."")",,1.0,Insertion
549,"('#le-libraire', ""Quant à moi, je crus en m'établissant, qu'une belle femme était le premier ornement d'une bibliothèque, et qu'un joli minois faisait plus d'effet derrière un comptoir que cent in-folio sur des tablettes."")",,1.0,Insertion
550,"('#arlequin', ""Il y a du vrai à cela, au moins ; et je connais plus d'un marchand dont l'étalage vaut mieux que le fonds."")",,1.0,Insertion
551,"('#le-libraire', 'Je choisis pour épouse une jeune personne, belle, bien faite, de bon air, et par-dessus cela, bel esprit, et bel esprit juré.')","('#spinette', 'Scaramouche, partons, et finis tes discours, Je crains que dans ces lieux mon père ne revienne. Enlève-moi donc vite.')",1.69,Substitution
552,"('#arlequin', ""Ce dernier point n'est pas tout à fait décisif pour la paix du ménage, et pour la douceur du commerce.  Mais enfin, votre moitié vous attirait-elle bien des chalands ?"")","('#scaramouche', ""Ah, qu'à cela ne tienne, L'enlèvement vous plaît."")",1.18,Substitution
553,"('#le-libraire', ""Mon heureuse Boutique ne désemplissait point : à quelque heure qu'on y vint, on y trouvait gens d'Épée, de Robe, de Finance, Abbés et surtout grand nombre de Provinciaux."")",,1.0,Insertion
554,"('#arlequin', ""Tous ces gens-là attirés bien plus par les agréments du tendron que par l'envie d'acheter des Livres."")",,1.0,Insertion
555,"('#le-libraire', ""C'est ce que je n'ai jamais bien pu décider ; car quoi qu'ils parussent fort empressés auprès de ma femme, et qu'il n'y en eût pas un, qui par-ci par là, ne lui décochât quelque fleurette, ils ne laissaient pas d'acheter fort cher les bagatelles que me fournissaient trois grands diseurs de rien, et un Auteur femelle, dont la plume avait encore plus de rapidité que la langue."")","('#spinette', ""Je ne puis t'exprimer Le plaisir que j'éprouve ; oui, je me sens charmer, Ne nous arrêtons pas, je meurs d'impatience, Ce doux enlèvement flatte mon espérance."")",0.69,Substitution
556,"('#arlequin', ""Je ne m'étonne pas si elle a fait tant de Volumes."")","('#scaramouche', ""D'où vous vient cette joie ?"")",1.34,Substitution
557,"('#le-libraire', ""C'était une aimable femme.  Elle faisait un Livre en une nuit."")","('#spinette', ""En lisant des romans, J'ai pris beaucoup de goût pour les enlèvements. Allons trouver Octave."")",1.49,Substitution
558,"('#arlequin', ""Les jolies femmes de ce temps-ci, n'emploient pas si mal les leurs.  Mais comment en usait la vôtre ?"")",,1.0,Insertion
559,"('#le-libraire', ""Le mieux du monde, et je n'ai jamais vu personne se plaindre d'elle."")",,1.0,Insertion
560,"('#arlequin', ""Femme si accommodante accommode pour l'ordinaire un mari de toutes pièces."")","('#scaramouche', ""Il faut vous satisfaire, Quand je serais pendu ce n'est pas une affaire. "")",1.57,Substitution
561,"('#le-libraire', ""Oh, pour moi j'ai cela de bon, je ne suis point sujet au mal de tête.  Il est vrai que quelques contrôleurs de profession remarquaient que de mes enfants aucun ne me ressemblait, et qu'ils avaient de l'air, l'un d'un Colonel, l'autre d'un jeune Magistrat, à qui j'ai dressé une Bibliothèque de Romans."")","('#mezzetin', ""Mon Maître honnêtement veut se servir de moi, Et de Courtier d'Amour il me donne l'emploi : Aujourd'hui ce métier est assez en usage, Avec un grand plaisir j'en fais l'apprentissage ; Pour mieux me distinguer, et me faire un beau nom, Je devrais bien porter des ailes au talon, Chacun me connaîtrait, et me rendrait hommage : Mais allons au plutôt faire nôtre message : À sa belle je dois remettre le poulet, Et m'acquitter de tout en fidèle Valet. Il m'a fait voir l'endroit où je dois la conduire, Faisons donc promptement ce que son coeur désire. Il frappe."")",0.79,Substitution
562,"('#arlequin', ""C'est-à-dire qu'il en était de vos enfants comme de ces Livres dont l'Épître dédicatoire est sous votre nom ?  Vous faites les honneurs de l'ouvrage d'autrui."")","('#argentine', ""Que voulez-vous, l'ami ?"")",1.46,Substitution
563,"('#le-libraire', ""Ma foi, si on regardait de près, on trouverait autant de plagiaires dans les familles que dans la République des Lettres.  Heureux qui sait s'accommoder de sa femme !  Je me trouvais fort bien de la mienne ; et tant qu'elle a été jeune et jolie, j'ai triomphé.  Mais à présent qu'elle n'est que jolie sans être jeune..."")",,1.0,Insertion
564,"('#arlequin', ""Vous n'avez plus cette affluence dans votre Boutique ?"")",,1.0,Insertion
565,"('#le-libraire', ""Pardonnez-moi, j'ai encore assez de gens chez moi.  Mais, Monsieur, ma femme a plus de quarante ans."")",,1.0,Insertion
566,"('#arlequin', ""Ainsi ils n'y viennent que pour la conversation ?"")","('#mezzetin', 'Vous rendre ce billet, De la part de Léandre.')",1.55,Substitution
567,"('#le-libraire', 'Justement.  Ils ont fait de ma Boutique une Académie de beaux esprits, où ma femme régente parmi les Historiens, les Poètes, et les diseurs de bons mots.')",,1.0,Insertion
568,"('#arlequin', 'Il faut bien de ces gens-là pour échauffer une Cuisine.')",,1.0,Insertion
569,"('#le-libraire', ""Que voulez-vous, j'ai dupé le public, et le public m'a dupé ; chacun à son tour...  Je lui troquais d'abord des bagatelles pour de bon argent, il les prenait avidement ; je crus qu'il se laisserait tromper plus longtemps, et me donnerait celui de faire une fortune complète."")",,1.0,Insertion
570,"('#arlequin', ""Le public est un compère capricieux dont il faut brusquer le goût : pendant qu'il vous en disait que n'en profitiez-vous mieux ?"")","('#argentine', ""Ah, donnez s'il vous plaît."")",1.31,Substitution
571,"('#le-libraire', ""Si je puis revenir sur l'eau, que je profiterai de vos avis !  Plus de romans, ni d'Historiettes, j'y renonce...  de bons livres de maximes, et de caractères.  Ce sont ceux-là dont on voit en quatre mois doubler le prix, et multiplier les éditions.  Voilà ce qui fait rouler un libraire en carrosse."")","('#mezzetin', ""Vous êtes, je le vois, fort âpre à la curée, Et fillette en amour n'est jamais modérée."")",1.03,Substitution
572,"('#arlequin', ""Cela n'est pas tout à fait sûr, le goût change là-dessus ; et on plonge dans la bagatelle.  Ainsi, si vous voulez avoir de l'argent du public, il faut l'endormir par des contes ce Fées, le réveiller par des rapsodies, ou l'amuser par de petits jeux ; comme le Gage-touché, Cache-mitoulas, et Colin-Maillard.  Voilà des titres cela !"")","('#argentine', ""Pour vous dérober au pouvoir Du Jaloux odieux que votre coeur abhorre, N'écoutez point un barbare devoir, Et répondez au feu qui me dévore ; Avec mon Valet Mezzetin, Dans le lieu qu'il connaît vous n'avez qu'à vous rendre, Et vous y trouverez Léandre, Qui vous prépare un plus heureux destin. LÉANDRE."")",0.78,Substitution
573,"('#le-libraire', ""Ah, Monsieur, si vous me permettez de m'établir dans votre Ville, voilà les Livres par où je débuterai.  Le Gagetouché !  Quel effet dans une Affiche !"")","('#mezzetin', ""Madame suivez-moi, vous n'avez rien à craindre."")",1.47,Substitution
574,"('#arlequin', 'Fort bien, nous penserons à cela une autre fois ; laissez-moi un moment en repos.')","('#argentine', ""C'est assez, je ne puis plus longtemps me contraindre, Attendez un moment, je reviens sur mes pas. Elle rentre."")",1.02,Substitution
575,"('#le-libraire', ""Je vais en écrire à ma femme.  Qu'elle sera aise de venir débiter ses Romans en style coupé !  Pour peu que vous y donniez la main, notre fortune est faite."")","('#mezzetin', ""Ce petit tendron-là ne me déplairait pas, Cette fille est mignonne, une telle bouteille Rappelle par ma foi son buveur à merveille : Mon Maître est bon gourmet, il a fait un beau choix, Le gaillard en sait long, c'est un futé matois, Il se plaît d'en conter aux femmes comme aux filles, Et c'est un pèlerin qui vend bien ses coquilles. La voici de retour. "")",0.87,Substitution
576,"('#arlequin', 'Adieu, bon soir, et bonne nuit.')",,1.0,Insertion
577,"('#le-libraire', ""L'heureuse rencontre !  L'heureuse rencontre !"")",,1.0,Insertion
578,"('#le-peintre', ""Comme tout ce qu'il y a d'illustres dans le monde, semble s'être donné rendez-vous pour venir peupler votre nouvelle Ville où vous ne voulez rien de commun, agréez que je vous présente un homme en la manière des plus extraordinaires qui se fassent."")",,1.0,Insertion
579,"('#arlequin', 'Où est-il ?')",,1.0,Insertion
580,"('#le-peintre', 'Le voilà.')",,1.0,Insertion
581,"('#arlequin', 'Je le crois.  Mais qui êtes-vous ?')","('#mezzetin', 'Hé bien partirons-nous ?')",1.28,Substitution
582,"('#le-peintre', 'Monsieur, je suis un original sans copie, un Poète muet, un imposteur de bonne foi, un beau morceau moderne qui ne deviendra que trop antique avec le temps.')","('#argentine', ""Ah ! pour le refuser ce plaisir est trop doux ! Je vous suis... Juste Ciel mon importun s'avance !"")",0.9,Substitution
583,"('#arlequin', 'Et avec tout cela, vous êtes gueux, comme un Peintre ?')",,1.0,Insertion
584,"('#le-peintre', ""Il est vrai qu'un Peintre ne va pas si tôt en Carrosse qu'un Caissier ; mais enfin, on ne laisse pas de se tirer d'intrigue ; et depuis que les gens d'affaire se sont jetés dans le goût des tableaux, notre profession est un peu réconciliée avec la fortune.  D'ailleurs, j'ai un talent merveilleux pour le portrait."")",,1.0,Insertion
585,"('#arlequin', ""Et attrapez-vous bien l'air des gens ?  Faites-vous ressembler ?"")",,1.0,Insertion
586,"('#le-peintre', ""À merveille...  J'attrape cela... le tour du visage, le feu des yeux, le coloris du teint...  Il n'y a pas un de mes portraits qui ne ressemble parfaitement."")",,1.0,Insertion
587,"('#arlequin', 'Et avec ce beau talent, peignez-vous bien des femmes ?')",,1.0,Insertion
588,"('#le-peintre', 'Oui da.')",,1.0,Insertion
589,"('#arlequin', ""Vous peignez des femmes, et vous faites ressembler ?  Poursuivez, mon ami, poursuivez, vous êtes dans le grand chemin de l'Hôpital.  Un bon Peintre de femmes doit être un imposteur de profession."")",,1.0,Insertion
590,"('#le-peintre', ""Cela est vrai.  Il y a quelque temps qu'une vieille Marquise me pria de faire son portrait, je fus assez sot pour me piquer de sincérité, je la peignis comme deux gouttes d'eau."")","('#mezzetin', ""Comment ? C'est Arlequin... Un peu de patience, Couvrez-vous le visage, et ne redoutez rien, C'est un franc animal, je le duperai bien."")",0.84,Substitution
591,"('#arlequin', 'Hé bien ?')","('#arlequin', 'Où vas-tu Mezzetin avec cette femelle ?')",1.27,Substitution
592,"('#le-peintre', ""Elle ne se vit pas plutôt comme la nature l'avait faite, qu'elle voulut me faire jeter par les fenêtres, disant que je la rendais hideuse.  À huit jours de là, je lui portai un Portrait que j'avais fait d'une jolie petite personne de dix-huit ans.  Je lui dis que c'était le sien que j'avais raccommodé, elle me fit donner cinquante pistoles, et publie partout, que je suis le premier homme du monde."")","('#mezzetin', ""Et morbleu, gardez vous d'effaroucher la belle, C'est une jeune Enfant, qu'au gré de mes désirs J'ai prise seulement pour mes menus plaisirs, Je l'enlève, mon cher, puisqu'il faut tout vous dire, En lieu de sûreté je prétends la conduire."")",0.72,Substitution
593,"('#arlequin', ""Bon !  Si l'on peignait les gens tels qu'ils sont, ils se feraient peur les uns aux autres."")",,1.0,Insertion
594,"('#le-peintre', ""À vous parler naturellement, mon grand gain n'est pas de faire des Portraits."")",,1.0,Insertion
595,"('#arlequin', 'À quoi donc gagnez-vous davantage ?')","('#arlequin', 'Et ne pourrait-on pas voir la Belle au minois ?')",1.43,Substitution
596,"('#le-peintre', 'À retoucher les anciens originaux.')",,1.0,Insertion
597,"('#arlequin', ""Quoi, vous vous mêlez barbouiller ce qui nous reste de l'antiquité ?"")",,1.0,Insertion
598,"('#le-peintre', ""Vous ne m'entendez pas.  Je dis que je travaille sur les vieux Originaux naturels."")",,1.0,Insertion
599,"('#arlequin', 'Encore moins.')",,1.0,Insertion
600,"('#le-peintre', ""N'avez-vous jamais vu un visage sur lequel les années ou la petite vérole ont sillonné des trous, où les amours à coup sûr ne jouent plus à la fossette...  Tac... tac...  Je vous remplis cela, et rétablis à une face sexagénaire un embonpoint de dix-huit ans."")","('#mezzetin', ""Non pas, mais vous pourrez la voir une autre fois, Elle a de la pudeur, et craint d'être connue, Cette fille en un mot ne veut pas être vue. Adieu... Venez Madame il est temps de partir.  À Argentine."")",0.89,Substitution
601,"('#arlequin', 'Ah, vous êtes fort intelligible à présent.')",,1.0,Insertion
