,moissy-goute,moissy-petit-paysan,Cost,Operation Type
80,"('#le-petit-blandineau', ""Ah ça, si tu dis que nous t'avons battu, si tu le dis, nous dirons, comme l'autre fois, que tu as encore volé des fruits dans le jardin."")","('#le-petit-blandineau', ""Ah ça, si tu dis que nous t'avons battu, si tu le dis, nous dirons, comme l'autre fois, que tu as encore volé des fruits dans le jardin."")",0,Match
81,"('#jannot', ""Allez, n'ayez point peur ; vous m'avez déjà battu plus d'une fois, et je n'en ai rien dit."")","('#jannot', ""Allez, n'ayez point peur ; vous m'avez déjà battu plus d'une fois, et je n'en ai rien dit."")",0,Match
82,"('#le-petit-blandineau', ""Allons, rends-nous ton pain, puisque tu ne veux pas nous aller prendre des poires, tu ne l'auras pas."")","('#le-petit-blandineau', ""Allons, rends-nous ton pain, puisque tu ne veux pas nous aller prendre des poires, tu ne l'auras pas."")",0,Match
83,"('#jannot', ""Oh !  Tenez, le voilà, gardez-le ; je suis bien-aise à présent de n'en pas avoir mangé du tout ; j'aime encore mieux notre pain-bis, on ne me le reproche pas."")","('#jannot', ""Oh !  Tenez, le voilà, gardez-le ; je suis bien-aise à présent de n'en pas avoir mangé du tout ; j'aime encore mieux notre pain-bis, on ne me le reproche pas."")",0,Match
84,"('#monsieur-blandineau', ""Eh bien !  Madame, est-ce là ce que vous m'aviez promis ?"")","('#monsieur-blandineau', ""Eh bien !  Madame, est-ce là ce que vous m'aviez promis ?"")",0,Match
85,"('#madame-blandineau', ""Ah ! ah !  Vous êtes de jolis enfants, j'ai tout entendu.  Voilà donc comme vous m'avez menti tous deux fur le compte de ce pauvre Jannot.  Il est gourmand, il vole les fruits, il est méchant, il est menteur, tandis que c'est vous qui avez tous ces vices-là.  Oh !  Je suis bien-aise de vous connaître."")","('#madame-blandineau', ""Ah ! ah !  Vous êtes de jolis enfants, j'ai tout entendu.  Voilà donc comme vous m'avez menti tous deux fur le compte de ce pauvre Jannot.  Il est gourmand, il vole les fruits, il est méchant, il est menteur, tandis que c'est vous qui avez tous ces vices-là.  Oh !  Je suis bien-aise de vous connaître."")",0,Match
86,"('#jannot', ""Ne vous fâchez pas, Madame, par rapport à moi ; tout cela n'était que pour rire, je vous assure, et je ne suis pas fâché du tout ; je vous promets qu'ils ne m'ont point fait de mal, nous jouions ensemble, voilà tout."")","('#jannot', ""Ne vous fâchez pas, Madame, par rapport à moi ; tout cela n'était que pour rire, je vous assure, et je ne suis pas fâché du tout ; je vous promets qu'ils ne m'ont point fait de mal, nous jouions ensemble, voilà tout."")",0,Match
87,"('#madame-blandineau', ""Vas, mon pauvre Jannot, je te rends justice, et je les punirai tous deux comme ils le méritent. Allons vite, allez-vous en tous deux dans votre chambre, auprès de votre Gouvernante, jusqu'à ce que je vous fasse essuyer la punition que vous méritez. Elle les renvoyé. "")","('#madame-blandineau', ""Vas, mon pauvre Jannot, je te rends justice, et je les punirai tous deux comme ils le méritent. Allons vite, allez-vous en tous deux dans votre chambre, auprès de votre Gouvernante, jusqu'à ce que je vous fasse essuyer la punition que vous méritez. Elle les renvoyé. "")",0,Match
88,"('#monsieur-blandineau', ""Chargez-vous, Madame, de celle de votre Fille, je ne veux point m'en mêler ; ce que je vous conseillerais seulement, serait de lui ôter jusqu'à nouvel ordre, tous ses Maîtres de Musique, de Danse et de Dessein, et de travailler seulement à lui apprendre à bien coudre, à broder, à filer, et à lui former le coeur et l'esprit.  Pour mon fils, la punition qu'il mérite, est que Jannot prenne ici sa place, ses habits, enfin qu'il devienne mon fils, et que ce beau Monsieur-là soit traité comme le fils d'un paysan, je dis plus, comme le plus mauvais sujet de la Nature.  Au reste, Madame, serez-vous encore prévenue contre ce qui résulte de la pauvreté de certains états ?"")","('#monsieur-blandineau', ""Chargez-vous, Madame, de celle de votre Fille, je ne veux point m'en mêler ; ce que je vous conseillerais seulement, serait de lui ôter jusqu'à nouvel ordre, tous ses Maîtres de Musique, de Danse et de Dessein, et de travailler seulement à lui apprendre à bien coudre, à broder, à filer, et à lui former le coeur et l'esprit.  Pour mon fils, la punition qu'il mérite, est que Jannot prenne ici sa place, ses habits, enfin qu'il devienne mon fils, et que ce beau Monsieur-là soit traité comme le fils d'un paysan, je dis plus, comme le plus mauvais sujet de la Nature.  Au reste, Madame, serez-vous encore prévenue contre ce qui résulte de la pauvreté de certains états ?"")",0,Match
89,"('#madame-blandineau', 'Non, Monsieur : malgré la peine que cela me fait, je suis obligée de convenir que cette fois-ci vous avez raison, et que...')","('#madame-blandineau', 'Non, Monsieur : malgré la peine que cela me fait, je suis obligée de convenir que cette fois-ci vous avez raison, et que...')",0,Match
