,barante-arlequin-misanthrope,biancolelli-ecole-galante,Cost,Operation Type
411,"('#monsieur-de-colafon', ""Bon !  Je suis le premier homme du monde, pour escrimer.  C'est moi qui ai eu l'honneur de mettre les armes à la main aux trois quarts de la petite Gendarmerie de la rue Au-fer, et de la rue Saint-Denis."")","('#spinette', ""Je le veux bien, je n'ai plus rien à craindre, Et je puis à présent le voir sans me contraindre, S'il fût entré chez nous sans faire un grand effort, Il aurait découvert la tache tout d'abord."")",1.33,Substitution
412,"('#arlequin', 'Tudieu !  Quels écoliers !')",,1.0,Insertion
413,"('#monsieur-de-colafon', ""Vous allez voir ce que je sais faire.  Allons, faites assaut contre moi. Le Maître à danser présente un Fleuret à Arlequin qui le refuse d'abord, et le prend enfin. Après avoir escrimé quelques moments, le Maître à danser sort un pistolet, et fait rendre la bourse à Arlequin, et s'en va en disant. Voilà une de mes bottes franches."")","('#arlequin', ""LE dessein en est pris, je vais faire carnage, Rien ne peut modérer ma fureur et ma rage : Il faut que l'infidèle expire sous mes coups, Et qu'elle soit l'objet de mon juste courroux. Je ne puis mieux punir le traître qui m'offense, Qu'en faisant sur sa belle éclater ma vengeance. Allons donc ... mais comment la ferai-je mourir ! Pourquoi m'embarrasser ? Elle a de quoi choisir. D'un coup de Mousqueton si je casse sa tête, Cela lui fera mal ... bon je suis une bête, Je ne puis la tuer et lui faire du bien ; Plutôt avec l'épée ... ah ! cela ne vaut rien, Je pourrais la blesser, la pauvre créature, Puis il faudrait payer les frais de sa blessure. Ne perdons point le temps en discours superflus, Je prétends qu'elle meure, ainsi n'en parlons plus. Hola !"")",0.49,Substitution
414,"('#arlequin', ""Au voleur, au voleur ?  Mais voici peut-être quelqu'un de ses camarades.  Taisons-nous, de peur qu'il ne nous en coûte la vie."")",,1.0,Insertion
415,"('#arlequin', ""Hé, bien Madame, Qu'est-ce ?  Qu'y a-t-il ?  Quoi plus ?  De quoi est-il question ?  Que demandez-vous ?  Et que veulent tous ces visages de plâtre ?  Venez-vous me montrer quelque botte franche ?"")","('#argentine', 'Que vois-je, ô Ciel ! Que prétendez-vous faire ?')",0.87,Substitution
416,"('#madame-de-l-architrave', ""Monsieur, je suis une fabricatrice de niches humaines, un antidote contre les injures du temps, un répertoire de la commodité des saisons, un alambic des aises de la vie ; Architecte à votre service, commandant pour l'honneur de vos commandements, une escouade de Limousins."")","('#arlequin', ""Rien, je veux vous purger, et vous tirer d'affaire : Hé bien, c'est donc ainsi, Madame la guenon, Que sans avoir égard à l'honneur, au renom, D'un vilain bois de Cerf vous arborez ma tête ? Il faut que vous mouriez, allons êtes-vous prête ?"")",0.52,Substitution
417,"('#arlequin', ""Hé bien, Madame, du répertoire, de l'alambic, et de l'escouade Limousine, de quoi est-il question ?"")",,1.0,Insertion
418,"('#madame-de-l-architrave', ""D'une petite affaire de rien touchant notre métier ; de bâtir une Ville."")",,1.0,Insertion
419,"('#arlequin', ""Une Ville ?  Il y en a déjà que trop.  Quand les hommes logeaient dans les Bois, ils étaient humains, et ne se mangeaient pas les uns les autres.  Le séjour des villes les a gâtées, les a rendus féroces, et plus ours et plus tigres que les ours et les tigres qu'ils ont laissés dans les forêts."")",,1.0,Insertion
420,"('#madame-de-l-architrave', ""Oh, cela est vrai ; et cependant nombre de gens qui veulent profiter de votre Philosophie, viendront s'établir ici, et vivre avec vous sous vos lois."")",,1.0,Insertion
421,"('#arlequin', 'Une ville ?')",,1.0,Insertion
422,"('#madame-de-l-architrave', ""Sans doute, une Ville pour les Mécontents ; elle sera peuplée dans un instant.  Vous aurez d'abord tous ces importants d'office, qui se plaignent éternellement que la Cour, qui ne les connaît pas, ne fait rien pour eux.  Ces mères Coquettes désespérées du mauvais goût des hommes, qui les quittent pour leurs filles.  Ces Grisettes de conséquence, qui croient que les privautés d'un Duc ou d'un Marquis, leur ont acquis des droits incontestables sur le Carrosse et le nombre de Laquais.  Ces gens de lettres pestant éternellement contre l'injustice de la fortune, et la dureté du siècle, et surtout ce nombre presque infini d'Auteurs altérés, dont tous les théâtres regorgent."")","('#argentine', ""Quoi, vous vous préparez à terminer mes jours, Et vous voulez vous-même en abréger le cours ? Détournez loin de moi cet appareil terrible, Qu'à mes vives douleurs vôtre coeur soit sensible. De tout ce que j'ai fait, ingrat est-ce le prix ? Par où donc ai-je pu m'attirer vos mépris ? Ha, de mes tristes yeux voyez couler mes larmes, Et daignez dissiper mes mortelles alarmes. Quand je veux vous donner le nom de mon époux, Que je cherche à répondre à vos voeux les plus doux, Vous pouvez vous résoudre à m'arracher la vie ! Vôtre fureur sur moi doit-elle etre assouvie ? A vos jaloux soupçons vous voulez m'immoler, Et c'est par vous, cruel, que mon sang, doit couler ?  Pendant qu'Argentine dit ces vers, Arlequin petit à petit laisse tomber toutes ses Armes en pleurant à sa manière, et faisant des lazzi tout plaisants, après quoi Argentine prend un mousqueton et va sur Arlequin, qui se met à genoux devant elle en criant."")",0.51,Substitution
423,"('#arlequin', 'Voilà une Architecte qui a du bon.  Vous êtes de belle humeur, Madame ?')",,1.0,Insertion
424,"('#madame-de-l-architrave', ""Pour vous servir, Monsieur.  L'air joyeux, est la première partie d'un Architecte.  Si nos bâtiments ne sont riants, je n'en donnerais pas une nèfle.  La joie, la joie, partout ?  Il faut de l'air dans les maisons, la vue libre, l'abord aisé, l'aspect gracieux, les avenues faciles, les faux fuyants commodes, et les sorties borgnes et à discrétion."")","('#argentine', ""Non, c'est sur toi qu'il faut qu'éclate ma colère, Je veux exécuter ce que tu n'as su faire, C'est à présent mon tour, et je vais te purger. C'est donc ainsi, faquin, que tu veux te venger ? Ah ! Le vilain magot, apprends à me connaître, Si tu viens au Logis, ma foi, par la fenêtre Je te ferai sortir."")",0.82,Substitution
425,"('#arlequin', 'Voici une femme rare !  Vous êtes donc bien employée, Madame.')",,1.0,Insertion
426,"('#madame-de-l-architrave', ""Oui !  Mais je n'aime à travailler que pour de jeunes veuves, et pour des gens d'affaires ; ce sont là les gens de bon goût, il faut primer avec eux.  Ils ont plus d'invention et de goût pour placer une chaise percée, que les autres pour arranger un cabinet."")",,1.0,Insertion
427,"('#arlequin', 'Les Abbés ne sont-ils pas de ce nombre ?  Vous les oubliez ?')",,1.0,Insertion
428,"('#madame-de-l-architrave', 'Oh point, ce sont des goûts différents.  Les Abbés appuient sur la cuisine, sur la cave, et les fausses portes des ruelles.')","('#arlequin', 'Mais...')",1.73,Substitution
429,"('#arlequin', ""Vous avez raison.  Diable !  Cette femme l'entend !  Est-ce vous qui avez inventé de mettre toutes les fenêtres en portes, surtout du côté des Jardins ?"")",,1.0,Insertion
430,"('#madame-de-l-architrave', ""Je n'ai pas trouvé cette invention, mais je l'ai perfectionnée ?  Vous allez voir ici de quoi je suis capable."")",,1.0,Insertion
431,"('#arlequin', ""Je vois bien qu'il faut s'y résoudre, il faut bien loger tant de gens qui viennent ici.  Car de quoi est-il question ?  Je vous avertis par avance que je veux une ville, qui ne ressemble en rien à Paris, où l'on ne paye point de Boues ni de Lanternes, et dont les rues ne servent que pour les chevaux, les mulets, les crocheteurs, et les autres bêtes de voiture."")","('#argentine', ""Tu parles, je crois ? Je te conseille encor de te jouer à moi ; Dans ta bouche je veux mettre quelque pilule, Mais non, de te tuer je me fais un scrupule, Tu n'en vaux pas la peine : adieu, maître poltron ; C'est ainsi que je sais punir un fanfaron. Elle entre."")",0.91,Substitution
432,"('#madame-de-l-architrave', ""Je suis votre fait.  Voici comme je m'y prendrai.  Je ferai qu'il y aura partout des Balcons publics qui régneront sans interruption de maison en maison, et qui feront un saut par-dessus les rues qu'ils traversent ; les lumières qui éclairent les chambres éclaireront les Balcons, toutes les fenêtres seront des portes pour la commodité du public, et après cela ce sera la faute des particuliers s'ils ne se rendent pas visite."")",,1.0,Insertion
433,"('#arlequin', ""Oui, mais cette commodité me paraît trop commode.  L'occasion fait le larron.  Ces Balcons et ces fenêtres de communication sont cause que l'on communique plus qu'il ne faut.  Tenez, depuis que vous avez inventé à Paris et à la Campagne, ces larges gouttières en forme de Corridor autour des mansardes, les jolies femmes ne logent plus qu'au grenier, et les hommes comme des chats passent la nuit sur les gouttières."")","('#arlequin', ""Voilà comme l'on doit se tirer d'une affaire, Ma foi, j'ai bien du coeur, et l'on ne peut mieux faire, Ah ! Chien de naturel ! J'admire ma valeur, Une femme aujourd'hui m'outrage et me fait peur ! "")",1.33,Substitution
434,"('#madame-de-l-architrave', ""Oh, Monsieur, c'est un abus que de s'abuser sur cela, les chats suivront toujours les chattes, et les femmes trouveront toujours des matous qui les suivront."")",,1.0,Insertion
435,"('#arlequin', ""Je pense qu'elle a raison, c'est un mal sans remède.  Mais revenons à notre Ville."")",,1.0,Insertion
436,"('#madame-de-l-architrave', 'Nous pourrons fort bien la bâtir sue cette Rivière qui est ici près : cela sera fort commode.')",,1.0,Insertion
437,"('#arlequin', ""Peste !  Gardez-vous en bien.  Une rivière ?  Et nous y verrions dans rien établir des Moulins de Javelles, des Charentons, des Ports à l'Anglais, des îles...  Enfin je ne veux point de rivière."")","('#pierrot', ""Petit fouille-partout, Dieu plus méchant qu'un Diable, Amour, c'est trop long temps me rendre misérable : Depuis que sur Pierrot décochant tous tes traits, Tu l'as fait par malice entrer dans tes filets, Il ne fait que languir, pleurer, gémir, et braire, Ma foi pour me guérir je ne sais plus que faire. J'ai depuis quelque temps un cours de ventre affreux : Argentine, mamour, doux objet de mes voeux, Quand soulagerez-vous le tourment que j'endure ? Vous avez un onguent très bon pour la brûlure. Aouf, quel gros soupir ! Non ce n'est pas un jeu, Je brûle là dedans, au feu, Messieurs, au feu."")",0.67,Substitution
438,"('#madame-de-l-architrave', ""Soit, soit ; je suis accommodante.  Il faudra donc la bâtir ici, et ce grand espace nous servira pour faire un beau jardin public, précédé d'une grande avenue d'arbres."")","('#scaramouche', 'Pourquoi crier au feu, ta Maison brûle-t-elle ?')",1.61,Substitution
439,"('#arlequin', 'Hé oui, oui, un Jardin !  Voilà-t-il pas Paris tout revenu ?  Je ne veux ni cours ni Tuileries, entendez-vous, parce que je veux bannir de notre Ville la coquetterie et la médisance.')","('#pierrot', ""Hélas, c'est que l'amour me trouble la cervelle : Je suis devenu fou par faute de raison, Et dans mon estomac je sens comme un tison,  Qui petit à petit par les deux bouts s'allume ; Je crains bien qu'à la fin ce feu ne me consume : Argentine est l'objet qui me fait tant languir, Elle m'aime beaucoup, et ne peut me souffrir."")",1.26,Substitution
440,"('#madame-de-l-architrave', ""J'ai tout prévu, je m'en vais commander mon Escouade de placer mon monde dans les postes convenables. Madame de l'Architrave se retire, et en même temps tous les maçons qui l'accompagnaient bâtissent en dansant, un magnifique Palais."")","('#scaramouche', ""Aux dépens de Pierrot, ma foi je prétends rire : C'est donc-là la beauté pour qui ton coeur soupire ? Comment pauvre nigaud veux-tu t'en faire aimer ? Peut-on en te voyant se laisser enflammer ? Un habit de meunier te sert de couverture, Tu n'as point de cheveux, et ta laide figure Doit plutôt dans une âme inspirer du mépris : Aujourd'hui, mon enfant, on s'attache aux habits, Et quand tu serais beau comme un petit Narcisse, Si tu n'est bien vêtu, tu seras un Jocrisse,"")",0.67,Substitution
441,"('#arlequin', ""Diantre !  C'est bâtir bien gaiement !  Mais pour qui destinez-vous cette habitation superbe ?"")","('#pierrot', ""Comment, c'est donc l'habit qui donne de l'amour ?"")",1.24,Substitution
442,"('#un-maçon', ""Superbe, Monsieur.  Bon !  C'est la maison de campagne d'une fille de l'Opéra.  Ce n'est rien que cela, si vous voyez comme elle est meublée !"")","('#scaramouche', ""Aux habits, à l'argent les femmes font la cour : Est-on riche et bien mis, on doit s'attendre à plaire, La femme aime l'éclat, et non pas la misère. Fagoté de la sorte avec ce vêtement, On te prendrait ma foi pour un sac de froment : Mais si Pierrot voulait reformer sa figure, Et comme un petit Maître affecter la parure, Se mettre tout en frange, et se poudrer le dos, Il serait en amour reçu comme un héros. Oui tu serais couru de toutes les coquettes, Des Dames du grand air, et même des grisettes : Je vais, si tu le veux, pour te mettre en crédit, Dans ce même moment te chercher un habit."")",1.03,Substitution
443,"('#arlequin', ""Est-ce que vos maisons se meublent à mesure qu'on les bâtit ?"")",,1.0,Insertion
444,"('#un-maçon', ""Elles sont faites, meublées, et occupées tout à la fois.  Tenez, voilà l'Opératrice en question, sans doute elle veut répéter quelque chose."")",,1.0,Insertion
445,"('#la-chanteuse', ""Miei spirti amorosi, Brillatem'in sen : Amor vuol ch'io posi In braccio al mio ben. Miei spirti amorosi, Brillatem'in sen."")",,1.0,Insertion
446,"('#arlequin', ""Mais voilà qui est étonnant !  Je n'aurais jamais cru une fille d'Opéra si magnifiquement logée."")",,1.0,Insertion
447,"('#un-maçon', ""Il y a quinze jours qu'elle occupait un grenier, et il n'est pas bien décidé si elle ne retournera pas à son premier gîte.  En un mot, si vous voulez voir les fortunes de Théâtre, les voilà.  Un moment les élève, un moment les détruit. Tout le Palais se détruit."")",,1.0,Insertion
448,"('#arlequin', ""Je ne fais pas l'amour, Madame, en jeune sot, Et ne sais pas longtemps tourner autour du pot. Je vais d'abord au fait. Je vous aime, ma Reine, Vos yeux comme un forçat me tiennent à la chaîne ; Mais sans perdre le temps en fades compliments, Songez que les déserts sont faits pour les Amants, Profitez-en."")","('#pierrot', ""Tope, je le veux bien, que j'aurai bonne mine ! Je suis sûr de charmer mon aimable Argentine, Quand elle me verra couvert d'un bel harnois : Dans le fond je n'ai pas un trop vilain minois,  Ce n'est que cet habit qui seul me défigure, Sans cela j'aurais eu quelque bonne aventure. Scaramouche revient avec un habit tout garni de franges de soie, le chapeau et les gants de même ; il habille Pierrot, après quoi il lui dit qu'il est trop pâle, et qu'il faut lui donner un peu de couleur ; il prend une palette de Peintre, et lui barbouille le visage avec différentes couleurs ; il lui met ensuite une Perruque et le poudre par tout, en disant que c'est la mode d'être en frange et bien poudré : après plusieurs jeux de théâtre il le laisse en lui disant qu'il va avertir Argentine de le venir voir ; mais il dit qu'il veut le faire rosser, et que pour cet effet il va envoyer des gens de sa connaissance qui en feront l'office."")",0.26,Substitution
449,"('#colombine', ""Jamais d'une si brusque flamme Le pétulant aveu ne touchera mon âme ; Mais hélas ! Suis-je encor maîtresse de mon coeur ? Vous le savez, Octave..."")",,1.0,Insertion
450,"('#arlequin', ""Oh ma foi, serviteur, Pour donner là-dedans je sais trop bien l'usage ; Ma Mignonne, il n'est plus de Novice à votre âge : À dix-huit ans passés quand on a de l'esprit, Le changement d'amant réveille l'appétit. Du lieu d'où vous venez oubliez-vous la mode ? Voulez-vous des Romans pratiquer la méthode ? À lorgner dans un bois croyez-vous m'obliger ? En Céladon moderne allez-vous m'ériger ? Un héros de Cyrus sans crainte de faiblesse, Pouvoir impunément enlever sa Maîtresse ; Avec lui sans façon la belle s'embarquait, Il ne lui baisait pas le petit bout du doigt. Ces braves Chevaliers par combats et prouesses. Envers et contre tous défendaient leurs Princesses ; Mais tout bien compassé, ces valeureux nigauds N'étaient de leur honneur que les Custodicos. Comme ce temps n'est plus, un autre a pris sa place, Les choses aujourd'hui se font de bonne grâce ; Et dès qu'en pareil cas l'Amant sait demander, De son côté la belle est prête d'accorder. Vous connaissez l'amour, je le connais de même Nous sommes seuls ici, Madame, et je vous aime."")","('#pierrot', ""Voilà ce qui s'appelle être sur le bon pied, Au Diable l'habit blanc, fi je faisais pitié : Sous ces beaux ornements je pourrai bien paraître, Je crois qu'ainsi vêtu j'ai l'air d'un petit Maître. Quatre Danseurs avec des bâtons entrent au son des violons, font une danse figurée, en chargeant Pierrot de coups ; après quoi ils prennent un tapis, le mettent dedans, et l'emportent en cadence. Pierrot crie, et le second acte finit."")",0.5,Substitution
451,"('#colombine', ""L'ai-je bien entendu ? Quelle surprise, ô Dieux ? Que me proposez-vous ? Ah trop funestes lieux ! À de pareils propos me serais-je attendue ? Seigneur, rendez le calme à mon âme éperdue. Voudriez-vous tout de bon... Non c'est pour m'éprouver."")","('#octave', ""Quand du puissant amour nous ressentons les feux, Ce vainqueur aisément nous rend ingénieux ; A qui subit ses lois il n'est rien d'impossible, Ce Dieu fait surmonter un obstacle invincible : C'est par lui que Spinette a trompé le Docteur, Ce tour est merveilleux, et j'en ris de bon coeur. Mais il faut au plutôt m'assurer de la belle, Quoique son père fasse exacte sentinelle, Je prétends l'enlever, le dessein en est pris, Et je ne puis enfin être heureux qu'à ce prix."")",0.41,Substitution
452,"('#arlequin', ""Madame, en mes panneaux je n'irai pas crever. Quelque sot !"")",,1.0,Insertion
453,"('#colombine', 'Ah, Seigneur, vous êtes Philosophe ?')",,1.0,Insertion
454,"('#arlequin', ""Bon bon ! Nous sommes de la même étoffe ; Et Philosophe, ou non, Madame, il est écrit, Que l'on a de l'amour, quand on a de l'esprit, Cet esprit voit en vous de quoi me satisfaire, Vos petites façons ont le secret de plaire, Et le sort me donnant femme et lieux à mon choix Je crois qu'il ne faut pas que j'en fasse à deux fois."")","('#leandre', ""Cher ami, vos conseils ont engagé mon âme A brûler comme vous d'une fidèle flamme ; Les leçons d'Arlequin m'ont su déterminer, Je vous fais un aveu qui doit vous étonner : L'indifférence était de mon coeur, le partage, Mais l'amour aujourd'hui s'y fait un doux passage."")",0.17,Substitution
455,"('#colombine', ""Vous ne rougissez pas d'avoir tant de faiblesse, Vous que l'on voit prêcher une austère sagesse ? Vous qui vous gendarmez sur les défauts d'autrui ?"")","('#octave', 'Vous aimez ?')",1.24,Substitution
456,"('#arlequin', ""C'est là le grand talent du sage d'aujourd'hui, Loup-garou, fier, hargneux, farouche, impraticable, Sur les moindres défauts toujours inexorable, Regardant les plaisirs d'un oeil indifférent, Voilà comme il se montre au vulgaire ignorant. Mais quand se dérobant aux yeux de tout le monde, En un réduit rustique il peut mener sa blonde, Qu'il sait bien au milieu des plaisirs les plus doux, Apprécier de l'amour les plus exquis ragoûts ! Tout cela ne nuit pas à l'austère sagesse, Et la vertu ne gît qu'à cacher sa faiblesse, Ne vous entêtez point d'un chimérique honneur, Croyez-moi."")","('#leandre', ""C'en est fait, j'ai cédé malgré moi, Je n'ai pu me soustraire à l'amoureuse loi : Vainement les plus fiers cherchent à s'en défendre, Et cent fois plus que vous, ami j'ai le coeur tendre. Pour marquer à ma belle un violent amour, Je la dois enlever avant la fin du jour ; Et pour la délivrer du jaloux qui l'obsède, Cette grande entreprise en est le seul remède."")",0.43,Substitution
457,"('#colombine', ""Je ne puis en revenir, Seigneur, Quoi vous, qui détestant tous les mauvais usages ; Cherchez de la vertu dans ces antres sauvages, Qui voyez en pitié le reste des humains ; Osez faire éclater de criminels desseins ? Mais quand il serait vrai que votre âme enflammée De mes faibles attraits se sentirait charmée, Faut-il presser les gens, faut-il brusquer les coeurs ? Si vous avez pour moi de sincères ardeurs, D'un air moins violent faites-le moi paraître."")","('#octave', ""Nos desseins sont égaux, pour preuve de mes feux, Je tromperai les soins d'un père trop fâcheux ; Par un enlèvement digne de ma tendresse, Je m'assure aujourd'hui de ma chère Maîtresse : Mais quelle est la beauté dont vous êtes épris ? Vous le savez assez, je suis de vos amis, Ne me déguisez rien. "")",0.0,Match
458,"('#arlequin', ""La mode est aujourd'hui d'aimer en Petit Maître, C'est le goût général, Madame, et les abbés Même avant les Robins y sont enfin tombés. Tous nos hommes ont l'art d'attaquer et de prendre, Mais nos femmes n'ont pas celui de se défendre."")","('#leandre', ""Non, c'est vôtre voisine, Elle loge ici près, et se nomme Argentine."")",1.66,Substitution
459,"('#colombine', 'Mais nous voyons de graves Magistrats, Des Abbés réservés...')",,1.0,Insertion
460,"('#arlequin', ""Ne vous y fiez pas, Tel qu'on voit en public faire le bon apôtre, Sous deux doigts de verrouil, est homme comme un autre. La différence enfin du rabat au plumet, Se réduit à ceci : l'un dit plus qu'il ne fait, L'autre en ses actions tout rempli de mystère, Sait chercher son plaisir, en jouir et se taire. Mais qui vient nous troubler en ce doux entretien ? Examinons si c'est ou quelque chose, ou rien. Vous fuyez mes transports, en Amante discrète ? Allez, j'irai bientôt être leur interprète."")","('#octave', ""Comment, que dites-vous ? Vous me surprenez fort, Argentine ! Vraiment d'un si tendre transport Vôtre Maître Arlequin vous sera redevable, Vous en usez fort bien avec ce pauvre Diable, Qui charitablement vous a tantôt instruit : Il devait, ce dit on, l'épouser cette nuit."")",0.17,Substitution
461,"('#arlequin', ""Quelle révérence !  Encore...  Ouf.  Je n'y saurais durer."")",,1.0,Insertion
462,"('#monsieur-de-geresol', 'Je ne sais, Monsieur, si vous nous connaissez.')","('#leandre', ""Arlequin, dites-vous ! L'aventure est plaisante, Je ne le savais pas."")",1.13,Substitution
463,"('#arlequin', ""Non, et je n'en ai même aucune envie."")",,1.0,Insertion
464,"('#monsieur-de-geresol', 'Nous venons vous assurer de nos respects.')",,1.0,Insertion
465,"('#monsieur-de-la-cabriole', ""Nous n'avons pas voulu manquer cette occasion de vous faire la révérence."")",,1.0,Insertion
466,"('#arlequin', 'En voilà déjà plus de quinze de faites.')",,1.0,Insertion
467,"('#monsieur-de-geresol', ""Vous voyez, Monsieur, dans Monsieur de la Cabriole, les meilleurs pieds, et la plus belle jambe du monde.  C'est le héros des chaconnes et des rigodons."")",,1.0,Insertion
468,"('#monsieur-de-la-cabriole', ""Monsieur de Geresol est de mes amis, il me flatte ; mais il parlerait plus sincèrement, s'il vous disait qu'il est le Lulli de Quatre-vingt-seize."")",,1.0,Insertion
469,"('#arlequin', 'À vous la balle, Monsieur.')",,1.0,Insertion
470,"('#monsieur-de-geresol', 'Monsieur de la Cabriole est le Coryphée des Danseurs.')",,1.0,Insertion
471,"('#monsieur-de-la-cabriole', 'Monsieur de Geresol est la fleur, et la crème des musiciens.')",,1.0,Insertion
472,"('#arlequin', 'Hé bien, monsieur le Coryphée, et vous monsieur la Crème, que voulez-vous ?')",,1.0,Insertion
473,"('#monsieur-de-geresol', 'Vous faire une proposition que vous ne pouvez refuser ?')",,1.0,Insertion
474,"('#monsieur-de-la-cabriole', ""Vous donner des moyens assurés de joindre l'agréable à l'utile."")",,1.0,Insertion
475,"('#arlequin', 'Promesses de Musicien !')",,1.0,Insertion
476,"('#monsieur-de-geresol', 'Dites un mot, et nous vous faisons trente mille livres de rente.')",,1.0,Insertion
477,"('#monsieur-de-la-cabriole', 'Vous vous enrichissez sans appauvrir personne.')",,1.0,Insertion
478,"('#arlequin', ""Ce n'est guères la manière de ce temps-ci.  Mais enfin ?"")",,1.0,Insertion
479,"('#monsieur-de-la-cabriole', 'Mais enfin, si vous voulez nous croire, vous ferez dans votre nouvelle Ville, une Académie de Danse et de Musique.')",,1.0,Insertion
480,"('#monsieur-de-geresol', ""Il n'y a pas de divertissement plus agréable au public, ni plus utile aux particuliers."")",,1.0,Insertion
481,"('#arlequin', ""Il est vrai que personne ne se plaint de l'Opéra, et que tout le monde y trouve son compte."")",,1.0,Insertion
482,"('#monsieur-de-la-cabriole', ""Son compte !  Et sans l'Opéra que deviendraient les bons airs, les pieds bien tournés, les visages plâtrés, et les jolis gosiers ?"")",,1.0,Insertion
483,"('#arlequin', ""Il est vrai.  Sans l'Opéra comment subsisteraient tant d'honnêtes fainéants ?  Que deviendraient tant de beautés, qui tirent tout leur mérite de l'Orchestre ?"")",,1.0,Insertion
484,"('#monsieur-de-la-cabriole', ""L'Opéra est un trésor inépuisable dont on ne voit jamais le fonds."")",,1.0,Insertion
485,"('#monsieur-de-geresol', ""C'est un abyme, un labyrinthe de ressources qu'on ne connaît qu'à mesure qu'on les creuse."")",,1.0,Insertion
486,"('#monsieur-de-la-cabriole', ""Tout y rapporte son revenu jusqu'aux rides d'une Coquette surannée."")",,1.0,Insertion
487,"('#monsieur-de-geresol', ""C'est une terre où on sème des sons et des gambades pour recueillir des pistoles."")",,1.0,Insertion
