,campistron-achille,corneillep-andromede,Cost,Operation Type
123,"('#le-choeur', ""Suivons, suivons sans cesse Ce héros, ce fameux vainqueur C'est à son bras que la Grèce  Doit sa force et son bonheur. Chantons la valeur et sa gloire Du héros qui nous a sauvé Qu'ils jouissent après sa victoire Des honneurs éclatants à lui seul réservés. Chantons la valeur et la gloire Du héros qui nous a sauvé. De ses heureux travaux chérissons la mémoire, Consacrons-lui des jours qu'il nous a conservés. Chantons la valeur et la gloire Du héros qui nous a sauvé."")","('#cephee', ""Apprenez que le sort n'agit que sous les dieux, Et souffrez comme moi le bonheur de ces lieux. Votre perte n'est rien au prix de ma misère : Vous n'êtes qu'amoureux, Phinée, et je suis père. Il est d'autres objets dignes de votre foi ; Mais il n'est point ailleurs d'autres filles pour moi. Songez donc mieux qu'un père à ces affreux ravages Que partout de ce monstre épandirent les rages ; Et n'en rappelez pas l'épouvantable horreur, Pour trop croire et trop suivre une aveugle fureur."")",0.68,Substitution
124,"('#achille', ""Allez, que chacun court où son devoir l'appelle, Vos soins pour moi feraient trop de jaloux, Et de mes ennemis la vengeance cruelle Ne pouvant m'accabler retomberait sur vous."")","('#phinee', ""Que de nouveau ce monstre entré dessus vos terres Fasse à tous vos sujets d'impitoyables guerres, Le sang de tout un peuple est trop bien employé Quand celui de ses rois en peut être payé ; Et je ne connais point d'autre perte publique Que celle où vous condamne un sort si tyrannique."")",0.1,Substitution
125,,"('#cephee', 'Craignez ces mêmes dieux qui président au sort.')",1.0,Deletion
126,"('#arcas', ""Venez, marchez, sans défiance, Les grecs vous ont donné leur foi Achille est généreux, craignez moins sa présence Et qu'une juste espérance succède à votre effroi."")","('#phinee', ""Qu'entre eux-mêmes ces dieux se montrent donc d'accord. Quelle crainte après tout me pourrait y résoudre ? S'ils m'ôtent Andromède, ont-ils quelque autre foudre ? Il n'est plus de respect qui puisse rien sur moi ; Andromède est mon sort, et mes dieux, et mon roi ; Punissez un impie, et perdez un rebelle ; Satisfaites le sort en m'exposant pour elle : J'y cours ; mais autrement je jure ses beaux yeux, Et mes uniques rois, et mes uniques Dieux... Ici le tonnerre commence à rouler avec un si grand bruit, et accompagné d'éclairs redoublés avec tant de promptitude, que cette feinte donne de l'épouvante aussi bien que de l'admiration, tant elle approche du naturel. On voit cependant descendre Éole avec huit vents, dont quatre sont à ses deux côtés, en sorte toutefois que les deux plus éloignés sont comme volants en l'air tout conte ce même nuage. Les quatre autres paraissent deux à deux au milieu de l'air sur les ailes du théâtre, deux à la main gauche et deux à la main droite : ce qui n'empêche pas Phinée de continuer ses blasphèmes."")",0.42,Substitution
127,"('#priam', ""Restes infortunés du plus beau sang du monde, Polixène, ma fille et vous, veuve d'Hector, Mêlez vos pleurs aux miens, et s'il se peut encor Que tout redouble ici notre douleur profonde."")","('#cephee', ""Arrêtez : ce nuage enferme une tempête Qui peut-être déjà menace votre tête. N'irritez plus les dieux déjà trop irrités."")",0.64,Substitution
128,,"('#phinee', ""Qu'il crève, ce nuage, et que ces déités..."")",1.0,Deletion
129,,"('#cephee', 'Ne les irritez plus, vous dis-je, et prenez garde...')",1.0,Deletion
130,"('#priam #andromaque #polixene', 'Puissions-nous attendrir le coeur De ce superbe vainqueur !')","('#phinee', ""À les trop irriter qu'est-ce que je hasarde ? Que peut craindre un amant quand il voit tout perdu ? Tombe, tombe sur moi leur foudre, s'il m'est dû ! Mais s'il est quelque main assez lâche et traîtresse Pour suivre leur caprice et saisir ma princesse, Seigneur, encore un coup, je jure ses beaux yeux, Et mes uniques rois, et mes uniques dieux..."")",0.74,Substitution
131,"('#priam', ""Vous voyez, guerrier indomptable Un roi qui fut longtemps le plus puissant des rois ; C'est ce même Priam, qui tenait sous ses lois Des Troyens renommés, l'empire redoutable; C'est lui, que le dernier de vos fameux exploits Vient de rendre plus misérable, Qui ne fut heureux autrefois."")","('#eole', ""Téméraire mortel, n'en dis pas davantage ; Tu n'obliges que trop les dieux à te haïr : Quoi que pense attenter l'orgueil de ton courage, Ils ont trop de moyens de se faire obéir. Connais-moi pour ton infortune ; Je suis Éole, roi des vents. Partez, mes orageux suivants, Faites ce qu'ordonne Neptune."")",0.27,Substitution
132,,"('#andromede', 'ô ciel !')",1.0,Deletion
133,,"('#cephee', ""Ils l'ont saisie, et l'enlèvent en l'air."")",1.0,Deletion
134,,"('#phinee', 'Ah ! Ne présumez pas ainsi me la voler : Je vous suivrai partout malgré votre surprise.')",1.0,Deletion
135,"('#achille', ""Le sort ne peut changer l'auguste caractère, Dont les Dieux vous ont revêtu. Je le respecte en vous, je plains votre vertu, Je sens expirer ma colère, Je cesse de haïr mes plus grands ennemis, Sitôt que je les vois, ou vaincus ou soumis."")","('#persee', 'Seigneur, un tel péril ne veut point de remise ; Mais espérez encor, je vole à son secours, Et vais forcer le sort à prendre un autre cours.')",0.65,Substitution
136,,"('#cephee', ""Vingt amants pour Nérée en firent l'entreprise ; Mais il n'est point d'effort que ce monstre ne brise. Tous voulurent sauver ses attraits adorés, Tous furent avec elle à l'instant dévorés."")",1.0,Deletion
137,"('#andromaque', ""J'ai perdu mon époux dans un combat funeste, Votre valeur me l'a ravi ; Mon amour, chez les morts, l'aurait déjà suivi, Sans les soins que je dois au seul fils qui me reste. Vous le savez, Dieux que j'atteste! Au sort de cet enfant, mon sort est asservi ; Je l'ai perdu cet époux que j'adore, Et pour comble d'horreur, je sais qu'il est encore Indignement privé, par des ordres cruels D'un droit, que le trépas donne à tous les mortels : Souffrez que je le rende aux murs qui l'ont vu naître, Qu'un superbe tombeau fasse du moins connaître La splendeur de son sang, son sort, et mon amour. Ce tombeau servira de temple à votre gloire, Puisque tout l'avenir y verra, quelque jour, L'histoire de nos maux, et de votre victoire."")","('#persee', ""Le ciel aime Andromède, il veut son hyménée, Seigneur ; et si les vents l'arrachent à Phinée, Ce n'est que pour la rendre à quelque illustre époux Qui soit plus digne d'elle, et plus digne de vous ; À quelque autre par là les dieux l'ont réservée. Vous saurez qui je suis quand je l'aurai sauvée. Adieu : par des chemins aux hommes inconnus Je vais mettre en effet l'oracle de Vénus. Le temps nous est trop cher pour le perdre en paroles."")",0.05,Substitution
138,,"('#cephee', ""Moi, qui ne puis former d'espérances frivoles, Pour ne voir point courir ce grand coeur au trépas, Je vais faire des voeux qu'on n'écoutera pas."")",1.0,Deletion
139,,"('#timante', ""Allons voir, chers amis, ce qu'elle est devenue, La princesse, et mourir, s'il se peut, à sa vue."")",1.0,Deletion
140,,"('#le-choeur', ""La voilà que ces vents achèvent d'attacher, En infâmes bourreaux, à ce fatal rocher."")",1.0,Deletion
141,,"('#timante', ""Oui, c'est elle sans doute. Ah ! L'indigne spectacle !"")",1.0,Deletion
142,,"('#le-choeur', ""Si le ciel n'est injuste, il lui doit un miracle."")",1.0,Deletion
143,,"('#timante', ""Il en fera voir un, s'il en croit nos désirs."")",1.0,Deletion
144,,"('#andromede', 'ô dieux !')",1.0,Deletion
145,"('#achille', 'Quels regrets ! Quels tristes accents ! Dieux ! Que la douleur est tendre ! Que ses soupirs sont puissants ! Que je souffre à les entendre !')","('#timante', 'Avec respect écoutons ses soupirs ; Et puissent les accents de ses premières plaintes Porter dans tous nos coeurs de mortelles atteintes !')",0.26,Substitution
146,,"('#andromede', ""Affreuse image du trépas Qu'un triste honneur m'avait fardée, Surprenantes horreurs, épouvantable idée, Qui tantôt ne m'ébranliez pas, Que l'on vous conçoit mal quand on vous envisage Avec un peu d'éloignement ! Qu'on vous méprise alors ! Qu'on vous brave aisément ! Mais que la grandeur de courage Devient d'un difficile usage Lorsqu'on touche au dernier moment ! Ici seule, et de toutes parts À mon destin abandonnée, Ici que je n'ai plus ni parents, ni Phinée, Sur qui détourner mes regards, L'attente de la mort de tout mon coeur s'empare, Il n'a qu'elle à considérer ; Et quoi que de ce monstre il s'ose figurer, Ma constance qui s'y prépare Le trouve d'autant plus barbare Qu'il diffère à me dévorer. Étrange effet de mes malheurs ! Mon âme traînante, abattue, N'a qu'un moment à vivre, et ce moment me tue À force de vives douleurs. Ma frayeur a pour moi mille mortelles feintes, Cependant que la mort me fuit : Je pâme au moindre vent, je meurs au moindre bruit ; Et mes espérances éteintes N'attendent la fin de mes craintes Que du monstre qui les produit. Qu'il tarde à suivre mes désirs ! Et que sa cruelle paresse À ce coeur dont ma flamme est encore la maîtresse Coûte d'amers et longs soupirs ! Ô toi, dont jusqu'ici la douceur m'a suivie, Va-t'en, souvenir indiscret ; Et cessant de me faire un entretien secret De ce prince qui m'a servie, Laisse-moi sortir de la vie Avec un peu moins de regret. C'est assez que tout l'univers Conspire à faire mes supplices ; Ne les redouble point, toi qui fus mes délices, En me montrant ce que je perds ; Laisse-moi..."")",1.0,Deletion
147,"('#priam', ""Par vos sacrés aïeux ; par le nom de Thétis, Laissez-moi recueillir les cendres de mon fils. Pour m'accorder la grâce que j'espère, Souvenez-vous de votre père, Et songez quel amour il eût toujours pour vous Je sentais pour mon fils une égale tendresse ; Ah ! Jugez par l'excès de cet amour si doux Quel doit être aujourd'hui l'excès de ma tristesse."")","('#cassiope', ""Me voici, qui seule ai fait le crime ; Me voici, justes dieux, prenez votre victime : S'il est quelque justice encore parmi vous, C'est à moi seule, à moi qu'est dû votre courroux. Punir les innocents, et laisser les coupables, Inhumains ! Est-ce en être, est-ce en être capables ? À moi tout le supplice, à moi tout le forfait. Que faites-vous, cruels ? Qu'avez-vous presque fait ? Andromède est ici votre plus rare ouvrage ; Andromède est ici votre plus digne image ; Elle rassemble en soi vos attraits divisés : On vous connaîtra moins si vous la détruisez. Ah ! Je découvre enfin d'où provient tant de haine : Vous en êtes jaloux plus que je n'en fus vaine ; Si vous la laissiez vivre, envieux tout-puissants, Elle aurait plus que vous et d'autels et d'encens ; Chacun préférerait le portrait au modèle, Et bientôt l'univers n'adorerait plus qu'elle."")",0.05,Substitution
148,"('#polixene', ""Que pourrais-je espérer du secours de mes pleurs, Si mon père et ma soeur vous trouvent inflexible ! Si vous méprisez leurs douleurs, À mes plaintes, hélas ! Serez-vous plus sensible ? Sorti du sang des Dieux, imitez leur bonté, À nos soupirs rendez-vous favorable, N'augmentez point l'excès de notre adversité Par un refus impitoyable."")","('#andromede', ""En l'état où je suis le sort m'est-il trop doux, Si vous ne me donnez de quoi craindre pour vous ? Faut-il encore ce comble à des malheurs extrêmes ? Qu'espérez-vous, madame, à force de blasphèmes ?"")",0.0,Match
149,,"('#cassiope', ""Attirer et leur monstre et leur foudre sur moi ; Mais je ne les irrite, hélas ! Que contre toi : Sur ton sang innocent retombent tous mes crimes ; Seule tu leur tiens lieu de mille autres victimes ; Et pour punir ta mère ils n'ont, ces cruels dieux, Ni monstre dans la mer, ni foudre dans les cieux. Aussi savent-ils bien que se prendre à ta vie, C'est percer de mon coeur la plus tendre partie ; Que je souffre bien plus en te voyant périr, Et qu'ils me feraient grâce en me faisant mourir. Ma fille, c'est donc là cet heureux hyménée, Cette illustre union par Vénus ordonnée, Qu'avec tant de pompe il fallait préparer, Et que ces mêmes dieux devaient tant honorer ! Ce que nos yeux ont vu n'était-ce donc qu'un songe, Déesse ? Ou ne viens-tu que pour dire un mensonge ? Nous aurais-tu parlé sans l'aveu du destin ? Est-ce ainsi qu'à nos maux le ciel trouve une fin ? Est-ce ainsi qu'Andromède en reçoit les caresses ? Si contre elle l'envie émeut quelques déesses, L'amour en sa faveur n'arme-t-il point de dieux ? Sont-ils tous devenus ou sans coeur, ou sans yeux ? Le maître souverain de toute la nature Pour de moindres beautés a changé de figure ; Neptune a soupiré pour de moindres appas ; Elle en montre à Phébus que Daphné n'avait pas ; Et l'Amour en Psyché voyait bien moins de charmes, Quand pour elle il daigna se blesser de ses armes. Qui dérobe à tes yeux le droit de tout charmer, Ma fille ? Au vif éclat qu'ils sèment dans la mer, Les tritons amoureux, malgré leurs Néréides, Devraient déjà sortir de leurs grottes humides, Aux fureurs de leur monstre à l'envi s'opposer, Contre ce même écueil eux-mêmes l'écraser, Et de ses os brisés, de sa rage étouffée, Au pied de ton rocher t'élever un trophée."")",1.0,Deletion
150,"('#achille', ""Que peut-on refuser au pouvoir de vos yeux ? Vous pouvez tout en ces lieux. Rassurez-vous calmez la douleur qui vous presse, Emportez dans vos murs, ce héros glorieux, Ne craignez point les efforts de la Grèce, J'arrêterai ses desseins furieux : Suivez l'ardeur qui vous anime, Rien ne vous troublera dans ce soin légitime : Je ne vais songer désormais Qu'à vous donner une éternelle paix."")","('#andromede', ""Renouveler le crime, est-ce pour les fléchir ? Vous hâtez mon supplice au lieu de m'affranchir. Vous appelez le monstre. Ah ! Du moins à sa vue Quittez la vanité qui m'a déjà perdue. Il n'est mortel ni dieu qui m'ose secourir. Il vient : consolez-vous, et me laissez mourir."")",0.0,Match
151,"('#achille', ""C'en est fait, cher Arcas, j'adore Polixène, Quoiqu'il en coûte enfin, je veux la posséder ; C'est toi que j'ai choisi, pour aller demander, Cours à Troie, il est temps de soulager ma peine."")","('#cassiope', ""Je le vois, c'en est fait. Parois du moins, Phinée, Pour sauver la beauté qui t'était destinée ; Parais, il en est temps ; viens en dépit des dieux Sauver ton Andromède, ou périr à ses yeux ; L'amour te le commande, et l'honneur t'en convie ; Peux-tu, si tu la perds, aimer encore la vie ?"")",0.0,Match
152,"('#arcas', ""Son père, à votre amour, voudra-t-il l'accorder ?"")","('#andromede', ""Il n'a manque d'amour, ni manque de valeur ; Mais sans doute, madame, il est mort de douleur ; Et comme il a du coeur et sait que je l'adore, Il périrait ici, s'il respirait encore."")",1.8,Substitution
153,"('#achille', ""Il sera trop heureux de me donner sa fille, Et de me voir devenir son époux ; L'amitié, que ce noeud fera naître entre nous, Soutiendra désormais son trône et sa famille."")","('#cassiope', ""Dis plutôt que l'ingrat n'ose te mériter. Toi donc, qui plus que lui t'osais tantôt vanter, Viens, amant inconnu, dont la haute origine, Si nous t'en voulons croire, est royale ou divine ; Viens en donner la preuve, et par un prompt secours, Fais-nous voir quelle foi l'on doit à tes discours ; Supplante ton rival par une illustre audace ; Viens à droit de conquête en occuper la place : Andromède est à toi si tu l'oses gagner. Quoi ? Lâches, le péril vous la fait dédaigner ! Il éteint en tous deux ces flammes sans secondes ! Allons, mon désespoir, jusqu'au milieu des ondes Faire servir l'effort de nos bras impuissants D'exemple et de reproche à leurs feux languissants ; Faisons ce que tous deux devraient faire avec joie ; Détournons sa fureur dessus une autre proie : Heureuse si mon sang la pouvait assouvir ! Allons. Mais qui m'arrête ? Ah ! C'est mal me servir."")",1.13,Substitution
154,"('#arcas', ""Juste Ciel ! Des Troyens vous devenez l'appui ? Loin de les accabler, vous voulez les défendre."")","('#timante', 'Courez-vous à la mort quand on vole à votre aide ? Voyez par quels chemins on secourt Andromède ; Quel héros, ou quel dieu sur ce cheval ailé...')",1.0,Substitution
155,,"('#cassiope', ""Ah ! C'est cet inconnu par mes cris appelé, C'est lui-même, seigneur, que mon âme étonnée..."")",1.0,Deletion
156,"('#achille', ""Contre un peuple abattu, que pourrais-je entreprendre, Après ce que mon bras vient de faire aujourd'hui ? Hector seul méritait la gloire De mourir par mes coups, Le reste des Troyens après cette victoire Est indigne de mon courroux."")","('#persee', ""Reine, voyez par là si je vaux bien Phinée, Si j'étais moins que lui digne de votre choix, Et si le sang des dieux cède à celui des rois."")",0.61,Substitution
157,,"('#cassiope', ""Rien n'égale, seigneur, un amour si fidèle ; Combattez donc pour vous en combattant pour elle : Vous ne trouverez point de sentiments ingrats."")",1.0,Deletion
158,,"('#persee', 'Adorable princesse, avouez-en mon bras.')",1.0,Deletion
159,,"('#le-choeur', ""Courage, enfant des Dieux ! Elle est votre conquête ; Et jamais amant ni guerrier Ne vit ceindre sa tête D'un si beau myrte ou d'un si beau laurier."")",1.0,Deletion
160,"('#achille', ""Quand après un cruel tourment, L'hymen succède Aux tendre désirs d'un amant, Que le trouble qui précède Ce bien heureux moment Est doux et charmant! Mais, on vient en ces lieux, ma surprise est extrême ! C'est Agamemnon lui-même."")","('#voix', 'Andromède est le prix qui suit votre victoire : Combattez, combattez ; Et vos plaisirs et votre gloire Rendront jaloux les dieux dont vous sortez.')",0.59,Substitution
161,"('#agamemnon', ""Je ne saurais plus longtemps Conserver contre vous mes chagrins et ma haine, Après vos exploits éclatants, Un mouvement plus doux près de vous me ramène : Avec les jours d'Hector nos périls sont passés, Troie a perdu la bras qui pouvait la défendre."")","('#le-choeur', ""Courage, enfant des dieux ! Elle est votre conquête ; Et jamais amant ni guerrier Ne vit ceindre sa tête D'un si beau myrte ou d'un si beau laurier."")",0.51,Substitution
162,,"('#timante', 'Voyez de quel effet notre attente est suivie, Madame : elle est sauvée, et le monstre est sans vie.')",1.0,Deletion
163,,"('#persee', ""Rendez grâces au dieu qui m'en a fait vainqueur."")",1.0,Deletion
164,"('#achille', ""J'ai fait mon devoir, c'est assez, Vous n'avez point de grâces à mes rendre : Je n'ai point crû servir ceux qui m'ont outragé, Et c'est Patrocle seul que mon bras a vengé."")","('#cassiope', ""Ô ciel ! Que ne vous puis-je assez ouvrir mon coeur ! L'oracle de Vénus enfin s'est fait entendre : Voilà ce dernier choix qui nous devait tout rendre ; Et vous êtes, seigneur, l'incomparable époux Par qui le sang des dieux se doit joindre avec nous. Ne pense plus, ma fille, à ton ingrat Phinée : C'est à ce grand héros que le sort t'a donnée ; C'est pour lui que le ciel te destine aujourd'hui ; Il est digne de toi, rends-toi digne de lui."")",0.39,Substitution
165,"('#agamemnon', 'Votre colère dure encore, Elle éclate dans vos discours : Il faut, pour en finir le cours, Vous rendre la beauté qui vous aime toujours, Et que votre coeur adore. Venez, charmant objet, revoyez votre amant.')","('#persee', ""Il faut la mériter par mille autres services ; Un peu d'espoir suffit pour de tels sacrifices. Princesse, cependant quittez ces tristes lieux, Pour rendre à votre cour tout l'éclat de vos yeux. Ces vents, ces mêmes vents qui vous ont enlevée, Vont rendre de tout point ma victoire achevée : L'ordre que leur prescrit mon père Jupiter Jusqu'en votre palais les force à vous porter, Les force à vous remettre où tantôt leur surprise..."")",0.08,Substitution
166,"('#achille', 'Ah Ciel ! Ma raison cède à mon étonnement.')","('#andromede', ""D'une frayeur mortelle à peine encore remise, Pardonnez, grand héros, si mon étonnement N'a pas la liberté d'aucun remerciement."")",0.32,Substitution
167,"('#agamemnon', ""Mes respects, mes soupirs, les marques de ma flamme N'ont fait qu'allumer son courroux ; Ses constantes rigueurs m'ont appris que son âme Ne peut brûler que pour vous."")","('#persee', 'Venez, tyrans des mers, réparer votre crime, Venez restituer cette illustre victime ; Méritez votre grâce, impétueux mutins, Par votre obéissance au maître des destins.')",0.42,Substitution
168,"('#diomede', ""Jouissez du bonheur que l'amour vous présente, Que votre ardeur s'augmente De moment en moment ! Que c'est un plaisir charmant, Après une absence cruelle, De retrouver sa maîtresse fidèle !"")","('#cassiope', ""Peuple, qu'à pleine voix l'allégresse publique Après un tel miracle en triomphe s'explique, Et fasse retentir sur ce rivage heureux L'immortelle valeur d'un bras si généreux."")",0.39,Substitution
169,"('#briseis', ""Quel triste accueil, Dieux ! Qu'est-ce que je vois? Suis-je encor Briseis ? N'êtes-vous plus Achille ? Pouvez vous me revoir, et demeurer tranquille ? Qu'est devenu l'amour dont vous brûliez pour moi ? Vous ne répondez point ?..."")","('#le-choeur', ""Le monstre est mort, crions victoire, Victoire tous, victoire à pleine voix ; Que nos campagnes et nos bois Ne résonnent que de sa gloire. Princesse, elle vous donne enfin l'illustre époux Qui seul était digne de vous. Vous êtes sa digne conquête. Victoire tous, victoire à son amour ! C'est lui qui nous rend ce beau jour, C'est lui qui calme la tempête ; Et c'est lui qui vous donne enfin l'illustre époux Qui seul était digne de vous."")",1.07,Substitution
170,"('#achille', 'Hélas !')",,1.0,Insertion
171,"('#briseis', ""Que me veut dire Ce regard, ce soupir échappé malgré vous ? Ah ! Que mon destin sera doux, Si c'est encor pour moi que votre coeur soupire ?"")","('#cassiope', ""Dieux ! J'étais sur ces bords immobile de joie. Allons voir où ces vents ont reporté leur proie, Embrasser ce vainqueur, et demander au roi L'effet du juste espoir qu'il a reçu de moi."")",0.32,Substitution
172,"('#achille', ""Ô Ciel ! Que je suis malheureux ! Dans quel temps venez-vous m'accabler de vos larmes ? Que ne suis-je, à mon gré, le maître de mes voeux ! Je finirais bientôt vos mortelles alarmes Mais un charme fatal..."")","('#cymodoce', 'Ainsi notre colère est de tout point bravée ; Ainsi notre victime à nos yeux enlevée Va croître les douceurs de ses contentements Par le juste mépris de nos ressentiments.')",0.77,Substitution
173,"('#briseis', ""Perfide c'est assez. Je vois toute mon infortune, Un autre amour te rend ma tendresse importune, Je te fatigue enfin par mes soins empressés : Le bruit de cette amour nouvelle Était venu jusques à moi, Mais je n'ai pu le croire, et soupçonner ta foi, J'ai cru ton coeur trop grand, pour n'être pas fidèle. C'en est donc fait ? Je ne dois plus penser À l'hymen qui faisait toute mon espérance, À ce suprême honneur il me faut renoncer, D'un amour si parfait, funeste récompense ! Dieux ! Quelle est ma douleur ! Je cède à son effort, Cruel, peux-tu la voir avec indifférence ? Et ne sais-tu pas que ma mort Suivra de près ton inconstance ?"")","('#ephyre', ""Toute notre fureur, toute notre vengeance Semble avec son destin être d'intelligence, N'agir qu'en sa faveur ; et ses plus rudes coups Ne font que lui donner un plus illustre époux."")",0.24,Substitution
174,"('#achille', ""Je ne puis entendre Une plainte si tendre Je souffre autant que vous, les Dieux m'en sont témoins, Faut-il vous immoler ma vie ? Ordonnez, ce sera le plus doux de mes soins De satisfaire à votre envie : Mais, calmez vos transports, et ne m'affligez plus Par des reproches superflus. Vous connaissez mon coeur incapable de feindre, Je suis moins criminel, que je ne suis à plaindre, Du sort et de l'Amour l'indispensable loi M'entraîne ailleurs malgré moi."")","('#cydippe', ""Le sort, qui jusqu'ici nous a donné le change, Immole à ses beautés le monstre qui nous venge ; Du même sacrifice, et dans le même lieu, De victime qu'elle est, elle devient le dieu. Cessons dorénavant, cessons d'être immortelles, Puisque les immortels trahissent nos querelles, Qu'une beauté commune est plus chère à leurs yeux ; Car son libérateur est sans doute un des dieux. Autre qu'un dieu n'eût pu nous ôter cette proie Autre qu'un dieu n'eût pu prendre une telle voie ; Et ce cheval ailé fût péri mille fois, Avant que de voler sous un indigne poids."")",0.02,Substitution
175,"('#briseis', ""Quel amant m'est ravi ! Sa valeur, sa noblesse L'élèvent au dessus du reste des mortels, La victoire le suit sans cesse, Et ses moindres vertus méritent des autels, Dans le haut rang où son destin l'appelle Il eut été parfait, s'il eut été fidèle. Mais n'est-il pas quelque moyen De détourner l'hymen où son coeur se prépare ? Ah ! Faisons que Junon contre lui se déclare, Elle hait tout le sang Troyen, Et ne souffrira pas que cet hymen funeste Sauve un peuple qu'elle déteste, Puissante Reine des Cieux ! Écoutez moi, daignez jeter les yeux Sur le malheur qui me menace, Prévenez ma honte et ma mort, En prenant pitié de mon sort. Des perfides Troyens vous contrez l'audace ? Mes voeux sont exaucés, Junon descend des cieux, Et pour me secourir s'approche de ces lieux. Junon descend sur son char."")","('#cymodoce', ""Oui, c'est sans doute un dieu qui vient de la défendre : Mais il n'est pas, mes soeurs, encore temps de nous rendre ; Et puisqu'un dieu pour elle ose nous outrager, Il faut trouver aussi des dieux à nous venger. Du sang de notre monstre encore toutes teintes, Au palais de Neptune allons porter nos plaintes, Lui demander raison de l'immortel affront Qu'une telle défaite imprime à notre front."")",0.04,Substitution
