401,"('#eraste', ""Tu m'oses donc flatter, infâme, et tu supprimes Par ce reproche obscur la moitié de mes crimes ? Est-ce ainsi qu'il te faut n'en parler qu'à demi ? Achève tout d'un coup, dis que maîtresse, ami, Tout ce que je chéris, tout ce qui dans mon âme Sut jamais allumer une pudique flamme, Tout ce que l'amitié me rendit précieux, Par ma fourbe a perdu la lumière des Cieux. Dis que j'ai violé les deux lois les plus saintes Qui nous rendent heureux par leurs douces contraintes, Dis que j'ai corrompu, dis que j'ai suborné, Falsifié, trahi, séduit, assassiné, Tu n'en diras encor que la moindre partie. Quoi, Tircis est donc mort, et Mélite est sans vie ! Je ne l'avais pas su, Parques, jusqu'à ce jour, Que vous relevassiez de l'empire d'Amour ; J'ignorais qu'aussitôt qu'il assemble deux âmes Il vous pût commander d'unir aussi leurs trames. Vous en relevez donc, et montrez aujourd'hui Que vous êtes pour nous aveugles comme lui ! Vous en relevez donc, et vos ciseaux barbares Tranchent comme il lui plaît les destins les plus rares ! Mais je m'en prends à vous, moi qui suis l'imposteur, Moi qui suis de leurs maux le détestable auteur. Hélas ! Et fallait-il que ma supercherie Tournât si lâchement tant d'amour en furie ? Inutiles regrets, repentirs superflus, Vous ne me rendez pas Mélite qui n'est plus, Vos mouvements tardifs ne la font pas revivre, Elle a suivi Tircis, et moi je la veux suivre. Il faut que de mon sang je lui fasse raison, Et de ma jalousie, et de ma trahison, Et que de ma main propre une âme si fidèle Reçoive... Mais d'où vient que tout mon corps chancelle ? Quel murmure confus ? Et qu'entends-je hurler ? Que de pointes de feu se perdent parmi l'air ? Les dieux à mes forfaits ont dénoncé la guerre, Leur foudre décoché vient de fendre la terre, Et, pour leur obéir, son sein me recevant M'engloutit, et me plonge aux Enfers tout vivant. Je vous entends, grands dieux, c'est là-bas que leurs âmes Aux champs Elysiens éternisent leurs flammes, C'est là-bas qu'à leurs pieds il faut verser mon sang : La Terre à ce dessein m'ouvre son large flanc, Et jusqu'aux bords du Styx me fait libre passage. Je l'aperçois déjà, je suis sur son rivage. Fleuve, dont le saint nom est redoutable aux Dieux, Et dont les neuf replis ceignent ces tristes lieux, N'entre point en courroux contre mon insolence Si j'ose avec mes cris violer ton silence : Je ne te veux qu'un mot. Tircis est-il passé ? Mélite est-elle ici ?... Mais qu'attends-je, insensé ? Ils sont tous deux si chers à ton funeste Empire, Que tu crains de les perdre, et n'oses m'en rien dire. Vous donc, esprits légers, qui manque de tombeaux Tournoyez vagabonds à l'entour de ces eaux, A qui Charon cent ans refuse sa nacelle, Ne m'en pourriez-vous point donner quelque nouvelle ? Parlez, et je promets d'employer mon crédit À vous faciliter ce passage interdit."")","('#eraste', ""Tu m'oses donc flatter, et ta sottise estime  M'obliger en taisant la moitié de mon crime ?  Est-ce ainsi qu'il te faut n'en parler qu'à demi ?  Achève tout d'un trait, dis que maîtresse, ami,  Tout ce que je chéris, tout ce qui dans mon âme  Sut jamais allumer une pudique flamme,  Tout ce que l'amitié me rendit précieux,  Par ma fraude a perdu la lumière des cieux :  Dis que j'ai violé les deux lois les plus saintes  Qui nous rendent heureux par leurs douces contraintes,  Dis que j'ai corrompu, dis que j'ai suborné,  Falsifié, trahi, séduit, assassiné,  Que j'ai toute une ville en larmes convertie,  Tu n'en diras encor que la moindre partie.  Mais quel ressentiment ! Quel puissant déplaisir !  Grands Dieux, et peuvent-ils jusque là nous saisir  Qu'un pauvre amant en meure, et qu'une âpre tristesse  Réduise au même point après lui sa maîtresse ? "")",0.0,Match
402,,"('#cliton', 'Tous ces discours ne font [...]')",1.0,Deletion
403,"('#cliton', ""Monsieur, que faites-vous, votre raison troublée Par l'effort des douleurs dont elle est accablée Figure à votre vue..."")","('#eraste', ""Laisse agir ma douleur.  Traître, si tu ne veux attirer ton malheur,  Interrompre son cours, c'est n'aimer pas ta vie.  La mort de son Tirsis me l'a doncques ravie,  Je ne l'avais pas su, Parques, jusqu'à ce jour  Que vous relevassiez de l'empire d'amour,  J'ignorais qu'aussitôt qu'il assemble deux âmes  Il vous peut commander d'unir aussi leurs trames,  J'ignorais que pour être exemptes de ses coups  Vous souffrissiez qu'il prît un tel pouvoir sur vous.  Vous en relevez donc, et vos ciseaux barbares  Tranchent comme il lui plaît les destins les plus rares ?  Vous en relevez donc, et pour le flatter mieux  Vous voulez comme lui ne vous servir point d'yeux :  Mais je m'en prends à vous, et ma funeste ruse  Vous imputant ces maux, se bâtit une excuse,  J'ose vous en charger, et j'en suis l'inventeur,  Et seul de mes malheurs le détestable auteur,  Mon courage au besoin se trouvant trop timide  Pour attaquer Tirsis autrement qu'en perfide  Je fis à mon défaut combattre son ennui,  Son deuil, son désespoir, sa rage contre lui.  Hélas ! Et fallait-il que ma supercherie  Tournât si lâchement tant d'amour en furie ?  Fallait-il, l'aveuglant d'une indiscrète erreur  Contre une âme innocente allumer sa fureur ?  Fallait-il le forcer à dépeindre Mélite  Des infâmes couleurs d'une fille hypocrite ?  Inutiles regrets repentirs superflus,  Vous ne me rendez pas Mélite qui n'est plus,  Vos mouvements tardifs ne la font pas revivre, Elle a suivi Tirsis, et moi je la veux suivre :  Il faut que de mon sang je lui fasse raison,  Et de ma jalousie, et de ma trahison,  Et que par ma main propre, un juste sacrifice  De mon coupable chef venge mon artifice.  Avançons donc, allons sur cet aimable corps  Éprouver, s'il se peut, à la fois mille morts.  D'où vient qu'au premier pas je tremble, je chancelle ?  Mon pied qui me dédit contre moi se rebelle,  Quel murmure confus ? Et qu'entends-je hurler ?  Que de pointes de feu se perdent parmi l'air !  Les Dieux à mes forfaits ont dénoncé la guerre,  Leur foudre décoché vient de fendre la terre,  Et pour leur obéir son sein me recevant  M'engloutit, et me plonge aux Enfers tout vivant.  Je vous entends, grands Dieux, c'est là-bas que leurs âmes  Aux champs Élysiens éternisent leurs flammes,  C'est là-bas qu'à leurs pieds il faut verser mon sang,  La terre à ce dessein m'ouvre son large flanc, Et jusqu'aux bords du Styx me fait libre passage,  Je l'aperçois déjà, je suis sur son rivage.  Fleuve, dont le saint nom est redoutable aux Dieux,  Et dont les neuf replis ceignent ces tristes lieux,  Ne te colère point contre mon insolence  Si j'ose avec mes cris violer ton silence :  Ce n'est pas que je veuille, en buvant de ton eau,  Avec mon souvenir étouffer mon bourreau,  Non, je ne prétends pas une faveur si grande,  Réponds-moi seulement, réponds à ma demande,  As-tu vu ces amants ? Tirsis est-il passé ?  Mélite est-elle ici ? Mais que dis-je, insensé ?  Le père de l'oubli dessous cette onde noire  Pourrait-il conserver tant soit peu de mémoire ?  Mais derechef que dis-je ? Imprudent, je confonds  Le Léthé pêle-mêle, et ses gouffres profonds ;  Le Styx de qui l'oubli ne prît jamais naissance  De tout ce qui se passe a tant de connaissance,  Que les Dieux n'oseraient vers lui s'être mépris,  Mais le traître se tait, et tenant ces esprits,  Pour le plus grand trésor de son funeste empire  De crainte de les perdre, il n'en ose rien dire. Vous donc esprits légers, qui faute de tombeaux  Tournoyez vagabonds à l'entour de ces eaux,  À qui Charon cent ans refuse sa nacelle,  Ne m'en pourriez-vous point donner quelque nouvelle ?  Dites, et je promets d'employer mon crédit  À vous faciliter ce passage interdit. "")",0.47,Substitution
404,,"('#cliton', ""Monsieur, que faites-vous ? Votre raison s'égare,  Voyez qu'il n'est ici de Styx, ni de Ténare,  Revenez à vous-même. "")",1.0,Deletion
405,"('#eraste', ""Ah ! Te voilà, Charon, Dépêche promptement, et d'un coup d'aviron Passe-moi, si tu peux, jusqu'à l'autre rivage."")","('#eraste', ""Ah ! Te voilà, Charon,  Dépêche promptement, et d'un coup d'aviron  Passe-moi, si tu peux, jusqu'à l'autre rivage."")",0.0,Match
406,"('#cliton', 'Monsieur, rentrez en vous, regardez mon visage, Reconnaissez Cliton.')","('#cliton', 'Monsieur, rentrez en vous, contemplez mon visage,  Reconnaissez Cliton. ')",0.0,Match
407,"('#eraste', ""Dépêche, vieux nocher, Avant que ces esprits nous puissent approcher, Ton bateau de leur poids fondrait dans les abîmes, Il n'en aura que trop d'Eraste et de ses crimes. Quoi, tu veux te sauver à l'autre bord sans moi ? Si faut-il qu'à ton cou je passe malgré toi. Il se jette sur les épaules de Cliton qui l'emporte derrière le théâtre."")","('#eraste', ""Dépêche, vieux nocher,  Avant que ces esprits nous puissent approcher,  Ton bateau de leur poids fondrait dans les abîmes,  Il n'en aura que trop d'Éraste, et de ses crimes."")",0.0,Match
408,,"('#cliton', ""Il vaut mieux esquiver, car avecque des fous  Souvent on ne rencontre à gagner que des coups,  Si jamais un amant fut dans l'extravagance  Il s'en peut bien vanter avec toute assurance. "")",1.0,Deletion
409,,"('#eraste', ""Tu veux donc échapper à l'autre bord sans moi,  Si faut-il qu'à ton col je passe malgré toi.  Il se jette sur les épaules de Cliton, qui l'emporte du Théâtre."")",1.0,Deletion
410,"('#philandre', ""Présomptueux rival, dont l'absence importune Retarde le succès de ma bonne fortune, As-tu sitôt perdu cette ombre de valeur Que te prêtait tantôt l'effort de ta douleur ? Que devient à présent cette bouillante envie De punir ta volage aux dépens de ma vie ? Il ne tient plus qu'à toi que tu ne sois content, Ton ennemi t'appelle, et ton rival t'attend, Je te cherche en tous lieux, et cependant ta fuite Se rit impunément de ma vaine poursuite. Crois-tu, laissant mon bien dans les mains de ta soeur, En demeurer toujours l'injuste possesseur, Ou que ma patience à la fin échappée (Puisque tu ne veux pas le débattre à l'épée), Oubliant le respect du sexe, et tout devoir, Ne laisse point sur elle agir mon désespoir ?"")","('#philandre', ""Rival injurieux dont l'absence importune  Retarde le succès de ma bonne fortune,  Et qui sachant combien m'importe ton retour  De peur de m'obliger n'oserait voir le jour,  As-tu si tôt perdu cette ombre de courage  Que te prêtaient jadis les transports de ta rage ?  Ce brusque mouvement d'un esprit forcené  Relâche-t-il si tôt ton coeur efféminé ?  Que devient à présent cette bouillante envie  De punir ta volage aux dépens de ma vie ?  Il ne tient plus qu'à toi que tu ne sois content,  Ton ennemi t'appelle, et ton rival t'attend,  Je te cherche en tous lieux, et cependant ta fuite  Se rit impunément de ma vaine poursuite.  Crois-tu laissant mon bien dans les mains de ta soeur  En demeurer toujours l'injuste possesseur,  Ou que ma patience à la fin échappée  (Puisque tu ne veux pas le débattre à l'épée)  Oubliant le respect du sexe, et tout devoir,  Ne laisse point sur elle agir mon désespoir ? "")",0.0,Match
411,"('#eraste', ""Détacher Ixion pour me mettre en sa place ! Mégères, c'est à vous une indiscrète audace, Ai-je, avec même front que cet ambitieux Attenté sur le lit du Monarque des Cieux ? Vous travaillez en vain, barbares Euménides : Non, ce n'est pas ainsi qu'on punit les perfides. Quoi, me presser encor ! Sus, de pieds et de mains ; Essayons d'écarter ces monstres inhumains, À mon secours, esprits, vengez-vous de vos peines, Écrasons leurs serpents, Chargeons-les de vos chaînes, Pour ces filles d'Enfer nous sommes trop puissants."")","('#eraste', ""Détacher Ixion pour me mettre en sa place ! Mégères, c'est à vous une indiscrète audace,  Ai-je, prenant le front de cet audacieux,  Attenté sur le lit du monarque des Cieux ?  Vous travaillez en vain, bourrelles Euménides,  Non, ce n'est pas ainsi qu'on punit les perfides. Quoi ! Me presser encor ! Sus, de pieds et de mains  Essayons d'écarter ces monstres inhumains,  À mon secours, esprits, vengez-vous de vos peines,  Écrasons leurs serpents, chargeons-les de vos chaînes,  Pour ces filles d'Enfer nous sommes trop puissants. "")",0.0,Match
412,"('#philandre', ""Il semble à ce discours qu'il ait perdu le sens. Eraste, cher ami, quelle mélancolie Te met dans le cerveau cet excès de folie !"")","('#philandre', ""Il semble à ce discours qu'il ait perdu le sens,  Éraste, cher ami, quelle mélancolie  Te met dans le cerveau cet excès de folie ? "")",0.0,Match
413,"('#eraste', ""Équitable Minos, grand juge des Enfers, Voyez qu'injustement on m'apprête des fers. Faire un tour d'amoureux, supposer une lettre, Ce n'est pas un forfait qu'on ne puisse remettre. Il est vrai que Tircis en est mort de douleur, Que Mélite après lui redouble ce malheur, Que Cloris sans amant ne sait à qui s'en prendre, Mais la faute n'en est qu'au crédule Philandre, Lui seul en est la cause et son esprit léger, Qui trop facilement résolut de changer, Car ces lettres, qu'il croit l'effet de ses mérites, La main que vous voyez les a toutes écrites."")","('#eraste', ""Équitable Minos, grand juge des enfers,  Voyez qu'injustement on m'apprête des fers. Faire un tour d'amoureux, supposer une lettre,  Ce n'est pas un forfait qu'on ne puisse remettre,  Il est vrai que Tirsis en est mort de douleur,  Que Mélite après lui redouble ce malheur,  Que Cloris sans amant ne sait à qui s'en prendre,  Mais la faute n'en est qu'au crédule Philandre,  Lui seul en est la cause, et son esprit léger  Qui trop facilement résolut de changer,  Car ces lettres qu'il a de la part de Mélite  Autre que cette main n'en a pas une écrite. "")",0.0,Match
414,"('#philandre', ""Je te laisse impuni, traître, de tels remords Te donnent des tourments pires que mille morts, Je t'obligerais trop de t'arracher la vie, Et ma juste vengeance est bien mieux assouvie Par les folles horreurs de cette illusion. Ah, grands Dieux, que je suis plein de confusion !"")","('#philandre', ""Je te laisse impuni, perfide, tes remords  Te donnent des tourments pires que mille morts ;  Je t'obligerais trop de t'arracher la vie,  Et ma juste vengeance est bien mieux assouvie  Par les folles horreurs de cette illusion. Ah ! Grands Dieux ! Que je suis plein de confusion !"")",0.0,Match
415,"('#eraste', ""Tu t'enfuis donc, barbare ! Et me laissant en proie À ces cruelles soeurs, tu les combles de joie ? Non, non, retirez-vous, Tisiphone, Alecton, Et tout ce que je vois d'officiers de Pluton. Vous me connaissez mal, dans le corps d'un perfide Je porte le courage et les forces d'Alcide. Je vais tout renverser dans ces Royaumes noirs, Et saccager moi seul ces ténébreux manoirs : Une seconde fois le triple chien Cerbère Vomira l'aconit en voyant la lumière. J'irai du fond d'Enfer dégager les Titans, Et si Pluton s'oppose à ce que je prétends, Passant dessus le ventre à sa troupe mutine, J'irai d'entre ses bras enlever Proserpine."")","('#eraste', ""Tu t'enfuis donc, barbare, en me laissant en proie  À ces cruelles soeurs, tu les combles de joie ?  Non, non, retirez-vous, Tisiphone, Alecton,  Et tout ce que je vois d'officiers de Pluton,  Vous me connaissez mal, dans le corps d'un perfide  Je porte le courage, et les forces d'Alcide,  Je vais tout renverser dans ces Royaumes noirs,  Et saccager moi seul ces ténébreux manoirs,  Une seconde fois le triple chien Cerbère  Vomira l'aconit en voyant la lumière,  J'irai du fond d'Enfer dégager les Titans,  Et si Pluton s'oppose à ce que je prétends,  Passant dessus le ventre à sa troupe mutine,  J'irai d'entre ses bras enlever Proserpine. "")",0.0,Match
416,"('#lisis', ""N'en doute plus, Cloris, ton frère n'est point mort, Mais ayant su de lui son déplorable sort, Je voulais éprouver, par cette triste feinte, Si celle qu'il adore aucunement atteinte, Deviendrait plus sensible aux traits de la pitié, Qu'aux sincères ardeurs d'une sainte amitié. Maintenant que je vois qu'il faut qu'on nous abuse, Afin que nous puissions découvrir cette ruse, Et que Tircis en soit de tout point éclairci, Sois sûre que dans peu je te le rends ici. Ma parole sera d'un prompt effet suivie ; Tu reverras bientôt ce frère plein de vie, C'est assez que je passe une fois pour trompeur."")","('#lisis', ""N'en doute aucunement ! Ton frère n'est point mort,  Mais ayant su de lui son déplorable sort  Je voulais éprouver par cette triste feinte,  Si ce coeur recevant quelque légère atteinte  Deviendrait plus sensible aux traits de la pitié  Qu'aux sincères ardeurs d'une sainte amitié.  Maintenant que je vois qu'il faut qu'on nous abuse  Afin que nous puissions découvrir cette ruse  Et que Tirsis en soit de tout point éclairci  Sois sûre que dans peu je te le rends ici,  Ma parole sera d'un prompt effet suivie,  Tu reverras bientôt ce frère plein de vie.  C'est assez que je passe une fois pour trompeur. "")",0.0,Match
417,"('#cloris', ""Si bien qu'au lieu du mal nous n'aurons que la peur ? Le coeur me le disait, je sentais que mes larmes Refusaient de couler pour de fausses alarmes, Dont les plus dangereux et plus rudes assauts Avaient beaucoup de peine à m'émouvoir à faux, Et je n'étudiai cette douleur menteuse, Qu'à cause qu'en effet j'étais un peu honteuse Qu'une autre en témoignât plus de ressentiment."")","('#cloris', ""Si bien qu'au lieu du mal nous n'aurons que la peur ?  Le coeur me le disait, je sentais que mes larmes  Refusaient de couler pour de fausses alarmes,  Dont les plus furieux, et plus rudes assauts  Avaient bien de la peine à m'émouvoir à faux,  Et je n'étudiai cette douleur menteuse  Qu'à cause que j'étais parfaitement honteuse  Qu'une autre en témoignât plus de ressentiment. "")",0.0,Match
418,"('#lisis', ""Après tout, entre nous, confesse franchement Qu'une fille en ces lieux qui perd un frère unique Jusques au désespoir fort rarement se pique : Ce beau nom d'héritière a de telles douceurs, Qu'il devient souverain à consoler des soeurs."")","('#lisis', ""Mais avec tout cela confesse franchement  Qu'une fille en ces lieux qui perd un frère unique  Jusques au désespoir fort rarement se pique,  Ce beau nom d'héritière a de telles douceurs,  Qu'il devient souverain à consoler des soeurs."")",0.0,Match
419,"('#cloris', ""Adieu, railleur, adieu son intérêt me presse D'aller rendre d'un mot la vie à sa maîtresse : Autrement je saurais t'apprendre à discourir."")","('#cloris', ""Adieu, railleur, adieu, son intérêt me presse  D'aller vite d'un mot ranimer sa maîtresse,  Autrement je saurais te rendre ton paquet. "")",0.0,Match
420,"('#lisis', 'Et moi, de ces frayeurs de nouveau te guérir.')","('#lisis', 'Et moi pareillement rabattre ton caquet. ')",0.98,Substitution
421,"('#cliton', ""Je ne t'ai rien celé ; tu sais toute l'affaire."")","('#cliton', ""Je ne t'ai rien celé, tu sais toute l'affaire. "")",0.0,Match
422,"('#la-nourrice', ""Tu m'en as bien conté. Mais se pourrait-il faire Qu'Eraste eût des remords si vifs et si pressants, Que de violenter sa raison et ses sens ?"")","('#la-nourrice', ""Tu m'en as bien conté, mais se pourrait-il faire  Qu'Éraste eût des remords si vifs, et si pressants,  Que de violenter sa raison, et ses sens. "")",0.0,Match
423,"('#cliton', ""Eût-il pu, sans en perdre entièrement l'usage, Se figurer Charon des traits de mon visage, Et de plus, me prenant pour ce vieux nautonier, Me payer à bons coups des droits de son denier ?"")","('#cliton', ""Eût-il pu, sans en perdre entièrement l'usage,  Se figurer Charon des traits de mon visage,  Et de plus me prenant pour ce vieux Nautonier  Me payer à bons coups des droits de son denier ? "")",0.0,Match
424,"('#la-nourrice', 'Plaisante illusion !')","('#la-nourrice', 'Plaisante illusion ! ')",0.0,Match
425,"('#cliton', ""Mais funeste à ma tête, Sur qui se déchargeait une telle tempête, Que je tiens maintenant à miracle évident Qu'il me soit demeuré dans la bouche une dent."")","('#cliton', ""Mais funeste à ma tête,  Sur qui se déchargeait une telle tempête  Que je tiens maintenant à miracle évident  Qu'il me soit demeuré dans la bouche une dent. "")",0.0,Match
426,"('#la-nourrice', ""C'était mal reconnaître un si rare service."")","('#la-nourrice', ""C'était mal reconnaître un si rare service. "")",0.0,Match
427,"('#eraste', 'Arrêtez, arrêtez, poltrons.')","('#eraste', 'Arrêtez, arrêtez poltrons. ')",0.0,Match
428,"('#cliton', ""Adieu, nourrice. Voici ce fou qui vient, je l'entends à la voix, Crois que ce n'est pas moi qu'il attrape deux fois."")","('#cliton', ""Adieu, Nourrice,  Voici ce fou qui vient, je l'entends à la voix, Crois que ce n'est pas moi qu'il attrape deux fois."")",0.0,Match
429,"('#la-nourrice', 'Pour moi, quand je devrais passer pour Proserpine, Je veux voir à quel point sa fureur le domine.')","('#la-nourrice', 'Et moi, quand je devrais passer pour Proserpine,  Je veux voir à quel point sa fureur le domine. ')",0.0,Match
430,"('#cliton', 'Contente à tes périls ton curieux désir.')","('#cliton', 'Adieu, saoule à ton dam ton curieux désir. ')",0.05,Substitution
431,"('#la-nourrice', ""Quoi qu'il puisse arriver, j'en aurai le plaisir."")","('#la-nourrice', ""Quoi qu'il puisse arriver j'en aurai le plaisir. "")",0.0,Match
