,corneillep-andromede,quinault-persee,Cost,Operation Type
0,,"('#phronime', ""La Vertu veut choisir ce lieu pour sa retraite : C'est un heureux séjour ; tout y plaît à mes yeux."")",1.0,Deletion
1,"('#melpomene', ""Arrête un peu ta course impétueuse : Mon théâtre, Soleil, mérite bien tes yeux ; Tu n'en vis jamais en ces lieux La pompe plus majestueuse : J'ai réuni, pour la faire admirer, Tout ce qu'ont de plus beau la France et l'Italie ; De tous leurs arts mes soeurs l'ont embellie : Prête-moi tes rayons pour la mieux éclairer. Daigne à tant de beautés, par ta propre lumière, Donner un parfait agrément, Et rends cette merveille entière En lui servant toi-même d'ornement."")","('#megathyme', 'La Vertu fait trouver dans les plus tristes lieux Une félicité secrète')",0.9,Substitution
2,"('#soleil', ""Charmante muse de la scène, Chère et divine Melpomène, Tu sais de mon destin l'inviolable loi : Je donne l'âme à toutes choses, Je fais agir toutes les causes ; Mais quand je puis le plus, je suis le moins à moi ; Par une puissance plus forte Le char que je conduis m'emporte : Chaque jour sans repos doit et naître et mourir. J'en suis esclave alors que j'y préside ; Et ce frein que je tiens aux chevaux que je guide Ne règle que leur route, et les laisse courir."")","('#phronime', ""Sans la Vertu, sans son secours, On n'a point de bien véritable. Elle est toujours aimable ; Il faut l'aimer toujours."")",1.06,Substitution
3,"('#melpomene', ""La naissance d'Hercule et le festin d'Atrée T'ont fait rompre ces lois ; Et tu peux faire encore ce qu'on t'a vu deux fois Faire en même contrée. Je dis plus : tu le dois en faveur du spectacle Qu'au monarque des lis je prépare aujourd'hui ; Le ciel n'a fait que miracles en lui : Lui voudrais-tu refuser un miracle ?"")","('#megathyme', ""Elle éternise la mémoire D'un héros qui la suit. La gloire où la Vertu conduit Est la parfaite gloire."")",0.98,Substitution
4,"('#soleil', ""Non ; mais je le réserve à ces bienheureux jours Qu'ennoblira sa première victoire : Alors j'arrêterai mon cours, Pour être plus longtemps le témoin de sa gloire. Prends cependant le soin de le bien divertir, Pour lui faire avec joie attendre les années Qui feront éclater les belles destinées Des peuples que son bras lui doit assujettir. Calliope ta soeur déjà d'un oeil avide Cherche dans l'avenir les faits de ce grand roi, Dont les hautes vertus lui donneront emploi Pour plus d'une Illiade et plus d'une Énéide."")","('#phronime #megathyme', ""Suivons partout ses pas,  On ne peut la connaître  Sans aimer ses appas. Le bonheur ne peut être Où la Vertu n'est pas. La Vertu s'avance au milieu d'un troupe de suivants et de suivantes. L'innocence et les Plaisirs innocents accompagnent la Vertu."")",0.35,Substitution
5,"('#melpomene', ""Que je porte d'envie à cette illustre soeur, Quoique j'aie à craindre pour elle Que sous ce grand fardeau sa force ne chancelle ! Mais quel qu'en soit enfin le mérite et l'honneur, J'aurai du moins cet avantage, Que déjà je le vois, que déjà je lui plais, Et que de ses vertus, et que de ses hauts faits Déjà dans ses pareils je lui trace une image. Je lui montre Pompée, Alexandre, César, Mais comme des héros attachés à son char ; Et tout ce haut éclat où je les fais paraître Lui peint plus qu'ils n'étaient, et moins qu'il ne doit être."")","('#phronime #megathyme #choeur', ""Ô Vertu charmante ! Votre empire est doux.  Avec vous, tout nous contente ; On n'est point heureux sans vous. Ô Vertu charmante, Votre empire est doux."")",0.8,Substitution
6,"('#soleil', ""Il en effacera les plus glorieux noms, Dès qu'il pourra lui-même animer son armée ; Et tout ce que d'eux tous a dit la renommée Te fera voir en lui le plus grand des Bourbons. Son père et son aïeul tous rayonnants de gloire, Ces grands rois qu'en tous lieux a suivis la victoire, Lui voyant emporter sur eux le premier rang, En deviendraient jaloux s'il n'était pas leur sang. Mais vole dans mon char, muse ; je veux t'apprendre Tout l'avenir d'un roi qui t'est si précieux."")","('#la-vertu', ""Ne vous abusez point par une vaine attente :  On n'a pas aisément les prix que je présente ; Ils coûtent mille efforts ils font mille jaloux. L'inconstante Fortune à ma nuire est constante ;  Lorsque l'on suit mes pas on s'expose à mes coups. On trouve en son fatal courroux Une hydre toujours renaissante."")",0.57,Substitution
7,,"('#megathyme', ""Avec vous rien n'épouvante."")",1.0,Deletion
8,"('#melpomene', ""Je sais déjà ce qu'on doit en attendre, Et je lis chaque jour son destin dans les cieux."")","('#phronime', ""On n'est point heureux sans vous."")",1.66,Substitution
9,,"('#phronime #megathyme #choeur', 'Ô Vertu charmante, etc.')",1.0,Deletion
10,"('#soleil', ""Viens donc, viens avec moi faire le tour du monde ; Qu'unissant ensemble nos voix, Nous fassions résonner sur la terre et sur l'onde Qu'il est et le plus jeune et le plus grand des rois."")","('#la-vertu', ""Fuyons de la grandeur la pompe embarrassante ;  La retraite a des biens dont la douceur enchante Et qui sont réservés pour nous. Jouissons du bonheur d'une vie innocente ; C'est le bien le plus grand de tous."")",1.21,Substitution
11,"('#melpomene', ""Soleil, j'y vole ; attends-moi donc, de grâce."")",,1.0,Insertion
12,"('#soleil', ""Viens, je t'attends, et te fais place. Mélpomène vole dans le char du soleil, et y ayant pris place auprès de lui, ils unissent leurs voix, et chantent cet air à la louange du roi. Le dernier vers de chaque couplet est répété par le choeur de la musique."")","('#phronime #megathyme #choeur', ""Ô Vertu charmante, etc. L'innocence, les Plaisirs innocents, et toute la suite de la Vertu témoignent leur joie en dansant et en chantant."")",0.88,Substitution
13,"('#melpomene #soleil', 'Cieux, écoutez ; écoutez, mers profondes ; Et vous, antres et bois, Affreux déserts, rochers battus des ondes, Redites après nous d\'une commune voix : "" Louis est le plus jeune et le plus grand des rois. "" La majesté qui déjà l\'environne Charme tous ses François ; Il est lui seul digne de sa couronne ; Et quand même le ciel l\'aurait mise à leur choix, Il serait le plus jeune et le plus grand des rois. C\'est à vos soins, reine, qu\'on doit la gloire De tant de grands exploits ; Ils sont partout suivis de la victoire ; Et l\'ordre merveilleux dont vous donnez ses lois Le rend et le plus jeune et le plus grand des rois.')","('#phronime #megathyme', ""La grandeur brillante,  qui fait tant de bruit, N'a rien qui nous tente : Le repos la fuit. Malheureux qui la suit... ! Fortune volage, Laissez-nous en paix ! Vous ne donnez jamais Qu'un pompeux esclavage : Tous vos biens n'ont que de faux attraits. Dans un doux asile Nous bornons nos voeux : Notre sort est tranquille ; C'est un bien qui doit nous rendre heureux. La Vertu couronne Ses amants constant : Heureux qui lui donne Ses soins et son temps ; Ses voeux seront contents... Fortune volage, etc. Le lieu champêtre que la Vertu a choisi pour retraite est tout-à-coup embelli d'ornements magnifiques. On voit sortir de terre un parterre de fleurs, deux rangs de statues, des berceaux dorés et des fontaines jaillissantes."")",0.15,Substitution
14,"('#soleil', ""Voilà ce que je dis sans cesse Dans tout mon large tour. Mais c'est trop retarder le jour ; Allons, muse, l'heure me presse, Et ma rapidité Doit regagner le temps que sur cette province, Pour contempler ce prince, Je me suis arrêté. Le Soleil part avec rapidité, et enlève Melpomène avec lui dans son char pour aller publier ensemble la même chose au reste de l'univers."")","('#la-vertu', ""Qui nous fait voir ici tant de magnificence.. ? C'est la Fortune qui s'avance. Me cherchez-vous quand je vous fuis. Fortune, je sais trop que vous m'êtes contraire. Non, ce n'est pas un soin qui vous soit ordinaire D'embellir les lieux où je suis. On entend le bruit éclatant d'un grand nombre d'instruments. La Fortune s'approche : l'Abondance et la Magnificence l'accompagnent, avec une suite richement parée. Tout se réjouit et tout danse autour de la Fortune."")",0.25,Substitution
15,"('#cassiope', ""Généreux inconnu, qui chez tous les monarques Portez de vos vertus les éclatantes marques, Et dont l'aspect suffit à convaincre nos yeux Que vous sortez du sang ou des rois ou des dieux, Puisque vous avez vu le sujet de ce crime Que chaque mois expie une telle victime, Cependant qu'en ce lieu nous attendrons le roi, Soyez-y juste juge entre les dieux et moi. Jugez de mon forfait, jugez de leur colère ; Jugez s'ils ont eu droit d'en punir une mère, S'ils ont dû faire agir leur haine au même instant."")","('#la-fortune', ""Effaçons du passé la mémoire importune ; J'ai toujours contre vous vainement combattu : Un auguste héros ordonne à la Fortune D'être en paix avec la Vertu."")",0.62,Substitution
16,,"('#la-vertu', ""Ah ! je le reconnais sans peine ; C'est le héros qui calme l'Univers."")",1.0,Deletion
17,"('#persee', ""J'en ai déjà jugé, reine, en vous imitant ; Et si de vos malheurs la cause ne procède Que d'avoir fait justice aux beautés d'Andromède, Si c'est là ce forfait digne d'un tel courroux, Je veux être à jamais coupable comme vous. Mais comme un bruit confus m'apprend ce mal extrême, Ne le puis-je, madame, apprendre de vous-même, Pour mieux renouveler ce crime glorieux Où soudain la raison est complice des yeux ?"")","('#la-fortune', ""Lui seul pour vous pouvait vaincre ma haine ; Il vous révère, et je le sers. Je l'aime constamment, moi qui suis si légère. Partout suivant ses voeux avec ardeur je cours. Vous paraissez toujours sévère, Et vous êtes toujours Ses plus chères amours."")",0.3,Substitution
18,"('#cassiope', 'écoutez : la douleur se soulage à se plaindre ; Et quelques maux qu\'on souffre ou que l\'on aie à craindre, Ce qu\'un coeur généreux en montre de pitié Semble en notre faveur en prendre la moitié. Ce fut ce même jour qui conclut l\'hyménée De ma chère Andromède avec l\'heureux Phinée : Nos peuples, tous ravis de ces illustres noeuds, Sur les bords de la mer dressèrent force jeux ; Elle en donnait les prix. Dispensez ma tristesse De vous dépeindre ici la publique allégresse ; On décrit mal la joie au milieu des malheurs, Et sa plus douce idée est un sujet de pleurs. Ô jour, que ta mémoire encore m\'est cruelle ! Andromède jamais ne me parut si belle ; Et voyant ses regards s\'épandre sur les eaux Pour jouir et juger d\'un combat de vaisseaux : "" telle, dis-je, Vénus sortit du sein de l\'onde, Et promit à ses yeux la conquête du monde, Quand elle eut consulté sur leur éclat nouveau Les miroirs vagabonds de son flottant berceau. "" À ce fameux spectacle on vit les Néréides Lever leurs moites fronts de leurs palais liquides, Et pour nouvelle pompe à ces nobles ébats À l\'envi de la terre étaler leurs appas. Elles virent ma fille ; et leurs regards à peine Rencontrèrent les siens sur cette humide plaine, Que par des traits plus forts se sentant effacer, éblouis et confus je les vis s\'abaisser, Examiner les leurs, et sur tous leurs visages En chercher d\'assez vifs pour braver nos rivages. Je les vis se choisir jusqu\'à cinq et six fois, Et rougir aussitôt nous comparant leur choix ; Et cette vanité qu\'en toutes les familles On voit si naturelle aux mères pour leurs filles, Leur cria par ma bouche : "" en est-il parmi vous, Ô nymphes ! Qui ne cède à des attraits si doux ? Et pourrez-vous nier, vous autres immortelles, Qu\'entre nous la nature en forme de plus belles ? "" Je m\'emportais sans doute, et c\'en était trop dit : Je les vis s\'en cacher de honte et de dépit ; J\'en vis dedans leurs yeux les vives étincelles : L\'onde qui les reçut s\'en irrita pour elles ; J\'en vis enfler la vague, et la mer en courroux Rouler à gros bouillons ses flots jusques à nous. C\'eût été peu des flots : la soudaine tempête, Qui trouble notre joie et dissipe la fête, Enfante en moins d\'une heure et pousse sur nos bords Un monstre contre nous armé de mille morts. Nous fuyons, mais en vain ; il suit, il brise, il tue ; Chaque victime est morte aussitôt qu\'abattue. Nous ne voyons qu\'horreur, que sang de toutes parts ; Son haleine est poison, et poison ses regards : Il ravage, il désole et nos champs et nos villes, Et contre sa fureur il n\'est aucuns asiles. Après beaucoup d\'efforts et de voeux superflus, Ayant souffert beaucoup, et craignant encore plus, Nous courons à l\'oracle en de telles alarmes ; Et voici ce qu\'Ammon répondit à nos larmes : "" pour apaiser Neptune, exposez tous les mois Au monstre qui le venge une fille à son choix, Jusqu\'à ce que le calme à l\'orage succède ; Le sort vous montrera Celle qu\'il agréera : Différez cependant les noces d\'Andromède."" Comme dans un grand mal un moindre semble doux, Nous prenons pour faveur ce reste de courroux. Le monstre disparu nous rend un peu de joie : On ne le voit qu\'aux jours qu\'on lui livre sa proie. Mais ce remède enfin n\'est qu\'un amusement : Si l\'on souffre un peu moins, on craint également ; Et toutes nous tremblons devant une infortune Qui toutes nous menace avant qu\'en frapper une. La peur s\'en renouvelle au bout de chaque mois ; J\'en ai cru de frayeur déjà mourir cinq fois. Déjà nous avons vu cinq beautés dévorées, Mais des beautés, hélas ! Dignes d\'être adorées, Et de qui tous les traits, pleins d\'un céleste feu, Ne cédaient qu\'à ma fille, et lui cédaient bien peu : Comme si choisissant de plus belle en plus belle, Le sort par ces degrés tâchait d\'approcher d\'elle, Et que pour élever ses traits jusques à nous, Il essayât sa force et mesurât ses coups. Rien n\'a pu jusqu\'ici toucher ce dieu barbare ; Et le sixième choix aujourd\'hui se prépare : On le va faire au temple ; et je sens malgré moi Des mouvements secrets redoubler mon effroi. Je fis hier à Vénus offrir un sacrifice, Qui jamais à mes voeux ne parut si propice ; Et toutefois mon coeur, à force de trembler, Semble prévoir le coup qui le doit accabler. Vous donc, qui connaissez et mon crime et sa peine, Dites-moi s\'il a pu mériter tant de haine, Et si le ciel devait tant de sévérité Aux premiers mouvements d\'un peu de vanité.')","('#la-vertu', ""Mes biens brillent moins que les vôtres.  Vous trouverez tant de coeurs qui n'adorent que vous ! Vous les enchantez presque tous."")",0.89,Substitution
19,"('#persee', ""Oui, madame, il est juste ; et j'avouerai moi-même Qu'en le blâmant tantôt j'ai commis un blasphème. Mais vous ne voyez pas, dans votre aveuglement, Quel grand crime il punit d'un si grand châtiment. Les nymphes de la mer ne lui sont pas si chères Qu'il veuille s'abaisser à suivre leurs colères ; Et quand votre mépris en fit comparaison, Il voyait mieux que vous que vous aviez raison. Il venge, et c'est de là que votre mal procède, L'injustice rendue aux beautés d'Andromède. Sous les lois d'un mortel votre choix l'asservit ! Cette injure est sensible aux dieux qu'elle ravit, Aux dieux qu'elle captive ; et ces rivaux célestes S'opposent à des noeuds à sa gloire funestes, En sauvent les appas qui les ont éblouis, Punissent vos sujets qui s'en sont réjouis. Jupiter, résolu de l'ôter à Phinée, Exprès par son oracle en défend l'hyménée. À sa flamme peut-être il veut la réserver ; Ou s'il peut se résoudre enfin à s'en priver, À quelqu'un de ses fils sans doute il la destine ; Et voilà de vos maux la secrète origine. Faites cesser l'offense, et le même moment Fera cesser ici son juste châtiment."")","('#la-fortune', ""Vous régnez sur un coeur qui vaut seul tous les autres. Ah ! S'il m'eût voulu suivre, il eût tout surmonté. Tout tremblait, tout cédait à l'ardeur qui l'anime. C'est vous, Vertu trop magnanime ; C'est vous qui l'avez arrêté."")",0.38,Substitution
20,"('#cassiope', ""Vous montrez pour ma fille une trop haute estime, Quand pour la mieux flatter vous me faites un crime, Dont la civilité me force de juger Que vous ne m'accusez qu'afin de m'obliger. Si quelquefois les dieux pour des beautés mortelles Quittent de leur séjour les clartés éternelles, Ces mêmes dieux aussi, de leur grandeur jaloux, Ne font pas chaque jour ce miracle pour nous ; Et quand pour l'espérer je serais assez folle, Le roi, dont tout dépend, est homme de parole ; Il a promis sa fille, et verra tout périr Avant qu'à se dédire il veuille recourir. Il tient cette alliance et glorieuse et chère : Phinée est de son sang, il est fils de son frère."")","('#la-vertu', ""Son grand coeur s'est mieux fait connaître, Il a fait sur lui-même un effort généreux : Il veut rendre le monde heureux. Il préfère au bonheur d'en devenir le maître, La gloire de montrer qu'il mérite de l'âtre."")",0.73,Substitution
21,"('#persee', 'Reine, le sang des dieux vaut bien celui des rois... Mais nous en parlerons encore quelque autre fois. Voici le roi qui vient.')","('#la-vertu #la-fortune', 'Sans cesse combattons à qui servira mieux Ce héros glorieux.')",1.44,Substitution
22,"('#cephee', ""N'en parlons plus, Phinée, Et laissons d'Andromède aller la destinée. Votre amour fait pour elle un inutile effort : Je la dois comme une autre au triste choix du sort. Elle est cause du mal, puisqu'elle l'est du crime : Peut-être qu'il la veut pour dernière victime, Et que nos châtiments deviendraient éternels, S'ils ne pouvaient tomber sur les vrais criminels."")","('#la-vertu #la-fortune #choeurs', ""Les Dieux ne l'ont donné que pour le bien du monde, Que ses travaux sont grands ! que ses destins sont beaux ! Dans une paix profonde  Il trouve une source féconde De triomphes nouveaux. Les Dieux ne l'ont donné que pour le bien du monde."")",0.56,Substitution
23,"('#phinee', ""Est-ce un crime en ces lieux, seigneur, que d'être belle ?"")","('#la-vertu', ""Que jusque dans les jeux tout nous parle de lui. Les Dieux, qui méditaient leur plus parfait ouvrage, Autrefois dans Persée en tracèrent l'image : J'obtiendrai qu'Apollon le ranime aujourd'hui."")",1.63,Substitution
24,"('#cephee', 'Elle a rendu par là sa mère criminelle.')",,1.0,Insertion
25,"('#phinee', ""C'est donc un crime ici que d'avoir de bons yeux Qui sachent bien juger d'un tel présent des cieux ?"")","('#la-vertu #la-fortune', 'Mille nouveaux concerts doivent se faire entendre : Tout promet au mérite un favorable sort. Quel bien ne doit-on pas attendre De notre heureux accord ? La suite de la Vertu et le suite de la Fortune se réunissent, et témoignent leur joie par leurs danses et par leurs chants.')",1.4,Substitution
26,"('#cephee', ""Qui veut en bien juger n'a point le privilège D'aller jusqu'au blasphème et jusqu'au sacrilège."")","('#suivante-de-la-vertu #suivante-de-la-fortune', ""Quel heureux jour pour nous ! Tout suit notre envie. Quel heureux jour pour nous ! Que notre sort est doux ! La Vertu voit en paix tous ceux qui l'ont suivie : La Fortune pour eux perd son fatal courroux. Quel heureux jour pour nous, etc. Tous nos jours seront beaux ; goûtons, goûtons la vie. Rien ne trouble nos voeux, le ciel les comble tous. Quel heureux jour pour nous, etc."")",1.42,Substitution
27,"('#cassiope', ""Ce blasphème, seigneur, de quoi vous m'accusez..."")","('#la-vertu #la-fortune #choeurs', 'Heureuse intelligence, Douce et charmante paix, Comblez notre espérance. Douce et charmante paix, Puissiez-vous durer à jamais.')",1.51,Substitution
28,"('#cephee', ""Madame, après les maux que vous avez causés, C'est à vous à pleurer, et non à vous défendre. Voyez, voyez quel sang vous avez fait répandre ; Et ne laissez paraître en cette occasion Que larmes, que soupirs, et que confusion. Je vous le dis encore, elle la crut trop belle ; Et peut-être le sort l'en veut punir en elle : Dérober Andromède à cette élection, C'est dérober sa mère à sa punition."")","('#cephee', ""Je crains que Junon ne refuse D'apaiser sa haine pour nous ; Je crains, malgré vos voeux, Que l'affreuse Méduse Ne revienne servir son funeste courroux. L'Ethiopie en vain à mes lois est soumise ; Quelle espérance m'est permise, Si le ciel contre nous veut toujours être armé ? Que me sert toute ma puissance ? Contre ce monstre affreux Mon peuple est sans défense : Qui le voit est soudain en rocher transformé ; Et si Junon, que votre orgueil offense, N'arrête sa vengeance, Je serai bientôt roi d'un peuple inanimé."")",0.07,Substitution
29,"('#phinee', ""Déjà cinq fois, seigneur, à ce choix exposée, Vous voyez que cinq fois le sort l'a refusée."")",,1.0,Insertion
30,"('#cephee', ""Si le courroux du ciel n'en veut point à ses jours, Ce qu'il a fait cinq fois il le fera toujours."")",,1.0,Insertion
31,"('#phinee', ""Le tenter si souvent, c'est lasser sa clémence : Il pourra vous punir de trop de confiance : Vouloir toujours faveur, c'est trop lui demander, Et c'est un crime enfin que de tant hasarder. Mais quoi ? N'est-il, seigneur, ni bonté paternelle, Ni tendresse du sang qui vous parle pour elle ?"")","('#cassiope', ""Heureuse épouse, heureuse mère, Trop vaine d'un sort glorieux, Je n'ai pu m'empêcher d'exciter la colère De l'épouse du Dieu de la Terre et des Cieux ! J'ai comparé ma gloire à sa gloire immortelle. La déesse punit ma fierté Criminelle ; Mais j'espère fléchir son courroux rigoureux ; J'ordonne les célèbres Jeux Qu'à l'honneur de Junon en ces lieux on prépare Mon orgueil offensa cette divinité ; Il faut que mon respect répare Le crime de ma vanité."")",0.31,Substitution
32,"('#cephee', ""Ah ! Ne m'arrachez point mon sentiment secret. Phinée, il est tout vrai, je l'expose à regret. J'aime que votre amour en sa faveur me presse ; La nature en mon coeur avec lui s'intéresse ; Mais elle ne saurait mettre d'accord en moi Les tendresses d'un père et les devoirs d'un roi ; Et par une justice à moi-même sévère, Je vous refuse en roi ce que je veux en père."")","('#cephee', ""Je vais, avec Persée, implorer l'assistance Du dieu dont il tient la naissance ; Il est fils du plus grand des Dieux. Apaisez de Junon, la colère fatale, Ce serait pour elle en ces lieux Un objet odieux Qu'un fils de sa rivale."")",0.0,Match
33,"('#phinee', ""Quelle est cette justice, et quelles sont ces lois Dont l'aveugle rigueur s'étend jusques aux rois ?"")","('#cassiope', 'Par un cruel châtiment Les Dieux vous font voir leur haine ; On les irrite aisément, On les apaise avec peine.')",1.24,Substitution
34,"('#cephee', ""Celles que font les dieux, qui, tous rois que nous sommes, Punissent nos forfaits ainsi que ceux des hommes, Et qui ne nous font part de leur sacré pouvoir Que pour le mesurer aux règles du devoir. Que diraient mes sujets si je me faisais grâce, Et si, durant qu'au monstre on expose leur race, Ils voyaient, par un droit tyrannique et honteux, Le crime en ma maison, et la peine sur eux ?"")","('#cephee', ""Les Dieux punissent la fierté, Ils n'est point de grandeur que le ciel irrité N'abaisse quand il veut, et ne réduisent en poudre, Mais un prompt repentir Peut arrêter la foudre Toute prête à partir."")",0.18,Substitution
35,,"('#merope', 'Puissions nous désarmer le ciel qui nous menace.')",1.0,Deletion
36,"('#phinee', 'Heureux sont les sujets, heureuses les provinces Dont le sang peut payer pour celui de leurs princes !')","('#cephee #cassiope #merope', ""Ô Dieux ! qui punissez l'audace ! Dieux ! redoutables ennemis ! Pardonnez à des coeurs soumis. Céphée sort."")",0.99,Substitution
37,"('#cephee', ""Mais heureux est le prince, heureux sont ses projets, Quand il se fait justice ainsi qu'à ses sujets ! Notre oracle, après tout, n'excepte point ma fille : Ses termes généraux comprennent ma famille ; Et ne confondre pas ce qu'il a confondu, C'est se mettre au-dessus du dieu qui l'a rendu."")","('#cassiope', ""Aimé et destiné pour épouser ma fille, Vous savez mes desseins pour vous, Ma soeur ; par votre hymen, il m'aurait été doux D'unir Persée à ma famille ; Mais je le veux en vain, l'Amour n'y consent pas : Aux yeux de ce héros, ma fille a trop d'appas."")",0.3,Substitution
38,"('#persee', ""Seigneur, s'il m'est permis d'entendre votre oracle, Je crois qu'à sa prière il donne peu d'obstacle ; Il parle d'Andromède, il la nomme, il suffit, Arrêtez-vous pour elle à ce qu'il vous en dit : La séparer longtemps d'un amant si fidèle, C'est tout le châtiment qu'il semble vouloir d'elle. Différez son hymen sans l'exposer au choix. Le ciel assez souvent, doux aux crimes des rois, Quand il leur a montré quelque légère haine, Répand sur leurs sujets le reste de leur peine."")","('#merope', ""Le fils de Jupiter l'adore ; Croyez-vous que je sois encore à m'en apercevoir ? J'y prends trop d'intérêt pour ne le pas savoir. Je goûtais une paix heureuse Avant que ce héros parût dans cette Cour ; Par une espérance trompeuse, Allait-il me livrer au pouvoir de l'Amour ?"")",0.14,Substitution
39,"('#cephee', ""Vous prenez mal l'oracle ; et pour l'expliquer mieux, Sachez... Mais quel éclat vient de frapper mes yeux ? D'où partent ces longs traits de nouvelles lumières ?"")",,1.0,Insertion
40,"('#persee', ""Du ciel qui vient d'ouvrir ses luisantes barrières, D'où quelque déité vient, ce semble, ici-bas Terminer elle-même entre vous ces débats."")","('#cassiope', ""Sachez bien la faiblesse où votre coeur s'engage."")",0.89,Substitution
41,"('#cassiope', ""Ah ! Je la reconnais, la déesse d'Éryce ; C'est elle, c'est Vénus, à mes voeux si propice : Je vois dans ses regards mon bonheur renaissant. Peuple, faites des voeux, tandis qu'elle descend."")","('#merope', ""Mon vainqueur encore aujourd'hui Ignore de mon coeur le funeste esclavage : Je mourrai de honte et de rage Si l'ingrat connaissait l'amour que j'ai pour lui."")",0.9,Substitution
