,regnard-arlequin-bonnes-fortunes,regnard-filles-errantes,Cost,Operation Type
308,"('#le-docteur', ""Or, voulez-vous savoir quelle différence il y a entre l'homme et la bête ?  C'est que l'un se conduit par la raison et l'autre par l'instinct.  Entre le ciel et la terre ?  C'est que l'un est sur notre tête, l'autre sous nos pieds.  Entre le roturier et le gentilhomme ?  C'est que l'un paye ses dettes, l'autre se moque de ses créanciers.  Entre le marchand et le voleur ?  C'est que l'un vole dans les villes, l'autre dans les bois.  Entre le procureur et l'assassin ? C'est que l'un enlève les biens, l'autre la vie.  Entre le médecin et le bourreau ?  C'est que l'un assassine peu à peu ses malades, et que l'autre tue tout d'un coup ceux qui se portent bien. "")","('#pierrot', ""Je suis à votre égard ce que la bride est à un cheval, un bâton à un aveugle, un gouvernail à un vaisseau : je suis la bride, et vous êtes le cheval ; je suis le bâton, vous êtes l'aveugle ; vous êtes le vaisseau, et moi le gouvernail : mais un gouvernail avec lequel j'empêcherai que vous n'alliez donner contre les rochers des garçons ; car ce monde est une mer, et les vents soufflent dans cette eau qui bouillonne... ce qui fait que la raison dans... cette mer..."")",0.81,Substitution
309,,"('#isabelle', 'Vite, vite, au secours !  Voilà un homme qui se noie.')",1.0,Deletion
310,"('#arlequin', 'Cela est le mieux du inonde.  Je voudrais donc savoir... ')","('#pierrot', ""Que la raison, dis-je, la...  Enfin, Arlequin m'a laissé dans la maison pour vous garder."")",1.87,Substitution
311,"('#le-docteur', ""Quoi ?  La philosophie ou la rhétorique ?  La théorie ou la pratique ?  La géométrie ou l'astrologie ?  La pharmacie ou la médecine ?  La sphère ou la géographie ?  La cosmographie ou la topographie ? "")",,1.0,Insertion
312,"('#arlequin', 'Non ; je ne veux rien de tout cela... ')","('#isabelle', ""Je te suis trop obligée ; je t'assure que je me garderai bien moi-même."")",1.17,Substitution
313,,"('#pierrot', ""Nenni pas, s'il vous plaît ; je ne me fie plus aux filles ; j'y ai été attrapé."")",1.0,Deletion
314,,"('#isabelle', 'Comment donc ?  Est-ce que tu entretiens commerce avec des filles ?')",1.0,Deletion
315,"('#le-docteur', ""Voulez-vous que je vous parle des arts ou des sciences ?  Des huit parties de l'oraison ?  Des trois puissances de l'âme, la mémoire, l'entendement et la volonté ?  De l'influence des planètes, Jupiter, Mars, Mercure, etc ?  De la qualité des étoiles majeures, fixes ou errantes ?  Des comètes crinées, tombantes et volantes ?  De la disparité des tempéraments flegmatiques, sanguins et mélancoliques ?  Des mouvements du coeur, systoliques et diastoliques ? "")",,1.0,Insertion
316,"('#arlequin', ""Hé, monsieur !  Je n'ai que faire de ce galimatias-là. "")","('#pierrot', ""Bon !  Quand on est fait d'une certaine manière, on en a à revendre de cette marchandise-là.  Une petite carogne me pria de lui donner un baiser.  Dame !  Moi, il ne faut pas me le dire deux fois : 0je ne fus ni fou ni étourdi ; je m'approchai ; elle me donna un grand soufflet : depuis ce temps-là, j'ai bien juré que je n'en baiserais plus."")",0.86,Substitution
317,"('#le-docteur', ""Est-ce de l'histoire ou de la fable que vous voulez que je vous parle ?  Commencerai-je par le déluge ?  Le jugement de Pâris ?  Les malheurs de Pyrame et de Thishé ?  L'incendie de Troie ?  Les erreurs d'Ulysse ?  Le passage d'Énée ?  Le sac de Carthage ?  La mort de Tarquin ?  Les triomphes de Scipion ?  La conjuration de Catilina ?  Le pas des Thermopyles ?  La bataille de Marathon ?  Eh !  Non, non, cent fois non, de par tous les diables, non.  Je voudrais savoir seulement si je dois épouser une brune ou une blonde.  Arlequin dit non à chaque demande. "")","('#isabelle', ""C'est très bien fait, Pierrot.  Crois-moi, ne te joue point aux filles ; il n'y a rien à gagner."")",1.47,Substitution
318,"('#le-docteur', 'Eh !  Que ne parlez-vous donc !  Il y a deux heures que vous me faites chanter inutilement. ')",,1.0,Insertion
319,"('#arlequin', 'Comment diable voulez-vous que je parle ?  Vous ne toussez ni ne crachez : je ne puis prendre mon temps.  Ouf ! ')","('#pierrot', ""Si ce n'est quelque bon soufflet à la rencontre.  Allons, point tant de raisonnements ; rentrez, et marchez devant moi. Isabelle rentre ; Pierrot la suit des yeux."")",1.19,Substitution
320,"('#le-docteur', 'Vous voulez donc savoir si vous devez épouser une brune ou une blonde ? ')",,1.0,Insertion
321,"('#arlequin', 'Oui, monsieur.  Ah !  Nous y voilà, à la fin. ')","('#pierrot', 'Perdez cela de vue, autant de gobé. Scènes italiennes.')",1.63,Substitution
322,"('#le-docteur', ""Voulez-vous que je vous dise cela par les règles d'astronomie, prophétie, chronologie, analogie, physionomie, chimie, astrologie, hydromancie, éromancie, pyromancie, koscinomancie, chyromancie, nigromancie ? "")","('#arlequin', ""Hé !  L'Espérance, Brise-Fer, Poudre-à-Canon, l'Effroi-des-Poulets !  Hé bien, mes enfants !  Que vous dit le coeur ?  Y a-t-il longtemps que vous n'avez mangé de chair humaine ?"")",1.0,Substitution
323,"('#arlequin', ""Je ne m'en soucie pas, pourvu... "")",,1.0,Insertion
324,"('#le-docteur', ""Aimeriez-vous mieux que ce fût par le moyen de l'invocation, imprécation, multiplication, indiction, spéculation, superstition, interprétation, conjuration, prognostication, évocation ? "")",,1.0,Insertion
325,"('#arlequin', ""Corbillon, qu'y met-on ?  Hé, monsieur !  Cela m'est indifférent, pourvu que... "")","('#pasquariel', ""Vous n'avez qu'à dire, mon capitaine ; je fais d'abord main basse. Il met l'épée la main, et pousse de tous côtés, comme s'il avait plusieurs personnes à combattre."")",1.46,Substitution
326,"('#le-docteur', 'Si vous voulez, je me servirai des connaissances de la rhétorique, physique, logique, métaphysique, arithmétique, art magique, poétique, politique, musique, dialectique, éthique, mathématique, téraprectique. ')",,1.0,Insertion
327,"('#arlequin', ""Ali !  J'en mourrai ! "")","('#arlequin', 'Voilà, mordi !  Un bon garçon.  Ce drôle-là a tué plus de poulets à lui seul que toute ma compagnie ensemble.')",1.45,Substitution
328,"('#le-docteur', ""Alba ligustra cadant ; vaccinia nigra leguntur. Un autre, non moins célèbre, s'écrie :  Hic niger est : ore hunc tu, Romane, caveto.  Puis donc que toutes les sciences ci-dessus sont des terres inconnues pour vous, je vous dirai que nos auteurs ont parlé différemment sur le point dont il s'agit.  Les uns tenaient pour les blondes, et les autres pour les brunes. La différence du poil fait aussi la différence de l'inclination.  La blonde est tendre, languissante et amoureuse ; la brune est vive, gaillarde et fringante.  La blonde pourra bien outrager votre front ; la brune ne vous en quittera pas à meilleur marché. Un savant poète de l'antiquité dit :  Ainsi vous voyez que c'est une matière bien délicate : Undique ambages, et qu'il est difficile d'y porter un jugement certain ; car, quoique je sois consommé dans toutes sortes de sciences, ne croyez pas que je veuille que mon sentiment prévale.  Je ne m'arrête pas mordicus à mon opinion.  L'obstination est le propre de la bête, et je ne voudrais pas que... "")","('#pasquariel', ""Holà !  Holà !  En voilà assez d'échinés.  Il ne faut pas laisser refroidir cette ardeur-là : allons chercher Cinthio."")",1.29,Substitution
329,"('#arlequin', ""Allez-vous-en à tous les diables ; je ne veux rien savoir.  Quel babillard !  Je gage que si on examinait cet homme-là, on trouverait que c'est une femme. Il veut s'en aller. "")","('#arlequin', ""Qui est cet homme-là ?  Il me semble qu'il a assez l'encolure d'un dénicheur de filles.  Qui êtes-vous, mon ami ?  Ne vous appelez-vous pas Cinthio ?"")",1.09,Substitution
330,"('#le-docteur', 'Je vous dis encore que... ')","('#cinthio', ""Hé !  Qu'en avez-vous affaire ?"")",1.12,Substitution
331,"('#arlequin', ""Je vous dis que je vous baillerai sur les oreilles.  Quel insolent est-ce là ?  Je ne veux plus rien entendre.  Le Docteur le prend par la manche. Arlequin veut s'échapper de ses mains, et son justaucorps reste au Docteur. Arlequin s'enfuit ; le Docteur le poursuit en parlant toujours ad libitum."")","('#arlequin', ""Comment, ventrebleu !  Ce que j'en ai affaire !  Si vous étiez Cinthio, ou que vous fussiez seulement cousin, petit-cousin, arrière-petit-cousin de Cinthio, par la ventrebleu !  Je veux que le diable m'emporte, vous verriez beau jeu."")",0.91,Substitution
332,"('#isabelle', 'Donne-moi ce chapeau.  Hé bien, Pierrot, ce cavalier-là est il de ton goût ? ')","('#cinthio', 'Ne pourrait-on pas savoir, monsieur, en quoi ce Cinthio vous a tant offensé ?  Car vous me paraissez bien échauffé.')",1.11,Substitution
333,"('#pierrot', 'Pardi, mademoiselle, vous voilà à charmer !  On vous prendrait pour moi.  Il y a pourtant un peu de différence.  Est-ce que vous allez lever une compagnie de fantassinerie ? ')","('#arlequin', ""Assurément, je le suis.  C'est un drôle qui va de fille en fille avec une promesse de mariage circulaire.  Oh !  Parbleu, si je vous rencontre, mon petit ami, vous tiendrez la parole que vous avez donnée à ma soeur, ou vous aurez les étrivières de ma façon."")",0.44,Substitution
334,"('#isabelle', ""Ne pense pas te moquer ; je tâterais fort bien de l'armée, et je n'appréhenderais pas plus le feu qu'un autre. "")","('#cinthio', 'Cela est bien scélérat de tromper comme cela les filles.')",1.82,Substitution
335,"('#pierrot', ""Si tous les capitaines étaient faits comme vous, ils pourraient gagner les frais de l'enrôlement, et faire leurs soldats eux-mêmes. "")",,1.0,Insertion
336,"('#isabelle', ""Je ne mets pas cet habit-ci sans raison.  Tu sais que mon père veut que j'épouse monsieur Bassinet. "")","('#arlequin', 'Par la tête !  Par la mort !  Je voudrais le tenir pour cent pistoles.')",1.67,Substitution
337,"('#pierrot', ""Votre père ?  Bon !  C'est un vieux fou qui radote ; et je le lui ai dit, da ! "")",,1.0,Insertion
338,"('#isabelle', ""Je me sers du déguisement où tu me vois pour détourner ce mariage.  Monsieur Bassinet ne m'a jamais vue ; il doit venir me voir, et j'attends sa visite en cet équipage.  Je vais lui apprendre des nouvelles d'Isabelle, et je lui en ferai, parbleu, passer l'envie. "")","('#cinthio', ""Touchez là, monsieur ; je veux vous faire gagner plus de cinquante louis aujourd'hui : donnez-m'en trente, je vous dirai où est Cinthio ; et, afin de ne pas vous tenir plus longtemps en suspens, c'est moi."")",1.18,Substitution
339,"('#pierrot', ""Mardi !  Voilà une hardie tête de fille !  J'ai toujours dit à votre père que je ne croyais pas qu'il fût le mari de votre mère quand elle vous a faite.  Vous avez trop d'esprit. Qu'en croyez-vous ? "")","('#arlequin', ""C'est vous ?  C'est vous ?  Ah !  Par ma foi, j'en suis bien aise.  Vous ne voulez donc pas, monsieur, épouser ma soeur ?"")",0.1,Substitution
340,"('#isabelle', ""Pour moi, Pierrot, je ne m'embarrasse pas de cela ; je ne songe qu'à faire rompre, si je puis, l'impertinent mariage dont je suis menacée.  Mais je crois que voilà monsieur Bassinet ; laisse-moi avec lui : je vais commencer mon rôle. "")","('#cinthio', 'Bon !  Sommes-nous dans un siècle à épouser ?')",1.55,Substitution
341,"('#pierrot', ""Pardi !  C'est lui-même ; il ressemble à un marcassin."")",,1.0,Insertion
342,"('#isabelle', 'Serviteur, monsieur, serviteur. ')",,1.0,Insertion
343,"('#monsieur-bassinet', ""Ah, monsieur !  Je vous demande pardon.  On m'avait dit que Mademoiselle Isabelle était dans sa chambre.  Que diable cherche ici ce godelureau-là ?  À part. "")",,1.0,Insertion
344,"('#isabelle', ""Monsieur, elle n'y est pas, et je l'attends.  Mais vous, monsieur, que venez-vous faire ici ?  Mademoiselle Isabelle est-elle malade ?  Car, à votre mine, je vous crois médecin, et vous avez toute l'encolure d'un membre de la Faculté. "")","('#arlequin', 'Non ?  Oh !  Parbleu, nous verrons : vous la prendrez, quand je devrais vous la faire avaler dans une médecine.  Laissez-moi faire seulement.')",0.49,Substitution
345,"('#monsieur-bassinet', ""Vous ne vous trompez pas, monsieur ; je suis un nourrisson d'Hippocrate : mais je ne viens pas ici pour tâter le pouls à Isabelle ; j'ai bien d'autres prétentions sur... "")","('#cinthio', 'Je me moque de vos menaces ; et pour vous faire voir que je ne vous crains, ni vous ni vos spadassins, je vais vous attendre dans cette hôtellerie-là.')",0.41,Substitution
346,"('#isabelle', ""Oui !  Et de quelle nature, s'il vous plaît, sont les prétentions d'un médecin sur une fille ? "")","('#arlequin', ""Qu'on me suive cet homme-là, et qu'on me le garde à vue.  Voilà, mordi !  Comme il faut sortir vigoureusement d'une affaire. Scènes italiennes."")",1.52,Substitution
347,"('#monsieur-bassinet', ""Je viens ici pour l'épouser. "")",,1.0,Insertion
348,"('#isabelle', ""Pour l'épouser !  Isabelle ? "")",,1.0,Insertion
349,"('#monsieur-bassinet', 'Isabelle.')","('#le-hollandais', 'Gouten tag, minher, gouten tag.')",1.35,Substitution
350,"('#isabelle', 'Ha, ha, ha ! ')","('#arlequin', 'Gouten tag, gouten tag.')",1.24,Substitution
351,"('#monsieur-bassinet', 'Mais cela est donc bien drôle ? ')","('#le-hollandais', ""Moi l'être un étrangir qui cherchir à logir dans sti ville. "")",1.81,Substitution
352,"('#isabelle', ""Point du tout ; mais c'est que...  Ha, ha, ha !...  Je ris comme cela quelquefois.  Ha, ha, ha ! "")","('#arlequin', ""Sti ville, monsir, l'être à vous bien obligir. Ma foi, voilà un croustilleux corps. À part."")",1.65,Substitution
353,"('#monsieur-bassinet', 'Comment donc !  Est-ce que je suis barbouillé ? ')","('#le-hollandais', ""Enseignir moi, s'il plaît à monsir, où être un logiment pour mon chevau et pour mon personne."")",1.67,Substitution
354,"('#isabelle', ""Bon !  Ne voyez-vous pas bien que je ris ?  Ha, ha, ha !  Dites-moi un peu, monsieur, en vous déterminant à un saut si périlleux, vous êtes-vous bien tâté ?  N'avez-vous point senti quelque petit mal de tête...  Vous m'entendez bien ? "")","('#arlequin', ""C'est une hôtellerie que vous cherchez, n'est-ce pas, monsieur ?"")",1.08,Substitution
355,,"('#le-hollandais', ""Oui, monsir, l'être une hôtellerie."")",1.0,Deletion
356,"('#monsieur-bassinet', 'Non, monsieur ; je me porte fort bien : je ne suis pas sujet à la migraine.')",,1.0,Insertion
357,"('#isabelle', ""Ma foi, vous porterez bien cela ; et je suis plus aise que vous ayez cette fille-là qu'un autre. "")","('#arlequin', ""Tenez, monsieur, en voilà une où vous serez parfaitement bien ; il y a de bon vin, et vous y trouverez aussi de jolies filles ; et voilà ce que vous demandez ; j'entends à demi-mot."")",0.48,Substitution
358,"('#monsieur-bassinet', 'Et moi aussi. ')","('#le-hollandais', ""Moi demandre excuse à monsir, si ne parlir pas bon français ; mais mon pensir l'être beaucoup plus meilleur que mon parlemente."")",1.98,Substitution
359,"('#isabelle', ""Mais quand elle sera votre femme, au moins n'allez pas nous la gâter par vos manières ridicules.  Nous avons eu assez de peine à la mettre sur le pied où elle est.  Le joli tour d'esprit !  Elle l'a comme le corps. "")","('#arlequin', ""Allez, monsieur, vous ne l'écorchez pas mal.  Croyez-moi, monsieur, allez vous reposer dans cette hôtellerie-là : car un homme qui n'a qu'une jambe doit être une fois plus las qu'un autre."")",0.98,Substitution
360,"('#monsieur-bassinet', ""Comme le corps !  Et savez-vous comme elle l'a tourné ? "")",,1.0,Insertion
361,"('#isabelle', ""Bon !  Qui le sait mieux que moi !  Si vous voulez, je vais la dessiner qu'il n'y manquera pas un trait.  Une gorge, morbleu !  Plantée là...  Bon !  C'est un marbre. "")",,1.0,Insertion
362,"('#monsieur-bassinet', 'Ouf !  Quel peintre ! ')","('#le-hollandais', 'Adieu, monsir ; moi remercir vous bien fortiment. Il frappe à la porte.')",1.58,Substitution
363,"('#isabelle', 'Je vous dis que vous ne sauriez faire une meilleure affaire. ')",,1.0,Insertion
364,"('#monsieur-bassinet', ""Je vois bien qu'elle ne serait point mauvaise pour vous. "")",,1.0,Insertion
365,"('#isabelle', ""Elle a, par-dessus cela, une adresse à conduire une affaire de coeur qui ne se comprend pas.  C'est un petit démon pour les tours d'esprit.  Si elle est votre femme, elle aura des intrigues avec toute la terre, que vous ne vous en apercevrez non plus que si elle était à Rome et vous au Japon.  Diable !  Une femme comme cela est un trésor pour le repos du ménage. "")","('#arlequin', 'Il faut que je sache un peu qui est cet étranger qui va loger chez moi.  Venez çà, monsieur ; ne peut-on pas savoir de quel pays vous êtes, et le sujet qui vous amène en cette ville ?')",1.01,Substitution
366,,"('#le-hollandais', ""Moi l'être un gentilhomme hollandais de Hollande, qui vient dans sti ville pour affaire de grand importement."")",1.0,Deletion
367,,"('#arlequin', ""Vous verrez que c'est un de ces sots qui se sont laissé prendre."")",1.0,Deletion
368,,"('#le-hollandais', ""Moi avoir toujours fait mon service sur la mer, et j'ai commandir un vaisseau de guerre des États dans le combat naval."")",1.0,Deletion
369,"('#monsieur-bassinet', ""Et avec tous ces beaux talents-là, d'où vient qu'elle n'est pas mariée ? Voilà des qualités merveilleuses pour être femme. "")","('#arlequin', 'Comment, diable, monsieur !  Hé !  Que venez-vous faire ici ?  Apparemment que vous avez un bon passeport ?')",1.33,Substitution
370,"('#isabelle', ""Ne savez-vous pas les allures du monde et la malignité des rivaux ?  Les uns disent qu'elle a des vapeurs ; les autres lui font faire un voyage : il y en a d'assez enragés qui lui font garder le lit cinq ou six mois pour une détorse... et... que sais-je, moi !  Cent autres contes que l'on va souffler aux oreilles d'un fiancé, qui ne manquent pas de rompre un mariage comme un verre ; et si, de tout cela, bien souvent il n'y en a pas la moitié de vrai. "")","('#le-hollandais', ""Moi venir expressément de mon pays, de la part des États, pour demandir à la cour qu'on me rendre mon vaisseau, que sti tiaple de Français avoir fait griller comme du poudin."")",0.96,Substitution
371,"('#monsieur-bassinet', ""Quand il n'y en aurait que le quart, c'est bien encore assez, de par tous les diables !  Une détorse ! "")","('#arlequin', ""Oh !  Vous avez raison ; voilà de méchants diables que ces Français !  Il fallait crier au feu ; quelqu'un serait venu à votre secours."")",1.47,Substitution
372,"('#isabelle', 'Au moins, je veux être de vos amis ; et je prétends, quand vous serez marié, aller sans façon manger chez vous votre chapon. ')","('#le-hollandais', ""N'être pas là tout, monsii. ; moi avoir encore perdu mon jambe, qui sti enragés m'ont emporté dans la bataille."")",1.5,Substitution
373,"('#monsieur-bassinet', ""Monsieur, vous me faites trop d'honneur ; mais je ne mange jamais de volaille.  À ce que je vois, vous connaissez parfaitement la demoiselle en question ? "")","('#arlequin', ""Si vous avez perdu votre jambe, ce n'est pas ma faute ; je vous assure, monsieur, que je ne l'ai point trouvée."")",1.36,Substitution
374,"('#isabelle', ""Ce n'est pas d'aujourd'hui que nous sommes toujours ensemble, et si vous étiez discret, je vous apprendrais quelque chose sur son chapitre, que je suis sûr que vous ne savez pas. "")",,1.0,Insertion
375,"('#monsieur-bassinet', 'Oh !  Vous pouvez tout dire, et compter sur ma discrétion.  Vous savez que les médecins... ')",,1.0,Insertion
376,"('#isabelle', 'Je passe...  (Mais il faut voir si personne ne nous entend.)  Je passe toutes les nuits dans sa chambre. ')",,1.0,Insertion
377,"('#monsieur-bassinet', 'Dans sa chambre ? ')",,1.0,Insertion
378,"('#isabelle', 'Dans sa chambre.  Je vous dirai même... ;  mais vous irez jaser. ')","('#le-hollandais', 'Moi redemandir mon membre à la cour.')",1.56,Substitution
379,"('#monsieur-bassinet', 'Non, je me donne au diable. ')","('#arlequin', ""Ma foi, monsieur, si vous voulez que je vous parle sincèrement, je ne crois pas qu'on vous rende votre jambe."")",1.8,Substitution
380,"('#isabelle', 'Cette nuit, nous avons reposé tous deux sur le même chevet.  Prenez vos mesures là-dessus. ')",,1.0,Insertion
381,"('#monsieur-bassinet', 'Sur le même chevet !  Ensemble ? ')","('#le-hollandais', 'Hé !  Pourquoi, monsir ?')",1.39,Substitution
382,"('#isabelle', 'Ensemble ; et cette nuit nous en ferons autant infailliblement.  Elle ne saurait se coucher sans moi.')",,1.0,Insertion
383,"('#monsieur-bassinet', ""Ah, ah !  Monsieur Brocantin, vous voulez donc m'en faire avaler ! "")","('#arlequin', ""Bon !  S'il fallait, à la cour, que l'on rendît à vos confrères les Hollandais tous les membres que les Français leur ont emportés cette année, il n'y aurait plus ni bras ni jambes en France."")",1.77,Substitution
384,"('#isabelle', ""Ce que je viens de vous dire là, au moins, ne doit point vous empêcher de conclure l'affaire.  Un homme bien amoureux ne s'arrête pas à ces bagatelles-là. "")",,1.0,Insertion
385,"('#monsieur-bassinet', ""Bon !  Voilà de belles badineries !  Je ne vois pas que rien presse encore de quitter la robe et le bonnet de médecine, pour me faire coiffer de mademoiselle Isabelle.  Adieu, monsieur, jusqu'au revoir.  Le ciel m'a assisté : voilà un jeune homme qui m'aime bien."")","('#le-hollandais', ""Mais, monsir, comment faire pour servir ?  Moi, n'avoir plus ni jambe, ni vaisseau."")",1.1,Substitution
386,"('#isabelle', ""On !  Pardi, monsieur Bassinet, je crois que vos fumées d'amour pour Isabelle sont bien passées présentement.  Depuis un quart d'heure que je fais l'homme, je ne suis pas mal scélérat.  Elle rentre.  Il y a ici des scènes italiennes. "")","('#arlequin', ""Je vous conseille, monsieur, d'aller servir aux Invalides.  À ce que je vois, monsieur le Hollandais, vous avez été un peu démâté, hé, hé, lié..."")",1.17,Substitution
387,"('#pierrot', ""Tout franc, monsieur, je crains que vous n'ayez attendu trop tard à marier vos filles. "")",,1.0,Insertion
388,"('#brocantin', 'Comment donc !  Serait-il arrivé quelque malheur dans ma famille ? ')","('#le-hollandais', ""Moi ne rire point, monsir ; moi l'être un gentilhomme.  Das, dick, der, dondre, vernetre."")",1.49,Substitution
389,"('#pierrot', ""Non, pas encore tout à fait ; mais, voyez-vous, monsieur, vous tournez trop à l'entour du pot.  Diable !  Les filles sont de certains animaux équivoques... "")","('#arlequin', 'Das, dick... Mon petit ami, vous sentez votre vieux rossé.  Je vous renverrai à Fleurus. Ils se battent ; le Hollandais tombe, et fait plusieurs lazzis avec sa jambe de bois. Scènes italiennes.')",1.23,Substitution
390,"('#brocantin', 'Que veux-tu donc dire avec tes animaux équivoques ? ')","('#arlequin', 'Allons, dépêchons-nous vite ; tire ton écritoire, ferme la porte, chasse les chiens, prends une chaise, mouche ton nez, laisse de la marge, écris gros.')",1.13,Substitution
391,,"('#pierrot', ""Monsieur, faisons vite, s'il vous plaît ; j'ai un cours de ventre, comme vous savez, qui ne me permet pas d'être longtemps en place."")",1.0,Deletion
392,"('#pierrot', ""C'est-à-dire, monsieur... tant y a que, je m'entends bien.  C'est comme des armes à feu ; ça tire quelquefois sans qu'on y pense. "")","('#arlequin', ""J'aurai bientôt fait. Comment vous appelez-vous ?  Dites-moi votre nom, surnom, qualité, patrie, rue, paroisse, logis, appartement.  Avez-vous un père, une mère, des frères, des parents ?  Que faites-vous à Paris ?  Y a-t-il longtemps que vous y êtes ?  Qui voyez-vous ?  D'où venez-vous ?  Où allez-vous ?  Écrivez donc, greffier. À Cinthio. Il donne un coup sur l'épaule de son clerc."")",0.96,Substitution
393,"('#brocantin', ""Ne te mets point en peine, Pierrot ; je suis sur le point d'en marier une, et je crois que je ferai affaire de l'aînée avec monsieur Bassinet. "")",,1.0,Insertion
394,"('#pierrot', ""Qui ?  Ce médecin ?  Fi !  Votre fille n'est point le fait de ce vieux rhumatisme-là. "")","('#pierrot', ""Ah !  J'ai l'épaule cassée.  Voilà un clerc estropié."")",1.54,Substitution
395,"('#brocantin', ""Il m'a promis qu'il quitterait sa profession de médecin, si je voulais lui donner Isabelle, et qu'il se ferait troqueur. "")",,1.0,Insertion
396,"('#pierrot', ""Hé !  Pardi, je le crois bien.  On lui en sait grand gré, ma foi, de quitter son séné ; pour une fille drue comme Isabelle !  Tuchoux !  Si vous voulez me la bailler, je vous quitte, vous et vos chevaux, dès demain ; et si, je crois que je vous panse avec autant d'honneur qu'un médecin fait ses malades.  Voulez-vous que je vous dise mon sentiment ?  Car, révérence parler, j'ai plus d'esprit que vous : vous ferez mieux, si je ne vous accommode pas, de la donner à quelque homme de condition, comme, par exemple, à un gentilhomme de robe. "")","('#arlequin', ""C'est punctum interrogationis.  Quel diable d'ignorant ! Et vous, mon petit gentillâtre, vous ne voulez donc pas répondre ?  Écrivez qu'il n'a rien dit. À Cinthio."")",1.37,Substitution
397,"('#brocantin', ""Te moques-tu, Pierrot ?  Notre vacation est la plus jolie du monde ; nous voyons tout ce qu'il y a de gens de qualité ; il n'y a point de prince qui fasse la dépense que nous faisons ; nous changeons de meubles tous les jours ; on ne voit jamais chez nous la même chose, et notre cabinet est le rendez-vous de tous les fainéants de la ville. "")",,1.0,Insertion
398,"('#pierrot', 'Et quelquefois aussi des fainéantes ; Car voyez vous, monsieur, les femmes ont toujours quelque pièce à troquer.')",,1.0,Insertion
399,"('#colombine', 'Mon papa, il y a là-bas une troupe de carêmes-prenants qui veulent entrer. ')",,1.0,Insertion
