,dufresny-depart-des-comediens,mongin-promenades-de-paris,Cost,Operation Type
83,,"('#arlequin', ""Oui, mais ces gens de robe époux, Manants, sont moins heureux que vous. Chez vous, femme, mari, chacun fait sa besogne. L'homme fait des fagots, la femme des balais. Mais ces pauvres robins s'échauffent au Palais, Tandis que leurs moitiés dans ce bois de Boulogne Gobent tranquillement le frais."")",1.0,Deletion
84,,"('#pierrot', 'Perrette aura moins de licence Je la tiendrons de près.')",1.0,Deletion
85,,"('#arlequin', ""Mais l'heure d'Audience, Chez les femmes de robe est l'heure du berger."")",1.0,Deletion
86,,"('#pierrot', ""Au diantre donc la robe, il n'y faut plus songer."")",1.0,Deletion
87,"('#pierrot', 'Que la comédie aille comme elle pourra, pour moi je serai toujours recherché des femmes pour mon bel esprit.')","('#arlequin', ""Non, il vaut encor mieux s'en aller à l'armée, Allons, il faut servir le Roi, Et quand tu porteras le plumet et l'épée, Ah, ta femme ma foi sera bien attrapée Il faudra bien que la rusée T'aime, ou qu'elle dise pourquoi."")",0.96,Substitution
88,"('#colombine', ""Une fille qui a du service, se tire toujours d'affaires dans le monde."")","('#pierrot', ""En effet, la mine guerrière Aux femmes aujourd'hui donne dans la visière. Mais un plumet, une épée à Pierrot ! Moi porter cela ? Quelque sot ! Que porteront les Gentilshommes ?"")",1.55,Substitution
89,"('#pierrot', ""Un homme qui a de l'entremetture et de l'entregent, ne saurait manquer de rien."")","('#arlequin', ""Bon, bon ! Dans le siècle où nous sommes, On habille de même et manants et marquis. Tel portait des sabots jadis, Qui porte aujourd'hui l'écarlate. Un homme n'est plus un pied-plat, Dés qu'il n'a plus sa bourse plate. L'argent est gentilhomme, en un mot, entends-tu ?"")",1.25,Substitution
90,,"('#pierrot', 'Quoi ? Noblesse à présent ne vient pas de vertu ?')",1.0,Deletion
91,,"('#arlequin', ""Hé non, ce n'est plus là sa source. Noblesse en ce pays se tire de la bourse. Oui, la Noblesse vient de là. Cela te semble-t-il étrange ? Pierrot aura pourtant, tout comme le voilà, Des Lettres de noblesse avec Lettres de change. Ainsi tu peux porter arme, et quoi que manant, Tu pourras à ton gré suivre l'arrière-ban. Il fait comme s'il comptait de l'argent."")",1.0,Deletion
92,,"('#pierrot', ""Allons donc; aussi bien ces Arriere-Banistes Des morts et des blessés n'emplissent point les listes. Mais comment m'appellera-t-on ? Car Pierrot, ce nom-là n'est point fait pour la Guerre."")",1.0,Deletion
93,,"('#arlequin', ""Hé tous les jours on change et d'habit et de nom. Pierrot s'appellera le Marquis de la Pierre, Et Perrette ta femme aussi sera Marquise."")",1.0,Deletion
94,,"('#pierrot', 'Son amour après ça me sera tout acquis ?')",1.0,Deletion
95,,"('#arlequin', 'Non pas. Hé quelle est ta sottise ! Ta femme Marquis ? Tant pis ! Nous voyons tous les jours Marquises et Comtesses, Être aussi mal avecque leurs maris, Que leurs maris sont mal avecque les richesses.')",1.0,Deletion
96,,"('#pierrot', ""Comment ? Quand j'irai à l'armée, Que j'aurai vu quelques combats Quand j'aurai bonne renommée, Perrette ne m'aimera pas ?"")",1.0,Deletion
97,,"('#arlequin', 'Et quand bien tu ferais mille et mille conquêtes, Quand tu serais le plus grand des guerriers,  Les coiffes rarement épargnèrent les têtes Que Mars a couvert de lauriers.')",1.0,Deletion
98,,"('#pierrot', 'Oh bien, me voilà donc revenu de la gloire.')",1.0,Deletion
99,"('#colombine', ""Arlequin, j'ai trouvé une bonne condition, veux-tu en être de moitié ?"")","('#arlequin', ""Veux-tu, Pierrot, veux-tu m'en croire ?"")",0.94,Substitution
100,"('#arlequin', 'Selon.')","('#pierrot', 'Hé bien ?')",0.85,Substitution
101,,"('#arlequin', ""Reste manant, et retourne chez toi.  Il est dans le monde je crois, Bien plus d'un doux et bon ménage. Mais il en est bien moins à Paris qu'au village. Crois-moi, in vino veritas.  Il boit."")",1.0,Deletion
102,"('#pierrot', ""Je m'en vais servir dans une bonne maison, je te veux faire mon aide de camp."")","('#pierrot', ""Moi retourner aux champs ? Je ne le ferai pas. Car encore à Paris, si ma femme est un diable, Et s'il faut que j'y sois un mari misérable, J'aurai de quoi me consoler En voyant partout mon semblable. Mais il est temps de m'en aller. Serviteur."")",0.97,Substitution
103,,"('#arlequin', 'Mais avant de remettre en chemin, Tiens, sable ce verre de vin. Cela, dit-on, avise bien un homme.')",1.0,Deletion
104,,"('#pierrot', ""Non, je veux, vous dit-on, être dépaysé. Et que je boive ou non, je suis tout avisé. Un bourgeois et moi, c'est tout comme."")",1.0,Deletion
105,,"('#arlequin', ""Hé bien donc, à votre santé.  Il boit, et Pierrot s'en va."")",1.0,Deletion
106,,"('#mezzetin', ""Vive le Bois_de_Boulogne, Vive tous ces tapis verts, Où l'on vient rougir sa trogne, Et voir la feuille à l'envers ! C'est dans ce lieu délectable, C'est dans ce charmant séjour, Que les plaisirs de la table Font venir ceux de l'amour. Courage, Camarade !  Voici les restes de la collation que je viens partager avec toi.  Allons, buvons, mangeons, rions, chantons."")",1.0,Deletion
107,,"('#arlequin', ""À juger de la collation par ces restes, elle était somptueuse, et je crois qu'il fera peu resté de cruauté à celle à qui on l'a donnée."")",1.0,Deletion
108,,"('#mezzetin', ""Tout doux.  Cette maîtresse-ci, non plus que sa suivante, n'est pas de même étoffe que les autres, et mon maître et moi ne soupirons aujourd'hui qu'à bon escient et pour le mariage."")",1.0,Deletion
109,"('#arlequin', 'Nous verrons.')","('#arlequin', ""Hé oui, pour un mariage du Bois_de_Boulogne, n'est-ce pas ?  Allons, buvons à ce bon mariage."")",1.44,Substitution
110,"('#colombine', 'Je suis reçue fille de chambre.')","('#mezzetin', ""Tu railles, mais je parle sérieusement, et dès aujourd'hui..."")",1.67,Substitution
111,,"('#arlequin', 'Mon_Dieu !  Je connais ton maître ; et Monsieur_Calmar, te dis-je, est un de ces Calmars qui ne veulent épouser que la débauche.')",1.0,Deletion
112,,"('#mezzetin', 'Non encore un coup, nous allons faire divorce avec elle.  Il faut finir, et tu vas perdre en nous une bonne pratique.')",1.0,Deletion
113,,"('#arlequin', ""Bon, bon !  Quand ton maître serait assez fou pour se marier tout de bon, serait-il plutôt infidèle au Fiacre et à toutes ses petites maîtresses qu'à sa femme ?"")",1.0,Deletion
114,"('#pierrot', ""Et moi valet d'antichambre."")","('#mezzetin', ""Assurément, et mon maître et moi nous vivrons avec nos petites femmes comme s'il n'y avait qu'elles de femmes au monde."")",1.82,Substitution
115,,"('#arlequin', ""Quoi ?  Monsieur_Calmar, par exemple, ne se promènera plus, ne s'enivrera plus, et ne se perdra plus dans le Bois_de_Boulogne qu'avec sa femme ?"")",1.0,Deletion
116,"('#colombine', 'Chez une femme.')","('#mezzetin', ""Non, qu'avec sa femme."")",0.69,Substitution
117,"('#arlequin', ""Fi !  Une femme servir une femme.  Il n'y a point de contraste là-dedans."")","('#arlequin', ""Monsieur_Calmar ne donnera plus de rendez-vous aux Quinze-vingts, au Palais-Royal, ni de fêtes au Grand_Turc et à Picpus qu'à sa femme ?"")",1.89,Substitution
118,,"('#mezzetin', 'Non.')",1.0,Deletion
119,"('#pierrot', 'Et moi chez une femme.')","('#arlequin', ""Monsieur_Calmar ne se fera plus enfermer la nuit aux Tuileries, et n'en sortira plus par dessus l'impériale d'un carrosse qu'avec sa femme ?"")",1.77,Substitution
120,"('#arlequin', 'Fort bien cela.')","('#mezzetin', 'Non.')",0.35,Substitution
121,"('#colombine', ""C'est une bourgeoise de la rue Saint-Denis."")","('#arlequin', ""Et Monsieur_Calmar ne meublera plus de chambres à Paris, et n'en louera plus à la campagne que pour les éclipses de sa femme ?"")",1.86,Substitution
122,"('#pierrot', ""C'est une bourgeoise de la rue Saint-Denis aussi la mienne."")","('#mezzetin', ""Non, non, non.  Mon maître, redis-je, ne connaîtra, ne verra et n'aimera que sa femme.  Mais paix.  J'entends la voix je crois de celle qui doit être la mienne.  Oui, c'est Colombine elle-même."")",1.13,Substitution
123,"('#colombine', ""On l'appelle madame la marquise d'Argent-filé."")","('#colombine', ""Holà hé, Fiacre, c'est assez boire et manger ; cours en donner à tes chevaux, et les mets en état de nous mener tout à l'heure aux Tuileries."")",1.86,Substitution
124,,"('#mezzetin', 'Oui, oui, laisse-nous seuls, et va soigner tes bêtes.')",1.0,Deletion
125,"('#pierrot', ""D'Argent-filé ?  C'est justement la mienne."")","('#arlequin', ""Dans de semblables tête à têtes,  Il ne faut de tiers que l'amour.  Courage elle est jolie. J'y cours, et je sais bien qu'en ce charmant séjour,  Il s'en va."")",1.71,Substitution
126,"('#colombine', 'Comment maraud, tu vas sur mes brisées ?')","('#mezzetin', 'Hé bien, mon adorable,  Ce Bois à mon amour sera-t-il favorable ?  Nous sommes sans témoins, et nous pouvons ainsi... Mais arrête, où cours-tu ?')",0.64,Substitution
127,"('#pierrot', ""C'est toi qui vas sur mon marché."")","('#colombine', 'Rengaine ta tendresse.  Je vais rejoindre ma maîtresse,  Et ne veux point rester seule dans ce bois-ci.')",1.51,Substitution
128,"('#colombine', 'Tu es un flagorneur.')","('#mezzetin', ""Et qu'as-tu donc à craindre en ce charmant bocage ?  Qu'est-ce ? En ce bois est-il quelques filous ?"")",1.46,Substitution
129,,"('#colombine', 'Que trop. Oui, sous ce vert feuillage,  Des filles seules comme nous  Sont souvent mises au pillage.  Fuyons les bois de peur des loups.')",1.0,Deletion
130,,"('#mezzetin', ""Non, ici sans se hasarder  On se promène, on se repose.  Si tu crois qu'aux caquets un tête à tête expose,  Le Fiacre viendra nous garder."")",1.0,Deletion
131,,"('#colombine', 'Mauvais moyen pour empêcher la chose !  Et tous ceux qui sous ces ormeaux  Font la charge de sentinelle ,  Bien loin de garder une belle,  Ne gardent rien que les manteaux.')",1.0,Deletion
132,,"('#mezzetin', ""Que cette retraite est charmante !  Qu'il est doux d'être assis dessus ce vert gazon !"")",1.0,Deletion
133,,"('#colombine', 'Ne voilà pas déjà le gazon qui te tente ?  Adieu.')",1.0,Deletion
134,"('#pierrot', 'Tu es une chercheuse...')","('#mezzetin', 'Non non, de grâce, arrête, écoute donc.')",1.54,Substitution
135,"('#arlequin', 'Là, là, là, doucement.')","('#colombine', 'Laisse-moi.')",0.68,Substitution
136,"('#pierrot', ""Madame_la_Marquise m'a choisi à la mine, et elle m'a distingué par la propre personne. \n"")",,1.0,Insertion
137,"('#colombine', ""Et moi, j'y suis entrée de la main d'un joli homme."")","('#mezzetin', ""Mais d'où vient cette peur, cet effroi ?  Tu ne serais pas plus timide,  Quand tu serais avecque moi  Aux déserts de la Thébaïde."")",1.34,Substitution
138,,"('#colombine', ""Oh, ce bois est plus dangereux  Que le désert le plus affreux.  Telle qui tiendrait bon où gîte la cicogne,  Se rend dans le Bois_de_Boulogne.  On ne va boire ni manger  Où les cicognes vont loger ;  Mais ici tous les jours l'ivrogne,  À l'aide du vin de Bourgogne,  Fait sonner l'heure du berger.  D'un précipice ou d'une grotte  Où sifflent les serpents, l'on peut se dégager :  Mais qu'une nymphe est en danger  Où l'on sait la contraindre à siffler la linotte !  Dans ces lieux la Coquette à la bisque se rend ;  Et pour la bisque aussi la prude  Permet dans cette solitude  Ce que partout elle défend."")",1.0,Deletion
139,"('#arlequin', ""Hé bien, vous la servirez tous deux.  C'est ton avantage, Colombine : et quand une dame a un valet de chambre, le service se fait mieux : la maîtresse est toujours de bonne humeur, et la fille de chambre est moins grondée."")","('#mezzetin', ""Oui, dans ce beau séjour tout ressent la tendresse,  On n'y voit que toi de tigresse.  Tu n'as point de pareil ici que ces cailloux ;  Et ce bois ne voit point ni d'humains ni de bêtes,  Qui dans leur tête à têtes  Soient si bêtes que nous.  Mais ne la fais donc plus la bête, Colombine.  Te sied-il bien d'être mutine Dans un séjour où tour se rend ;  Où nul coeur n'est indifférent ;  Où l'on ne voit enfin que toi d'impitoyable ?"")",1.04,Substitution
140,"('#pierrot', ""Oui-da, il y a moyen de s'accommoder, aussi bien tu es délicate et fluette, tu ne peux pas tout faire : et je servirai, moi, pour la grosse besogne."")","('#colombine', ""Ah ! Qu'Arlequin m'est redevable  Et que n'est-il ici, Coquin, au lieu de toi !  Quelle est la femme comme moi  Assez maîtresse d'elle, assez fidèle et sage  Pour résister, à ces hélas ?  Et pour ne sacrifier pas  Le plumet à la robe en ce sombre bocage ?  Mais chut ! Quelqu'un vient en ce lieu,  Et j'entends que l'on nous appelle ;  Et c'est fort à propos. Adieu."")",0.8,Substitution
141,"('#colombine', 'Tu serviras donc à la cuisine ?')",,1.0,Insertion
142,"('#pierrot', ""Oh, il n'y a point de cuisine chez cette marquise-là."")","('#calmar', ""C'est , Mademoiselle, une petite collation champêtre, comme vous voyez."")",1.27,Substitution
143,"('#arlequin', ""C'est-à-dire que chacun porte son plat, et qu'on fait tout cuire en ville."")","('#elise', ""Monsieur_Calmar ne fait rien que de magnifique, et à la campagne comme à la Ville tout est somptueux quand il s'en mêle. Ici Octave et Scaramouche mettent le couvert à terre. On apporte plusieurs carreaux sur lesquels on s'assied, et lorsqu'on découvre les plats qu'un avait servis pour manger, on les trouve remplis d'instruments de musique tout différents , qu'Octave, Scaramouche, et les autres garçons cabaretiers prennent et dont ils jouent ; ce qui forme un concert fort agréable. Calmar et Élise dansent ; après quoi on fait tomber Calmar, et on l'emporte enveloppé dans la nappe ; ce qui finit le premier acte."")",1.17,Substitution
144,"('#pierrot', ""J'aurais envie d'être portier, j'ai étudié pour cela : car un jour dans notre village, il me prit de quitter la robe pour l'épée ; j'étais bedeau, je me fis suisse. \n"")","('#calmar', ""Si j'avais eu cette épée, l'on ne m'aurait pas insulté impunément au Bois_de_Boulogne.  Holà Mezzetin, me voilà en état de plaire et de faire face aux Tuileries.  Mais avant que d'aller plus loin, dis-moi ce que tu penses de mon habit.  Trouves-tu qu'il pêche contre l'air guerrier ?  Me trouves-tu encore quelque teinture de la robe, et me prendrais-tu de loin pour Monsieur_Calmar ?"")",0.68,Substitution
145,,"('#mezzetin', ""Oh, vous voilà, Monsieur, tout à fait bien décalmardé ; il vous reste seulement à prendre l'air et les manières assortissantes à votre habit.  Là, mettez-moi ce chapeau sous le bras, par exemple.  Le peigne à la main ?  Barbouillez-vous le nez de tabac ; faites plisser votre justaucorps.  L'estomac débraillé.  Allons, l'air brusque, vif, et dissipé ?  Bon !  Il ne vous manque plus qu'une moustache, un ton de fausset, et des créanciers  à vos trousses, pour avoir toutes les parties d'un galant homme."")",1.0,Deletion
146,,"('#calmar', ""Ce changement d'air et d'habit, ce produira je crois dans le cour d'Élise.  Cette métamorphose lui paraîtra peut-être extraordinaire : mais Jupiter lui-même s'est bien métamorphosé pour se rendre aimable."")",1.0,Deletion
147,,"('#mezzetin', ""J'ai oui dire en effet, que Jupiter s'était changé en pluie d'or, et une pareille métamorphose, Monsieur, vous siérait bien mieux que celle-là.  Car enfin, que va-t-on dire devoir un vénérable Magistrat comme vous, venir donner le paroli à tous les petits-maîtres des Tuileries ?"")",1.0,Deletion
148,"('#colombine', ""Si tu étais portier, tu emporterais tout le profit ; la porte d'une coquette est aussi lucrative que celle d'un juge."")","('#calmar', ""Va va, je ne suis pas le seul de ma robe, qui au sortir du Palais, troque le rabat et le bonnet carré, contre l'épée et le plumet, pour se faire regarder de bon poil aux Tuileries. Que veux-tu ?  Élise ne se rend point aux fleurettes, aux cadeaux, ni aux fêtes ; il faut l'attaquer par les yeux, et les hommes aujourd'hui ne font donner les femmes dans le panneau, qu'en leur donnant dans la vue."")",0.76,Substitution
149,,"('#mezzetin', ""D'accord.  Je sais que l'amour tout nu n'est plus de ce siècle, et que les étoffes de la rue_Saint-Denis font plus de conquêtes, que tout le mérite crotté de l'Académie_Française.  Mais ce n'est pas assez que l'attirail d'un guerrier ; il en faut les qualités, l'air, les manières, et ce je ne sais quoi enfin qui met tant de sympathie entre la coiffe et le plumet.  En un mot, il faut être héros de mine et d'effet, Monsieur, pour vaincre votre héroïne."")",1.0,Deletion
150,,"('#calmar', ""Et bien, s'il ne fallait qu'aller à la guerre, je suis capable de tout pour plaire à Élise."")",1.0,Deletion
151,,"('#mezzetin', 'Vous allez à la guerre ?  Ah, ah, ah ! Il rit.')",1.0,Deletion
152,,"('#calmar', ""Oui, moi, à la guerre.  Pourquoi non ?  Je veux du mal à mon père et à ma mère de m'avoir envoyé au Droit plutôt qu'aux Cadets."")",1.0,Deletion
153,,"('#mezzetin', 'Vous à la guerre ?  Fi donc !  Vous voudriez troquer votre Cabinet contre une tente ?  Votre carrosse contre un fourgon ?  Et votre vie enfin douce et tranquille, contre les fatigues et les peines de nos Césars ?')",1.0,Deletion
154,,"('#calmar', ""Oui.  J'affronterais les peines les plus rudes, pour engager Élise à soulager la mienne."")",1.0,Deletion
155,"('#arlequin', ""Vous pouvez partager l'emploi ; car chez les coquettes il doit toujours y avoir deux portes et deux escaliers.  Pendant que l'un entre par celle-ci, l'autre sort par celle-là."")","('#mezzetin', ""Chanson !  Quoi ?  Vous qui ne pouvez braver le sommeil à l'Audience, vous iriez affronter l'insomnie continuelle de l'Armée ?  Vous qui ne pouvez ouïr sans chagrin les sottises qui sortent de la bouche d'un Avocat, vous iriez vous exposer de gaîté de cour à celle du canon ?  Vous vous moquez, Monsieur, vous vous moquez."")",1.2,Substitution
156,,"('#calmar', ""Non, sérieusement, je voudrais qu'il ne tînt, pour plaire à Élise, qu'à troquer ma robe contre l'épée, et ma charge contre un régiment."")",1.0,Deletion
157,,"('#mezzetin', ""Monsieur_Calmar à la tête d'un régiment ?  Ah, ah ! Le beau spectacle ! Il rit."")",1.0,Deletion
158,,"('#calmar', ""Oui, moi, à la tête d'un régiment.  Où est là le mot pour rire ?"")",1.0,Deletion
159,,"('#mezzetin', ""Qu'il ferait beau voir la gravité d'un sénateur dans la tranchée ou sur la brèche !"")",1.0,Deletion
160,,"('#calmar', 'Encore ?  Ouais !  Ce Maraud-là se moque de moi.  Finissons ces ris, je te prie.  Changeons de discours, et va de ce pas avertir mes musiciens, et leur dis.')",1.0,Deletion
161,,"('#mezzetin', ""Quel plaisir de voir Monsieur_Calmar courir avec les gouttes sur les pas des Césars !  Ah, ah, ah, ah ! Il s'en va en riant."")",1.0,Deletion
162,,"('#calmar', ""À la fin la patience m'échappe.  Tu ris encore.  Il faut que je rosse ce coquin-là.  Arrête, arrête, arrête. Il court après."")",1.0,Deletion
163,,"('#colombine', ""Quoi, c'est toi, mon cher Arlequin ?  Mais sans aller plus loin, apprends-moi, je te prie,  Depuis quand donc ici ?"")",1.0,Deletion
164,,"('#arlequin', ""J'arrive en ce jardin,  Et ne puis t'exprimer l'envie  Que je sentais de te revoir.  Mais du moins, fais donc ton devoir, Et permets qu'ici je t'embrasse ;  On ne refuse pas cette petite grâce. Il veut l'embrasser."")",1.0,Deletion
165,,"('#colombine', ""Fi donc, l'on nous regarde ; apaise tes transports.  Ta personne me semble encore bien vivante,  Pour venir d'un pays où l'on voit tant de morts."")",1.0,Deletion
166,,"('#arlequin', ""C'est que l'absence, ma Charmante, A le don de rendre un amant  Une fois plus vif et plus tendre ;  Et surtout au retour de Flandre,  On se sent près de vous tout je ne sais comment."")",1.0,Deletion
167,,"('#colombine', 'Laissons cela, parlons de ton maître.')",1.0,Deletion
168,,"('#arlequin', ""Aujourd'hui  Ta maîtresse pourra s'expliquer avec lui. Était-ce avec Calmar que dans la grande allée  Elle riait de si bon cour,  Lorsque je t'ai du doigt doucement appelée ?"")",1.0,Deletion
169,,"('#colombine', ""Non, c'est un autre adorateur.  Mais qui t'a dit que ma maîtresse  Fut aussi celle de Calmar !"")",1.0,Deletion
170,,"('#arlequin', ""Cela n'est que trop vrai, traîtresse,  Que sans avoir à la tendresse  Non plus qu'à la personne égard,  Tout_à_coup ta maîtresse Élise, l'infidèle  Quitte Léandre pour Calmar.  Je n'aurais jamais pu croire cette nouvelle.  Ah ! Malheureux Léandre !"")",1.0,Deletion
171,,"('#colombine', 'Il est mal informé ;  Et quoi que de Calmar Élise soit aimée,  Ton maître en est-il moins aimé ?')",1.0,Deletion
172,,"('#arlequin', ""Et quoi, sans doute, puisqu'à l'armée  L'on nous a su mander son infidélité.  Mais ce bruit est-ce donc mensonge ou vérité ?"")",1.0,Deletion
173,,"('#colombine', 'Comment ton maître a cru ce faux bruit véritable ?')",1.0,Deletion
174,,"('#arlequin', ""Oui, c'est sur les discours que l'on nous a tenu,  Que de Flandre à Paris en poste il est venu."")",1.0,Deletion
175,,"('#colombine', ""Oui, mais raisonne. Est-il croyable ? Qu'un homme au cour tendre, aux yeux doux,  Se quitte pour un sot de fort mauvaise mine ?"")",1.0,Deletion
176,,"('#arlequin', ""Tu dis encor vrai, Colombine.  Mais aujourd'hui les femmes, entre nous,  Aiment, et trouvent bons de si mauvais ragoûts,  Qu'en amour aussi bien qu'à table  On ne dispute point des goûts ;  Et dans ce siècle abominable,  Où pour ce métal seul tout cour est enflammé, C'est peu pour être bien aimé,  Que d'être de figure aimable.  Ce n'était pas Calmar non plus que ses désirs  Qui nous donnaient martel en tête ;  Nous craignions que ton or en butte à vos désirs,  Ne lui donnât une conquête,  Que tout l'or du Pérou ne pourrait pas payer."")",1.0,Deletion
177,"('#colombine', ""Mais le profit n'est pas égal : car celui qui entre, et qui meurt d'envie de voir Madame, paye grassement ; mais celui qui sort, voudrait souvent retenir ce qu'il a donné en entrant."")","('#colombine', ""Allez, vous étiez fous de vous tant effrayer.  Le cour de ma maîtresse est de la vieille roche, Un hameçon doré n'est pas ce qui l'accroche ;  Et si Calmar enfin est bien reçu chez nous,  C'est que de ma maîtresse il est l'homme d'affaire.  Il fait de son mieux pour lui plaire :  Mais ma foi, quoiqu'il puisse faire,  Il ne fera point de jaloux.  Quoi que de ces Calmars l'on souffre la présence,  Et les fêtes et la dépense,  On n'a pour eux d'autres douceurs  Que celles d'écouter les leurs."")",0.49,Substitution
178,,"('#arlequin', ""Oui mais, ces dragons noirs de la galanterie, N'ont-ils point non plus, je te prie,  Dedragonné tant soit peu ta vertu ?"")",1.0,Deletion
179,,"('#colombine', 'Comment donc ? Pour qui me prends-tu ?  Crois-tu que de tout bois Colombine fait flèche ?  Ah ! Fi de ces Calmars cela ne me sent rien.')",1.0,Deletion
180,,"('#arlequin', ""On dit pourtant qu'ils ont fait brèche  À de plus grands cours que le tien.  Et qu'en amour tous ces reptiles,  Assiégeaient en été les cours  Comme ordinairement nous assiégeons les villes. "")",1.0,Deletion
181,,"('#colombine', 'Ah, ah ! Les illustres vainqueurs !  Ils ne les prenaient pas de même. ')",1.0,Deletion
182,,"('#arlequin', ""Comment ? Employaient-ils quelqu'autre stratagème ? Ils ne les prenaient pas de même ? Et pourquoi non ?"")",1.0,Deletion
183,"('#arlequin', ""Cela est vrai.  Tel donne en entrant chez une coquette, qui aurait besoin qu'on lui donnât en sortant. \n"")","('#colombine', ""Hé, c'est qu'une ville mutine,  Ville à l'épreuve du canon,  Vous la prenez, vous autres par famine.  Au contraire, bien des Iris,  Tenant bon dans une ruelle  Aux soupirs de leurs favoris, Capitulent souvent au Moulin de Javelle."")",0.61,Substitution
184,,"('#arlequin', ""Je t'entends. C'est à dire, en peu d'expressions,  Qu'en amour comme en guerre, avec une farouche,  Les meilleures munitions  Sont les munitions de bouche.  Les Calmars, à ce compte, opulents, généreux, Et surtout beaucoup amoureux,  Doivent avancer leurs conquêtes."")",1.0,Deletion
185,,"('#colombine', ""Hé bien, le nôtre encore un coup, N'avance que fort peu, quoi qu'il aime beaucoup,  Il nous donne souvent des cadeaux et des fêtes,  Et ce soir même il s'est offert De nous donner aux Tuileries  Au clair de Lune un fort joli concert."")",1.0,Deletion
186,,"('#arlequin', 'Un Concert ?')",1.0,Deletion
187,,"('#colombine', 'Oui, voilà de ses galanteries.')",1.0,Deletion
188,,"('#arlequin', 'Mon maître viendra donc à temps pour y chanter.  Mais attends, il me vient certain dessein en tête,  Qui pourrait bien déconcerter  Le héros du concert, le maître de la fête.  Est-ce de voix ce concert ?')",1.0,Deletion
189,,"('#colombine', 'Oui.')",1.0,Deletion
190,,"('#arlequin', ""Fort bien. Le valet de Calmar n'est pas incorruptible.  Avec un doigt de vin la chose est infaillible.  Je connais un musicien.  Pour rendre ta chose complète,  Il ne me manque plus rien  Qu'un faiseur de vers, un poète."")",1.0,Deletion
191,,"('#colombine', 'Quel est donc ton dessein ?')",1.0,Deletion
192,,"('#arlequin', ""Tantôt tu le sauras ;  De ce que le t'ai dit garde d'ouvrir la bouche.  Adieu, j'aperçois Scaramouche,  Qui peut être pourra me tirer d'embarras.  Va donc, cours vite à ta maîtresse  Et dis-lui que Léandre arrive sur mes pas."")",1.0,Deletion
193,,"('#colombine', 'Mais.')",1.0,Deletion
194,"('#colombine', ""Il n'y a qu'un mot qui serve.  Si tu veux, nous partagerons les profits et le service.  Je présiderai aux conversations secrètes ; toi, tu porteras les billets.  Je veillerai le jour..."")","('#arlequin', 'Va, te dis-je.')",0.71,Substitution
195,,"('#colombine', 'Hé bien, à revoir ; je te laisse.')",1.0,Deletion
