biancolelli-ecole-galante,mongin-promenades-de-paris,Score
"('#argentine', ""Quel plaisir trouvez vous à me désespérer ? Vôtre coeur aux soupçons ne fait que se livrer.  Vous êtes inquiet, jaloux à toute outrance, Croyez-moi, c'est trop loin pousser la défiance, Vous mériteriez bien qu'à vôtre vilain front Puisque vous m'outragez, je file quelque affront."")",-,0.0
"('#arlequin', ""Hélas ! pardonnez-moi mon aimable Argentine, J'ai tout à redouter de vôtre humeur badine ; Vos yeux vifs, et perçants, me font avec raison, Craindre de vôtre part un peu de trahison. Je ne puis m'empêcher de me rendre justice, Je suis à parler net un fort vilain Jocrice ; Si j'étais plus joli je serais moins jaloux ; Mais enfin vous savez ce que j'ai fait pour vous. J'ai moi-même pris soin d'élever vôtre enfance ; Donnez-moi vôtre coeur pour toute récompense. Je vous fais aujourd'hui la maîtresse du mien, Je vous donne ma main, mon amour, et mon bien, Je suis maître d'École, et marchand de Fromage, Je vais tout disposer pour notre mariage, Dés demain vous serez admise dans mon lit, Cela vous devrait bien aiguiser l'appétit."")",-,0.0
"('#argentine', ""Dés demain, dites-vous ? C'est trop tôt, rien ne presse."")",-,0.0
"('#arlequin', 'Ah ! Ce terme est encor trop long pour ma tendresse.')",-,0.0
"('#argentine', 'Il vaut bien mieux laisser passer un peu de temps, Ce sera, je vous jure, assez tôt dans dix ans.')",-,0.0
"('#arlequin', ""Dans dix ans, ma Bellotte, ah ! Qu'oses-tu me dire ? Quelle extrême rigueur ! Tu veux donc que j'expire, Tu prétends me ravir des biens si souhaités, Lorsque je suis pressé de mes nécessités.  Non, non, point de délai : la chose est résolue. Tu seras du logis la maîtresse absolue, Je te ferai porter perles, et bracelets, Toi seule auras le soin de gronder les valets, Tu feras le matin mitonner mon potage, Et tu n'oublieras point d'y mettre du fromage, Je ne puis m'en passer, je l'aime autant que toi, Et c'est, mon cher amour, t'en dire assez, je crois ; Je me suis consulté, je ne puis plus attendre, À mes justes désirs ma belle il faut se rendre."")",-,0.0
"('#argentine', ""Quoi c'est donc tout de bon ? vous n'en démordez pas, Vous ferez dés demain la noce, et le repas ? Ah ! Différez de grâce."")",-,0.0
"('#arlequin', ""Il ne m'est pas possible : A toutes tes beautés mon coeur est trop sensible ; Et certaine raison m'oblige fortement à marquer pour l'hymen beaucoup d'empressement. Non mon coeur je ne puis différer, ou je meure, Et si je m'en croyais, ce serait tout à l'heure ; Va, va, n'affecte point ces dehors spécieux, Tu le veux, comme moi, je le vois à tes yeux. Adieu, tout de ce pas, je vais chez le Notaire, Cette cérémonie est ici nécessaire, Pourtant si tu voulais je m'en passerais bien."")",-,0.0
"('#argentine', ""Puisque vous le pouvez, Monsieur n'en faites rien."")",-,0.0
"('#arlequin', ""Non, je veux que demain tu partages ma couche L'hymen est un morceau qu'on prend de broc en bouche, Le plutôt est le mieux, point de réflexion, Lorsque l'on veut former une longue union. Donne-moi deux baisers."")",-,0.0
"('#argentine', 'Vraiment, je suis trop sage.')",-,0.0
"('#arlequin', 'Je rabattrai cela sur notre mariage.')",-,0.0
"('#argentine', ""Les hommes, ce dit-on, en rabattent assez, Prés de nous cependant ils font les empressez, Débitent galamment un amoureux langage, Et pour nous obtenir mettent tout en usage ; Quand ils sont une fois les maîtres du Logis, En moins de quinze jours ils sont bien refroidis. Nous ne les voyons plus attachez à nous plaire, A peine peuvent-ils fournir le nécessaire, Les époux sont ma foi d'étranges animaux !"")",-,0.0
"('#arlequin', ""Les hommes d'aujourd'hui ne sont pas tous égaux, Tu ne te plaindras point, mon aimable Argentine, Toujours bon vin en Cave, et bon pot en Cuisine : Je te laisse, mon coeur, pour un petit moment."")",-,0.0
"('#argentine', ""J'ai tout à craindre hélas ! De cet empressement, Je ne puis le souffrir, et malgré mon envie Il veut que dès demain le noeud d'hymen nous lie ; Il croit se faire aimer, mais son espoir est vain, Je ne puis consentir à lui donner la main ; Que demande Pierrot ? "")",-,0.0
"('#pierrot', ""Bonjour la brune-blonde, Il faut auprès de vous que mon coeur se débonde ; Si vous le souhaitez je ferai vôtre Amant, Et je m'en vais vous faire un petit compliment. Je commence, écoutez. Le feu de ma tendresse Allumé par les yeux de ma belle Maîtresse... Cela fait que l'amour... Ne m'interrompez pas, Cela fait donc tout juste... Un autre en pareil cas Pourrait bien se brouiller ; mais je ne suis pas bête. Ors donc je vous dirai, que si vous êtes prête, Je suis tout disposé, vous n'avez qu'à parler... Dame ! Je voudrais bien avec vous m'enrôler."")",-,0.0
"('#argentine', ""Je veux feindre un moment d'applaudir à sa flamme ; Vous m'aimez donc Pierrot ?"")",-,0.0
"('#pierrot', ""Qui vraiment, ma chère âme, Quand je ne vous vois pas je suis absent de vous ; Quand je m'emporte un peu, je me mets en courroux. En un mot je vous aime, et vous n'avez qu'à dire, Je suis un drôle, allez, je vous ferai bien rire."")",-,0.0
"('#argentine', ""Que vos expressions charment mon tendre coeur ! Je ne m'en défends point, vous êtes mon vainqueur, Et je n'ai pu vous voir sans vous rendre les armes."")",-,0.0
"('#pierrot', ""On me l'a toujours dit ; que j'avais bien des charmes, Je suis un beau garçon ; pour la taille, je crois Qu'on n'en saurait trouver de mieux bâti que moi.  Elle en tient pour le coup. Bas."")",-,0.0
"('#argentine', ""Non, il n'est pas possible Qu'en vous voyant si beau je paraisse insensible : On ne peut résister à de puissants appas."")",-,0.0
"('#pierrot', ""Elle va se pâmer, je pense, entre mes bras. Eh, Ventrebleu, pourquoi suis-je un fi beau brin d'homme. Ça, je vois bien qu'il faut vous acquitter la somme, Et vous ne voulez point des lettres de répit, Embrassez-moi ma fille, et sans faire grand bruit..."")",-,0.0
"('#pierrot', 'Ah ! Je me suis mépris, et cela me chagrine : Au lieu de toi, je dois embrasser Argentine, Je vais recommencer pour te faire plaisir.')",-,0.0
"('#arlequin', ""Il n'en est pas besoin, modère ce désir. Hé bien, je vous y prends, Madame la carogne, Et vous, que faites-vous ici Monsieur l'ivrogne ? "")",-,0.0
"('#pierrot', ""Tu m'as interrompu, que je suis malheureux ! Ta prétendue, et moi je badinions tous deux. Je me dégourdissais de la belle manière, Va t'en pour un moment, crois-moi, laisse-moi faire."")",-,0.0
"('#argentine', ""Vous êtes trop jaloux, c'est là tour mon souci, Et vous ne deviez pas venir sitôt ici."")",-,0.0
"('#arlequin', ""Je conviens que j'ai tort, et je devais attendre Le joli dénouement d'un entretien si tendre. Vous voulez donc toujours m'en donner à garder, A vôtre opinion la mienne doit céder, Sur le point d'occuper la couche maritale, Vous donnez une entorse à la foi conjugale ?"")",-,0.0
"('#pierrot', ""Puisqu'il demeure ici, sans faire du fracas, Mène-moi dans ta Chambre, il ne le saura pas."")",-,0.0
"('#argentine', ""J'y consens."")",-,0.0
"('#arlequin', 'Ah ! Tout doux, et vous Monsieur le drille Décampez au plutôt.')",-,0.0
"('#pierrot', 'Lâche-moi cette fille, Va, je te la rendrai dans un petit moment.')",-,0.0
"('#arlequin', ""Morbleu, craignez l'effet de mon emportement ; Apprenez que demain j'épouse cette belle, Que je veux qu'elle soit toujours sage, et fidèle."")",-,0.0
"('#argentine', ""Bon cela ne se peut, Arlequin, croyez-moi, Gardez de m'imposer une si dure loi. Fi donc vous vous feriez berner de tout le monde : Un Mari trop jaloux mérite qu'on le fronde, La sagesse est un monstre, et les femmes ont soin De ne le regarder ni de près, ni de loin."")",-,0.0
"('#arlequin', 'Que faites-vous ici ?')",-,0.0
"('#pierrot', ""Moi, j'attends que tu sortes. Pour rester en ces lieux j'ai des raisons bien fortes."")",-,0.0
"('#arlequin', 'Veux-tu te retirer, ou je te romps les bras.')",-,0.0
"('#pierrot', ""Hé bien, je reviendrai quand tu n'y seras pas."")",-,0.0
"('#argentine', ""Vos manières Monsieur, ne font que me déplaire ! De tous ces vains soupçons songez à vous défaite, Je vous l'ai déjà dit, vous devez profiter Des leçons qu'Argentine a voulu vous dicter. Je veux goûter en paix les douceurs de la vie, Folâtrer, badiner au gré de mon envie, Adieu souvenez-vous, et soyez convaincu, Que quand on est jaloux, on est bien-tôt cocu. Elle rentre."")",-,0.0
"('#arlequin', ""Franchement ce discours n'est point énigmatique, Elle veut m'encorner malgré ma rhétorique, Mais je ne serai point sujet au grand malheur Qui de tant de maris fait naître la douleur, Et je prendrai morbleu, de si bonnes mesures, Que ma femme à mon front ne fera point d'injures. "")",-,0.0
"('#octave', ""Se peut-il, cher ami, que ton coeur à son tout Refuse de se rendre au pouvoir de l'amour ? Tu fais gloire en tous lieux de ton indifférence ; Ah ! c'est faire au beau sexe une sensible offense Que de marquer pour lui si peu d'empressement, Et de voir sans l'aimer l'objet le plus charmant. Crains donc, pour te punir, que le fils de Cythère Ne te livre aux effets de sa juste colère, Et que ce fier vainqueur renversant tes projets Sur ton coeur dédaigneux ne lance tous ses traits."")",-,0.0
"('#leandre', ""Pourquoi me blâmes-tu ? Ta remontrance est vaine, Je cède avec plaisir au penchant qui m'entraîne, Content de mon état, satisfait de mon sort, J'ignore les effets d'un amoureux transport. Un paisible repos est le bien où j'aspire, Un coeur qui le possède a tout ce qu'il désire ; Est-ce un charme ? dis-moi, de languir sans espoir, D'adorer un objet que l'on a peine à voir, De pousser des regrets, de répandre des larmes, De ressentir toujours de mortelles alarmes ; L'amour m'accablerait sous ses funestes coups, Et me ferait former mille soupçons jaloux ? Inquiet, agité, je craindrais que ma belle, Malgré ma tendre ardeur ne devint infidèle, Chaque instant ne ferait que redoubler mon mal.  Je verrais avec peine un trop heureux rival ! Ami je vis en paix, rien ne trouble ma vie : Au calme de mon coeur tu dois porter envie, Puisque rien n'est égal à ma félicité, Laisse-moi m'applaudir de ma tranquillité."")",-,0.0
"('#octave', ""Non c'est injustement que tu veux te défendre D'un doux engagement ; et d'un commerce tendre : Chacun doit, cher ami, se laisser enflammer Et nul n'échappe enfin au Dieu qui fait aimer."")",-,0.0
"('#leandre', ""Inutiles efforts pour soumettre mon âme, Aux tyranniques lois d'une volage femme ! Et qui par un esprit, faible, capricieux, Reçoit tous les objets qui lui frappent les yeux. De ce sexe enchanteur l'approche est trop fatale : Une femme est toujours d'une humeur inégale, Aujourd'hui ses transports font des plus violents, On la trouve demain au milieu des galants, Affectant d'imiter les airs d'une coquette Badiner avec eux, répondre à la fleurette, Et pour donner du lustre à ses trompeurs appas Inspirer une ardeur qu'elle ne ressent pas. "")",-,0.0
"('#arlequin', ""Messieurs mes écoliers quel nouveau soin vous presse ? Venez-vous dans ces lieux chercher quelque Maîtresse ? Vous étés faits d'un air à ne pas en manquer, Et je vous crois tous deux d'âge à prévariquer ; Du temps que vous étiez sujets à ma férule J'étais, vous le savez, d'une humeur ridicule, Je vous interdisais les plaisirs amoureux ; Mais pour lors vous n'étiez que des petits morveux : Je crois que maintenant une telle défense, Ne ferait qu'augmenter votre concupiscence, Et je puis affirmer, sans passer pour menteur, Que vous en savez plus que vôtre précepteur."")",-,0.0
"('#octave', ""Je fais ce que je puis pour convaincre Léandre ; Mais à tous mes discours il ne veut rien comprendre, Et persistant toujours dans sa frivole erreur, Du plus charmant plaisir il conçoit de l'horreur ? Pour lui le mot d'amour est un obscur langage, Et je ne vis jamais un garçon si sauvage."")",-,0.0
"('#leandre', ""Je ne sais ce que c'est : pour tout indifférent  J'avouerai qu'en amour je suis fort ignorant."")",-,0.0
"('#arlequin', ""Je veux par mes leçons le rendre plus habile : Laissez-le moi, dans peu vous le verrez docile ; Je consens de tout perdre, et de passer pour fou, S'il n'est dans quelque temps plus tendre qu'un matou."")",-,0.0
"('#octave', ""Ami, pour un moment d'ici je me retire ; Le Seigneur Arlequin aura soin de t'instruire, Malgré ta fermeté, bien-tôt sur ton esprit Ses savantes leçons auront quelque crédit."")",-,0.0
"('#arlequin', ""Ici nous sommes seuls, rien ne nous importune. Se peut-il, qu'insensible à la Blonde, à la Brune, Dans cette inaction tu passes tes beaux ans ? Tu devrais, cher Léandre, employer mieux le temps. Un garçon sans maîtresse est un vaisseau sans rame, Une Ville sans porte, enfin un corps sans âme, Un canon sans affût, c'est un fleuve sans eau, Palais sans fondement, et lame sans fourreau, Tu n'aimes rien, dis-tu, fi donc c'est vivre en bête, Tu peux facilement faire quelque conquête : La beauté la plus fière en l'écoutant parler, D'elle-même aussi-tôt viendra capituler. Tout aime dans le monde, et c'est pure folie, De narguer les appas d'une femme jolie, Les plus braves héros sensibles à leur tour, Ont sans peine accordé Bellone avec l'amour. Ce Dieu dans tous les coeurs s'insinue, et se glisse, Titus malgré son deuil aima sa Bérénice. Hercule d'un beau feu fut contraint de brûler Et pour la Reine Omphale il voulut bien filer. À des désirs ardents peut-on mettre des bornes ? Pour Europe Jupin voulut prendre des cornes. Il n'est point d'animal qui n'aime tendrement : Le singe la guenon, le cheval la jument, Le coq aime la poule, et l'âne son ânesse, Le gros taureau soupire, et mugit de tendresse, La chaste tourterelle aime son tourtereau, Et la belle perdrix brûle pour son perdreau. Le lion plein de feu rugit pour sa lionne, Et le goujon frétille auprès de sa goujonne, La Chatte en miaulant appelle le matou, Et la sombre chouette est folle du hibou. Toujours le bécasseau vole après la bécasse, Pour l'aimable crapaud la grenouille coasse, Dans l'Empire des flots les Poissons amoureux Malgré l'humidité brûlent des plus beaux feux. Un carpeau suit de près une carpe fidèle ; Et le maquereau vert pourchasse sa femelle, Tant d'exemples tracés ne suffiront-ils pas Pour te déterminer à marcher sur leurs pas ?"")",-,0.0
"('#leandre', ""Pour me persuader à fuir l'indifférence, Vous employez en vain toute vôtre éloquence : J'ignore le secret de triompher d'un coeur, Daignez donc m'éclaircir, Monsieur mon précepteur : Lorsque vous m'aurez dit comment je dois m'y prendre, Peut être malgré moi chercherai-je à me rendre, Si vous m'instruisez bien je saurai galamment Pratiquer vos leçons prés d'un objet charmant."")",-,0.0
"('#arlequin', ""Pour soumettre à tes lois une beauté charmante. Suis avec un grand soin ma maxime savante. Sitôt que tu verras une belle au balcon, Campe-toi tout d'abord... là... de cette façon. Fais-lui la révérence, et d'un oeil plein de flamme Pour la mieux amorcer regarde cette Dame. Qu'un soupir amoureux s'échappe de ton coeur, Mord ton gant, affectant une douce langueur, Exprime en mots pompeux ta nouvelle tendresse, Et la belle aussi-tôt, fût-elle une Lucrèce, Lors qu'en termes choisis tu conteras tes feux Ne refusera point de répondre à tes Voeux. Dis-lui qu'en la voyant, trop sensible à ses charmes, Tu n'as pu t'empêcher de leur rendre les armes. Que jusques au tombeau tu veux être constant, Et qu'enfin tu serais parfaitement content Si d'un objet si beau tu faisais la conquête. Après un grand discours demande un tête à tête, Tu verras que sans peine elle t'accordera Tête à tête, baisers, peut être.... Et cetera. Arlequin fait tout ce qu'il dit ci-dessus, d'une manière toute comique."")",-,0.0
"('#leandre', ""Je vois qu'il faut céder, et qu'à vôtre éloquence On ne peut opposer qu'une vaine défense ; Je vais tout de ce pas en fidèle écolier Suivre vôtre leçon, et la bien essayer. Il s'en va."")",-,0.0
"('#arlequin', 'Moi, je vais sur le champ avertir le Notaire De se rendre chez moi pour finir mon affaire. ')",-,0.0
"('#octave', ""C'est vivre trop longtemps loin de l'objet aimé ; Rien ne doit arrêter un coeur bien enflammé. Lorsque je ne vois point la charmante Spinette Mes sens sont agitez, mon âme est inquiète Cette jeune beauté fixe tous mes désirs, Loin d'elle je ne puis goûter de vrais plaisirs, J'aime son air naïf, sa manière innocente, Et sa simplicité me ravit, et m'enchante : Que dis-tu de mon choix ?"")",-,0.0
"('#scaramouche', ""À parler franchement, C'est un vilain métier que celui d'un Amant : Vous passez sans dormir les nuits les plus tranquilles, Vous êtes comme un Chat qui rode sur les tuiles, Pour moi je ne sais pas quel plaisir vous trouvez ! Vos draps depuis deux mois n'ont pas été lavez Est ce pour épargner les frais du blanchissage Que vous dormez si peu ? quel Diable de ménage ! Aussi vous devenez maigre comme un anchois, Et vous avez morbleu le plus fichu minois ! J'enrage ; car il faut aussi par complaisance, Que je veille avec vous sans me farcir la panse. Moi qui toute ma vie ai bien mangé, bien bu, Ma foi, je n'ai jamais été si mal repu. Aussi, je m'aperçois que ma graisse est fondue, Je deviens tous les jours plus sec qu'une morue, À peine suis-je à table, aussitôt vous criez Scaramouche... d'abord il faut lever les pieds. Tu mangeras tantôt, va porter cette lettre À Spinette, à présent elle est à sa fenêtre, Et tu la lui rendras sans qu'on puisse te voir ; Cet ordre rigoureux me met au désespoir La nuit lorsque je crois reposer à mon aise, Scaramouche ! Viens-t'en me mettre sur la chaise, Pendant toute la nuit voilà quel est le train, Cela dure souvent jusques au lendemain ; Je crois que vous rendez votre amour par derrière Et vous m'empoisonnez avec vôtre matière."")",-,0.0
"('#octave', 'Veux-tu bien terminer de si fades discours Sans rime, et sans raison tu plaisantes toujours.')",-,0.0
"('#scaramouche', ""Le vilain loup-garou qui n'aime pas la joie !"")",-,0.0
"('#octave', 'Cours appeler Spinette il faut que je la voie.')",-,0.0
"('#scaramouche', ""Oui, mais si le docteur était dans la maison Il me régalerait de cent coups de bâton : Le drôle quand il bat n'y va pas de main morte, Je le sais."")",-,0.0
"('#octave', 'Ne crains rien, va frapper à sa porte.')",-,0.0
"('#scaramouche', ""Allons je le veux bien, et si je suis battu Je vous rendrai ma foi ce que j'aurai reçu."")",-,0.0
"('#octave', 'Finiras-tu maraud ?')",-,0.0
"('#scaramouche', ""Qu'il a l'humeur farouche ! Hola ! Quelqu'un, c'est moi ? Il frappe."")",-,0.0
"('#spinette', 'Que veux-tu Scaramouche ?')",-,0.0
"('#scaramouche', 'Madame en vérité... pour moi je ne veux rien,')",-,0.0
"('#spinette', 'Adieu donc.')",-,0.0
"('#scaramouche', 'Serviteur, parlez, Monsieur.')",-,0.0
"('#octave', ""Hé bien ! Qu'as-tu donc fait ?"")",-,0.0
"('#scaramouche', ""J'ai vu la charmante Spinette, Qu'elle a l'air engageant ! morbleu qu'elle est bien faite ! Elle m'a demandé pourquoi je l'appelais, Elle a voulu savoir ce que je lui voulais, Et moi j'ai répondu, je ne veux rien Spinette, Aussi-tôt elle a pris la poudre d'escampette. Voilà ce que j'ai fait."")",-,0.0
"('#octave', ""Ah L le joli garçon Et qu'il s'acquitte bien d'une commission. Hola ! Il va frapper à la porte."")",-,0.0
"('#spinette', ""Que veux-tu donc, ah ! c'est vous !"")",-,0.0
"('#octave', 'Oui, ma belle, Vous me voyez ici...')",-,0.0
"('#scaramouche', ""Bonjour Mademoiselle, Mon maître n'a pas tort, elle a bien des appas, Le pauvre Scaramouche en ferait ses choux gras."")",-,0.0
"('#octave', ""Hé bien puis- je former une douce espérance ? Vôtre coeur ressent-il les tourments de l'absence ? Et quand vous me voyez, goûte-t-il les plaisirs Où doivent se borner ses uniques désirs ?"")",-,0.0
"('#spinette', ""Douteriez-vous encor de mon ardeur parfaite ? Quoi, vous ne croyez pas d'être aimé de Spinette ? Que je suis malheureuse ; après ce que j'ai fait, Vous êtes trop jaloux."")",-,0.0
"('#octave', ""Je le suis en effet : Si je ne vous aimais avec délicatesse, Je ne craindrais pas tant, ma charmante Maîtresse, Ah ! Loin que mes soupçons vous soient injurieux, Ils doivent leur naissance à l'excès de mes feux."")",-,0.0
"('#spinette', ""Par où donc, cher Octave, ai-je pu vous déplaire ? Pour vous tant allarmeR que me voyez-vous faire ? Du matin jusqu'au soir je suis dans la Maison ; Quand vous me soupçonnez vous n'avez pas raison ; A de pareils discours je ne puis rien comprendre. Elle pleure."")",-,0.0
"('#octave', 'Tu pleures ? ')",-,0.0
"('#scaramouche', ""Oui, Monsieur ; c'est que j'ai le coeur tendre."")",-,0.0
"('#octave', 'Daignez sécher les pleurs qui coulent de vos yeux.')",-,0.0
"('#scaramouche', ""Monsieur, jusqu'à demain nous pleurerons tous deux ; Aussi pour quoi lâcher le robinet des larmes : Que de beaux yeux en pleurs ont d'agréables charmes !"")",-,0.0
"('#spinette', ""De moi, je le vois bien, vous faites peu de cas, Vous me grondez toujours, et vous ne m'aimez pas."")",-,0.0
"('#octave', ""Pardonnez-moi Spinette, et croyez que mon âme Saura brûler pour vous d'une éternelle flamme, Belle, vous me voyez soumis à vos genoux..."")",-,0.0
"('#spinette', 'Dites moi donc, Monsieur quand nous marierons-nous ? Mon père est bien méchant, vous aurez de la peine À gagner son esprit.')",-,0.0
"('#octave', ""Non, vôtre crainte est vaine, Il faudra qu'il consente, et je suis assuré..."")",-,0.0
"('#scaramouche', ""Ah ! Que je serai beau quand j'aurai bien pleuré !"")",-,0.0
"('#spinette', ""Vous m'avez tant de fois promis des sérénades, Quand m'en donnerez-vous ? j'aime fort les aubades."")",-,0.0
"('#octave', 'Ce soir.')",-,0.0
"('#spinette', ""N'y manquez pas, les filles du quartier Ont toutes ce plaisir, et je dois l'envier, J'aime les instruments on ne peut davantage."")",-,0.0
"('#scaramouche', ""C'est assez là le goût des filles de vôtre âge."")",-,0.0
"('#octave', ""Votre père n'est pas à présent au Logis. Entrons-y."")",-,0.0
"('#spinette', ""Mais par lui si vous étiez surpris, Il me maltraiterait d'une étrange manière."")",-,0.0
"('#octave', ""Entrons sans différer, ne craignez rien ma chère ; Scaramouche aura soin de l'écarter d'ici : Entends-tu ? Ils entrent."")",-,0.0
"('#scaramouche', ""Peste soit de l'amoureux transi : Cet emploi m'est à charge, et ne me convient guère, Tout franc je suis bien las d'un pareil ministère, Moi qui jamais n'ai craint en amour de rivaux, Aujourd'hui l'on m'emploie à garder les manteaux : Mais voici le Docteur. "")",-,0.0
"('#le-docteur', ""Non, je n'y puis suffire : C'est souffrir trop longtemps un rigoureux martyre : Quoi, je ne puis jouir d'un moment de repos ! Le moyen d'écouter tant de fades propos ; L'un me vient aborder, un inconnu m'embrasse, Et cet autre me tient des discours à la glace : Comment vous portez-vous ; que dit-on de nouveau, Pour aller prendre l'air le temps est assez beau. L'un parle de sa voix, et l'autre de sa danse ; Celui-ci prend le soin de vanter ma science : De pareils entretiens ne me conviennent pas, Peste des importuns, j'en trouve à chaque pas : Horace avait raison d'en craindre la poursuite, Et de fuir avec soin cette race maudite ; Et le plus sûr moyen de fuir tous ces fâcheux, C'est d'entrer au Logis, et de m'éloigner d'eux. "")",-,0.0
"('#octave', ""Hé bien puis-je sortir, et n'ai-je rien à craindre ?"")",-,0.0
"('#scaramouche', ""Le Docteur est bien loin, et j'ai su le contraindre A partir de ces lieux en le chargeant de coups, De peur qu'il ne revienne, allons, retirez-vous."")",-,0.0
"('#argentine', ""Que l'état d'une fille est triste et déplorable ! Lors qu'en proie aux rigueurs du destin qui l'accable, Elle doit obéir, et que son coeur gêné, À fuir un doux penchant est enfin condamné. Non, je ne puis subir cette loi tyrannique."")",-,0.0
"('#leandre', ""Il faut pour m'égayer que je mette en pratique  La leçon qu'Arlequin m'a tracée en ces lieux. Que vois-je ! Quel objet se présente à mes yeux ! Je vais, comme il m'a dit, me camper devant elle D'un air de petit Maître, et sourire à la belle. Bon, j'en fuis aperçu, tout va bien jusqu'ici ; Jouons de la prunelle en amoureux transi, Lançons-lui tendrement une oeillade engageante, Pour la faire bien-tôt répondre à mon attente : Ce soupir plein de feu va la déterminer ; J'ai commencé l'ouvrage, il faut le terminer : Je dois mordre mon gant ; elle se met à rire, Je crois que j'obtiendrai tout ce que je désire. Madame, permettez que ma naissante ardeur Éclate, et que le feu qui dévore mon coeur Se découvre à vos yeux, puis qu'eux seuls l'ont fait naître. Il est trop violent pour craindre de paraître, Et jusques au tombeau je prétends vous aimer, Ma belle à vôtre tour laissez-vous enflammer ; Et pour prix de l'ardeur qui prés de vous m'arrête, J'ose vous demander en grâce un tête à tête. Qui ne dit mot consent ; elle l'accordera, Et je suis déjà sûr d'avoir l'et cetera. Il se campe devant la fenêtre, et se donnant des airs. Il s'approche après avoir fait tout ce qu'il a dit ci-dessus. À part."")",-,0.0
"('#argentine', ""Un tel aveu, Monsieur, a lieu de me confondre ; Vous m'embarrassez fort, je ne sais que répondre ; Cependant je veux bien vous dire ingénument Qu'en cet instant mon coeur goûte un plaisir charmant ; Et comme je voudrais éviter l'esclavage, Pour me soustraire au joug d'un fatal mariage, Où prétend me soumettre un jaloux odieux ; Je braverais pour vous ses transports furieux ; Mais je crains de former une vaine espérance."")",-,0.0
